Fuel Type Code,Station Name,Street Address,Intersection Directions,City,State,ZIP,Plus4,Station Phone,Status Code,Expected Date,Groups With Access Code,Access Days Time,Cards Accepted,EV Level1 EVSE Num,EV Level2 EVSE Num,EV DC Fast Count,EV Other Info,EV Network,EV Network Web,Geocode Status,Latitude,Longitude,Date Last Confirmed,ID,Updated At,Owner Type Code,Federal Agency ID,Federal Agency Name,Open Date,EV Connector Types
ELEC,CORNELL,37 Forest Home Dr,FOREST HOME 1; Parking Level 3FOREST HOME 2; -FOREST HOME 3; Level 3L parking garage,Ithaca,NY,14850,,888-758-4389,E,,Public,24 hours daily,,,6,,,ChargePoint Network,http://www.chargepoint.com/,200-8,42.469059,-76.486687,01/23/2021,96757,2021-01-23 00:19:13,,,,,J1772
ELEC,Hampton Inn Rome - Tesla Destination,1352 Floyd Ave,,Rome,NY,13441,,315-709-0000  877-798-3752,E,,Public,24 hours daily; for customer use only,,,3,,,Tesla Destination,https://www.tesla.com/destination-charging,200-8,43.222098,-75.421363,11/03/2020,115229,2020-11-18 00:06:10,P,,,11/01/2018,J1772 TESLA
ELEC,TOWN GERMANTOWN,189 Main St,MUNICIPAL LOT,Germantown,NY,12526,,888-758-4389,E,,Public,24 hours daily,,,2,,,ChargePoint Network,http://www.chargepoint.com/,GPS,42.132595,-73.882650,01/23/2021,149273,2021-01-23 00:19:13,,,,,J1772
ELEC,ERIE COUNTY,1711 Girdle Rd,ELMA MEADOWS,Elma,NY,14059,,888-758-4389,E,,Public,24 hours daily,,,2,,,ChargePoint Network,http://www.chargepoint.com/,GPS,42.825420,-78.595024,01/23/2021,154704,2021-01-23 00:19:13,,,,,J1772
ELEC,ADAMS STATION,701 Baxter Ct,701 BAXTER; Bldg 701-706,Delmar,NY,12054,,888-758-4389,E,,Public,24 hours daily,,,2,,,ChargePoint Network,http://www.chargepoint.com/,GPS,42.608073,-73.849243,01/23/2021,165397,2021-01-23 00:19:13,,,,,J1772
ELEC,MOTM,1110  Fulton St,FARMINGDALE; Men On The Move Self-Storage,Farmingdale,NY,11735,,888-758-4389,E,,Public,24 hours daily,,,2,,,ChargePoint Network,http://www.chargepoint.com/,GPS,40.723380,-73.429030,01/23/2021,165308,2021-01-23 00:19:13,,,,,J1772
ELEC,LACROIX COURT,14 Lacroix Ct Dr,LACROIX APTS,Irondequoit,NY,14609,,888-758-4389,E,,Public,24 hours daily,,,2,,,ChargePoint Network,http://www.chargepoint.com/,GPS,43.195533,-77.566124,01/23/2021,165499,2021-01-23 00:19:13,,,,,J1772
ELEC,EVolve NY - Watertown,1242 Arsenal St,Near Starbucks,Watertown,NY,13601,,914-287-4200,E,,Public,24 hours daily,,,1,,,Non-Networked,,GPS,43.979207,-75.946384,12/03/2020,168319,2020-12-03 22:33:12,P,,,11/02/2020,J1772
ELEC,Greenville Center,855 Central Park Ave,,Scarsdale,NY,10583,,877-455-3833,E,,Public,24 hours daily,,,,1,,eVgo Network,https://www.evgo.com/,GPS,40.995411,-73.819055,01/23/2021,168480,2021-01-23 01:19:54,,,,,CHADEMO J1772COMBO
ELEC,RUPCO,20 Cedar St,,Kingston,NY,12401,,,E,,Public,24 hours daily,,,4,,,AMPUP,https://ampup.io/,200-9,41.928591,-74.004355,12/03/2020,169706,2020-12-03 22:33:12,P,,,12/01/2020,J1772
ELEC,Loews Regency New York - Tesla Destination,540 Park Ave,,New York,NY,10065,,212-759-4100  877-798-3752,E,,Public,24 hours daily; pay lot; see valet for access,,,3,,,Tesla Destination,https://www.tesla.com/destination-charging,200-9,40.764608,-73.969355,11/03/2020,115156,2020-11-18 00:06:10,P,,,11/01/2016,J1772 TESLA
ELEC,Robert Moses Park Office,600 Robert Moses State Pkwy,,Babylon,NY,11702,,866-816-7584,E,,Public,24 hours daily,,,1,,,EV Connect,http://evconnect.com/,GPS,40.623340,-73.277629,04/08/2020,123123,2020-04-08 12:29:55,P,,,04/01/2019,J1772
ELEC,Nissan City - Port Chester,225 Boston Post Rd,,Port Chester,NY,10573,,914-937-1777,E,,Public - Call ahead,Dealership business hours,,,1,,,Non-Networked,,200-9,40.996358,-73.669405,06/09/2020,44184,2020-06-09 16:47:26,P,,,11/30/2011,J1772
ELEC,FLEETWOODGARAGE,42 Broad St W,,Mount Vernon,NY,10552,,888-758-4389,E,,Public,24 hours daily,,,4,,,ChargePoint Network,http://www.chargepoint.com/,200-9,40.925892,-73.837103,01/23/2021,171343,2021-01-23 00:19:13,,,,,J1772
ELEC,ROCKETSHIPPARK,121 West Broadway Port,STATION 1; Near Public Bathrooms .,Port Jefferson,NY,11777,,888-758-4389,E,,Public,24 hours daily,,,2,,,ChargePoint Network,http://www.chargepoint.com/,GPS,40.945134,-73.069450,01/23/2021,156297,2021-01-23 00:19:13,,,,,J1772
ELEC,TOWNE BMW,8215 Main St,SERVICEDRIVE OS; Located to the left side of the left rear service door on south side of building.,Williamsville,NY,14221,,888-758-4389,E,,Public,24 hours daily,,,1,,,ChargePoint Network,http://www.chargepoint.com/,GPS,42.964084,-78.687654,01/23/2021,162446,2021-01-23 00:19:13,,,,,J1772
ELEC,Piermont Village,468 Piermont Ave,,Piermont,NY,10968,,855-900-7584,E,,Public,24 hours daily,,,,1,,Greenlots,http://greenlots.com/,GPS,41.040137,-73.915998,01/23/2021,146924,2021-01-23 01:21:30,,,,,CHADEMO J1772COMBO
ELEC,MUNI PARKIN LOT,5 Chestnut St,VILLAGE GENESEO; Municipal Lot,Geneseo,NY,14454,,888-758-4389,E,,Public,24 hours daily,,,2,,,ChargePoint Network,http://www.chargepoint.com/,GPS,42.795196,-77.816084,01/23/2021,162362,2021-01-23 00:19:13,,,,,J1772
ELEC,PPC,Point Place Casino 450 St Route 31,STATION 1; Rear parking lotSTATION 2; Rear parking lot,Bridgeport,NY,13030,,888-758-4389,E,,Public,24 hours daily,,,4,,,ChargePoint Network,http://www.chargepoint.com/,GPS,43.153646,-75.965958,01/23/2021,162272,2021-01-23 00:19:13,,,,,J1772
ELEC,MTP Parking 41-42 24th Street - Tesla Destination,41-42 24th St,,Long Island City,NY,11101,,347-410-4910  877-798-3752,E,,Public,24 hours daily; pay lot; see valet for access,,,4,,,Tesla Destination,https://www.tesla.com/destination-charging,200-9,40.751815,-73.941166,11/03/2020,122488,2020-11-18 00:06:10,P,,,03/01/2019,TESLA
ELEC,RTS,Fairport Park & Ride State Route 31F,STJFISHER 1; Parking Lot Entrance off Route 31F. Near bus sheltersSTJFISHER 2; Enter parking lot from Route 31F. Near bus shelters,Pittsford,NY,14618,,888-758-4389,E,,Public,24 hours daily,,,4,,,ChargePoint Network,http://www.chargepoint.com/,GPS,43.112196,-77.508090,01/23/2021,168176,2021-01-23 00:19:13,,,,,J1772
ELEC,Town of Elmira,1255 W Water St,,Elmira,NY,14905,,866-816-7584,E,,Public,24 hours daily,,,2,,,EV Connect,http://evconnect.com/,GPS,42.077220,-76.844582,06/09/2020,157947,2020-06-09 16:47:26,P,,,05/15/2020,J1772
ELEC,EVPASS,506 West Embargo Street,R JFKA-1; 1 unit at lot in front of poolhouse at corner of N Jay St,Rome,NY,13440,,888-758-4389,E,,Public,24 hours daily,,,1,,,ChargePoint Network,http://www.chargepoint.com/,GPS,43.218845,-75.463188,01/23/2021,162514,2021-01-23 00:19:13,,,,,J1772
ELEC,LIA HONDA,4891 Transit Rd,SHOP1; Service Use OnlySHOP2; Rear of building Deal use only,Buffalo,NY,14221,,888-758-4389,E,,Public,24 hours daily,,,2,,,ChargePoint Network,http://www.chargepoint.com/,200-9,42.980699,-78.696681,01/23/2021,162179,2021-01-23 00:19:13,,,,,J1772
ELEC,Rapidpark 480 Riverside (120th St) - Tesla Destination,480 Riverside Dr,,New York,NY,10027,,212-870-6736  877-798-3752,E,,Public,24 hours daily; pay lot; see valet for access,,,3,,,Tesla Destination,https://www.tesla.com/destination-charging,200-8,40.811206,-73.963782,11/03/2020,115140,2020-11-18 00:06:10,P,,,11/01/2018,J1772 TESLA
ELEC,GARDEN CHARGERS,1000 Corporate Dr,JOVIA #2; Garden AreaJOVIA #3; Garden AreaJOVIA #4; member Parking 1JOVIA #5; Member Parking 2JOVIA ASD 1; Near loading dock 1,Westbury,NY,11590,,888-758-4389,E,,Public,24 hours daily,,,10,,,ChargePoint Network,http://www.chargepoint.com/,200-9,40.739982,-73.600521,01/23/2021,145671,2021-01-23 00:19:13,,,,,J1772
ELEC,NATIONAL GRID,350 Prospect St,NIAGARA FALLS 1,Niagara Falls,NY,14303,,888-758-4389,E,,Public,24 hours daily,,,2,,,ChargePoint Network,http://www.chargepoint.com/,GPS,43.086961,-79.065842,01/23/2021,162239,2021-01-23 00:19:13,,,,,J1772
ELEC,One Seneca Ramp,1 Seneca Dr,,Buffalo,NY,14203,,716-849-5812,E,,Public,24 hours daily,,,2,,,Non-Networked,,GPS,42.879878,-78.875574,09/03/2020,104730,2020-09-03 19:35:48,LG,,,04/01/2018,J1772
ELEC,ALBANY COUNTY,839 Kenwood Ave Rail Trail,RAIL TRAIL; In Parking lot for Rail bike trail,Slingerlands,NY,12159,,888-758-4389,E,,Public,24 hours daily,,,2,,,ChargePoint Network,http://www.chargepoint.com/,GPS,42.629269,-73.863661,01/23/2021,162134,2021-01-23 00:19:13,,,,,J1772
ELEC,ROCHESTER NY,"111 Woodbury Blvd,",WASH SQ GARAGE1WASH SQ GARAGE2,Rochester,NY,14607,,888-758-4389,E,,Public,24 hours daily,,,4,,,ChargePoint Network,http://www.chargepoint.com/,200-9,43.152689,-77.604178,01/23/2021,61063,2021-01-23 00:19:13,,,,,J1772
ELEC,MARKET 32 EV,501 Columbia Turnpike,MARKET32 EV EG2; In front of store,Rensselaer,NY,12144,,888-758-4389,E,,Public,24 hours daily,,,2,,,ChargePoint Network,http://www.chargepoint.com/,GPS,42.607567,-73.720010,01/23/2021,152320,2021-01-23 00:19:13,,,,,J1772
ELEC,Dartmouth House - Tesla Destination,215 Dartmouth St,,Rochester,NY,14607,,585-434-3069  877-798-3752,E,,Public - Call ahead,24 hours daily; for customer use only,,,1,,,Tesla Destination,https://www.tesla.com/destination-charging,200-9,43.145078,-77.586462,11/03/2020,150746,2020-11-18 00:06:10,P,,,09/30/2019,TESLA
ELEC,Little Man Parking,220 E 9th St,,Manhattan,NY,10003,,866-816-7584,E,,Public - Credit card at all times,24 hours daily; Also accepts Paypal,A D M V,,6,,,EV Connect,http://evconnect.com/,200-9,40.729483,-73.988368,10/09/2020,166333,2020-10-09 12:41:43,P,,,05/29/2020,J1772
ELEC,BURNS MGT,6203 Johnston Rd,"OXFORD 3; Derbyshire Building, Oxford HeightsOXFORD 4; Derbyshire Building, Oxford HeightsOXFORD 5; Derbyshire building, Oxford Heights",Albany,NY,12203,,888-758-4389,E,,Public,24 hours daily,,,6,,,ChargePoint Network,http://www.chargepoint.com/,200-9,42.685351,-73.869725,01/23/2021,119018,2021-01-23 00:19:13,,,,,J1772
ELEC,Nissan of New Rochelle,2533 Palmer Ave,,New Rochelle,NY,10801,,914-576-7600,E,,Public - Call ahead,Dealership business hours,,,1,1,,Non-Networked,,200-8,40.919104,-73.776645,06/09/2020,44360,2020-06-09 16:47:26,P,,,11/30/2011,CHADEMO J1772
ELEC,NATIONAL GRID,120 Amsterdam commons,KOHLS AMSTERDAM,Amsterdam,NY,12010,,888-758-4389,E,,Public,24 hours daily,,,2,,,ChargePoint Network,http://www.chargepoint.com/,GPS,42.964365,-74.189901,01/23/2021,162224,2021-01-23 00:19:13,,,,,J1772
ELEC,MASSENA_EV,21-25 Andrews St,MUNI PARKING; Andrews St Municipal Parking Lot,Massena,NY,13662,,888-758-4389,E,,Public,24 hours daily,,,2,,,ChargePoint Network,http://www.chargepoint.com/,GPS,44.931757,-74.893984,01/23/2021,162410,2021-01-23 00:19:13,,,,,J1772
ELEC,HYDEPARK,4383 U.S. 9,HYDE PK TOWN HA; Town Hall parking lot,Hyde Park,NY,12538,,888-758-4389,E,,Public,24 hours daily,,,2,,,ChargePoint Network,http://www.chargepoint.com/,GPS,41.790836,-73.936440,01/23/2021,164503,2021-01-23 00:19:13,,,,,J1772
ELEC,Tazza Cafe,186 Katonah Ave,,Katonah,NY,10536,,877-455-3833,E,,Public,24 hours daily,,,,1,,eVgo Network,https://www.evgo.com/,GPS,41.256656,-73.684266,01/23/2021,170644,2021-01-23 01:19:54,,,,,CHADEMO J1772COMBO
ELEC,GGMC Parking Union Square Parking Garage - Tesla Destination,100 E 15th St,,New York,NY,10003,,212-677-2026  877-798-3752,E,,Public,24 hours daily; see valet for access,,,6,,,Tesla Destination,https://www.tesla.com/destination-charging,200-8,40.734817,-73.989198,11/03/2020,114988,2020-11-18 00:06:10,P,,,01/01/2016,J1772 TESLA
ELEC,PARKING GARAGE1,1 Lincoln St,PARKING GARAGE; First floor north,Auburn,NY,13021,,888-758-4389,E,,Public,24 hours daily,,,2,,,ChargePoint Network,http://www.chargepoint.com/,GPS,42.930293,-76.567186,01/23/2021,162333,2021-01-23 00:19:13,,,,,J1772
ELEC,U OF R,110 Crittenden Blvd,HOSP SEC D BLUE; D blue,Rochester,NY,14620,,888-758-4389,E,,Public,24 hours daily,,,2,,,ChargePoint Network,http://www.chargepoint.com/,GPS,43.123421,-77.622592,01/23/2021,149920,2021-01-23 00:19:13,,,,,J1772
ELEC,Cafe Crust - Tesla Supercharger,850 County Road 39,,Southampton,NY,11968,,877-798-3752,E,,Public,24 hours daily; for Tesla use only,,,,8,,Tesla,http://www.teslamotors.com/supercharger,200-9,40.891900,-72.427000,08/10/2020,102343,2020-08-27 20:39:12,P,,,06/01/2016,TESLA
ELEC,ADK FOLK SCHOOL,51 Main St,STATION 1,Lake Luzerne,NY,12846,,888-758-4389,E,,Public,24 hours daily,,,2,,,ChargePoint Network,http://www.chargepoint.com/,GPS,43.320377,-73.841870,01/23/2021,163515,2021-01-23 00:19:13,,,,,J1772
ELEC,1350 EGGERT RD,1350 Eggert Rd,EGGERT (1),Buffalo,NY,14226,,888-758-4389,E,,Public,24 hours daily,,,2,,,ChargePoint Network,http://www.chargepoint.com/,GPS,42.965328,-78.804684,01/23/2021,154369,2021-01-23 00:19:13,,,,,J1772
ELEC,Rochester General Hospital,1425 Portland Ave,,Rochester,NY,14621,,866-816-7584,E,,Public,24 hours daily,,,2,,,EV Connect,http://evconnect.com/,GPS,43.192906,-77.587022,06/09/2020,123068,2020-06-09 16:47:26,P,,,04/01/2019,J1772
ELEC,Bethpage Associates,99 Quaker Meeting House Rd,,Farmingdale,NY,11735,,866-816-7584,E,,Public,24 hours daily,,,1,,,EV Connect,http://evconnect.com/,GPS,40.741355,-73.455930,04/08/2020,123142,2020-04-08 12:29:55,P,,,04/01/2019,J1772
ELEC,Shops at Main / Transit - Tesla Supercharger,4455  Transit Road,,Buffalo,NY,14221,,877-798-3752,E,,Public,24 hours daily; for Tesla use only,,,,8,,Tesla,http://www.teslamotors.com/supercharger,200-9,42.968700,-78.695700,08/10/2020,102328,2020-08-27 20:39:12,P,,,06/01/2015,TESLA
ELEC,Quik Park 86th St. LLC - Tesla Destination,444 E 86th St,,New York,NY,10028,,212-352-0514  877-798-3752,E,,Public,24 hours daily; for customer use only; see valet for access,,,3,,,Tesla Destination,https://www.tesla.com/destination-charging,200-8,40.775975,-73.947732,11/03/2020,115139,2020-11-18 00:06:10,P,,,01/01/2016,J1772 TESLA
ELEC,The Shops at Riverhead,1762 Old Country Rd,,Riverhead,NY,11901,,877-455-3833,E,,Public,24 hours daily,,,,2,,eVgo Network,https://www.evgo.com/,GPS,40.927889,-72.706158,01/23/2021,146590,2021-01-23 01:19:54,,,,,CHADEMO J1772COMBO
ELEC,Belmont Lake State Park,625 Belmont Ave,,West Babylon,NY,11704,,866-816-7584,E,,Public,24 hours daily,,,1,,,EV Connect,http://evconnect.com/,GPS,40.734133,-73.344549,04/08/2020,123124,2020-04-08 12:29:55,SG,,,04/01/2019,J1772
ELEC,MARKET 32 EV,461 Nott St,NOTT ST EV1; Front row adjacent to sliding doorNOTTST EV2; Maxon road entrance to the left.,Schenectady,NY,12308,,888-758-4389,E,,Public,24 hours daily,,,4,,,ChargePoint Network,http://www.chargepoint.com/,200-9,42.821842,-73.932663,01/23/2021,155617,2021-01-23 00:19:13,,,,,J1772
ELEC,GGMC Parking Alfred - Tesla Destination,161 W 61st St,,New York,NY,10023,,212-397-8949  877-798-3752,E,,Public,24 hours daily; see valet for access,,,3,,,Tesla Destination,https://www.tesla.com/destination-charging,200-9,40.771561,-73.985834,11/03/2020,115027,2020-11-18 00:06:10,P,,,03/01/2017,J1772 TESLA
ELEC,Staten Island Mall - Dave & Busterâ€™s,2655 Richmond Ave,,Staten Island,NY,10314,,888-264-2208,E,,Public,6am-12am daily,,,4,,,Volta,https://voltacharging.com/,GPS,40.582763,-74.167812,10/09/2020,166728,2020-10-09 12:41:43,P,,,08/31/2020,J1772
ELEC,Arcadian Shopping Center - Tesla Supercharger,240 South Highland Avenue,,Ossining,NY,10562,,877-798-3752,E,,Public,24 hours daily; for Tesla use only,,,,12,,Tesla,http://www.teslamotors.com/supercharger,200-9,41.144000,-73.861300,08/10/2020,149341,2020-08-27 20:39:12,P,,,09/30/2019,TESLA
ELEC,TATABROOKFIELD,11 E Loop Rd,"#2; Second charger in parking garage, from ""Parking Customer Exit"" gate.#3; Third charger in parking garage, from ""Parking Customer Exit"" gate.#4; Fourth charger in parking garage, from ""Parking Customer Exit"" gate.#5; 2nd charger from tenant entrance doors#6; Next to tenant entrance#7; Hncp parking stall and near yellow cabinet#8; Near electric panel on the north wall at back of parking garageGATEWAY #1; First charger in parking garage, next to ""Parking Customer Exit"" gate.",New York,NY,10044,,888-758-4389,E,,Public,24 hours daily,,,8,,,ChargePoint Network,http://www.chargepoint.com/,GPS,40.755314,-73.955605,01/23/2021,143191,2021-01-23 00:19:13,,,,,J1772
ELEC,RTA,156-20 Riverside Dr W,RIVER TERRACE; For River Terrace garage space owners only,New York,NY,10032,,888-758-4389,E,,Public,24 hours daily,,,2,,,ChargePoint Network,http://www.chargepoint.com/,GPS,40.835351,-73.947934,01/23/2021,170243,2021-01-23 00:19:13,,,,,J1772
ELEC,Buttermilk Falls Inn & Spa - Tesla Destination,220 North Rd,,Milton,NY,12547,,845-795-1310  877-798-3752,E,,Public,24 hours daily; for customer use only,,,3,,,Tesla Destination,https://www.tesla.com/destination-charging,200-9,41.666684,-73.955378,11/03/2020,114977,2020-11-18 00:06:10,P,,,01/01/2016,J1772 TESLA
ELEC,Bob Johnson Chevrolet,1271 W Ridge Rd,,Rochester,NY,14615,,585-663-4040,E,,Public,24 hours daily; for customer use only,,,1,1,,Non-Networked,,200-9,43.203546,-77.661537,03/03/2020,80871,2020-03-03 21:13:47,P,,,01/01/2010,J1772 J1772COMBO
ELEC,TF VALATIE,2424 NY-203,TIERA,Valatie,NY,12184,,888-758-4389,E,,Public,24 hours daily,,,2,,,ChargePoint Network,http://www.chargepoint.com/,GPS,42.381610,-73.639220,01/23/2021,123655,2021-01-23 00:19:13,,,,,J1772
ELEC,Potter Park,53 W Church St,Entrance on Potter Place,Fairport,NY,14452,,585-223-9500,E,,Public,24 hours daily,,,2,,,EV Connect,http://evconnect.com/,GPS,43.098077,-77.446529,06/09/2020,152216,2020-06-09 16:47:26,LG,,,12/27/2019,J1772
ELEC,RPI 1,1525 15th St,OFF CAMPUS S1,Troy,NY,12180,,888-758-4389,E,,Public,24 hours daily,,,2,,,ChargePoint Network,http://www.chargepoint.com/,GPS,42.726645,-73.678464,01/23/2021,121237,2021-01-23 00:19:13,,,,,J1772
ELEC,GGMC Ruppert Car Park - Tesla Destination,245 E 90th St,,New York,NY,10128,,212-722-0188  877-798-3752,E,,Public,24 hours daily; pay lot; see valet for access,,,3,,,Tesla Destination,https://www.tesla.com/destination-charging,200-8,40.780918,-73.950526,11/03/2020,115066,2020-11-18 00:06:10,P,,,11/01/2018,J1772 TESLA
ELEC,Icon Parking University 10 Parking - Tesla Destination,63  E 9th St,,New York,NY,10003,,212-979-5380  877-798-3752,E,,Public - Call ahead,24 hours daily,,,3,,,Tesla Destination,https://www.tesla.com/destination-charging,200-9,40.731544,-73.992045,11/03/2020,115177,2020-11-18 00:06:10,P,,,08/15/2016,J1772 TESLA
ELEC,Saab Sensis,85 Collamer Crossings,,East Syracuse,NY,13057,,,E,,Public,24 hours daily,,,10,,,EV Connect,http://evconnect.com/,200-8,43.102147,-76.049212,04/08/2020,155103,2020-04-08 12:29:55,P,,,02/01/2020,J1772
ELEC,854ELLICOTT,134 Goodrich St,134 HIGH ST 6; -,Buffalo,NY,14203,,888-758-4389,E,,Public,24 hours daily,,,2,,,ChargePoint Network,http://www.chargepoint.com/,GPS,42.901523,-78.863471,01/23/2021,169908,2021-01-23 00:19:13,,,,,J1772
ELEC,GOLDEN ARROW,2559 Main St,GOLDEN 1.1; Lower parking garage of the golden arrow resort GOLDEN 1.2; Lowest level of car garage underneath the golden arrow resort,Lake Placid,NY,12946,,888-758-4389,E,,Public,24 hours daily,,,4,,,ChargePoint Network,http://www.chargepoint.com/,200-9,44.286410,-73.984480,01/23/2021,169879,2021-01-23 00:19:13,,,,,J1772
ELEC,Kings Nissan,2758 Coney Island Ave,,Brooklyn,NY,11235,,718-376-0538,E,,Public - Call ahead,Dealership business hours; Nissan vehicle use only,,,1,,,Non-Networked,,200-9,40.589167,-73.960707,06/09/2020,44329,2020-06-09 16:47:26,P,,,11/30/2011,J1772
ELEC,CAYUGA STATION,235 S Cayuga St,ALL PRO GARAGE; 3rd floor by elavators,Ithaca,NY,14850,,888-758-4389,E,,Public,24 hours daily,,,2,,,ChargePoint Network,http://www.chargepoint.com/,GPS,42.437359,-76.498744,01/23/2021,162323,2021-01-23 00:19:13,,,,,J1772
ELEC,EVCHARGE,Taughannock State Park Access Rd,BEACH LOT; Southwest corner of the swimming area parking lot,Trumansburg,NY,14886,,888-758-4389,E,,Public,24 hours daily,,,2,,,ChargePoint Network,http://www.chargepoint.com/,GPS,42.544649,-76.596445,01/23/2021,162328,2021-01-23 00:19:13,,,,,J1772
ELEC,WARRENCOUNTY,1380 U.S. 9,DPW 5,Lake George,NY,12845,,888-758-4389,E,,Public,24 hours daily,,,2,,,ChargePoint Network,http://www.chargepoint.com/,GPS,43.359247,-73.701335,01/23/2021,150255,2021-01-23 00:19:13,,,,,J1772
ELEC,TAPPS,2213 Gerritsen Ave,"KEY FOOD; Intersection of Gerritsen Ave, Knapp St &amp; Avenue U",Brooklyn,NY,11229,,888-758-4389,E,,Public,24 hours daily,,,2,,,ChargePoint Network,http://www.chargepoint.com/,GPS,40.601595,-73.934604,01/23/2021,162469,2021-01-23 00:19:13,,,,,J1772
ELEC,Rapidpark 600 Columbus Ave - Tesla Destination,100 W 89th,,New York,NY,10024,,212-265-7854  877-798-3752,E,,Public,24 hours daily; see valet for access,,,3,,,Tesla Destination,https://www.tesla.com/destination-charging,200-9,40.788305,-73.971353,09/30/2019,114990,2020-03-02 20:14:21,P,,,11/01/2018,J1772 TESLA
ELEC,del Lago Resort and Casino - Tesla Supercharger,1133 Route 414,,Waterloo,NY,13165,,877-798-3752,E,,Public,24 hours daily; for Tesla use only,,,,8,,Tesla,http://www.teslamotors.com/supercharger,200-8,42.969300,-76.846000,08/10/2020,102349,2020-08-27 20:39:12,P,,,09/01/2017,TESLA
ELEC,VERONA,5390 Willow Pl,LA QUINTA 1; Outside of front entrance of La Quinta hotel LA QUINTA 2; Outside of front entrance of La Quinta hotelLA QUINTA 3; Outside of front entrance of La Quinta hotel,Verona,NY,13478,,888-758-4389,E,,Public,24 hours daily,,,6,,,ChargePoint Network,http://www.chargepoint.com/,200-8,43.122569,-75.594239,01/23/2021,166799,2021-01-23 00:19:13,,,,,J1772
ELEC,Dino's Tailor Shop,2400 Monroe Av,,Rochester,NY,14618,,888-356-8911,E,,Public,24 hours daily,,,1,,,FLO,https://flo.ca/,GPS,43.118929,-77.556073,01/23/2021,152919,2021-01-23 01:30:20,,,,,J1772
ELEC,SAVARINO COMPAN,BRL Parking Lot 2nd from Building 1 South Street,BRL 4; -,Buffalo,NY,14204,,888-758-4389,E,,Public,24 hours daily,,,2,,,ChargePoint Network,http://www.chargepoint.com/,GPS,42.863697,-78.868064,01/23/2021,164158,2021-01-23 00:19:13,,,,,J1772
ELEC,Standard Parking 2 Metrotech - Tesla Destination,8 Metrotech Ctr S,,Brooklyn,NY,11201,,800-836-6666  877-798-3752,E,,Public,24 hours daily; see valet for access,,,3,,,Tesla Destination,https://www.tesla.com/destination-charging,200-8,40.692919,-73.987193,11/03/2020,114914,2020-11-18 00:06:10,P,,,11/01/2018,J1772 TESLA
ELEC,EMPIRE H-D,8 Industrial Ln,DCFAST HOG,New Rochelle,NY,10805,,888-758-4389,E,,Public,24 hours daily,,,,1,,ChargePoint Network,http://www.chargepoint.com/,GPS,40.898226,-73.792186,01/23/2021,143319,2021-01-23 00:19:13,,,,,J1772COMBO
ELEC,Chappaqua Metro - North Train Station,108 Allen Pl,Exit 32 off Saw Mill River Parkway,Chappaqua,NY,10514,,914-238-4772  866-816-7584,E,,Public,24 hours daily,,,3,,,EV Connect,http://evconnect.com/,200-8,41.159228,-73.773508,04/08/2020,65273,2020-04-08 12:29:55,SG,,,07/02/2014,J1772
ELEC,Queens Crossing - Tesla Supercharger,136-20 38th Avenue,,Flushing,NY,11354,,877-798-3752,E,,Public,24 hours daily; for Tesla use only,,,,4,,Tesla,http://www.teslamotors.com/supercharger,GPS,40.760900,-73.829800,08/10/2020,153417,2020-08-27 20:39:12,P,,,01/31/2020,TESLA
ELEC,Quikpark 173 W 12th Street - Tesla Destination,173 W 12th St,,New York,NY,10011,,646-336-6225  877-798-3752,E,,Public,24 hours daily; see valet for access,,,3,,,Tesla Destination,https://www.tesla.com/destination-charging,200-8,40.737200,-74.000070,11/03/2020,115032,2020-11-18 00:06:10,P,,,09/01/2017,J1772 TESLA
ELEC,Sylvan Gerard Garage - Tesla Destination,70-25 Yellowstone Blvd,,Forest Hills,NY,11375,,718-793-6773  877-798-3752,E,,Public,24 hours daily; pay lot; see valet for access,,,4,,,Tesla Destination,https://www.tesla.com/destination-charging,200-9,40.722160,-73.849258,11/03/2020,150639,2020-11-18 00:06:10,P,,,09/30/2019,TESLA
ELEC,Quik Park 32 Debrosses LLC - Tesla Destination,32 Debrosses St,,New York,NY,10013,,212-842-0069  877-798-3752,E,,Public,24 hours daily; see valet for access,,,3,,,Tesla Destination,https://www.tesla.com/destination-charging,200-8,40.723702,-74.010335,11/03/2020,115093,2020-11-18 00:06:10,P,,,01/01/2016,J1772 TESLA
ELEC,NY STATE PARKS,Lake Taghkanic Rd,LAKE TAGHKANIC; Lot by Beach Swimming Area - Park open sunrise to sunset.,Ancram,NY,12502,,888-758-4389,E,,Public,24 hours daily,,,2,,,ChargePoint Network,http://www.chargepoint.com/,GPS,42.090954,-73.720052,01/23/2021,120821,2021-01-23 00:19:13,,,,,J1772
ELEC,Park Kwik - 211 Atlantic - Tesla Destination,211 Atlantic Ave,,Brooklyn,NY,11201,,877-798-3752  877-798-3752,E,,Public,24 hours daily; for customer use only; see front desk for access,,,6,,,Tesla Destination,https://www.tesla.com/destination-charging,200-9,40.689671,-73.991786,11/03/2020,169009,2020-11-18 00:06:10,P,,,11/03/2020,J1772 TESLA
ELEC,City Lot #21,141 West Washington Street,,Syracuse,NY,13202,,888-998-2546,E,,Public,MON: 24 hours | TUE: 24 hours | WED: 24 hours | THU: 24 hours | FRI: 24 hours | SAT: 24 hours | SUN: 24 hours,,,14,,,Blink Network,http://www.blinkcharging.com/,GPS,43.049766,-76.152817,01/22/2021,144363,2021-01-22 22:55:21,,,,,J1772
ELEC,COMMCTR,Veterans Dr,NEW PALTZ TOWN; Near front entrance,New Paltz,NY,12561,,888-758-4389,E,,Public,24 hours daily,,,2,,,ChargePoint Network,http://www.chargepoint.com/,GPS,41.756382,-74.081041,01/23/2021,162372,2021-01-23 00:19:13,,,,,J1772
ELEC,ALBANY COUNTY,100 Beaver St,"TIMES UNION GA2; Requires $8 fee for garage entry.  Inside parking garage 3rd floor middle isleTIMES UNION GAR; Requires $8 fee for garage entry.  Inside parking garage, 2nd floor middle isle",Albany,NY,12207,,888-758-4389,E,,Public,24 hours daily,,,4,,,ChargePoint Network,http://www.chargepoint.com/,200-9,42.648885,-73.754699,01/23/2021,162174,2021-01-23 00:19:13,,,,,J1772
ELEC,MPG 923 5th Ave - Tesla Destination,923 5th Ave,,New York,NY,10021,,212-249-1947  877-798-3752,E,,Public,24 hours daily; see valet for access,,,3,,,Tesla Destination,https://www.tesla.com/destination-charging,200-9,40.773173,-73.966026,11/03/2020,115196,2020-11-18 00:06:10,P,,,09/01/2017,J1772 TESLA
ELEC,White Fences Inn Water Mill - Tesla Destination,371 Montauk Hwy,,Water Mill,NY,11976,,631-500-9013  877-798-3752,E,,Public,24 hours daily; see front desk for access,,,2,,,Tesla Destination,https://www.tesla.com/destination-charging,200-9,40.905728,-72.362692,11/03/2020,115245,2020-11-18 00:06:10,P,,,02/01/2016,J1772 TESLA
ELEC,Genesee Community College,1 College Rd,,Batavia,NY,14020,,866-816-7584,E,,Public,24 hours daily; Also accepts Paypal,A D M V,,2,,,EV Connect,http://evconnect.com/,GPS,43.016226,-78.137984,04/08/2020,155097,2020-04-08 12:29:55,P,,,08/05/2018,J1772
ELEC,Saratoga Auto Museum,110 Avenue of the Pines,,Saratoga Springs,NY,12866,,518-587-1935,E,,Public,24 hours daily,,,1,,,Non-Networked,,GPS,43.057348,-73.804726,01/14/2021,72698,2021-01-14 18:42:41,P,,,01/07/2021,J1772
ELEC,Arcadian Shopping Center,216 S Highland Ave,,Ossining,NY,10562,,877-455-3833,E,,Public - Card key at all times,24 hours daily,,,,1,,eVgo Network,https://www.evgo.com/,GPS,41.143368,-73.862697,01/23/2021,93704,2021-01-23 01:19:54,,,,,CHADEMO J1772COMBO
ELEC,City Square,50 Main Street,,White Plains,NY,10606,,800-663-5633,E,,Public,MO: Not Specified; TU: Not Specified; WE: Not Specified; TH: Not Specified; FR: Not Specified; SA: Not Specified; SU: Not Specified,,,2,,,SemaCharge Network,https://semaconnect.com/,GPS,41.031399,-73.773596,01/23/2021,148138,2021-01-23 00:11:44,,,,,J1772
ELEC,OSSINING TOWN,Ryder Park 43 Morningside Drive,RYDER PARK,Ossining,NY,10562,,888-758-4389,E,,Public,24 hours daily,,,2,,,ChargePoint Network,http://www.chargepoint.com/,GPS,41.166688,-73.827925,01/23/2021,162295,2021-01-23 00:19:13,,,,,J1772
ELEC,NATIONAL GRID,300 Parkside Ave,BUFFALO ZOO; Zoo parking lot,Buffalo,NY,14214,,888-758-4389,E,,Public,24 hours daily,,,2,,,ChargePoint Network,http://www.chargepoint.com/,GPS,42.937071,-78.851964,01/23/2021,162212,2021-01-23 00:19:13,,,,,J1772
ELEC,NATIONAL GRID,200 Niagara St,TONOWANDA; -,Tonawanda,NY,14150,,888-758-4389,E,,Public,24 hours daily,,,2,,,ChargePoint Network,http://www.chargepoint.com/,GPS,43.019109,-78.886973,01/23/2021,162394,2021-01-23 00:19:13,,,,,J1772
ELEC,RPI 1,71 Albright Ct,B-LOT,Troy,NY,12180,,888-758-4389,E,,Public,24 hours daily,,,2,,,ChargePoint Network,http://www.chargepoint.com/,GPS,42.731358,-73.669075,01/23/2021,143578,2021-01-23 00:19:13,,,,,J1772
ELEC,WEST HERR HONDA,6120 S Transit Rd,STATION 01,Lockport,NY,14094,,888-758-4389,E,,Public,24 hours daily,,,2,,,ChargePoint Network,http://www.chargepoint.com/,GPS,43.127954,-78.697391,01/23/2021,162169,2021-01-23 00:19:13,,,,,J1772
ELEC,SUNY NEW PALTZ,1 Sojourner Way,ELTING GYM 1; -ELTING GYM 2; -,New Paltz,NY,12561,,888-758-4389,E,,Public,24 hours daily,,,4,,,ChargePoint Network,http://www.chargepoint.com/,200-8,41.743938,-74.084258,01/23/2021,162191,2021-01-23 00:19:13,,,,,J1772
ELEC,Art Delta New York,25-20 Brooklyn Queens Expy,,Woodside,NY,11377,,866-816-7584,E,,Public,Office business hours; for employee and guest use only,,,2,,,EV Connect,http://evconnect.com/,GPS,40.763053,-73.902931,06/09/2020,94869,2020-06-09 16:47:26,P,,,06/29/2016,J1772
ELEC,SCHENECTADY,912 Woodlawn Dr,UPPER UNION LOT; Upper Union Street Parking Lot - In the back parking lot off Woodlawn or Dean,Schenectady,NY,12309,,888-758-4389,E,,Public,24 hours daily,,,2,,,ChargePoint Network,http://www.chargepoint.com/,GPS,42.804076,-73.904336,01/23/2021,162343,2021-01-23 00:19:13,,,,,J1772
ELEC,RTS,Baytowne Plaza 1900 Empire Blvd,BAYTOWNE 1; WalMart Shelter LocationBAYTOWNE 2; WalMart Shelter Location,Webster,NY,14580,,888-758-4389,E,,Public,24 hours daily,,,4,,,ChargePoint Network,http://www.chargepoint.com/,GPS,43.192290,-77.499040,01/23/2021,169289,2021-01-23 00:19:13,,,,,J1772
ELEC,Queens Center - Tesla Supercharger,90-15 Queens Boulevard,,Queens,NY,11373,,877-798-3752,E,,Public,24 hours daily; for Tesla use only,,,,10,,Tesla,http://www.teslamotors.com/supercharger,GPS,40.735100,-73.870700,08/10/2020,116809,2020-08-27 20:39:12,P,,,12/01/2018,TESLA
ELEC,Montauk Manor,236 Edgemere Street,,Montauk,NY,11954,,800-663-5633,E,,Public,MO: 07:00am-10:00pm; TU: 07:00am-10:00pm; WE: 07:00am-10:00pm; TH: 07:00am-10:00pm; FR: 07:00am-10:00pm; SA: 07:00am-10:00pm; SU: 07:00am-10:00pm,,,2,,,SemaCharge Network,https://semaconnect.com/,GPS,41.048379,-71.949387,01/23/2021,148203,2021-01-23 00:11:44,,,,,J1772
ELEC,LIBRARY 1,245 N Main St,HERKIMER; Rear parking lot of library,Herkimer,NY,13350,,888-758-4389,E,,Public,24 hours daily,,,2,,,ChargePoint Network,http://www.chargepoint.com/,GPS,43.027471,-74.988937,01/23/2021,162318,2021-01-23 00:19:13,,,,,J1772
ELEC,PICOTTE,11 Corporate Woods Blvd,11 CORPORATE 1; Behind building 11 East side of parking garage.11 CORPORATE 2; Behind building 11 east side of parking garage.11 CORPORATE 3; Behind building 11 east side of parking garage11 CORPORATE 4; Behind building 11 east side of parking garage11 CORPORATE 5;  Behind building 11 east side of parking garage,Albany,NY,12211,,888-758-4389,E,,Public,24 hours daily,,,10,,,ChargePoint Network,http://www.chargepoint.com/,200-9,42.684260,-73.767234,01/23/2021,163514,2021-01-23 00:19:13,,,,,J1772
ELEC,Town of Geneva,32 White Springs Rd,,Geneva,NY,14456,,866-816-7584,E,,Public,24 hours daily,,,2,,,EV Connect,http://evconnect.com/,GPS,42.856272,-77.000230,06/09/2020,123100,2020-06-09 16:47:26,LG,,,04/01/2019,J1772
ELEC,CITY OF BEACON,1 Municipal Plaza,STATION 2; Near Front Entrance,Beacon,NY,12508,,888-758-4389,E,,Public,24 hours daily,,,2,,,ChargePoint Network,http://www.chargepoint.com/,GPS,41.507937,-73.978278,01/23/2021,153264,2021-01-23 00:19:13,,,,,J1772
ELEC,La Tourelle Hotel & Spa - Tesla Destination,1150 Danby Rd,,Ithaca,NY,14850,,607-273-2734  877-798-3752,E,,Public - Call ahead,24 hours daily; for customer use only,,,2,,,Tesla Destination,https://www.tesla.com/destination-charging,200-9,42.401806,-76.502908,11/03/2020,114957,2020-11-18 00:06:10,P,,,12/15/2016,J1772 TESLA
ELEC,City of Binghamton - Recreation Park,88 Beethoven St,,Binghamton,NY,13901,,607-772-7017,E,,Public,24 hours daily,,,2,,,Non-Networked,,200-8,42.099763,-75.935148,03/03/2020,86715,2020-03-03 21:13:47,LG,,,08/10/2017,J1772
ELEC,MUNICIPAL LOT,20 Payne St,VOH LOT; In Village parking lot,Hamilton,NY,13346,,888-758-4389,E,,Public,24 hours daily,,,2,,,ChargePoint Network,http://www.chargepoint.com/,GPS,42.827000,-75.542481,01/23/2021,162367,2021-01-23 00:19:13,,,,,J1772
ELEC,IMPark 188 E 78th St - Tesla Destination,188 E 78th St,,Manhattan,NY,10075,,212-535-0403  877-798-3752,E,,Public,24 hours daily; pay lot; see valet for access,,,2,,,Tesla Destination,https://www.tesla.com/destination-charging,200-9,40.773467,-73.958287,11/03/2020,150580,2020-11-18 00:06:10,P,,,09/30/2019,TESLA
ELEC,Scotttech - Tesla Destination,336 Court St,,Binghamton,NY,13904,,315-214-6065  877-798-3752,E,,Public,24 hours daily,,,1,,,Tesla Destination,https://www.tesla.com/destination-charging,200-9,42.103472,-75.892293,11/03/2020,114884,2020-11-18 00:06:10,P,,,06/09/2015,TESLA
ELEC,Lorell Professional Building,1476 Deer Park Ave,,North Babylon,NY,11703,,866-816-7584,E,,Public,24 hours daily; Also accepts Paypal,A D M V,,4,,,EV Connect,http://evconnect.com/,GPS,40.747521,-73.324952,04/08/2020,154899,2020-04-08 12:29:55,P,,,04/11/2019,J1772
ELEC,Edge,3954 NY-12,,Lyons Falls,NY,13368,,866-816-7584,E,,Public,24 hours daily,,,1,,,EV Connect,http://evconnect.com/,GPS,43.621010,-75.372871,04/08/2020,123107,2020-04-08 12:29:55,P,,,04/01/2019,J1772
ELEC,Peppermints Restaurant - Tesla Destination,4870 W Henrietta Rd,,Henrietta,NY,14467,,585-359-9169  877-798-3752,E,,Public,24 hours daily; for customer use only,,,3,,,Tesla Destination,https://www.tesla.com/destination-charging,200-9,43.055362,-77.653150,11/03/2020,114948,2020-11-18 00:06:10,P,,,11/01/2018,TESLA
ELEC,iPark 59-63 Allen Street - Tesla Destination,59-63 Allen St,,New York,NY,10002,,212-226-1793  877-798-3752,E,,Public,24 hours daily; see valet for access,,,3,,,Tesla Destination,https://www.tesla.com/destination-charging,200-9,40.717124,-73.992010,11/03/2020,115166,2020-11-18 00:06:10,P,,,11/01/2018,J1772 TESLA
ELEC,Rapidpark 150 East 77th Street - Tesla Destination,150 E 77th St,,New York,NY,10021,,914-478-6300  877-798-3752,E,,Public,24 hours daily; for customer use only; see valet for access,,,3,,,Tesla Destination,https://www.tesla.com/destination-charging,200-8,40.773472,-73.959920,11/03/2020,115020,2020-11-18 00:06:10,P,,,11/01/2018,J1772 TESLA
ELEC,HWS COLLEGES,311 Pulteney St,MEDBERY LOT,Geneva,NY,14456,,888-758-4389,E,,Public,24 hours daily,,,2,,,ChargePoint Network,http://www.chargepoint.com/,GPS,42.860090,-76.984375,01/23/2021,170029,2021-01-23 00:19:13,,,,,J1772
ELEC,SDH STATION,2500 Kensington Ave,EV STATION 1,Buffalo,NY,14226,,888-758-4389,E,,Public,24 hours daily,,,2,,,ChargePoint Network,http://www.chargepoint.com/,GPS,42.957542,-78.769663,01/23/2021,165110,2021-01-23 00:19:13,,,,,J1772
ELEC,DMV PARKING LOT,227 W Main St,JOHNSTOWN; Back left of lot,Johnstown,NY,12095,,888-758-4389,E,,Public,24 hours daily,,,2,,,ChargePoint Network,http://www.chargepoint.com/,GPS,43.006616,-74.375423,01/23/2021,162306,2021-01-23 00:19:13,,,,,J1772
ELEC,iPark 41 E 85th Street - Tesla Destination,41 E 85th St,,New York,NY,10028,,212-472-4713  877-798-3752,E,,Public,24 hours daily; see valet for access,,,3,,,Tesla Destination,https://www.tesla.com/destination-charging,200-8,40.780305,-73.959091,11/03/2020,115125,2020-11-18 00:06:10,P,,,12/15/2016,J1772 TESLA
ELEC,MONOLITH SOLAR,432 Washington St,MONOLITH SOLAR; station is located directly adjacent to solar hood,Rensselaer,NY,12144,,888-758-4389,E,,Public,24 hours daily,,,2,,,ChargePoint Network,http://www.chargepoint.com/,GPS,42.641534,-73.743328,01/23/2021,162477,2021-01-23 00:19:13,,,,,J1772
ELEC,College Plaza,15-109 Middle Country Rd,,Selden,NY,11784,,877-455-3833,E,,Public - Card key at all times,24 hours daily,,,,1,,eVgo Network,https://www.evgo.com/,GPS,40.865165,-73.049424,01/23/2021,93537,2021-01-23 01:19:54,,,,,CHADEMO J1772COMBO
ELEC,Chelnik Parking NYC 880 5th - Tesla Destination,880 5th Ave,,New York,NY,10021,,212-988-9130  877-798-3752,E,,Public,24 hours daily; see valet for access,,,2,,,Tesla Destination,https://www.tesla.com/destination-charging,200-8,40.770385,-73.968296,11/03/2020,115190,2020-11-18 00:06:10,P,,,01/01/2016,TESLA
ELEC,TOWN OF HURLEY,2 Wamsley Pl,MAIN LOT; -,Hurley,NY,12443,,888-758-4389,E,,Public,24 hours daily,,,2,,,ChargePoint Network,http://www.chargepoint.com/,GPS,41.926193,-74.067190,01/23/2021,155285,2021-01-23 00:19:13,,,,,J1772
ELEC,Quik Park 82nd Street LLC - Tesla Destination,350 E. 82nd St,,New York,NY,10028,,212-352-0514  877-798-3752,E,,Public,24 hours daily; for customer use only; see valet for access,,,3,,,Tesla Destination,https://www.tesla.com/destination-charging,200-9,40.774316,-73.951909,11/03/2020,115108,2020-11-18 00:06:10,P,,,01/01/2016,J1772 TESLA
ELEC,NATIONAL GRID,2232 Delaware Ave,KOHLS BUFFALO,Buffalo,NY,14216,,888-758-4389,E,,Public,24 hours daily,,,2,,,ChargePoint Network,http://www.chargepoint.com/,GPS,42.944740,-78.870384,01/23/2021,162206,2021-01-23 00:19:13,,,,,J1772
ELEC,Ponquogue Beach Pavilion,280 Dune Rd,,Hampton Bays,NY,11946,,631-728-2530,E,,Public,24 hours daily; parking permit required,,,2,,,EV Connect,http://evconnect.com/,200-8,40.837540,-72.495432,05/06/2020,147061,2020-05-06 17:56:57,LG,,,08/20/2019,J1772
ELEC,High Falls Garage,240 State St,,Rochester,NY,14614,,866-816-7584,E,,Public,24 hours daily,,,2,,,EV Connect,http://evconnect.com/,GPS,43.159975,-77.616663,04/08/2020,123086,2020-04-08 12:29:55,P,,,04/01/2019,J1772
ELEC,Broadway Commons - Cinemas and Food,358 N Broadway Commons,,Hicksville,NY,11801,,888-264-2208,E,,Public,6am-12am daily,,,2,,,Volta,https://voltacharging.com/,GPS,40.773414,-73.533184,03/03/2020,151794,2020-03-03 21:13:47,P,,,09/05/2019,J1772
ELEC,HASLETT PARK,35 Main St,STATION 01; -,Fort Plain,NY,13339,,888-758-4389,E,,Public,24 hours daily,,,2,,,ChargePoint Network,http://www.chargepoint.com/,GPS,42.931182,-74.622160,01/23/2021,162256,2021-01-23 00:19:13,,,,,J1772
ELEC,4TH & LAFAYETTE,402 Lafayette St,FAST CHARGER 01; -,Jamestown,NY,14701,,888-758-4389,E,,Public,24 hours daily,,,,2,,ChargePoint Network,http://www.chargepoint.com/,GPS,42.096388,-79.245617,01/23/2021,162268,2021-01-23 00:19:13,,,,,CHADEMO J1772COMBO
ELEC,TAITEM,110 S Albany St,"NS1-CHARGEPOINT; Located in front lawn, street side access",Ithaca,NY,14850,,888-758-4389,E,,Public,24 hours daily,,,2,,,ChargePoint Network,http://www.chargepoint.com/,GPS,42.438969,-76.502064,01/23/2021,162494,2021-01-23 00:19:13,,,,,J1772
ELEC,THOMAS COLE,218 Spring St,STATION #1; Rear parking lot,Catskill,NY,12414,,888-758-4389,E,,Public,24 hours daily,,,2,,,ChargePoint Network,http://www.chargepoint.com/,GPS,42.226113,-73.861255,01/23/2021,164835,2021-01-23 00:19:13,,,,,J1772
ELEC,NATIONAL GRID,2080 Western Ave,VENT GUILDERLND,Guilderland,NY,12084,,888-758-4389,E,,Public,24 hours daily,,,2,,,ChargePoint Network,http://www.chargepoint.com/,GPS,42.697495,-73.890943,01/23/2021,162195,2021-01-23 00:19:13,,,,,J1772
ELEC,BMW SOUTHAMPTON,759 County Rd 39A,STATION 01,Southampton,NY,11968,,888-758-4389,E,,Public,24 hours daily,,,2,,,ChargePoint Network,http://www.chargepoint.com/,GPS,40.899092,-72.372788,01/23/2021,162453,2021-01-23 00:19:13,,,,,J1772
ELEC,DEPAULA,785 Central ave,DEPAULA EV CHAR; -,Albany,NY,12206,,888-758-4389,E,,Public,24 hours daily,,,2,,,ChargePoint Network,http://www.chargepoint.com/,GPS,42.678992,-73.788534,01/23/2021,162384,2021-01-23 00:19:13,,,,,J1772
ELEC,Standard Parking 15 Metrotech - Tesla Destination,15 Metrotech Ctr S,,Brooklyn,NY,11201,,800-836-6666  877-798-3752,E,,Public,24 hours daily; see valet for access,,,3,,,Tesla Destination,https://www.tesla.com/destination-charging,200-8,40.693317,-73.987100,11/03/2020,114890,2020-11-18 00:06:10,P,,,11/01/2018,J1772 TESLA
ELEC,Standard Parking 1360 Fulton Street - Tesla Destination,1360  Fulton St,,Brooklyn,NY,11216,,800-836-6666  877-798-3752,E,,Public,24 hours daily; see valet for access,,,2,,,Tesla Destination,https://www.tesla.com/destination-charging,200-9,40.679983,-73.946504,11/03/2020,114889,2020-11-18 00:06:10,P,,,11/01/2018,TESLA
ELEC,GAULT BMW,2311 North St,STATION 01,Endicott,NY,13760,,888-758-4389,E,,Public,24 hours daily,,,2,,,ChargePoint Network,http://www.chargepoint.com/,GPS,42.107059,-76.035088,01/23/2021,162435,2021-01-23 00:19:13,,,,,J1772
ELEC,Enterprise Parking 150 Myrtle Ave - Tesla Destination,150 Myrtle Ave,,Brooklyn,NY,11201,,718-422-7506  877-798-3752,E,,Public,24 hours daily; pay lot; see valet for access,,,4,,,Tesla Destination,https://www.tesla.com/destination-charging,200-9,40.693194,-73.982701,11/03/2020,150575,2020-11-18 00:06:10,P,,,09/30/2019,TESLA
ELEC,LaGrangeville Tops Market,16 John J Wagner Way,,LaGrangeville,NY,12540,,855-900-7584,E,,Public,24 hours daily,,,,4,,Greenlots,http://greenlots.com/,200-9,41.667907,-73.795294,01/23/2021,164367,2021-01-23 01:21:30,,,,,CHADEMO J1772COMBO
ELEC,MARKET 32 EV,81 Schoolhouse Rd,PEDIATRICEV1; To the left of building.PEDIATRICEV2; To the left of building.PEDIATRICEV3; To the left of building.,Albany,NY,12203,,888-758-4389,E,,Public,24 hours daily,,,6,,,ChargePoint Network,http://www.chargepoint.com/,200-9,42.678964,-73.844708,01/23/2021,155290,2021-01-23 00:19:13,,,,,J1772
ELEC,iPark 200 E 70th Street - Tesla Destination,200 E 70th St,,New York,NY,10021,,212-535-5908  877-798-3752,E,,Public,24 hours daily; see valet for access,,,3,,,Tesla Destination,https://www.tesla.com/destination-charging,200-8,40.768244,-73.961621,11/03/2020,115042,2020-11-18 00:06:10,P,,,12/15/2016,J1772 TESLA
ELEC,GGMC Yorkville Car Park - Tesla Destination,230 E 92nd St,,New York,NY,10128,,212-410-2184  877-798-3752,E,,Public,24 hours daily; for customer use only; see valet for access,,,3,,,Tesla Destination,https://www.tesla.com/destination-charging,200-8,40.782163,-73.950590,11/03/2020,115060,2020-11-18 00:06:10,P,,,03/01/2017,J1772 TESLA
ELEC,Marshall & Sons,701 Montauk Hwy,,Montauk,NY,11954,,866-816-7584,E,,Public - Credit card at all times,24 hours daily,A D Debit M V,,4,,,EV Connect,http://evconnect.com/,GPS,41.033512,-71.946540,07/13/2020,163945,2020-07-13 20:30:49,P,,,06/26/2020,J1772
ELEC,NYSE Thruway - NYPA,20 Codys Ct,,Saugerties,NY,12477,,866-816-7584,E,,Public,24 hours daily,A D M V,,,2,,EV Connect,http://evconnect.com/,200-9,42.110368,-73.958599,11/09/2020,167630,2020-11-09 16:53:32,SG,,,06/24/2020,CHADEMO J1772COMBO
ELEC,Quik Park Garden Lots LLC - Tesla Destination,126 West 32nd St,,New York,NY,10001,,212-564-2627  877-798-3752,E,,Public,24 hours daily; see valet for access,,,3,,,Tesla Destination,https://www.tesla.com/destination-charging,200-9,40.748789,-73.989915,11/03/2020,115009,2020-11-18 00:06:10,P,,,01/01/2016,J1772 TESLA
ELEC,Brunos Bakery and Restaurant - Tesla Destination,1650 Hylan Blvd,,Staten Island,NY,10310,,718-448-0993  877-798-3752,E,,Public,24 hours daily; for customer use only; see front desk for access,,,2,,,Tesla Destination,https://www.tesla.com/destination-charging,200-9,40.588001,-74.090126,11/03/2020,150697,2020-11-18 00:06:10,P,,,09/30/2019,TESLA
ELEC,Brookfield-200 Liberty,200 Liberty,,New York,NY,10281,,855-900-7584,E,,Public,24 hours daily,,,2,,,Greenlots,http://greenlots.com/,200-9,40.710580,-74.015583,01/23/2021,99175,2021-01-23 01:21:30,,,,,J1772
ELEC,WHITEFACE MT,5021 Route 86,WHITEFACE 1; Right side of Bear Den LotWHITEFACE MT 3; Right Side Bear Den Lot,Wilmington,NY,12997,,888-758-4389,E,,Public,24 hours daily,,,4,,,ChargePoint Network,http://www.chargepoint.com/,200-9,44.354307,-73.860699,01/23/2021,170744,2021-01-23 00:19:13,,,,,J1772
ELEC,MTP Parking 363 Bond Street - Tesla Destination,363 Bond St,,Brooklyn,NY,11231,,212-575-5335  877-798-3752,E,,Public,24 hours daily; pay lot; see valet for access,,,4,,,Tesla Destination,https://www.tesla.com/destination-charging,200-9,40.677977,-73.990135,11/03/2020,122476,2020-11-18 00:06:10,P,,,03/01/2019,TESLA
ELEC,Wingate By Wyndham Rome - Tesla Destination,90 Dart Cir,,Rome,NY,13441,,315-533-2591  877-798-3752,E,,Public,24 hours daily; for customer use only; see front desk for access,,,3,,,Tesla Destination,https://www.tesla.com/destination-charging,200-9,43.209127,-75.412926,11/03/2020,115230,2020-11-18 00:06:10,P,,,11/01/2018,J1772 TESLA
ELEC,Long View Lodge,681 Deerland Rd,,Long Lake,NY,12847,,866-816-7584,E,,Public,24 hours daily; Also accepts Paypal,A D M V,,2,,,EV Connect,http://evconnect.com/,GPS,43.948810,-74.451430,04/08/2020,154920,2020-04-08 12:29:55,P,,,04/13/2019,J1772
ELEC,NY DCFC,760 Montauk Hwy,"WATER MILL, NY; Rear Parking Lot",Water Mill,NY,11976,,888-758-4389,E,,Public,24 hours daily,,,,2,,ChargePoint Network,http://www.chargepoint.com/,GPS,40.911797,-72.353065,01/23/2021,167884,2021-01-23 00:19:13,,,,,CHADEMO J1772COMBO
ELEC,Borland House Bed and Breakfast - Tesla Destination,130 Clinton St,,Montgomery,NY,12549,,845-457-1513  877-798-3752,E,,Public,24 hours daily; for customer use only; see front desk for access,,,2,,,Tesla Destination,https://www.tesla.com/destination-charging,200-9,41.526880,-74.235988,11/03/2020,114981,2020-11-18 00:06:10,P,,,12/15/2016,J1772 TESLA
ELEC,MARKET 32 EV,873 New Loudon Rd,LATHAM EV 1; In front of building,Latham,NY,12110,,888-758-4389,E,,Public,24 hours daily,,,2,,,ChargePoint Network,http://www.chargepoint.com/,GPS,42.752846,-73.758177,01/23/2021,154302,2021-01-23 00:19:13,,,,,J1772
ELEC,Shaheen's Adirondack Inn - Tesla Destination,314 Park St,,Tupper Lake,NY,12986,,518-359-3384  877-798-3752,E,,Public,24 hours daily; for customer use only,,,1,,,Tesla Destination,https://www.tesla.com/destination-charging,200-9,44.224690,-74.448721,11/03/2020,122496,2020-11-18 00:06:10,P,,,03/01/2019,TESLA
ELEC,MARKET 32 EV,18 Glenridge Rd,GLENVILLE EV1; On side of building.GLENVILLE EV2; On side of building.GLENVILLE EV3; On side of building.GLENVILLE EV4; On side of building.,Schenectady,NY,12302,,888-758-4389,E,,Public,24 hours daily,,,8,,,ChargePoint Network,http://www.chargepoint.com/,200-9,42.867737,-73.928119,01/23/2021,156640,2021-01-23 00:19:13,,,,,J1772
ELEC,VIC AND CAMPUS,7833 NY-30,LOT 7 1.1; Inside of upper parking lot of lot 7,Paul Smiths,NY,12970,,888-758-4389,E,,Public,24 hours daily,,,2,,,ChargePoint Network,http://www.chargepoint.com/,GPS,44.436237,-74.251090,01/23/2021,154726,2021-01-23 00:19:13,,,,,J1772
ELEC,"Best Western Plus, Plattsburgh - Tesla Destination",446 Route #3,,Plattsburgh,NY,12901,,518-561-7750  877-798-3752,E,,Public,24 hours daily; for customer use only; see front desk for access,,,2,,,Tesla Destination,https://www.tesla.com/destination-charging,200-9,44.696590,-73.491530,11/03/2020,115211,2020-11-18 00:06:10,P,,,11/01/2018,TESLA
ELEC,Mortys Oyster Stand - Tesla Destination,2167 Montauk Hwy,,Montauk,NY,11954,,877-798-3752  877-798-3752,E,,Public,24 hours daily; for customer use only; see front desk for access,,,4,,,Tesla Destination,https://www.tesla.com/destination-charging,200-9,41.002726,-72.031415,11/03/2020,168975,2020-11-18 00:06:10,P,,,11/03/2020,TESLA
ELEC,2 WEST AVE,2 West Ave,2 WEST 1.12 WEST 1.22 WEST 1.3,Saratoga Springs,NY,12866,,888-758-4389,E,,Public,24 hours daily,,,6,,,ChargePoint Network,http://www.chargepoint.com/,200-9,43.084846,-73.804210,01/23/2021,170398,2021-01-23 00:19:13,,,,,J1772
ELEC,Burger King - LeRoy NY,134 W Main St,,LeRoy,NY,14482,,888-998-2546,E,,Public,MON: 24 hours | TUE: 24 hours | WED: 24 hours | THU: 24 hours | FRI: 24 hours | SAT: 24 hours | SUN: 24 hours,,,2,,,Blink Network,http://www.blinkcharging.com/,GPS,42.978631,-78.005787,01/22/2021,164405,2021-01-22 22:55:21,,,,,J1772
ELEC,Gowanda Train Station,50 Commercial St,,Gowanda,NY,14070,,716-532-5716,E,,Public,24 hours daily,,,2,,,Non-Networked,,GPS,42.457597,-78.932165,06/09/2020,157958,2020-06-09 16:47:26,P,,,05/15/2020,J1772
ELEC,Maguire Chevrolet,35 Cinema Dr,,Ithaca,NY,14850,,607-272-9292,E,,Public - Call ahead,Dealership business hours,,,2,1,,Non-Networked,,GPS,42.480929,-76.477605,03/03/2020,117739,2020-03-03 21:13:47,P,,,01/01/2019,J1772 J1772COMBO
ELEC,The Gunlocke Co,1 Gunloccke Dr,,Wayland,NY,14572,,866-816-7584,E,,Public,24 hours daily,,,2,,,EV Connect,http://evconnect.com/,GPS,42.555384,-77.589129,05/06/2020,123146,2020-05-06 17:56:57,P,,,04/01/2019,J1772
ELEC,MAGUIRE VW,370 Elmira Rd,VW_408158_A,Ithaca,NY,14850,,888-758-4389,E,,Public,24 hours daily,,,2,,,ChargePoint Network,http://www.chargepoint.com/,GPS,42.422426,-76.517437,01/23/2021,162419,2021-01-23 00:19:13,,,,,J1772
ELEC,776 Sixth Avenue,776 Avenue of the Americas,Enter Parking garage on 26th Ave. Between 6th Ave. and Broadway (North Side). See valet to use charging station.,New York,NY,10001,,888-998-2546,E,,Public,MON: 24 hours | TUE: 24 hours | WED: 24 hours | THU: 24 hours | FRI: 24 hours | SAT: 24 hours | SUN: 24 hours,,,1,,,Blink Network,http://www.blinkcharging.com/,GPS,40.745280,-73.991422,01/22/2021,124142,2021-01-22 22:55:21,,,,,J1772
ELEC,EP Building,1 Research Cir,Chargers are located in the parking lot to the north side of the Engineering Physics Bldg.,Niskayuna,NY,12309,,800-663-5633,E,,Public,MO: 12:00am-12:00am; TU: 12:00am-12:00am; WE: 12:00am-12:00am; TH: 12:00am-12:00am; FR: 12:00am-12:00am; SA: 12:00am-12:00am; SU: 12:00am-12:00am,,,5,,,SemaCharge Network,https://semaconnect.com/,GPS,42.828911,-73.874213,01/23/2021,148042,2021-01-23 00:11:44,,,,,J1772
ELEC,ICON 310 W 39TH,310 W 39th Street,Located between 8th Ave & 9th Ave.,New York,NY,10018,,888-998-2546,E,,Public,MON: 24 hours | TUE: 24 hours | WED: 24 hours | THU: 24 hours | FRI: 24 hours | SAT: 24 hours | SUN: 24 hours,,,1,,,Blink Network,http://www.blinkcharging.com/,GPS,40.755440,-73.992027,01/22/2021,169895,2021-01-22 22:55:21,,,,,J1772
ELEC,W 75th Parking Garage - Tesla Supercharger,201 W 75th Street,,New York,NY,10023,,877-798-3752,E,,Public,24 hours daily; for Tesla use only,,,,4,,Tesla,http://www.teslamotors.com/supercharger,200-8,40.781000,-73.980400,08/10/2020,102335,2020-08-27 20:39:12,P,,,07/23/2018,TESLA
ELEC,Rapidpark 204 W 101st Street - Tesla Destination,204 W 101st St,,New York,NY,10025,,212-864-8605  877-798-3752,E,,Public,24 hours daily; see valet for access,,,3,,,Tesla Destination,https://www.tesla.com/destination-charging,200-9,40.797283,-73.968766,11/03/2020,115047,2020-11-18 00:06:10,P,,,09/01/2017,J1772 TESLA
ELEC,Maguire Family of Dealerships,370 Elmira Rd,,Ithaca,NY,14850,,877-848-7174,E,,Public,24 hours daily,,,1,2,,Non-Networked,,GPS,42.422535,-76.518884,06/09/2020,157971,2020-06-09 16:47:26,P,,,05/15/2020,J1772 J1772COMBO
ELEC,Buffalo Niagara International Airport,4200 Genesee St,"Located on Level 1, section F-2 in the Daily/Hourly Parking Garage",Buffalo,NY,14225,,716-630-6191,E,,Public,24 hours daily,,,3,,,Non-Networked,,GPS,42.933441,-78.731633,06/09/2020,63479,2020-06-09 16:47:26,P,,,12/31/2014,J1772
ELEC,TOWN OF BABYLON,151 Phelps Ln,PHELPS LANE 1; Left Station PHELPS LANE 2; Right side station,North Babylon,NY,11703,,888-758-4389,E,,Public,24 hours daily,,,2,,,ChargePoint Network,http://www.chargepoint.com/,200-9,40.726021,-73.329552,01/23/2021,162278,2021-01-23 00:19:13,,,,,J1772
ELEC,TG EV STATIONS,35 State Route 299,LEFT STATIONRIGHT STATION; -,Gardiner,NY,12525,,888-758-4389,E,,Public,24 hours daily,,,4,,,ChargePoint Network,http://www.chargepoint.com/,GPS,41.744560,-74.117960,01/23/2021,154055,2021-01-23 00:19:13,,,,,J1772
ELEC,TOWN OF MP,1 Town Hall Plaza,TMP STATION 1TMP STATION 2,Valhalla,NY,10595,,888-758-4389,E,,Public,24 hours daily,,,3,,,ChargePoint Network,http://www.chargepoint.com/,200-9,41.095428,-73.777794,01/23/2021,123413,2021-01-23 00:19:13,,,,,J1772
ELEC,854ELLICOTT,854 Ellicott St,854 ELLICOTT 10; Near main entrance 854 ELLICOTT 11; Near main entrance 854 ELLICOTT 12; Near main entrance 854 ELLICOTT 1; -854 ELLICOTT 2; Near main entrance 854 ELLICOTT 3; By main entrance854 ELLICOTT 4; Near main entrance854 ELLICOTT 5; Near main entrance854 ELLICOTT 6; Near main entrance 854 ELLICOTT 7; Near main entrance 854 ELLICOTT 8; Near main entrance 854 ELLICOTT 9; Near main entrance,Buffalo,NY,14203,,888-758-4389,E,,Public,24 hours daily,,,24,,,ChargePoint Network,http://www.chargepoint.com/,200-8,42.901368,-78.867112,01/23/2021,162228,2021-01-23 00:19:13,,,,,J1772
ELEC,The Peninsula Hotel New York - Tesla Destination,700 5th Ave,,New York,NY,10019,,212-956 2888  877-798-3752,E,,Public,24 hours daily; for customer use only; see valet for access,,,1,,,Tesla Destination,https://www.tesla.com/destination-charging,200-8,40.761780,-73.975057,11/03/2020,115181,2020-11-18 00:06:10,P,,,01/01/2016,TESLA
ELEC,The Shops at Nanuet,75 S Middletown Rd,,Nanuet,NY,10954,,877-455-3833,E,,Public - Card key at all times,24 hours daily,,,,6,,eVgo Network,https://www.evgo.com/,GPS,41.094148,-74.012970,01/23/2021,122801,2021-01-23 01:19:54,,,,,CHADEMO J1772COMBO
ELEC,Skaneateles Village Hall,26 Fennell St,"At Village Hall building, next to the Post Office and Tops Market",Skaneateles,NY,13152,,315-685-3440  866-816-7584,E,,Public,24 hours daily,,,3,,,EV Connect,http://evconnect.com/,200-9,42.948234,-76.431694,05/06/2020,65277,2020-05-06 17:56:57,SG,,,07/05/2014,J1772
ELEC,CITY OF BEACON,13 South Ave,STATION 1,Beacon,NY,12508,,888-758-4389,E,,Public,24 hours daily,,,2,,,ChargePoint Network,http://www.chargepoint.com/,GPS,41.507568,-73.977600,01/23/2021,149620,2021-01-23 00:19:13,,,,,J1772
ELEC,"Littleman Driggs Parking, LLC - Tesla Destination",626  Driggs Ave,,Brooklyn,NY,11211,,212-714-3571  877-798-3752,E,,Public,24 hours daily; see valet for access,,,3,,,Tesla Destination,https://www.tesla.com/destination-charging,200-9,40.715405,-73.958638,11/03/2020,114910,2020-11-18 00:06:10,P,,,11/01/2018,J1772 TESLA
ELEC,GREEN ACRES MALL,2034 Green Acres Mall,,Valley Stream,NY,11581,,833-632-2778,E,,Public,24 hours daily,,,1,3,,Electrify America,https://www.electrifyamerica.com/,GPS,40.662119,-73.723241,01/23/2021,152450,2021-01-23 01:23:19,,,,,CHADEMO J1772 J1772COMBO
ELEC,SAVARINO COMPAN,BRL Parking Lot 4th from building 1 South Street,BRL 6; -,Buffalo,NY,14204,,888-758-4389,E,,Public,24 hours daily,,,2,,,ChargePoint Network,http://www.chargepoint.com/,GPS,42.863679,-78.868118,01/23/2021,164153,2021-01-23 00:19:13,,,,,J1772
ELEC,Lima - Town Court,7329 E Main St,,Lima,NY,14485,,866-816-7584,E,,Public,24 hours daily,,,1,,,EV Connect,http://evconnect.com/,GPS,42.905520,-77.610606,04/08/2020,123130,2020-04-08 12:29:55,LG,,,04/01/2019,J1772
ELEC,Rouses Point,139 Lake St,,Rouses Point,NY,12979,,866-816-7584,E,,Public,24 hours daily,,,2,,,EV Connect,http://evconnect.com/,200-9,44.991537,-73.363990,04/08/2020,65302,2020-04-08 12:29:55,LG,,,04/01/2018,J1772
ELEC,Waterloo Premium Outlets,655 New York 318,,Waterloo,NY,13165,,833-632-2778,E,,Public,24 hours daily,,,,4,,Electrify America,https://www.electrifyamerica.com/,GPS,42.955930,-76.920965,01/23/2021,166226,2021-01-23 01:23:19,,,,,CHADEMO J1772COMBO
ELEC,HUDSON PRESERVE,136 Troy Schdy Rd,BERYL WAY 5; Next to building 2,Watervliet,NY,12189,,888-758-4389,E,,Public,24 hours daily,,,2,,,ChargePoint Network,http://www.chargepoint.com/,GPS,42.733020,-73.725890,01/23/2021,143920,2021-01-23 00:19:13,,,,,J1772
ELEC,Enterprise Parking 219 E 69th St - Tesla Destination,219 E 69th St,,New York,NY,10021,,877-798-3752  877-798-3752,E,,Public,24 hours daily; for customer use only; see front desk for access,,,3,,,Tesla Destination,https://www.tesla.com/destination-charging,200-9,40.767519,-73.960678,11/03/2020,168757,2020-11-18 00:06:10,P,,,11/03/2020,J1772 TESLA
ELEC,Stewart's Shops - Tesla Supercharger,6151 NY-8 Chestertown,,Chestertown,NY,12817,,877-798-3752,E,,Public,24 hours daily; for Tesla use only,,,,6,,Tesla,http://www.teslamotors.com/supercharger,GPS,43.664460,-73.786500,08/10/2020,154440,2020-08-27 20:39:12,P,,,03/06/2020,TESLA
ELEC,506 W 181 St Garage-PARK-it - Tesla Destination,506 W 181 St,,Manhattan,NY,10033,,212-929-9404  877-798-3752,E,,Public,24 hours daily; pay lot; see valet for access,,,4,,,Tesla Destination,https://www.tesla.com/destination-charging,200-9,40.848198,-73.931808,11/03/2020,150535,2020-11-18 00:06:10,P,,,09/30/2019,TESLA
ELEC,Central Parking - 146 W 57th St,146 West 57th Street,Underground Parking,New York,NY,10019,,888-998-2546,E,,Public,MON: 24 hours | TUE: 24 hours | WED: 24 hours | THU: 24 hours | FRI: 24 hours | SAT: 24 hours | SUN: 24 hours,,,2,,,Blink Network,http://www.blinkcharging.com/,GPS,40.764609,-73.979517,01/22/2021,164738,2021-01-22 22:55:21,,,,,J1772
ELEC,STARR LIBRARY,68 W Market St,STARR LIBRARY,Rhinebeck,NY,12572,,888-758-4389,E,,Public,24 hours daily,,,2,,,ChargePoint Network,http://www.chargepoint.com/,GPS,41.926380,-73.918381,01/23/2021,162159,2021-01-23 00:19:13,,,,,J1772
ELEC,ULSTER COUNTY,1 Development Court,"DSS 1; Behind Department of Social Services Building. Ulster County's fee for public charging is $0.50 per hour, effective 1-1-2020.DSS 2; Behind Department of Social Services Building. Ulster County's fee for public charging is $0.50 per hour, effective 1-1-2020.DSS 3; Behind Department of Social Services Building. Ulster County's fee for public charging is $0.50 per hour, effective 1-1-2020.",Kingston,NY,12401,,888-758-4389,E,,Public,24 hours daily,,,6,,,ChargePoint Network,http://www.chargepoint.com/,200-8,41.947224,-73.995025,01/23/2021,162351,2021-01-23 00:19:13,,,,,J1772
ELEC,NATIONAL GRID,3954 NY-31,CHILISLIVERPOOL; Side of chiliâ€™s near back of the restaurant,Liverpool,NY,13090,,888-758-4389,E,,Public,24 hours daily,,,2,,,ChargePoint Network,http://www.chargepoint.com/,GPS,43.184548,-76.238194,01/23/2021,162210,2021-01-23 00:19:13,,,,,J1772
ELEC,Ellwanger Estate Bed & Breakfast - Tesla Destination,625 Mt Hope Ave,,Rochester,NY,14620,,585-314-1793  877-798-3752,E,,Public,24 hours daily; for customer use only; see front desk for access,,,1,,,Tesla Destination,https://www.tesla.com/destination-charging,200-9,43.137550,-77.615609,11/03/2020,115224,2020-11-18 00:06:10,P,,,12/15/2016,TESLA
ELEC,Rondout Valley Central School District Office,122 Kyserike Rd,,Accord,NY,12404,,866-816-7584,E,,Public,24 hours daily,,,2,,,EV Connect,http://evconnect.com/,GPS,41.814199,-74.189316,04/08/2020,123062,2020-04-08 12:29:55,P,,,04/01/2019,J1772
ELEC,The Fern Lodge - Tesla Destination,46 Fiddlehead Bay Rd,,Chestertown,NY,12817,,518-494-7238  877-798-3752,E,,Public,24 hours daily; for customer use only,,,2,,,Tesla Destination,https://www.tesla.com/destination-charging,200-9,43.625316,-73.850472,11/03/2020,114923,2020-11-18 00:06:10,P,,,11/01/2018,TESLA
ELEC,HUDSON PRESERVE,2507 Brooke Cir,BLDG 25 #1,Watervliet,NY,12189,,888-758-4389,E,,Public,24 hours daily,,,2,,,ChargePoint Network,http://www.chargepoint.com/,GPS,42.734540,-73.728250,01/23/2021,143272,2021-01-23 00:19:13,,,,,J1772
ELEC,Grand Ave Bus Depot & Central Maintenance Facility,4805 Grand Ave,,Maspeth,NY,11378,,866-816-7584,E,,Public,24 hours daily,,,1,,,EV Connect,http://evconnect.com/,GPS,40.717426,-73.920236,04/08/2020,123115,2020-04-08 12:29:55,P,,,04/01/2019,J1772
ELEC,24 STATE STREET,35 Lincoln Ave,SPIEGEL CENTER,Pittsford,NY,14534,,888-758-4389,E,,Public,24 hours daily,,,2,,,ChargePoint Network,http://www.chargepoint.com/,GPS,43.089355,-77.519620,01/23/2021,147217,2021-01-23 00:19:13,,,,,J1772
ELEC,New York Power Authority - Blenheim-Gilboa Project,397 Power Plant Access Rd,,Gilboa,NY,12076,,866-816-7584,E,,Public,Business hours,,,2,,,EV Connect,http://evconnect.com/,200-9,42.442290,-74.447636,04/08/2020,94840,2020-04-08 12:29:55,P,,,05/29/2016,J1772
ELEC,TRANSITION,11 Cornell Ave,HOBART; Behind the community hall,Hobart,NY,13788,,888-758-4389,E,,Public,24 hours daily,,,2,,,ChargePoint Network,http://www.chargepoint.com/,GPS,42.372190,-74.667225,01/23/2021,162389,2021-01-23 00:19:13,,,,,J1772
ELEC,DCEC - N DEPOT,7 Depot St,,Delhi,NY,13753,,888-758-4389,E,,Public,24 hours daily,,,2,,,ChargePoint Network,http://www.chargepoint.com/,GPS,42.271027,-74.919526,01/23/2021,171241,2021-01-23 00:19:13,,,,,J1772
ELEC,"The Ritz-Carlton Residences, Long Island - Tesla Destination",6000 Royal Court,,North Hills,NY,11040,,877-798-3752  877-798-3752,E,,Public,24 hours daily; for customer use only; see front desk for access,,,12,,,Tesla Destination,https://www.tesla.com/destination-charging,200-9,40.769686,-73.688986,11/03/2020,169195,2020-11-18 00:06:10,P,,,11/03/2020,J1772 TESLA
ELEC,VWOFHUNTINGTON,800-878 New York 25,VW_408382_A; -,Huntington Station,NY,11746,,888-758-4389,E,,Public,24 hours daily,,,2,,,ChargePoint Network,http://www.chargepoint.com/,GPS,40.834394,-73.380570,01/23/2021,162429,2021-01-23 00:19:13,,,,,J1772
ELEC,RIVERHEAD BAY,1521 Old Country Rd,VW_408150_A; East Part of Front Parking Lot,Riverhead,NY,11901,,888-758-4389,E,,Public,24 hours daily,,,2,,,ChargePoint Network,http://www.chargepoint.com/,GPS,40.925695,-72.692471,01/23/2021,162424,2021-01-23 00:19:13,,,,,J1772
ELEC,New York Hospital Queens - Tesla Destination,56-45 Main Street,,Flushing,NY,11355,,877-798-3752  877-798-3752,E,,Public,24 hours daily; for customer use only; see front desk for access,,,6,,,Tesla Destination,https://www.tesla.com/destination-charging,GPS,40.747190,-73.825366,11/03/2020,168984,2020-11-18 23:28:44,P,,,11/03/2020,TESLA
ELEC,MARKET 32 EV,1930 Saranac Ave,SARANAC EV1; To the right of front entrance.SARANAC EV2; To the right of front entrance.,Lake Placid,NY,12946,,888-758-4389,E,,Public,24 hours daily,,,4,,,ChargePoint Network,http://www.chargepoint.com/,200-9,44.294688,-74.011179,01/23/2021,158556,2021-01-23 00:19:13,,,,,J1772
ELEC,MAIN,1133 Route 414 Parking Garage,"2ND FLOOR 1 GW; 2nd floor near stairs, against front wall2ND FLOOR 2 NGW; 2nd floor of parking garage, at front wall, near casino entrance",Waterloo,NY,13165,,888-758-4389,E,,Public,24 hours daily,,,4,,,ChargePoint Network,http://www.chargepoint.com/,GPS,42.969486,-76.845264,01/23/2021,162377,2021-01-23 00:19:13,,,,,J1772
ELEC,MIDDLE COUNTRY,575 Middle Country Rd,SELDEN,Selden,NY,11784,,888-758-4389,E,,Public,24 hours daily,,,2,,,ChargePoint Network,http://www.chargepoint.com/,GPS,40.867476,-73.033034,01/23/2021,162152,2021-01-23 00:19:13,,,,,J1772
ELEC,Taste NY Market,4640 Taconic State Pkwy N,,Lagrangeville,NY,12540,,845-849-0247,E,,Public,Store business hours,,,2,,,EV Connect,http://evconnect.com/,GPS,41.656857,-73.789422,04/08/2020,94856,2020-06-15 16:07:25,P,,,03/25/2020,J1772
ELEC,CHARLIE JOHNS,111 Elm Lake Road,CHARLIE JOHNS; Behind Lane Emporium,Speculator,NY,12164,,888-758-4389,E,,Public,24 hours daily,,,2,,,ChargePoint Network,http://www.chargepoint.com/,GPS,43.502346,-74.364188,01/23/2021,163426,2021-01-23 00:19:13,,,,,J1772
ELEC,NATIONAL GRID,301 1st St,NICHOLS; Side of Nichols liquor inc,Liverpool,NY,13088,,888-758-4389,E,,Public,24 hours daily,,,2,,,ChargePoint Network,http://www.chargepoint.com/,GPS,43.101581,-76.207454,01/23/2021,162245,2021-01-23 00:19:13,,,,,J1772
ELEC,Standard Parking 270 Greenwich - Tesla Destination,270 Greenwich St,,New York,NY,10007,,800-836-6666  877-798-3752,E,,Public,24 hours daily; pay lot; see valet for access,,,3,,,Tesla Destination,https://www.tesla.com/destination-charging,200-9,40.715543,-74.011435,11/03/2020,115076,2020-11-18 00:06:10,P,,,11/01/2018,J1772 TESLA
ELEC,EVCS@MUNI LOT,7 Hudson St,KINDERHOOK VILL,Kinderhook,NY,12106,,888-758-4389,E,,Public,24 hours daily,,,2,,,ChargePoint Network,http://www.chargepoint.com/,GPS,42.394810,-73.697553,01/23/2021,162131,2021-01-23 00:19:13,,,,,J1772
ELEC,DEFREETSVILLE 1,649 Bloomingrove Dr,DEFREESTVILLE; Back corner of park and ride lot,Rensselaer,NY,12144,,888-758-4389,E,,Public,24 hours daily,,,2,,,ChargePoint Network,http://www.chargepoint.com/,GPS,42.652680,-73.696239,01/23/2021,162302,2021-01-23 00:19:13,,,,,J1772
ELEC,MARKET CENTER,55 Railroad Pl,55 RAILROAD 1.1; Bottom floor of parking garage near Price Chopper limited 55 RAILROAD 1.2; Bottom level of parking garage near Price Chopper limited 55 RAILROAD 1.3; Bottom level of parking garage near Price Chopper limited,Saratoga Springs,NY,12866,,888-758-4389,E,,Public,24 hours daily,,,6,,,ChargePoint Network,http://www.chargepoint.com/,200-9,43.082251,-73.788133,01/23/2021,170004,2021-01-23 00:19:13,,,,,J1772
ELEC,Tuthilltown Spirits - Tesla Destination,14 Gristmill Ln,,Gardiner,NY,12525,,845-633-8734  877-798-3752,E,,Public,24 hours daily,,,3,,,Tesla Destination,https://www.tesla.com/destination-charging,200-9,41.687197,-74.175388,11/03/2020,114944,2020-11-18 00:06:10,P,,,02/01/2016,J1772 TESLA
ELEC,ERIE COUNTY,3781 main street,GROVER CLEVELAN,Amerst,NY,14226,,888-758-4389,E,,Public,24 hours daily,,,2,,,ChargePoint Network,http://www.chargepoint.com/,GPS,42.957832,-78.810768,01/23/2021,165269,2021-01-23 00:19:13,,,,,J1772
ELEC,3555 Main Street - Tesla Destination,3555 Main Street,,Stone Ridge,NY,12484,,877-798-3752  877-798-3752,E,,Public,24 hours daily; for customer use only; see front desk for access,,,3,,,Tesla Destination,https://www.tesla.com/destination-charging,200-9,41.852541,-74.139181,11/03/2020,168549,2020-11-18 00:06:10,P,,,11/03/2020,TESLA
ELEC,CLAY STATION,4401 NY-31,TOWN OF CLAY,Clay,NY,13041,,888-758-4389,E,,Public,24 hours daily,,,2,,,ChargePoint Network,http://www.chargepoint.com/,GPS,43.187020,-76.208299,01/23/2021,162291,2021-01-23 00:19:13,,,,,J1772
ELEC,Hoss Country Corner,1142 Main St,,Long Lake,NY,12847,,866-816-7584,E,,Public,24 hours daily; Also accepts Paypal,A D M V,,2,,,EV Connect,http://evconnect.com/,GPS,43.968800,-74.418652,04/08/2020,154880,2020-04-08 12:29:55,P,,,04/13/2019,J1772
ELEC,ALBANESE ORG,95 North End Ave,NS1-211NORTHEND,New York,NY,10282,,888-758-4389,E,,Public,24 hours daily,,,2,,,ChargePoint Network,http://www.chargepoint.com/,GPS,40.715102,-74.016329,01/23/2021,162490,2021-01-23 00:19:13,,,,,J1772
ELEC,ECONOLODGE,237 W Main St,ECONOLODGE 1.1; In Front of building 3,Malone,NY,12953,,888-758-4389,E,,Public,24 hours daily,,,2,,,ChargePoint Network,http://www.chargepoint.com/,GPS,44.848682,-74.306880,01/23/2021,154172,2021-01-23 00:19:13,,,,,J1772
ELEC,DOUBLETREEHOTEL,455 S Broadway,DC FAST CHARGER; ChargePoint BMW & VW Express Corridor Location,Tarrytown,NY,10591,,888-758-4389,E,,Public,24 hours daily,,,,1,,ChargePoint Network,http://www.chargepoint.com/,GPS,41.061410,-73.862829,01/23/2021,162399,2021-01-23 00:19:13,,,,,J1772COMBO
ELEC,PUBLIC RESTROOM,10 Rock City Rd Chamber of Commerce,WOODSTOCK COMME; By public rest rooms,Woodstock,NY,12498,,888-758-4389,E,,Public,24 hours daily,,,2,,,ChargePoint Network,http://www.chargepoint.com/,GPS,42.041481,-74.117992,01/23/2021,162252,2021-01-23 00:19:13,,,,,J1772
ELEC,Holiday Inn Express & Suites Saugerties - Hudson Valley,9 Old Rte 32,,Saugerties,NY,12477,,866-816-7584,E,,Public,24 hours daily,,,4,,,EV Connect,http://evconnect.com/,GPS,42.087996,-73.975551,04/08/2020,154659,2020-04-08 12:29:55,P,,,03/20/2020,J1772
ELEC,CHHA2 Garages,532 W 122nd St,,New York,NY,10027,,866-816-7584,E,,Public - Credit card at all times,24 hours daily; Also accepts PayPal and Apple Pay,A D M V,,4,,,EV Connect,http://evconnect.com/,GPS,40.811438,-73.960481,12/03/2020,168414,2020-12-03 22:33:12,P,,,08/28/2020,J1772
ELEC,Icon Parking 560 Third Ave - Tesla Destination,560 3rd Ave,,New York,NY,10016,,212-599-9807  877-798-3752,E,,Public,24 hours daily; see valet for access,,,3,,,Tesla Destination,https://www.tesla.com/destination-charging,200-9,40.748094,-73.976864,11/03/2020,115162,2020-11-18 00:06:10,P,,,05/01/2016,J1772 TESLA
ELEC,iPark 247 N 7th Street - Tesla Destination,249 N 7th St,,Brooklyn,NY,11248,,929-337-8633  877-798-3752,E,,Public,24 hours daily; see valet for access,,,3,,,Tesla Destination,https://www.tesla.com/destination-charging,200-9,40.716085,-73.954508,11/03/2020,114894,2020-11-18 00:06:10,P,,,03/01/2017,J1772 TESLA
ELEC,STONY BROOK UNV,Service Rd,AUTOMOTIVE; Fleet use only,Stony Brook,NY,11790,,888-758-4389,E,,Public,24 hours daily,,,2,,,ChargePoint Network,http://www.chargepoint.com/,GPS,40.915314,-73.129239,01/23/2021,162404,2021-01-23 00:19:13,,,,,J1772
ELEC,PICOTTE,1 Park Pl,PARK PLACE 1,Colonie,NY,12205,,888-758-4389,E,,Public,24 hours daily,,,2,,,ChargePoint Network,http://www.chargepoint.com/,GPS,42.715828,-73.814990,01/23/2021,147503,2021-01-23 00:19:13,,,,,J1772
ELEC,NATIONAL GRID,488 Fairview Ave,KOHLS HUDSON,Hudson,NY,12534,,888-758-4389,E,,Public,24 hours daily,,,2,,,ChargePoint Network,http://www.chargepoint.com/,GPS,42.281075,-73.751372,01/23/2021,162177,2021-01-23 00:19:13,,,,,J1772
ELEC,Sebonack Golf Club - Tesla Destination,405 Sebonac Rd,,Southampton,NY,11968,,631-287-4444  877-798-3752,E,,Public,24 hours daily; for member use only; see front desk for access,,,1,,,Tesla Destination,https://www.tesla.com/destination-charging,200-8,40.902715,-72.450378,11/03/2020,115239,2020-11-18 00:06:10,P,,,01/01/2016,TESLA
ELEC,Clarion Pointe - Rochester,2729 Monroe Ave,,Rochester,NY,14618,,866-816-7584,E,,Public,24 hours daily; Also accepts Paypal,A D M V,,1,,,EV Connect,http://evconnect.com/,GPS,43.112674,-77.550963,04/08/2020,155078,2020-04-08 12:29:55,P,,,08/20/2019,J1772
ELEC,BEAM CHARGING,375 Park Ave,SEAGRAMS BLDG; See valet attendant to use charging station.,New York,NY,10152,,888-758-4389,E,,Public,24 hours daily,,,2,,,ChargePoint Network,http://www.chargepoint.com/,GPS,40.758462,-73.972211,01/23/2021,162500,2021-01-23 00:19:13,,,,,J1772
ELEC,Icon Parking 30 W 63rd St - Tesla Destination,30 W 63rd St,,New York,NY,10023,,212-586-1660  877-798-3752,E,,Public,24 hours daily; see valet for access,,,2,,,Tesla Destination,https://www.tesla.com/destination-charging,200-9,40.770769,-73.981573,11/03/2020,115081,2020-11-18 00:06:10,P,,,11/01/2016,TESLA
ELEC,City of Poughkeepsie - Market Street Garage,41 Civic Center Plaza,,Poughkeepsie,NY,12601,,845-451-4120,E,,Public,24 hours daily,,,2,,,ChargePoint Network,http://www.chargepoint.com/,200-9,41.704628,-73.927527,09/03/2020,165095,2020-09-03 19:35:48,LG,,,08/10/2020,J1772
ELEC,NATIONAL GRID,54 Crossing Blvd,KOHLS CLIFTON; Near main entrance,Clifton Park,NY,12065,,888-758-4389,E,,Public,24 hours daily,,,2,,,ChargePoint Network,http://www.chargepoint.com/,GPS,42.860939,-73.771285,01/23/2021,162199,2021-01-23 00:19:13,,,,,J1772
ELEC,SHG,21 Big Boom Rd,FAIRFIELD 1.1; Back parking lot of new Fairfield inn hotelFAIRFIELD 1.2; Rear parking lot of new Fairfield inn hotelFAIRFIELD 1.3; Rear parking lot of new Fairfield inn hotel FAIRFIELD 1.4; Bark parking lot of new fairfield inn queenburyFAIRFIELD 1.5; Rear parking lot of new Fairfield inn hotel,Queensbury,NY,12804,,888-758-4389,E,,Public,24 hours daily,,,10,,,ChargePoint Network,http://www.chargepoint.com/,200-8,43.296105,-73.677611,01/23/2021,170293,2021-01-23 00:19:13,,,,,J1772
ELEC,Jamestown Community College,525 Falconer St,,Jamestown,NY,14702,,716-338-1000,E,,Public,24 hours daily,,,2,,,EV Connect,http://evconnect.com/,GPS,42.114535,-79.217718,06/09/2020,65299,2020-06-09 16:47:26,LG,,,10/01/2015,J1772
ELEC,Burger King Farmington NY,1238 State Route 332,,Farmington,NY,14425,,888-998-2546,E,,Public,MON: 24 hours | TUE: 24 hours | WED: 24 hours | THU: 24 hours | FRI: 24 hours | SAT: 24 hours | SUN: 24 hours,,,2,,,Blink Network,http://www.blinkcharging.com/,GPS,42.972609,-77.354868,01/22/2021,164403,2021-01-22 22:55:21,,,,,J1772
ELEC,MAMARONECK BMW,282-300 W Boston Post Rd,STATION 01,Mamaroneck,NY,10543,,888-758-4389,E,,Public,24 hours daily,,,2,,,ChargePoint Network,http://www.chargepoint.com/,GPS,40.946568,-73.735108,01/23/2021,162441,2021-01-23 00:19:13,,,,,J1772
ELEC,Rapid Parking,25 Beekman St,,New York,NY,10038,,888-998-2546,E,,Public,MON: 24 hours | TUE: 24 hours | WED: 24 hours | THU: 24 hours | FRI: 24 hours | SAT: 24 hours | SUN: 24 hours,,,1,,,Blink Network,http://www.blinkcharging.com/,GPS,40.710636,-74.006195,01/22/2021,155235,2021-01-22 22:55:21,,,,,J1772
ELEC,Saratoga Auto Museum - Tesla Destination,110 Ave of the Pines,,Saratoga Springs,NY,12866,,518-587-1935  877-798-3752,E,,Public,24 hours daily; see front desk for access,,,2,,,Tesla Destination,https://www.tesla.com/destination-charging,200-8,43.057371,-73.804293,11/03/2020,115234,2020-11-18 00:06:10,P,,,10/01/2012,TESLA
ELEC,BURNS MGT,222 Heritage Rd,HV 4; -HV 5; -,Guilderland,NY,12203,,888-758-4389,E,,Public,24 hours daily,,,4,,,ChargePoint Network,http://www.chargepoint.com/,200-8,42.692239,-73.888335,01/23/2021,121688,2021-01-23 00:19:13,,,,,J1772
ELEC,Mohawk Ramp,477 Washington St,,Buffalo,NY,14203,,716-849-5812  866-816-7584,E,,Public,24 hours daily,,,2,,,EV Connect,http://evconnect.com/,GPS,42.887468,-78.872406,03/03/2020,105187,2020-03-03 21:13:47,P,,,10/01/2018,J1772
ELEC,Icon Parking 1350 Avenue of the Americas - Tesla Destination,1350 6th Ave,,New York,NY,10019,,877-727-5464  877-798-3752,E,,Public,24 hours daily; see valet for access,,,3,,,Tesla Destination,https://www.tesla.com/destination-charging,200-9,40.762653,-73.977846,11/03/2020,115013,2020-11-18 00:06:10,P,,,01/01/2016,J1772 TESLA
ELEC,Unique Parking,47 E 21st Street,,New York,NY,10010,,888-998-2546,E,,Public,MON: 24 hours | TUE: 24 hours | WED: 24 hours | THU: 24 hours | FRI: 24 hours | SAT: 24 hours | SUN: 24 hours,,,1,,,Blink Network,http://www.blinkcharging.com/,GPS,40.739376,-73.987898,01/22/2021,167661,2021-01-22 22:55:21,,,,,J1772
ELEC,610 Warren Street - Tesla Destination,610 Warren Street,,Brooklyn,NY,11217,,877-798-3752  877-798-3752,E,,Public,24 hours daily; for customer use only; see front desk for access,,,6,,,Tesla Destination,https://www.tesla.com/destination-charging,200-9,40.681274,-73.981216,11/03/2020,168558,2020-11-18 00:06:10,P,,,11/03/2020,TESLA
ELEC,STEINSCHINDER,8 W Main St,8W MAIN ST; -,Hastings-on-Hudson,NY,10706,,888-758-4389,E,,Public,24 hours daily,,,2,,,ChargePoint Network,http://www.chargepoint.com/,GPS,40.994445,-73.882657,01/23/2021,156655,2021-01-23 00:19:13,,,,,J1772
ELEC,SUNY ADIRONDACK,640 Bay Rd,SUNY ACC 1.1; North End of SUNY Adirondack campusSUNY ACC 1.2; North End of SUNY Adirondack campusSUNY ACC 1.3; North End of SUNY Adirondack campusSUNY ACC 1.4; North End of SUNY Adirondack campus SUNY ACC 1.5; North End of SUNY Adirondack campus,Queensbury,NY,12804,,888-758-4389,E,,Public,24 hours daily,,,10,,,ChargePoint Network,http://www.chargepoint.com/,200-9,43.353067,-73.653559,01/23/2021,167140,2021-01-23 00:19:13,,,,,J1772
ELEC,Hudson Valley Towne Center - Tesla Supercharger,18 Westage Drive,,Fishkill,NY,12524,,877-798-3752,E,,Public,24 hours daily; for Tesla use only,,,,12,,Tesla,http://www.teslamotors.com/supercharger,GPS,41.526740,-73.894500,08/10/2020,154792,2020-08-27 20:39:12,P,,,03/27/2020,TESLA
ELEC,Icon Parking 330 E 39th Street - Tesla Destination,330  E 39th St,,New York,NY,10016,,212-599-8670  877-798-3752,E,,Public,24 hours daily; see valet for access,,,3,,,Tesla Destination,https://www.tesla.com/destination-charging,200-9,40.747123,-73.972257,11/03/2020,115098,2020-11-18 00:06:10,P,,,06/01/2016,J1772 TESLA
ELEC,PERRY CHARGING,38 N Main St,PERRY CHARGING,Perry,NY,14530,,888-758-4389,E,,Public,24 hours daily,,,2,,,ChargePoint Network,http://www.chargepoint.com/,GPS,42.717358,-78.002460,01/23/2021,156352,2021-01-23 00:19:13,,,,,J1772
ELEC,GMC Parking 420 E 53rd - Tesla Destination,420 E 53rd St,,New York,NY,10022,,212-759-5290  877-798-3752,E,,Public,24 hours daily; pay lot; see valet for access,,,1,,,Tesla Destination,https://www.tesla.com/destination-charging,200-8,40.755013,-73.963549,11/03/2020,115130,2020-11-18 00:06:10,P,,,11/01/2018,TESLA
ELEC,New York University - Plaza Nursery School,110 Bleecker St,,New York,NY,10011,,866-816-7584,E,,Public,24 hours daily,,,2,,,EV Connect,http://evconnect.com/,GPS,40.727362,-73.997533,05/06/2020,123058,2020-05-06 17:56:57,P,,,04/01/2019,J1772
ELEC,TOWNOFHEMPSTEAD,1501 Lido Blvd,EAST MARINA 1N; Solar CarportEAST MARINA 2; -EAST MARINA 3S; -,Point Lookout,NY,11569,,888-758-4389,E,,Public,24 hours daily,,,6,,,ChargePoint Network,http://www.chargepoint.com/,200-9,40.592409,-73.585343,01/23/2021,162282,2021-01-23 00:19:13,,,,,J1772
ELEC,Letchworth State Park,1 Letchworth State Park,,Castile,NY,14427,,866-816-7584,E,,Public,24 hours daily,,,2,,,EV Connect,http://evconnect.com/,GPS,42.590383,-78.026753,06/09/2020,123260,2020-06-09 16:47:26,P,,,04/01/2019,J1772
ELEC,Smoky Rock BBQ - Tesla Destination,6367 Mill St,,Rhinebeck,NY,12572,,845-876-5232  877-798-3752,E,,Public,24 hours daily; for customer use only,,,3,,,Tesla Destination,https://www.tesla.com/destination-charging,200-9,41.925496,-73.913269,11/03/2020,115217,2020-11-18 00:06:10,P,,,12/15/2016,TESLA
ELEC,MASTERCARD INT,2000 Purchase St,STATIION1STATION 6STATION 7STATION 8STATION 9,Harrison,NY,10577,,888-758-4389,E,,Public,24 hours daily,,,10,,,ChargePoint Network,http://www.chargepoint.com/,200-8,41.024512,-73.711257,01/23/2021,118044,2021-01-23 00:19:13,,,,,J1772
ELEC,Sylvan Kissena Garage LLC - Tesla Destination,43-70 Kissena Blvd,,Flushing,NY,11355,,718-463-2070  877-798-3752,E,,Public,24 hours daily; pay lot; see valet for access,,,4,,,Tesla Destination,https://www.tesla.com/destination-charging,200-9,40.753639,-73.823616,11/03/2020,122481,2020-11-18 00:06:10,P,,,03/01/2019,TESLA
ELEC,Ruge's Chevrolet,3692 Route 44,,Millbrook,NY,12545,,845-444-3039,E,,Public - Call ahead,Dealership business hours; for customer use only,,,1,,,Non-Networked,,200-9,41.791563,-73.659717,03/03/2020,53442,2020-03-03 21:13:47,P,,,10/01/2012,J1772
ELEC,Champlain Centre - Tesla Supercharger,60 Smithfield Blvd.,,Plattsburgh,NY,12901,,877-798-3752,E,,Public,24 hours daily; for Tesla use only,,,,8,,Tesla,http://www.teslamotors.com/supercharger,200-8,44.704500,-73.491800,08/10/2020,102340,2020-08-27 20:39:12,P,,,06/01/2016,TESLA
ELEC,CCE TOMPKINS,615 Willow Ave,STATION ONE; Rear parking lot,Ithaca,NY,14850,,888-758-4389,E,,Public,24 hours daily,,,2,,,ChargePoint Network,http://www.chargepoint.com/,GPS,42.450688,-76.503432,01/23/2021,165558,2021-01-23 00:19:13,,,,,J1772
ELEC,MUNICIPAL EVSE,1 Civic Center Plaza,COOL INSURING,Glens Falls,NY,12801,,888-758-4389,E,,Public,24 hours daily,,,2,,,ChargePoint Network,http://www.chargepoint.com/,GPS,43.307785,-73.641884,01/23/2021,155384,2021-01-23 00:19:13,,,,,J1772
ELEC,Adirondack Pub & Brewery,33 Canada St,,Lake George,NY,12845,,866-816-7584,E,,Public - Credit card at all times,24 hours daily; Also accepts Paypal,A D M V,,4,,,EV Connect,http://evconnect.com/,GPS,43.418575,-73.713812,04/08/2020,155025,2020-04-08 12:29:55,P,,,08/07/2019,J1772
ELEC,ULSTER COUNTY,5 Pearl St,"CARR BUILDING; Parking area restricted to employees only during working hours and is available to the public all other times. The fee for public charging is $0.50 per hour, effective 1-1-2020.",Kingston,NY,12401,,888-758-4389,E,,Public,24 hours daily,,,2,,,ChargePoint Network,http://www.chargepoint.com/,GPS,41.932591,-74.016136,01/23/2021,162352,2021-01-23 00:19:13,,,,,J1772
ELEC,NATIONAL GRID,670 Liberty St,UNION COLLEGE; I front of 80 Nott Terrace Clarkson University capital region campus,Schenectady,NY,12305,,888-758-4389,E,,Public,24 hours daily,,,2,,,ChargePoint Network,http://www.chargepoint.com/,GPS,42.814021,-73.934518,01/23/2021,162225,2021-01-23 00:19:13,,,,,J1772
ELEC,STONY BROOK UNV,100 Nicolls Road,ADMIN 1; -ADMIN 2; -,Stony Brook,NY,11790,,888-758-4389,E,,Public,24 hours daily,,,4,,,ChargePoint Network,http://www.chargepoint.com/,200-8,40.913685,-73.116048,01/23/2021,165784,2021-01-23 00:19:13,,,,,J1772
ELEC,CASE CENTER LOT,Perimeter Rd,PALAMOUNTAIN,Saratoga Springs,NY,12866,,888-758-4389,E,,Public,24 hours daily,,,2,,,ChargePoint Network,http://www.chargepoint.com/,GPS,43.098201,-73.783743,01/23/2021,123549,2021-01-23 00:19:13,,,,,J1772
ELEC,Village of Lima,7327 E Main St,"Located in the municipal parking lot behind the Lima Courthouse, 200 feet east of the intersection of routes 5&20 and 15A",Lima,NY,14485,,585-624-2210,E,,Public,24 hours daily,,,2,,,EV Connect,http://evconnect.com/,GPS,42.905519,-77.611086,06/09/2020,103810,2020-06-09 16:47:26,P,,,09/17/2018,J1772
ELEC,CARCHARGING120!,120 E Hartsdale Ave,120 HARTSDALE; Basement parking garage,Hartsdale,NY,10530,,888-758-4389,E,,Public,24 hours daily,,,2,,,ChargePoint Network,http://www.chargepoint.com/,GPS,41.014570,-73.797270,01/23/2021,152400,2021-01-23 00:19:13,,,,,J1772
ELEC,FEHBOCES,23 Huskie Ln,FEH BOCES,Malone,NY,12953,,888-758-4389,E,,Public,24 hours daily,,,2,,,ChargePoint Network,http://www.chargepoint.com/,GPS,44.841328,-74.281940,01/23/2021,170502,2021-01-23 00:19:13,,,,,J1772
ELEC,NATIONAL GRID,1 Bridge PLaza,1 BRIDGE PLAZA; Parking lot of Ogdensburg Bridge and Port Authorty,Ogdensburg,NY,13669,,888-758-4389,E,,Public,24 hours daily,,,2,,,ChargePoint Network,http://www.chargepoint.com/,GPS,44.718303,-75.455798,01/23/2021,162232,2021-01-23 00:19:13,,,,,J1772
ELEC,ULSTER COUNTY,28-40 Crown St,"COURTHOUSE 2; Ulster County's fee for public charging is $0.50 per hour, effective 1-1-2020.",Kingston,NY,12401,,888-758-4389,E,,Public,24 hours daily,,,2,,,ChargePoint Network,http://www.chargepoint.com/,GPS,41.932871,-74.020585,01/23/2021,147634,2021-01-23 00:19:13,,,,,J1772
ELEC,Icon Parking 202 E 18th Street - Tesla Destination,202 E 18th St,,Manhattan,NY,10003,,212-473-9869  877-798-3752,E,,Public,24 hours daily; pay lot; see valet for access,,,2,,,Tesla Destination,https://www.tesla.com/destination-charging,200-8,40.735561,-73.985319,11/03/2020,150570,2020-11-18 00:06:10,P,,,09/30/2019,TESLA
ELEC,Superior Ink,400 W 12th St,,New York,NY,10014,,888-998-2546,E,,Public,MON: 24 hours | TUE: 24 hours | WED: 24 hours | THU: 24 hours | FRI: 24 hours | SAT: 24 hours | SUN: 24 hours,,,2,,,Blink Network,http://www.blinkcharging.com/,GPS,40.737537,-74.009830,01/22/2021,124147,2021-01-22 22:55:21,,,,,J1772
ELEC,Rapidpark 210 W 102nd Street - Tesla Destination,210 W 102st St,,New York,NY,10025,,212-864-8605  877-798-3752,E,,Public,24 hours daily; see valet for access,,,3,,,Tesla Destination,https://www.tesla.com/destination-charging,200-9,40.797961,-73.968389,11/03/2020,115051,2020-11-18 00:06:10,P,,,09/01/2017,J1772 TESLA
ELEC,iPark 43-25 Hunter Street - Tesla Destination,43-25 Hunter St,,Long Island City,NY,11101,,347-738-6170  877-798-3752,E,,Public,24 hours daily; pay lot; see valet for access,,,8,,,Tesla Destination,https://www.tesla.com/destination-charging,200-9,40.747653,-73.942313,11/03/2020,114969,2020-11-18 00:06:10,P,,,11/01/2018,TESLA
ELEC,Finger Lakes Waterfall Resort Motel & Cabins,3835 State Route 414,Located next to Hector Falls Public Parking Area in restricted parking area marked for resort guests only.,Burdett,NY,14818,,607-546-7171,E,,Public - Call ahead,Primarily for guest use; call to make appointment,Cash D M V,,1,,,Non-Networked,,GPS,42.418993,-76.867035,06/09/2020,63982,2020-06-09 16:47:26,P,,,09/01/2013,J1772
ELEC,OLD TOWN HALL,21-23 Midline Rd,CAROLINE; Left side of front entrance,Slaterville Springs,NY,14881,,888-758-4389,E,,Public,24 hours daily,,,2,,,ChargePoint Network,http://www.chargepoint.com/,GPS,42.394245,-76.350490,01/23/2021,162319,2021-01-23 00:19:13,,,,,J1772
ELEC,Old Westbury Golf and Country Club - Tesla Destination,270 Wheatley Road,,Old Westbury,NY,11568,,877-798-3752  877-798-3752,E,,Public,24 hours daily; for customer use only; see front desk for access,,,5,,,Tesla Destination,https://www.tesla.com/destination-charging,200-9,40.801955,-73.601317,11/03/2020,168994,2020-11-18 00:06:10,P,,,11/03/2020,J1772 TESLA
ELEC,ROSENBLUM300,3 Winners Cir,3 WINNERS 1; -3 WINNERS 2; -,Albany,NY,12205,,888-758-4389,E,,Public,24 hours daily,,,4,,,ChargePoint Network,http://www.chargepoint.com/,200-9,42.720190,-73.798352,01/23/2021,122587,2021-01-23 00:19:13,,,,,J1772
ELEC,Allan H. Treman State Marine Park,805 Taughannock Blvd,,Ithaca,NY,14850,,866-816-7584,E,,Public,24 hours daily,,,2,,,EV Connect,http://evconnect.com/,GPS,42.458262,-76.520092,04/08/2020,123135,2020-04-08 12:29:55,P,,,04/01/2019,J1772
ELEC,Quik Park 40 Riverside Blvd - Tesla Destination,251 W 62nd St,,New York,NY,10282,,212-247-9899  877-798-3752,E,,Public,24 hours daily; see valet for access,,,3,,,Tesla Destination,https://www.tesla.com/destination-charging,200-8,40.773464,-73.989532,11/03/2020,115070,2020-11-18 00:06:10,P,,,08/15/2016,J1772 TESLA
ELEC,VOB,15 Kensington Terrace,STATION 1; Parking garage p1,Bronxville,NY,10708,,888-758-4389,E,,Public,24 hours daily,,,2,,,ChargePoint Network,http://www.chargepoint.com/,GPS,40.942543,-73.834410,01/23/2021,165221,2021-01-23 00:19:13,,,,,J1772
ELEC,Icon Parking 524 East 73rd - Tesla Destination,524 E 73rd St,,New York,NY,10021,,212-452-1324  877-798-3752,E,,Public,24 hours daily; for customer use only; see valet for access,,,3,,,Tesla Destination,https://www.tesla.com/destination-charging,200-9,40.766741,-73.951930,11/03/2020,115149,2020-11-18 00:06:10,P,,,11/01/2018,J1772 TESLA
ELEC,Rosendale Justice Department,1915 Lucas Ave,,Cottekill,NY,12419,,866-816-7584,E,,Public,24 hours daily,,,2,,,EV Connect,http://evconnect.com/,GPS,41.853710,-74.106366,04/08/2020,123076,2020-04-08 12:29:55,LG,,,04/01/2019,J1772
ELEC,Village of Mt. Morris,11 Main St,,Mt. Morris,NY,14510,,866-816-7584,E,,Public - Credit card at all times,24 hours daily; Also accepts PayPal and Apple Pay,A D M V,,4,,,EV Connect,http://evconnect.com/,GPS,42.726715,-77.874388,12/03/2020,168431,2020-12-03 22:33:12,LG,,,09/01/2020,J1772
ELEC,CITY OF ONEONTA,37 Dietz St,DIETZ STREET,Oneonta,NY,13820,,888-758-4389,E,,Public,24 hours daily,,,2,,,ChargePoint Network,http://www.chargepoint.com/,GPS,42.455733,-75.062760,01/23/2021,162145,2021-01-23 00:19:13,,,,,J1772
ELEC,Kew Garage,80-02 Kew Gardens Rd,,Kew Gardens,NY,11415,,888-998-2546,E,,Public,MON: 24 hours | TUE: 24 hours | WED: 24 hours | THU: 24 hours | FRI: 24 hours | SAT: 24 hours | SUN: 24 hours,,,1,,,Blink Network,http://www.blinkcharging.com/,GPS,40.713705,-73.831217,01/22/2021,149431,2021-01-22 22:55:21,,,,,J1772
ELEC,TOWN OF BABYLON,N Indiana Ave,TOWN HALL 1; Near front entrance,Lindenhurst,NY,11757,,888-758-4389,E,,Public,24 hours daily,,,1,,,ChargePoint Network,http://www.chargepoint.com/,GPS,40.703615,-73.376144,01/23/2021,162286,2021-01-23 00:19:13,,,,,J1772
ELEC,"Sylvan Parking 23-25 31st St, Astoria - Tesla Destination",23-25 31st St,,Astoria,NY,11105,,718-204-5005  877-798-3752,E,,Public,24 hours daily; pay lot; see valet for access,,,4,,,Tesla Destination,https://www.tesla.com/destination-charging,200-9,40.773632,-73.913315,11/03/2020,150585,2020-11-18 00:06:10,P,,,09/30/2019,TESLA
ELEC,CANTONCHARGE,8 Hodskin St,DC CHARGERHODSKIN ST 1.1,Canton,NY,13617,,888-758-4389,E,,Public,24 hours daily,,,2,1,,ChargePoint Network,http://www.chargepoint.com/,200-8,44.595992,-75.170925,01/23/2021,154480,2021-01-23 00:19:13,,,,,J1772 J1772COMBO
ELEC,Union College - 50 Yard Line Lot,1261 Lenox Rd,,Schenectady,NY,12308,,866-816-7584,E,,Public,24 hours daily,,,1,,,EV Connect,http://evconnect.com/,GPS,42.816642,-73.924801,05/06/2020,156046,2020-05-06 17:56:57,P,,,05/01/2020,J1772
ELEC,BARD ALMNCT,New York 9G,NS1-ALMNCT; Located in parking lot of Alumni Canter at intersection of Entrance Road and 9G,Red Hook,NY,12504,,888-758-4389,E,,Public,24 hours daily,,,2,,,ChargePoint Network,http://www.chargepoint.com/,GPS,42.023436,-73.902037,01/23/2021,162492,2021-01-23 00:19:13,,,,,J1772
ELEC,Lakeland Park,11 Foreman St,,Cazenovia,NY,13035,,315-655-3041,E,,Public,Dawn to dusk daily,,,2,,,Non-Networked,,200-8,42.929429,-75.859296,03/03/2020,88340,2020-03-03 21:13:47,LG,,,10/01/2017,J1772
ELEC,Comfort Inn - Tesla Destination,66 W Pulteney St,,Corning,NY,14830,,607-962-1515  877-798-3752,E,,Public,24 hours daily; for customer use only; see front desk for access,,,3,,,Tesla Destination,https://www.tesla.com/destination-charging,200-9,42.150849,-77.064055,09/30/2019,114927,2020-03-02 20:14:21,P,,,11/01/2018,J1772 TESLA
ELEC,Saranac Lake Police Department,3 Main St,,Saranac Lake,NY,12983,,866-816-7584,E,,Public,24 hours daily,,,1,,,EV Connect,http://evconnect.com/,GPS,44.324241,-74.131946,04/08/2020,123097,2020-04-08 12:29:55,LG,,,04/01/2019,J1772
ELEC,Village of Irvington,110 Main St,,Irvington,NY,10533,,866-816-7584,E,,Public - Credit card at all times,24 hours daily; Also accepts PayPal and Apple Pay,A D M V,,2,,,EV Connect,http://evconnect.com/,GPS,41.038916,-73.867013,12/03/2020,168429,2020-12-03 22:33:12,LG,,,09/22/2020,J1772
ELEC,NATIONAL GRID,6081 US-219,HOLIDAY VALLEY; Happy Valley Parking Lot in front of unit 116 and ice room,Ellicottville,NY,14731,,888-758-4389,E,,Public,24 hours daily,,,2,,,ChargePoint Network,http://www.chargepoint.com/,GPS,42.261800,-78.663077,01/23/2021,162249,2021-01-23 00:19:13,,,,,J1772
ELEC,WARWARSING,Landfill Road,LIPPMAN CHARGER; Located in the lot near the lake,Kerhonkson,NY,12446,,888-758-4389,E,,Public,24 hours daily,,,2,,,ChargePoint Network,http://www.chargepoint.com/,GPS,41.762012,-74.354353,01/23/2021,162385,2021-01-23 00:19:13,,,,,J1772
ELEC,HUDSON PRESERVE,2101 Beryl Way,BLDG 21 #4,Watervliet,NY,12189,,888-758-4389,E,,Public,24 hours daily,,,2,,,ChargePoint Network,http://www.chargepoint.com/,GPS,42.733166,-73.727295,01/23/2021,143241,2021-01-23 00:19:13,,,,,J1772
ELEC,Nemet Motors,153-12 Hillside Ave,,Jamaica,NY,11432,,718-523-5858,E,,Public - Call ahead,Dealership business hours,,,1,,,Non-Networked,,200-9,40.707242,-73.803844,06/09/2020,44342,2020-06-09 16:47:26,P,,,11/30/2011,J1772
ELEC,GGMC Parking Carnegie Garage - Tesla Destination,40 E 94th St,,New York,NY,10128,,212-369-9304  877-798-3752,E,,Public,24 hours daily; see valet for access,,,3,,,Tesla Destination,https://www.tesla.com/destination-charging,200-9,40.785524,-73.954960,11/03/2020,115117,2020-11-18 00:06:10,P,,,11/01/2018,J1772 TESLA
ELEC,Village of Arcade - Municipal Parking Lot,17 Church St,,Arcade,NY,14009,,585-492-1111,E,,Public,24 hours daily,,,2,,,Non-Networked,,GPS,42.534763,-78.423960,06/09/2020,157963,2020-06-09 16:47:26,P,,,05/15/2020,J1772
ELEC,STATE ROUTE 42,4052 NY-42 Town Hall,THOMPSON TOWN H; NE corner of the front parking lot at Thompson Town Hall,Monticello,NY,12701,,888-758-4389,E,,Public,24 hours daily,,,2,,,ChargePoint Network,http://www.chargepoint.com/,GPS,41.668821,-74.672147,01/23/2021,162346,2021-01-23 00:19:13,,,,,J1772
ELEC,CITY-PEEKSKILL,414 Hudson Ave,RIVERFRONTGREEN,Peekskill,NY,10566,,888-758-4389,E,,Public,24 hours daily,,,2,,,ChargePoint Network,http://www.chargepoint.com/,GPS,41.286198,-73.930430,01/23/2021,145337,2021-01-23 00:19:13,,,,,J1772
ELEC,Village of Champlain,1104 Route 9,,Champlain,NY,12919,,866-816-7584,E,,Public,24 hours daily,,,2,,,EV Connect,http://evconnect.com/,200-9,44.983225,-73.444864,06/09/2020,94835,2020-06-09 16:47:26,LG,,,09/19/2017,J1772
ELEC,BURNS MGT,2125 Whistler Ct,EXCELSIOR 1; -EXCELSIOR 2; -EXCELSIOR 3; -,Saratoga Springs,NY,12866,,888-758-4389,E,,Public,24 hours daily,,,6,,,ChargePoint Network,http://www.chargepoint.com/,GPS,43.093548,-73.755140,01/23/2021,120973,2021-01-23 00:19:13,,,,,J1772
ELEC,ERIE COUNTY,8276 Lake Shore Rd,BENNETT BEACH,Angola,NY,14006,,888-758-4389,E,,Public,24 hours daily,,,2,,,ChargePoint Network,http://www.chargepoint.com/,GPS,42.658535,-79.061570,01/23/2021,164129,2021-01-23 00:19:13,,,,,J1772
ELEC,NY STATE PARKS,1111 Fuhrmann Boulevard,HARBOR PARK; -,Buffalo,NY,14203,,888-758-4389,E,,Public,24 hours daily,,,2,,,ChargePoint Network,http://www.chargepoint.com/,GPS,42.845382,-78.863831,01/23/2021,162166,2021-01-23 00:19:13,,,,,J1772
ELEC,Delaware & Ulster Railroad,43510 Highway 28,,Arkville,NY,12406,,866-816-7584,E,,Public,24 hours daily,,,1,,,EV Connect,http://evconnect.com/,GPS,42.147437,-74.614917,04/08/2020,123110,2020-04-08 12:29:55,P,,,04/01/2019,J1772
ELEC,Glenmere Mansion - Tesla Destination,634 Pine Hill Rd,,Chester,NY,10918,,845-469-1900  877-798-3752,E,,Public - Call ahead,24 hours daily; for customer use only,,,3,,,Tesla Destination,https://www.tesla.com/destination-charging,200-9,41.338768,-74.322712,11/03/2020,114922,2020-11-18 00:06:10,P,,,01/01/2016,J1772 TESLA
ELEC,RAY LAKS HONDA,3590 Southwestern Blvd,SHOP 02,Orchard Park,NY,14127,,888-758-4389,E,,Public,24 hours daily,,,1,,,ChargePoint Network,http://www.chargepoint.com/,GPS,42.784658,-78.767062,01/23/2021,150338,2021-01-23 00:19:13,,,,,J1772
ELEC,Silo Ridge - Tesla Destination,4651 Highway 22,,Amenia,NY,12501,,877-798-3752  877-798-3752,E,,Public,24 hours daily; for customer use only; see front desk for access,,,1,,,Tesla Destination,https://www.tesla.com/destination-charging,200-9,41.814971,-73.566438,11/03/2020,169104,2020-11-18 00:06:10,P,,,11/03/2020,TESLA
ELEC,Niagara Falls International Airport,2035 Niagara Falls Blvd,Located in parking lot 1 in front of the terminal,Niagara Falls,NY,14304,,716-855-7300,E,,Public,24 hours daily,,,2,,,Non-Networked,,200-9,43.101378,-78.941072,03/03/2020,63478,2020-03-03 21:13:47,P,,,09/19/2014,J1772
ELEC,SCHENECTADY,500-530 Liberty St,CITY HALL; Corner of Clinton and Liberty outside of Schenectady City Hall,Schenectady,NY,12305,,888-758-4389,E,,Public,24 hours daily,,,2,,,ChargePoint Network,http://www.chargepoint.com/,GPS,42.814348,-73.939017,01/23/2021,162342,2021-01-23 00:19:13,,,,,J1772
ELEC,BASIL VW,6179 S Transit Rd,VW_408303_A,Lockport,NY,14094,,888-758-4389,E,,Public,24 hours daily,,,2,,,ChargePoint Network,http://www.chargepoint.com/,GPS,43.122587,-78.695547,01/23/2021,162420,2021-01-23 00:19:13,,,,,J1772
ELEC,Marriott Hauppauge,850 Veterans Memorial Hwy,,Hauppauge,NY,11788,,866-816-7584,E,,Public - Call ahead,24 hours daily; for hotel guest use only,,,2,,,EV Connect,http://evconnect.com/,GPS,40.819636,-73.204528,12/03/2020,94841,2020-12-03 22:33:12,P,,,12/19/2013,J1772
ELEC,Icon Parking - One Lincoln Plaza,20 W 64th Street,Located at B1,New York,NY,10023,,888-998-2546,E,,Public,MON: 24 hours | TUE: 24 hours | WED: 24 hours | THU: 24 hours | FRI: 24 hours | SAT: 24 hours | SUN: 24 hours,,,1,,,Blink Network,http://www.blinkcharging.com/,GPS,40.771626,-73.981032,01/22/2021,164681,2021-01-22 22:55:21,,,,,J1772
ELEC,The Wick Hotel - Tesla Destination,41 Cross St,,Hudson,NY,12534,,833-843-9425  877-798-3752,E,,Public,24 hours daily; for customer use only; see front desk for access,,,3,,,Tesla Destination,https://www.tesla.com/destination-charging,200-9,42.253073,-73.796003,11/03/2020,114956,2020-11-18 00:06:10,P,,,11/01/2018,J1772 TESLA
ELEC,ADAMS STATION,501 Derzee Ct,501 DERZEE CT; Between Bldgs 500 and 600,Delmar,NY,12054,,888-758-4389,E,,Public,24 hours daily,,,2,,,ChargePoint Network,http://www.chargepoint.com/,GPS,42.606190,-73.850716,01/23/2021,165394,2021-01-23 00:19:13,,,,,J1772
ELEC,RPI 1,2 Colvin Cir,RPI 1; -,Troy,NY,12180,,888-758-4389,E,,Public,24 hours daily,,,2,,,ChargePoint Network,http://www.chargepoint.com/,GPS,42.731386,-73.669086,01/23/2021,162264,2021-01-23 00:19:13,,,,,J1772
ELEC,The Westminster,180 W 20th Street,,New York,NY,10011,,888-998-2546,E,,Public,MON: 24 hours | TUE: 24 hours | WED: 24 hours | THU: 24 hours | FRI: 24 hours | SAT: 24 hours | SUN: 24 hours,,,1,,,Blink Network,http://www.blinkcharging.com/,GPS,40.741945,-73.996664,01/22/2021,95502,2021-01-22 22:55:21,,,,,J1772
ELEC,BURNS MGT,21 Seward St,SGA 1; -SGA 2; -,Saratoga Springs,NY,12866,,888-758-4389,E,,Public,24 hours daily,,,4,,,ChargePoint Network,http://www.chargepoint.com/,200-9,43.087620,-73.795567,01/23/2021,162127,2021-01-23 00:19:13,,,,,J1772
ELEC,"Walmart 2152 - Albany, NY",141 Washington Ave. EXT,,Albany,NY,12205,,833-632-2778,E,,Public,24 hours daily,,,,6,,Electrify America,https://www.electrifyamerica.com/,GPS,42.694560,-73.848436,01/23/2021,169948,2021-01-23 01:23:19,,,,,CHADEMO J1772COMBO
ELEC,Vision Nissan,785 Ridge Rd,,Webster,NY,14580,,585-787-2000,E,,Public - Call ahead,Dealership business hours,,,1,,,Non-Networked,,200-9,43.204065,-77.478237,06/09/2020,44208,2020-06-09 16:47:26,P,,,11/30/2011,J1772
ELEC,109 E 58 St Garage,109 E 58th Street,,New York,NY,10022,,888-998-2546,E,,Public,MON: 24 hours | TUE: 24 hours | WED: 24 hours | THU: 24 hours | FRI: 24 hours | SAT: 24 hours | SUN: 24 hours,,,1,,,Blink Network,http://www.blinkcharging.com/,GPS,40.762199,-73.969557,01/22/2021,168065,2021-01-22 22:55:21,,,,,J1772
ELEC,Tribeca Green,325 North End Ave,,New York,NY,10282,,888-998-2546,E,,Public,MON: 24 hours | TUE: 24 hours | WED: 24 hours | THU: 24 hours | FRI: 24 hours | SAT: 24 hours | SUN: 24 hours,,,2,,,Blink Network,http://www.blinkcharging.com/,GPS,40.716950,-74.014948,01/22/2021,164713,2021-01-22 22:55:21,,,,,J1772
ELEC,BEAVER LAKE,Bog Trail,BEAVER LAKE 1BEAVER LAKE 2,Baldwinsville,NY,13027,,888-758-4389,E,,Public,24 hours daily,,,4,,,ChargePoint Network,http://www.chargepoint.com/,GPS,43.179698,-76.402596,01/23/2021,149646,2021-01-23 00:19:13,,,,,J1772
ELEC,Central Parking Corp,15 W 5th St,,Jamestown,NY,14701,,866-816-7584,E,,Public,Garage business hours,,,2,,,EV Connect,http://evconnect.com/,200-9,42.097522,-79.242525,04/08/2020,94845,2020-04-08 12:29:55,P,,,07/22/2015,J1772
ELEC,Woodbury Common Premium Outlets,498 Red Apple Ct,,Central Valley,NY,10917,,877-455-3833,E,,Public - Card key at all times,24 hours daily,,,2,2,,eVgo Network,https://www.evgo.com/,GPS,41.313287,-74.125236,01/23/2021,93221,2021-01-23 01:19:54,,,,,CHADEMO J1772 J1772COMBO
ELEC,ATRIUM EVCHARGE,56 Clifton Country Rd,PARKPLAZA EV1; Front Row Parking AreaPARKPLAZA EV2; Front Row Parking AreaPARKPLAZA EV3; Front Row Parking AreaPARKPLAZA EV4; Front Row Parking AreaPARKPLAZA EV5; Front Row Parking Area,Clifton park,NY,12065,,888-758-4389,E,,Public,24 hours daily,,,10,,,ChargePoint Network,http://www.chargepoint.com/,200-9,42.856515,-73.782775,01/23/2021,154276,2021-01-23 00:19:13,,,,,J1772
ELEC,Town of Livingston - Town Hall,119 Rt-19,,Livingston,NY,12541,,866-816-7584,E,,Public - Credit card at all times,24 hours daily; Also accepts Paypal,A D M V,,2,,,EV Connect,http://evconnect.com/,GPS,40.782319,-74.314475,10/09/2020,166438,2020-10-09 12:41:43,P,,,06/05/2020,J1772
ELEC,BETHLEHEM EV,NY-32,,Delmar,NY,12054,,888-758-4389,E,,Public,24 hours daily,,,2,,,ChargePoint Network,http://www.chargepoint.com/,GPS,42.599942,-73.839959,01/23/2021,171219,2021-01-23 00:19:13,,,,,J1772
ELEC,Rechler Equity,85 S Service Rd,,Plainview,NY,11803,,631-414-8400,E,,Public,Business hours,,,1,,,Non-Networked,,GPS,40.786520,-73.452186,01/14/2021,72670,2021-01-14 18:42:41,P,,,01/07/2021,J1772
ELEC,KINGSTON,Saccoman Ln,CORNELL ST. LOT; Paid Parking Lot $.75 per hour 9am-6pm Mon-Sat,Kingston,NY,12401,,888-758-4389,E,,Public,24 hours daily,,,2,,,ChargePoint Network,http://www.chargepoint.com/,GPS,41.929588,-74.002941,01/23/2021,162259,2021-01-23 00:19:13,,,,,J1772
ELEC,DEWITT EV 1,5400 Butternut Drive,CHARGEPOINT; Left parking lotSTATION 2; -,East Syracuse,NY,13057,,888-758-4389,E,,Public,24 hours daily,,,4,,,ChargePoint Network,http://www.chargepoint.com/,200-9,43.046615,-76.049353,01/23/2021,162183,2021-01-23 00:19:13,,,,,J1772
ELEC,Rapidpark 10 E 30th Street - Tesla Destination,10 E 30th St,,New York,NY,10016,,212-481-4097  877-798-3752,E,,Public,24 hours daily; see valet for access,,,3,,,Tesla Destination,https://www.tesla.com/destination-charging,200-9,40.745384,-73.985704,11/03/2020,114984,2020-11-18 00:06:10,P,,,09/01/2017,J1772 TESLA
ELEC,University at Albany - SEFCU Arena Parking Lot,1400 Washington Ave,University Dr,Albany,NY,12222,,,E,,Public,24 hours daily,,,2,,,EV Connect,http://evconnect.com/,GPS,42.682053,-73.828373,03/03/2020,123302,2020-03-03 21:13:47,P,,,04/01/2018,J1772
ELEC,SWL,234 Lake Flower Ave,SARANAC 1.1; Lake side in new parking lot of hotel SARANAC 1.2; Lake side in new parking lot of hotel SARANAC 1.3; Lake side in new parking lot of hotel,Saranac Lake,NY,12983,,888-758-4389,E,,Public,24 hours daily,,,6,,,ChargePoint Network,http://www.chargepoint.com/,200-9,44.322619,-74.123160,01/23/2021,169509,2021-01-23 00:19:13,,,,,J1772
ELEC,iPark 112 E 65th Street - Tesla Destination,112 E 65th St,,New York,NY,10065,,646-556-7342  877-798-3752,E,,Public,24 hours daily; pay lot; see valet for access,,,3,,,Tesla Destination,https://www.tesla.com/destination-charging,200-8,40.766174,-73.966419,11/03/2020,115001,2020-11-18 00:06:10,P,,,11/01/2018,J1772 TESLA
ELEC,CHAUTAUQUA,3375 E Main St,CHAUTUAQUA; In front of Renaâ€™s Rustiques,Dunkirk,NY,14048,,888-758-4389,E,,Public,24 hours daily,,,2,,,ChargePoint Network,http://www.chargepoint.com/,GPS,42.464198,-79.280122,01/23/2021,162235,2021-01-23 00:19:13,,,,,J1772
ELEC,MUNICIPAL EVSE,39 Murray St,MURRAY STREET,Glens Falls,NY,12801,,888-758-4389,E,,Public,24 hours daily,,,2,,,ChargePoint Network,http://www.chargepoint.com/,GPS,43.303196,-73.648670,01/23/2021,155245,2021-01-23 00:19:13,,,,,J1772
ELEC,Roscoe Diner - Tesla Supercharger,1908 Old Route 17,,Roscoe,NY,12776,,877-798-3752,E,,Public,24 hours daily; for Tesla use only,,,,8,,Tesla,http://www.teslamotors.com/supercharger,GPS,41.930500,-74.908800,08/10/2020,118946,2020-08-27 20:39:12,P,,,02/01/2019,TESLA
ELEC,COLGATE,Lally Ln,"LALLY LANE 1; Located on Lally Lane, next to Zip Car parking. Across from the Student Union (JCC) building",Hamilton,NY,13346,,888-758-4389,E,,Public,24 hours daily,,,2,,,ChargePoint Network,http://www.chargepoint.com/,GPS,42.817555,-75.539265,01/23/2021,162445,2021-01-23 00:19:13,,,,,J1772
ELEC,EVPASS,9090 Carousel Center Drive,CCT N-1; 3 units in north underground garage off Harborside DrCCT N-2; 3 units in north underground garage off Harborside Dr,Syracuse,NY,13290,,888-758-4389,E,,Public,24 hours daily,,,2,,,ChargePoint Network,http://www.chargepoint.com/,200-8,43.067538,-76.170394,01/23/2021,162506,2021-01-23 00:19:13,,,,,J1772
ELEC,Brooklyn Museum - Tesla Supercharger,878 Washington Avenue,,Brooklyn,NY,11225,,877-798-3752,E,,Public,24 hours daily; for Tesla use only,,,,10,,Tesla,http://www.teslamotors.com/supercharger,200-8,40.669900,-73.963100,08/10/2020,122247,2020-08-27 20:39:12,P,,,03/01/2019,TESLA
ELEC,SAG HARBOR,1 Long Wharf,LONG WHARF,Sag Harbor,NY,11963,,888-758-4389,E,,Public,24 hours daily,,,2,,,ChargePoint Network,http://www.chargepoint.com/,GPS,41.003280,-72.295880,01/23/2021,165390,2021-01-23 00:19:13,,,,,J1772
ELEC,Port Authority Bus Terminal,625 8th Ave,,New York,NY,10018,,866-816-7584,E,,Public,24 hours daily,,,2,,,EV Connect,http://evconnect.com/,200-8,40.756177,-73.990558,04/08/2020,65287,2020-04-08 12:29:55,J,,,04/01/2018,J1772
ELEC,NATIONAL GRID,NY-5,SCHENECTADY CCC; Parking lot of Schenectady County Community College Muisic building,Schenectady,NY,12305,,888-758-4389,E,,Public,24 hours daily,,,2,,,ChargePoint Network,http://www.chargepoint.com/,GPS,42.815176,-73.952875,01/23/2021,162220,2021-01-23 00:19:13,,,,,J1772
ELEC,Standard Parking Gateway Plaza Garage - Tesla Destination,339 South End Ave,,New York,NY,10280,,800-836-6666  877-798-3752,E,,Public,24 hours daily; for customer use only; see valet for access,,,3,,,Tesla Destination,https://www.tesla.com/destination-charging,200-8,40.710652,-74.016396,11/03/2020,115102,2020-11-18 00:06:10,P,,,09/01/2017,J1772 TESLA
ELEC,COLCHESTER EV,15185 NY-30,DOWNSVILLEDINER,Downsville,NY,13755,,888-758-4389,E,,Public,24 hours daily,,,2,,,ChargePoint Network,http://www.chargepoint.com/,GPS,42.079406,-74.993625,01/23/2021,162139,2021-01-23 00:19:13,,,,,J1772
ELEC,Grape Hollow Farm - Tesla Destination,62 Paine Rd,,Holmes,NY,12531,,917-992-6289  877-798-3752,E,,Public,24 hours daily; for customer use only,,,2,,,Tesla Destination,https://www.tesla.com/destination-charging,200-9,41.548637,-73.692718,11/03/2020,114951,2020-11-18 00:06:10,P,,,11/01/2018,TESLA
ELEC,Barons Cove - Tesla Destination,31 W Water St,,Sag Harbor,NY,11963,,877-798-3752  877-798-3752,E,,Public,24 hours daily; for customer use only; see front desk for access,,,1,,,Tesla Destination,https://www.tesla.com/destination-charging,200-9,41.000092,-72.300430,11/03/2020,168607,2020-11-18 00:06:10,P,,,11/03/2020,TESLA
ELEC,YATES COUNTY,214 Main St,YATES COUNTY 1; Library parking lot,Penn Yan,NY,14527,,888-758-4389,E,,Public,24 hours daily,,,2,,,ChargePoint Network,http://www.chargepoint.com/,GPS,42.663948,-77.056970,01/23/2021,147016,2021-01-23 00:19:13,,,,,J1772
ELEC,QuickChek - Tesla Supercharger,601 East Main Street,,Middletown,NY,10941,,877-798-3752,E,,Public,24 hours daily; for Tesla use only,,,,4,,Tesla,http://www.teslamotors.com/supercharger,GPS,41.442400,-74.376400,08/10/2020,150207,2020-08-27 20:39:12,P,,,11/19/2019,TESLA
ELEC,EDISONPARKFAST,451 Ninth Ave,LOC #250 #2,New York,NY,10018,,888-758-4389,E,,Public,24 hours daily,,,1,,,ChargePoint Network,http://www.chargepoint.com/,GPS,40.754611,-73.995971,01/23/2021,162409,2021-01-23 00:19:13,,,,,J1772
ELEC,Tony Mangino Mitsubishi,1658 Route 9,,Clifton Park,NY,12065,,518-373-4100,E,,Public,24 hours daily; priority for Mitsubishi vehicles,,,2,,,Non-Networked,,200-9,42.858085,-73.762909,03/03/2020,98431,2020-03-03 21:13:47,P,,,01/01/2012,J1772
ELEC,Astoria Central Parking - Tesla Destination,31-57 31st St,,Astoria,NY,11106,,718-489-1654  877-798-3752,E,,Public,24 hours daily; pay lot; see valet for access,,,4,,,Tesla Destination,https://www.tesla.com/destination-charging,200-8,40.762763,-73.924473,11/03/2020,114881,2020-11-18 00:06:10,P,,,11/01/2018,TESLA
ELEC,RED HOOK V.,7477 S Broadway,RED HOOK; -,Red Hook,NY,12571,,888-758-4389,E,,Public,24 hours daily,,,2,,,ChargePoint Network,http://www.chargepoint.com/,GPS,41.994604,-73.876440,01/23/2021,162186,2021-01-23 00:19:13,,,,,J1772
ELEC,iPark NYC 425 E 58th Street - Tesla Destination,425 E 58th St,,New York,NY,10022,,212-838-4447  877-798-3752,E,,Public,24 hours daily; for customer use only; see valet for access,,,3,,,Tesla Destination,https://www.tesla.com/destination-charging,200-8,40.758766,-73.961406,11/03/2020,115134,2020-11-18 00:06:10,P,,,08/15/2016,J1772 TESLA
ELEC,Village of Webster - Parks and Recreation,1350 Chiyoda Dr,,Webster,NY,14580,,866-816-7584,E,,Public,24 hours daily,,,2,,,EV Connect,http://evconnect.com/,GPS,43.227453,-77.422364,06/09/2020,157944,2020-06-09 16:47:26,P,,,05/15/2020,J1772
ELEC,Fuccillo Nissan,3893 Route 31,,Liverpool,NY,13090,,315-944-3200,E,,Public - Call ahead,Dealership business hours,,,1,,,Non-Networked,,200-8,43.185219,-76.242663,06/09/2020,70451,2020-06-09 16:47:26,P,,,09/15/2014,J1772
ELEC,MPG 543 W 110th Street Garage - Tesla Destination,543  W 110th St,,New York,NY,10025,,212-222-7813  877-798-3752,E,,Public,24 hours daily; see valet for access,,,3,,,Tesla Destination,https://www.tesla.com/destination-charging,200-9,40.804167,-73.965894,11/03/2020,115157,2020-11-18 00:06:10,P,,,03/01/2017,J1772 TESLA
ELEC,ULSTER COUNTY,317 Shamrock Lane,"PUBLIC WORKS; Ulster County's fee for public charging is $0.50 per hour, effective 1-1-2020. Station is located in the rear of the public works lot",Kingston,NY,12401,,888-758-4389,E,,Public,24 hours daily,,,2,,,ChargePoint Network,http://www.chargepoint.com/,GPS,41.935971,-74.028244,01/23/2021,162465,2021-01-23 00:19:13,,,,,J1772
ELEC,Icon Parking 101 West End Ave - Tesla Destination,101 West End Ave,,New York,NY,10023,,212-874-8021  877-798-3752,E,,Public,24 hours daily; see valet for access,,,3,,,Tesla Destination,https://www.tesla.com/destination-charging,200-9,40.775188,-73.988501,11/03/2020,114994,2020-11-18 00:06:10,P,,,11/01/2018,J1772 TESLA
ELEC,Center Park 250 Albany - Tesla Destination,250 Albany St,,Manhattan,NY,10280,,212-945-1876  877-798-3752,E,,Public,24 hours daily; pay lot; see valet for access,,,4,,,Tesla Destination,https://www.tesla.com/destination-charging,200-8,40.709643,-74.015239,11/03/2020,150574,2020-11-18 00:06:10,P,,,09/30/2019,TESLA
ELEC,ULSTER COUNTY,300 Foxhall Ave,"HALL OF RECORDS; Wall mounted unit on north side of the building. Ulster County's fee for public charging is $0.50 per hour, effective 1-1-2020.",Kingston,NY,12401,,888-758-4389,E,,Public,24 hours daily,,,2,,,ChargePoint Network,http://www.chargepoint.com/,GPS,41.936150,-73.997814,01/23/2021,123018,2021-01-23 00:19:13,,,,,J1772
ELEC,Stone Ridge Public Library,3700 Main St,,Stone Ridge,NY,12484,,845-687-7023,E,,Public,24 hours daily,,,2,,,Non-Networked,,GPS,41.849440,-74.142960,10/09/2020,167130,2020-10-09 12:41:43,P,,,09/21/2020,J1772
ELEC,KINGSTON,5 Garraghan Dr,BUILDING SAFETY; Near front entrance of Kingston Building Safety Dept.,Kingston,NY,12401,,888-758-4389,E,,Public,24 hours daily,,,2,,,ChargePoint Network,http://www.chargepoint.com/,GPS,41.921490,-73.984795,01/23/2021,167467,2021-01-23 00:19:13,,,,,J1772
ELEC,Central Avenue Nissan,1919 Central Park Ave,,Yonkers,NY,10710,,,E,,Public - Call ahead,Dealership business hours; Nissan use only; contact 914-961-3900 for more information,,,1,1,,Non-Networked,,GPS,40.964447,-73.840117,06/09/2020,49678,2020-06-09 16:47:26,P,,,04/05/2016,CHADEMO J1772
ELEC,Davidson Ford,3690 State Route 31,Located in the front of the building,Clay,NY,13090,,315-870-7000,E,,Public - Call ahead,Dealership business hours,,,2,,,Non-Networked,,GPS,43.181259,-76.256973,09/03/2020,82355,2020-09-03 19:35:48,P,,,04/01/2017,J1772
ELEC,QUEENSBURY TOWN,21 Lafayette Street,HOVEY POND 1; New parking area at hovey pond park HOVEY POND 2; New parking area at hovey pond park,Queensbury,NY,12804,,888-758-4389,E,,Public,24 hours daily,,,4,,,ChargePoint Network,http://www.chargepoint.com/,200-9,43.329243,-73.663402,01/23/2021,165628,2021-01-23 00:19:13,,,,,J1772
ELEC,MAIN ST CW,3665 Main St,MAIN STREET 1,Warrensburg,NY,12885,,888-758-4389,E,,Public,24 hours daily,,,2,,,ChargePoint Network,http://www.chargepoint.com/,GPS,43.488052,-73.761925,01/23/2021,170194,2021-01-23 00:19:13,,,,,J1772
ELEC,Fairport Village Landing,100 Fairport Village Landing,Adjacent to parking garage ramp near Perrin St,Fairport,NY,14450,,585-223-9500,E,,Public,24 hours daily,,,6,,,EV Connect,http://evconnect.com/,GPS,43.100514,-77.443475,06/09/2020,51537,2020-06-09 16:47:26,LG,,,02/27/2019,J1772
ELEC,City Parking Garment One Garage - Tesla Destination,155 E 34th St,,New York,NY,10016,,212-683-2928  877-798-3752,E,,Public,24 hours daily; for customer use only; see valet for access,,,3,,,Tesla Destination,https://www.tesla.com/destination-charging,200-9,40.746200,-73.978528,11/03/2020,115023,2020-11-18 00:06:10,P,,,09/01/2017,J1772 TESLA
ELEC,4545 Center Blvd-TF Cornerstone LIC - Tesla Destination,4545 Center Blvd,,Long Island City,NY,11109,,718-440-3408  877-798-3752,E,,Public,24 hours daily; pay lot,,,8,,,Tesla Destination,https://www.tesla.com/destination-charging,200-9,40.748121,-73.955990,11/03/2020,150600,2020-11-18 00:06:10,P,,,09/30/2019,TESLA
ELEC,CASE CENTER LOT,Lower Scribner Village Rd,SUSSMAN HALL,Saratoga Springs,NY,12866,,888-758-4389,E,,Public,24 hours daily,,,2,,,ChargePoint Network,http://www.chargepoint.com/,GPS,43.098653,-73.789220,01/23/2021,123552,2021-01-23 00:19:13,,,,,J1772
ELEC,NEW,1055 E Jericho Turnpike,STATION 01; West side of bldg,Huntington,NY,11743,,888-758-4389,E,,Public,24 hours daily,,,2,,,ChargePoint Network,http://www.chargepoint.com/,GPS,40.835537,-73.369803,01/23/2021,162149,2021-01-23 00:19:13,,,,,J1772
ELEC,CT4021-COURTHSE,355 W Main St,FRANKLINCOCOURT; Located at Rear of Courthouse Building,Malone,NY,12953,,888-758-4389,E,,Public,24 hours daily,,,2,,,ChargePoint Network,http://www.chargepoint.com/,GPS,44.849740,-74.295105,01/23/2021,145534,2021-01-23 00:19:13,,,,,J1772
ELEC,Green Acres Commons - Tesla Supercharger,2034 Green Acres Mall,,Valley Stream,NY,11581,,877-798-3752,E,,Public,24 hours daily; for Tesla use only,,,,16,,Tesla,http://www.teslamotors.com/supercharger,200-9,40.664100,-73.725100,08/10/2020,102344,2020-08-27 20:39:12,P,,,07/23/2018,TESLA
ELEC,Parkright 300 E 77th St - Tesla Destination,300 East 77th St,,New York,NY,10075,,212-247-7303  877-798-3752,E,,Public,24 hours daily; see valet for access,,,3,,,Tesla Destination,https://www.tesla.com/destination-charging,200-9,40.771689,-73.955816,11/03/2020,115085,2020-11-18 00:06:10,P,,,01/01/2016,J1772 TESLA
ELEC,STONY BROOK UNV,Stadium Road Lot,STADIUM; -,Stony Brook,NY,11790,,888-758-4389,E,,Public,24 hours daily,,,2,,,ChargePoint Network,http://www.chargepoint.com/,GPS,40.918106,-73.123368,01/23/2021,162460,2021-01-23 00:19:13,,,,,J1772
ELEC,Icon Parking 1114 Ave & 6th,1114 Avenue of the Americas,Located between 5th Ave & 6th Ave.,New York,NY,10036,,888-998-2546,E,,Public,MON: 24 hours | TUE: 24 hours | WED: 24 hours | THU: 24 hours | FRI: 24 hours | SAT: 24 hours | SUN: 24 hours,,,1,,,Blink Network,http://www.blinkcharging.com/,GPS,40.755245,-73.983406,01/22/2021,169937,2021-01-22 22:55:21,,,,,J1772
ELEC,Fort William Henry - Tesla Destination,48 Canada St,,Lake George,NY,12845,,518-668-3081  877-798-3752,E,,Public,24 hours daily; for customer use only; see front desk for access,,,4,,,Tesla Destination,https://www.tesla.com/destination-charging,200-9,43.421013,-73.712711,11/03/2020,122485,2020-11-18 00:06:10,P,,,03/01/2019,J1772 TESLA
ELEC,Lebrun Nissan,396 Grant Ave,,Auburn,NY,13021,,315-253-7700,E,,Public - Call ahead,Dealership business hours,,,1,,,Non-Networked,,200-9,42.966894,-76.535879,06/09/2020,44321,2020-06-09 16:47:26,P,,,11/30/2011,J1772
ELEC,COHOES,97 N Mohawk St,STATION 2,Cohoes,NY,12047,,888-758-4389,E,,Public,24 hours daily,,,2,,,ChargePoint Network,http://www.chargepoint.com/,GPS,42.791645,-73.714570,01/23/2021,162357,2021-01-23 00:19:13,,,,,J1772
ELEC,Salmon Run Mall - Tesla Supercharger,21182 Salmon Run Mall Loop W,,Watertown,NY,13601,,877-798-3752,E,,Public,24 hours daily; for Tesla use only,,,,8,,Tesla,http://www.teslamotors.com/supercharger,200-9,43.979600,-75.954100,08/10/2020,102350,2020-08-27 20:39:12,P,,,06/01/2016,TESLA
ELEC,COLACINO INUSTR,126 Harrison St,"COLACINO 1; Off Harrison St, in front of Colacino IndustriesCOLACINO 2; Off Harrison St in front of Colacino IndustriesCOLACINO 3; Off Harrison St in front of Colacino IndustriesCOLACINO 4; Colacino Industries",Newark,NY,14513,,888-758-4389,E,,Public,24 hours daily,,,8,,,ChargePoint Network,http://www.chargepoint.com/,200-9,43.049716,-77.093434,01/23/2021,143218,2021-01-23 00:19:13,,,,,J1772
ELEC,Burger King,5597 Camp Road,,Hamburg,NY,14075,,888-998-2546,E,,Public,MON: 24 hours | TUE: 24 hours | WED: 24 hours | THU: 24 hours | FRI: 24 hours | SAT: 24 hours | SUN: 24 hours,,,2,,,Blink Network,http://www.blinkcharging.com/,GPS,42.734800,-78.838000,01/22/2021,152267,2021-01-22 22:55:21,,,,,J1772
ELEC,Union College,North Ln,,Schenectady,NY,12308,,866-816-7584,E,,Public,24 hours daily; Also accepts Paypal,A D M V,,4,,,EV Connect,http://evconnect.com/,GPS,42.818224,-73.927289,04/08/2020,155030,2020-04-08 12:29:55,P,,,04/02/2019,J1772
ELEC,PICOTTE,80 Wolf Rd,80 WOLF 280 WOLF ROAD 1,Colonie,NY,12205,,888-758-4389,E,,Public,24 hours daily,,,4,,,ChargePoint Network,http://www.chargepoint.com/,200-9,42.715648,-73.813015,01/23/2021,147462,2021-01-23 00:19:13,,,,,J1772
ELEC,69 COLLIER ST,69 Collier St,BINGHAMTON,Binghamton,NY,13901,,888-758-4389,E,,Public,24 hours daily,,,2,,,ChargePoint Network,http://www.chargepoint.com/,GPS,42.097750,-75.911921,01/23/2021,122699,2021-01-23 00:19:13,,,,,J1772
ELEC,MARINA COURT,422 East Boston Post Road,,Mamaroneck,NY,10543,,800-663-5633,E,,Public,MO: Not Specified; TU: Not Specified; WE: Not Specified; TH: Not Specified; FR: Not Specified; SA: Not Specified; SU: Not Specified,,,4,,,SemaCharge Network,https://semaconnect.com/,GPS,40.950688,-73.730248,01/23/2021,171418,2021-01-23 00:11:44,,,,,J1772
ELEC,Tivoli Village Office,86 Broadway,,Tivoli,NY,12583,,866-816-7584,E,,Public,24 hours daily,,,1,,,EV Connect,http://evconnect.com/,GPS,42.058922,-73.911492,04/08/2020,123138,2020-04-08 12:29:55,LG,,,04/01/2019,J1772
ELEC,Icon Parking 100 Riverside Blvd. - Tesla Destination,100 Riverside Blvd,,New York,NY,10024,,212-724-0107  877-798-3752,E,,Public,24 hours daily; see valet for access,,,3,,,Tesla Destination,https://www.tesla.com/destination-charging,200-9,40.775704,-73.989483,11/03/2020,114989,2020-11-18 00:06:10,P,,,01/01/2016,J1772 TESLA
ELEC,iPark NYU 377 E 33rd Street - Tesla Destination,377 E 33rd St,,New York,NY,10016,,212-532-3721  877-798-3752,E,,Public,24 hours daily; for customer use only; see valet for access,,,3,,,Tesla Destination,https://www.tesla.com/destination-charging,200-9,40.743382,-73.974251,11/03/2020,115113,2020-11-18 00:06:10,P,,,09/01/2017,J1772 TESLA
ELEC,WARREN TIRE,14 Lafayette Street,WT QUEENBSURY 1; Near garage on right,Queensbury,NY,12804,,888-758-4389,E,,Public,24 hours daily,,,2,,,ChargePoint Network,http://www.chargepoint.com/,GPS,43.328762,-73.666275,01/23/2021,143390,2021-01-23 00:19:13,,,,,J1772
ELEC,City of Poughkeepsie - Duro Parking Lot,197 Main St,,Poughkeepsie,NY,12601,,845-451-4120,E,,Public,24 hours daily,,,2,,,ChargePoint Network,http://www.chargepoint.com/,200-9,41.704941,-73.930601,09/03/2020,143787,2020-09-03 19:35:48,LG,,,08/08/2019,J1772
ELEC,BURNS MGT,69-71 Hamilton St,GASLIGHT 1; -,Saratoga Springs,NY,12866,,888-758-4389,E,,Public,24 hours daily,,,2,,,ChargePoint Network,http://www.chargepoint.com/,GPS,43.076363,-73.788431,01/23/2021,120963,2021-01-23 00:19:13,,,,,J1772
ELEC,Northwell,375 Seguine Ave,,Staten Island,NY,10309,,866-816-7584,E,,Public,24 hours daily,A D M V,,6,,,EV Connect,http://evconnect.com/,200-8,40.516856,-74.196692,10/09/2020,166366,2020-10-09 12:41:43,P,,,05/08/2020,J1772
ELEC,REIKART HOUSE,5010 Main St,JAZZBOLINE 2; Located behind Jazzboline Restaurant,Amherst,NY,14226,,888-758-4389,E,,Public,24 hours daily,,,2,,,ChargePoint Network,http://www.chargepoint.com/,GPS,42.960133,-78.769670,01/23/2021,150803,2021-01-23 00:19:13,,,,,J1772
ELEC,GMC 388 Bridge Street - Tesla Destination,388 Bridge St,,Brooklyn,NY,11201,,718-855-1061  877-798-3752,E,,Public,24 hours daily; pay lot; see valet for access,,,3,,,Tesla Destination,https://www.tesla.com/destination-charging,200-9,40.691652,-73.985733,11/03/2020,114903,2020-11-18 00:06:10,P,,,11/01/2018,TESLA
ELEC,The Alpine Lodge - Tesla Destination,264 Main St,,North Creek,NY,12853,,518-251-2451  877-798-3752,E,,Public,24 hours daily; for customer use only; see front desk for access,,,2,,,Tesla Destination,https://www.tesla.com/destination-charging,200-9,43.700216,-73.986141,11/03/2020,115200,2020-11-18 00:06:10,P,,,11/01/2018,TESLA
ELEC,Rapidpark 205 W 101st Street - Tesla Destination,205 W 101st Street,,New York,NY,10025,,877-798-3752  877-798-3752,E,,Public,24 hours daily; for customer use only; see front desk for access,,,3,,,Tesla Destination,https://www.tesla.com/destination-charging,200-9,40.797676,-73.968479,11/03/2020,169060,2020-11-18 00:06:10,P,,,11/03/2020,J1772 TESLA
ELEC,ERLOWEST,3178 Lake Shore Drive,ERLOWEST #1,Lake George,NY,12845,,888-758-4389,E,,Public,24 hours daily,,,2,,,ChargePoint Network,http://www.chargepoint.com/,GPS,43.447617,-73.695690,01/23/2021,162143,2021-01-23 00:19:13,,,,,J1772
ELEC,Metro North Train Station - Southeast,4 Independent Way,,Brewster,NY,10590,,866-816-7584,E,,Public,24 hours daily,,,4,,,EV Connect,http://evconnect.com/,200-9,41.416405,-73.624373,04/08/2020,94829,2020-04-08 12:29:55,P,,,04/23/2015,J1772
ELEC,AAA Car Care Plus,2131 Eggert Rd,,Amherst,NY,14226,,716-362-0562,E,,Public,24 hours daily,,,1,,,Non-Networked,,200-9,42.979363,-78.821443,09/03/2020,42992,2020-09-03 19:35:48,P,,,12/31/2011,J1772
ELEC,MPG 500 West 30th - Tesla Destination,500 W 30th,,New York,NY,10001,,212-490-3474  877-798-3752,E,,Public,24 hours daily; see valet for access,,,3,,,Tesla Destination,https://www.tesla.com/destination-charging,200-9,40.751987,-74.001701,11/03/2020,115145,2020-11-18 00:06:10,P,,,11/01/2018,J1772 TESLA
ELEC,NYSE Thruway - NYPA,8420 Alleghany Rd,,Corfu,NY,14036,,866-816-7584,E,,Public - Credit card at all times,24 hours daily; Also accepts PayPal and Apple Pay,A D M V,,,2,,EV Connect,http://evconnect.com/,GPS,43.004597,-78.407320,12/03/2020,168456,2020-12-03 22:33:12,LG,,,08/25/2020,CHADEMO J1772COMBO
ELEC,Yeshiva University,385 Audubon Ave,,New York,NY,10033,,866-816-7584,E,,Public,24 hours daily,,,1,,,EV Connect,http://evconnect.com/,GPS,40.850664,-73.930638,06/09/2020,123105,2020-06-09 16:47:26,P,,,04/01/2019,J1772
ELEC,Hampton Inn Oneonta - Tesla Destination,225 River St,,Oneonta,NY,13820,,607-433-9000  877-798-3752,E,,Public,24 hours daily; for customer use only; see front desk for access,,,2,,,Tesla Destination,https://www.tesla.com/destination-charging,200-8,42.444012,-75.086447,11/03/2020,115205,2020-11-18 00:06:10,P,,,09/01/2017,TESLA
ELEC,Towne Place New Hartford - Tesla Destination,4760 Middle Settlement Rd,,Whitesboro,NY,13492,,315-732-2500  877-798-3752,E,,Public,24 hours daily; for customer use only,,,3,,,Tesla Destination,https://www.tesla.com/destination-charging,200-8,43.095308,-75.318661,11/03/2020,115249,2020-11-18 00:06:10,P,,,11/01/2018,J1772 TESLA
ELEC,Hampton Inn - Clifton Park,620 Plank Rd,,Clifton Park,NY,12065,,866-816-7584,E,,Public,24 hours daily,,,2,,,EV Connect,http://evconnect.com/,GPS,42.865495,-73.778228,01/14/2021,72921,2021-01-14 18:42:41,P,,,01/07/2021,J1772
ELEC,NATIONAL GRID,911 Saratoga Dr,SUNY COBLESKILL; CEST parking lot,Cobleskill,NY,12043,,888-758-4389,E,,Public,24 hours daily,,,2,,,ChargePoint Network,http://www.chargepoint.com/,GPS,42.670143,-74.507792,01/23/2021,162217,2021-01-23 00:19:13,,,,,J1772
ELEC,Corning Museum of Glass - Welcome Center,1 Museum Way,,Corning,NY,14830,,607-438-5298,E,,Public - Credit card at all times,24 hours daily,A D M V,,4,,,ChargePoint Network,http://www.chargepoint.com/,GPS,42.152965,-77.054137,03/03/2020,135491,2020-03-03 21:13:47,P,,,06/01/2019,J1772
ELEC,City of Rochester - Public Market,280 N Union St,,Rochester,NY,14609,,866-816-7584,E,,Public,24 hours daily,,,2,,,EV Connect,http://evconnect.com/,GPS,43.166050,-77.591385,06/09/2020,123093,2020-06-09 16:47:26,LG,,,04/01/2019,J1772
ELEC,Walmart 1949 Fredonia,10401 Bennett Road,,Fredonia,NY,14063,,833-632-2778,E,,Public,24 hours daily,,,,4,,Electrify America,https://www.electrifyamerica.com/,GPS,42.453787,-79.311176,01/23/2021,168359,2021-01-23 01:23:19,,,,,CHADEMO J1772COMBO
ELEC,Lexington-Grove West Garage,100 Main St,,White Plains,NY,10601,,914-422-1232,E,,Public,24 hours daily,,,2,,,Non-Networked,,200-9,41.031464,-73.769946,09/03/2020,165161,2020-09-03 19:35:48,SG,,,08/11/2020,J1772
ELEC,"Walgreens - Brooklyn, NY #15097",589 Prospect Avenue,"$2.00 first hour, billed at start. $2.00 per plug hour thereafter.",Brooklyn,NY,11215,,800-663-5633,E,,Public,MO: 12:00am-12:00am; TU: 12:00am-12:00am; WE: 12:00am-12:00am; TH: 12:00am-12:00am; FR: 12:00am-12:00am; SA: 12:00am-12:00am; SU: 12:00am-12:00am,,,1,,,SemaCharge Network,https://semaconnect.com/,GPS,40.656780,-73.977760,01/23/2021,148167,2021-01-23 00:11:44,,,,,J1772
ELEC,Hampton Inn by Hilton Kingston - Tesla Destination,1307 Ulster Ave,,Kingston,NY,12401,,845-382-2600  877-798-3752,E,,Public - Call ahead,24 hours daily; for customer use only,,,6,,,Tesla Destination,https://www.tesla.com/destination-charging,200-8,41.970001,-73.989083,11/03/2020,114961,2020-11-18 00:06:10,P,,,01/01/2016,J1772 TESLA
ELEC,iPark NYC 555 West Garage Corp. - Tesla Destination,549  W 23rd St,,New York,NY,10011,,855-472-7569  877-798-3752,E,,Public,24 hours daily; for customer use only; see valet for access,,,3,,,Tesla Destination,https://www.tesla.com/destination-charging,200-9,40.748931,-74.006078,11/03/2020,150502,2020-11-18 00:06:10,P,,,09/30/2019,J1772 TESLA
ELEC,Steet-Ponte Ford Lincoln Mazda,5074 Commercial Dr,,Yorkville,NY,13495,,315-736-3381,E,,Public - Call ahead,Dealership business hours,,,1,,,Non-Networked,,200-9,43.110055,-75.293478,03/03/2020,53976,2020-03-03 21:13:47,P,,,11/01/2013,J1772
ELEC,RIT EV CHARGING,Clark Drive,"ADMIN LOT; -D LOT CENTER; D Lot, south end of parking lotD LOT NORTH; D Lot, south end of parking lotD LOT SOUTH STA; D lot at south end of parking lot",Rochester,NY,14623,,888-758-4389,E,,Public,24 hours daily,,,8,,,ChargePoint Network,http://www.chargepoint.com/,GPS,43.086058,-77.673355,01/23/2021,162398,2021-01-23 00:19:13,,,,,J1772
ELEC,ROSENBLUM300,1 Winners Cir,1 WINNERS,Albany,NY,12205,,888-758-4389,E,,Public,24 hours daily,,,2,,,ChargePoint Network,http://www.chargepoint.com/,GPS,42.718322,-73.797207,01/23/2021,121069,2021-01-23 00:19:13,,,,,J1772
ELEC,ALBANY COUNTY,780 Albany Shaker Rd,NURSING HOME;  Pull into the  main entrance turn immediately to the right chargers on the right,Albany,NY,12211,,888-758-4389,E,,Public,24 hours daily,,,2,,,ChargePoint Network,http://www.chargepoint.com/,GPS,42.743270,-73.814908,01/23/2021,162162,2021-01-23 00:19:13,,,,,J1772
ELEC,Quik Park 365 Management LLC - Tesla Destination,365 Bond St,,Brooklyn,NY,11231,,888-705-7845  877-798-3752,E,,Public,24 hours daily; see valet for access,,,3,,,Tesla Destination,https://www.tesla.com/destination-charging,200-9,40.677433,-73.990299,11/03/2020,114902,2020-11-18 00:06:10,P,,,03/01/2017,J1772 TESLA
ELEC,VILLAGE HF,378-390 Main St,HGHLAND FALLS,Highland Falls,NY,10928,,888-758-4389,E,,Public,24 hours daily,,,2,,,ChargePoint Network,http://www.chargepoint.com/,GPS,41.372570,-73.964104,01/23/2021,162299,2021-01-23 00:19:13,,,,,J1772
ELEC,Burdick Nissan,5885 E Circle Dr,,Cicero,NY,13039,,315-458-8915,E,,Public - Call ahead,Dealership business hours,,,1,,,Non-Networked,,200-9,43.147147,-76.114274,06/09/2020,44331,2020-06-09 16:47:26,P,,,11/30/2011,J1772
ELEC,Village of Spencerport - Port Museum,16 East Ave,,Spencerport,NY,14559,,585-352-4771,E,,Public,24 hours daily,,,1,,,Non-Networked,,GPS,43.191902,-77.799795,06/09/2020,157967,2020-06-09 16:47:26,P,,,05/15/2020,J1772
ELEC,"MTP Parking, The Helena - Tesla Destination",601  W 57th St,,New York,NY,10019,,212-575.5335  877-798-3752,E,,Public,24 hours daily; pay lot; see valet for access,,,2,,,Tesla Destination,https://www.tesla.com/destination-charging,200-9,40.770771,-73.991789,11/03/2020,115171,2020-11-18 00:06:10,P,,,11/01/2016,TESLA
ELEC,Mendon Public Library,22 North Main Street,,Honeoye Falls,NY,14472,,855-900-7584,E,,Public,24 hours daily,,,2,,,Greenlots,http://greenlots.com/,200-9,42.953986,-77.591468,01/23/2021,170910,2021-01-23 01:21:30,,,,,J1772
ELEC,MPG 100 Jay Street - Tesla Destination,100 Jay St,,Brooklyn,NY,10021,,718-855-2851  877-798-3752,E,,Public,24 hours daily; for customer use only; see valet for access,,,3,,,Tesla Destination,https://www.tesla.com/destination-charging,200-9,40.702004,-73.987053,11/03/2020,114917,2020-11-18 00:06:10,P,,,09/01/2017,J1772 TESLA
ELEC,Heritage Park,65 Franklin St,,Springville,NY,14141,,716-592-4936,E,,Public,24 hours daily,,,2,,,Non-Networked,,GPS,42.510491,-78.665211,06/09/2020,157961,2020-06-09 16:47:26,P,,,05/15/2020,J1772
ELEC,CT4020-HD-GW,7559 Court St,COURT LOT,Elizabethtown,NY,12932,,888-758-4389,E,,Public,24 hours daily,,,2,,,ChargePoint Network,http://www.chargepoint.com/,GPS,44.215187,-73.594240,01/23/2021,143486,2021-01-23 00:19:13,,,,,J1772
ELEC,NATIONAL GRID,60 wolf rd,CHILIS ALBANY,Colonie,NY,12205,,888-758-4389,E,,Public,24 hours daily,,,2,,,ChargePoint Network,http://www.chargepoint.com/,GPS,42.714731,-73.814118,01/23/2021,162202,2021-01-23 00:19:13,,,,,J1772
ELEC,TRICITYRENTALS,61 Woodlake Rd N,WOODLAKEWOODLAKE 2,Albany,NY,12203,,888-758-4389,E,,Public,24 hours daily,,,4,,,ChargePoint Network,http://www.chargepoint.com/,200-8,42.681288,-73.849689,01/23/2021,51095,2021-01-23 00:19:13,,,,,J1772
ELEC,Maguire Nissan,716 W Genesee,,Syracuse,NY,13204,,315-802-4432,E,,Public - Call ahead,Dealership business hours,,,2,,,Non-Networked,,200-8,43.053474,-76.163547,06/09/2020,85970,2020-06-09 16:47:26,P,,,03/01/2017,J1772
ELEC,ROCHESTER NY,30 Church St,ROC CITY HALL1; City Hall rear lot,Rochester,NY,14614,,888-758-4389,E,,Public,24 hours daily,,,2,,,ChargePoint Network,http://www.chargepoint.com/,GPS,43.156992,-77.614895,01/23/2021,162173,2021-01-23 00:19:13,,,,,J1772
ELEC,SMITHTOWN,21 Pulaski Rd,21 PULASKI RD,Kings Park,NY,11754,,888-758-4389,E,,Public,24 hours daily,,,2,,,ChargePoint Network,http://www.chargepoint.com/,GPS,40.885946,-73.258659,01/23/2021,169402,2021-01-23 00:19:13,,,,,J1772
ELEC,The FLX Wienery - Tesla Destination,5090 Highway 14,,Dundee,NY,14837,,607-243-7100  877-798-3752,E,,Public - Call ahead,24 hours daily; for customer use only,,,2,,,Tesla Destination,https://www.tesla.com/destination-charging,200-9,42.519115,-76.922429,11/03/2020,114935,2020-11-18 00:06:10,P,,,01/01/2016,J1772 TESLA
ELEC,THE SAGAMORE,433 Boathouse Ln,SAGAMORE 1.1SAGAMORE 1.2; -SAGAMORE 1.3SAGAMORE 1.4SAGAMORE 1.5,Bolton,NY,12814,,888-758-4389,E,,Public,24 hours daily,,,10,,,ChargePoint Network,http://www.chargepoint.com/,GPS,43.557070,-73.645260,01/23/2021,153089,2021-01-23 00:19:13,,,,,J1772
ELEC,ROSENDALE,382 Main St,WILLOW KILN; Station is located in Willow kiln parking lot,Kingston,NY,12401,,888-758-4389,E,,Public,24 hours daily,,,2,,,ChargePoint Network,http://www.chargepoint.com/,GPS,41.844954,-74.081459,01/23/2021,162376,2021-01-23 00:19:13,,,,,J1772
ELEC,NY STATE PARKS,280 Club House Rd,JAMES BAIRD,Pleasant Valley,NY,12569,,888-758-4389,E,,Public,24 hours daily,,,2,,,ChargePoint Network,http://www.chargepoint.com/,GPS,41.685950,-73.791916,01/23/2021,149880,2021-01-23 00:19:13,,,,,J1772
ELEC,ROSENBLUM300,200 Great Oaks Blvd,200 GREAT OAKS,Albany,NY,12203,,888-758-4389,E,,Public,24 hours daily,,,2,,,ChargePoint Network,http://www.chargepoint.com/,GPS,42.682488,-73.848090,01/23/2021,162482,2021-01-23 00:19:13,,,,,J1772
ELEC,RESERVE - CLUB,1 Reserve Blvd,RESERVE-CLUB; -,Yaphank,NY,11980,,888-758-4389,E,,Public,24 hours daily,,,1,,,ChargePoint Network,http://www.chargepoint.com/,GPS,40.849614,-72.897944,01/23/2021,154433,2021-01-23 00:19:13,,,,,J1772
ELEC,Hannaford Supermarket,5239 Western Tpke,,Altamont,NY,12009,,877-455-3833,E,,Public - Card key at all times,24 hours daily,,,,1,,eVgo Network,https://www.evgo.com/,GPS,42.716216,-73.934492,01/23/2021,93480,2021-01-23 01:19:54,,,,,CHADEMO J1772COMBO
ELEC,Tupper Lake Municipal Park,17 Demars Blvd,,Tupper Lake,NY,12986,,866-816-7584,E,,Public,24 hours daily,,,1,,,EV Connect,http://evconnect.com/,GPS,44.227526,-74.464482,04/08/2020,123071,2020-04-08 12:29:55,P,,,04/01/2019,J1772
ELEC,BATAVIA DOWNS,8323-8325 Park Rd,BATAVIA DOWNS; Near front entrance,Batavia,NY,14020,,888-758-4389,E,,Public,24 hours daily,,,2,,,ChargePoint Network,http://www.chargepoint.com/,GPS,43.008683,-78.206055,01/23/2021,162294,2021-01-23 00:19:13,,,,,J1772
ELEC,Rapidpark 148 E 33rd Street - Tesla Destination,148 E 33rd St,,New York,NY,10016,,212-686-1436  877-798-3752,E,,Public - Call ahead,24 hours daily; for customer use only,,,3,,,Tesla Destination,https://www.tesla.com/destination-charging,200-9,40.745236,-73.979736,11/03/2020,115016,2020-11-18 00:06:10,P,,,09/01/2017,J1772 TESLA
ELEC,Glenwood Grand Tier Parking - Tesla Destination,1930 Broadway,,New York,NY,10023,,212-769-0546  877-798-3752,E,,Public,24 hours daily; see valet for access,,,2,,,Tesla Destination,https://www.tesla.com/destination-charging,200-9,40.772436,-73.981695,11/03/2020,115036,2020-11-18 00:06:10,P,,,09/01/2017,TESLA
ELEC,Central Parking - Tower 31,9 W 31st Street,,New York,NY,10001,,888-998-2546,E,,Public,MON: 24 hours | TUE: 24 hours | WED: 24 hours | THU: 24 hours | FRI: 24 hours | SAT: 24 hours | SUN: 24 hours,,,2,,,Blink Network,http://www.blinkcharging.com/,GPS,40.747090,-73.986670,01/22/2021,95069,2021-01-22 22:55:21,,,,,J1772
ELEC,Gregoris Motors,555 W Merrick Rd,,Valley Stream,NY,11580,,516-825-8700,E,,Public - Call ahead,Dealership business hours,,,1,,,Non-Networked,,200-9,40.670497,-73.717206,06/09/2020,44201,2020-06-09 16:47:26,P,,,11/30/2011,J1772
ELEC,RXR REALTY,340 RXR Plaza,RXR PLAZA; RXR Plaza - within the parking garage and not open to public,Uniondale,NY,11556,,888-758-4389,E,,Public,24 hours daily,,,2,,,ChargePoint Network,http://www.chargepoint.com/,GPS,40.720249,-73.583470,01/23/2021,162481,2021-01-23 00:19:13,,,,,J1772
ELEC,BRIDGE STREET,55 Bridge St,STATION-1; Public Parking Lot Station #1 - West of BridgeSTATION-2; Public Parking Lot Station #2 - West of BridgeSTATION-3; Public Parking Lot Station #3 - West of Bridge,Amsterdam,NY,12010,,888-758-4389,E,,Public,24 hours daily,,,6,,,ChargePoint Network,http://www.chargepoint.com/,200-9,42.934719,-74.197380,01/23/2021,170132,2021-01-23 00:19:13,,,,,J1772
ELEC,BEDFORDEV,60 Haines Rd.,MEMORIAL PARK 2; Bedford Hills Memorial Park (near Soccer Field),Bedford Hills,NY,10507,,888-758-4389,E,,Public,24 hours daily,,,2,,,ChargePoint Network,http://www.chargepoint.com/,GPS,41.234114,-73.706622,01/23/2021,162338,2021-01-23 00:19:13,,,,,J1772
ELEC,AMCR,873 State Route 37,CASINO 1.1; Side of the casino near comfort innCASINO 1.2; Side of the casino near comfort inn,Akwesasne,NY,13655,,888-758-4389,E,,Public,24 hours daily,,,4,,,ChargePoint Network,http://www.chargepoint.com/,200-8,44.967652,-74.645315,01/23/2021,167256,2021-01-23 00:19:13,,,,,J1772
ELEC,Windsor Town Court Room,124 Main St,,Windsor,NY,13865,,866-816-7584,E,,Public,24 hours daily,,,2,,,EV Connect,http://evconnect.com/,200-9,42.077966,-75.639472,04/08/2020,94868,2020-04-08 12:29:55,LG,,,10/26/2017,J1772
ELEC,SMITHTOWN VW,"536-540, NY-25",VW_408353_A; -,Smithtown,NY,11787,,888-758-4389,E,,Public,24 hours daily,,,2,,,ChargePoint Network,http://www.chargepoint.com/,GPS,40.858874,-73.161838,01/23/2021,162430,2021-01-23 00:19:13,,,,,J1772
ELEC,ICE RINK,9 Division St,LIBRARY,Saugerties,NY,12477,,888-758-4389,E,,Public,24 hours daily,,,2,,,ChargePoint Network,http://www.chargepoint.com/,GPS,42.077730,-73.948650,01/23/2021,149087,2021-01-23 00:19:13,,,,,J1772
ELEC,COHEN BROTHERS,750 Lexington Ave,750 LEXINGTON; -,New York,NY,10022,,888-758-4389,E,,Public,24 hours daily,,,1,,,ChargePoint Network,http://www.chargepoint.com/,GPS,40.762898,-73.968327,01/23/2021,162380,2021-01-23 00:19:13,,,,,J1772
ELEC,SUNY BUFFALO,185 Hayes Rd,,Buffalo,NY,14214,,888-758-4389,E,,Public,24 hours daily,,,14,,,ChargePoint Network,http://www.chargepoint.com/,GPS,42.951204,-78.822398,01/23/2021,171282,2021-01-23 00:19:13,,,,,J1772
ELEC,Spectrum,133-19 Atlantic Ave,,Jamaica,NY,11418,,866-816-7584,E,,Public,Office business hours; for employee and guest use only,,,2,,,EV Connect,http://evconnect.com/,200-8,40.696909,-73.816114,04/08/2020,94844,2020-04-08 12:29:55,P,,,06/30/2016,J1772
ELEC,Town of Keene - Town Hall,1300 Hurricane Rd,,Keene,NY,12942,,518-576-4444,E,,Public,24 hours daily,,,1,,,Non-Networked,,200-9,44.254853,-73.789435,02/06/2020,153284,2020-02-06 21:24:11,LG,,,06/24/2019,J1772
ELEC,Jamesport Vineyards - Tesla Destination,1216 Main Rd,,Jamesport,NY,11947,,631-722-5256  877-798-3752,E,,Public,24 hours daily; for customer use only,,,4,,,Tesla Destination,https://www.tesla.com/destination-charging,GPS,40.948665,-72.597301,11/03/2020,114960,2020-11-18 00:06:10,P,,,11/01/2018,TESLA
ELEC,Molloy College,1000 Hempstead Ave,,Rockville Centre,NY,11571,,866-816-7584,E,,Public,24 hours daily,,,2,,,EV Connect,http://evconnect.com/,GPS,40.686146,-73.624984,04/08/2020,123263,2020-04-08 12:29:55,P,,,04/01/2019,J1772
ELEC,Prettejohn Public Parking Lot,17 Commercial St,Located behind the Livonia Inn,Livonia,NY,14487,,585-346-2010,E,,Public,24 hours daily,,,2,,,Non-Networked,,GPS,42.821089,-77.668047,06/09/2020,87725,2020-06-09 16:47:26,LG,,,09/13/2017,J1772
ELEC,Fairfield Inn by Marriott Binghamton - Tesla Destination,864 Upper Front St,,Binghamton,NY,13905,,607-651-1000  877-798-3752,E,,Public,24 hours daily; for customer use only; see front desk for access,,,3,,,Tesla Destination,https://www.tesla.com/destination-charging,200-8,42.130103,-75.905801,11/03/2020,114885,2020-11-18 00:06:10,P,,,11/01/2018,J1772 TESLA
ELEC,Standard Parking 151 W 17th Street - Tesla Destination,151 W 17th St,,New York,NY,10011,,800-836-6666  877-798-3752,E,,Public,24 hours daily; for customer use only; see valet for access,,,3,,,Tesla Destination,https://www.tesla.com/destination-charging,200-9,40.740728,-73.997493,11/03/2020,115021,2020-11-18 00:06:10,P,,,09/01/2017,J1772 TESLA
ELEC,GSH NY,255 Lafayette Ave,"DOCTORS PARKING; Good Samaritan Hospital Dr Parking Lot, Restricted For Employees Only",Suffern,NY,10901,,888-758-4389,E,,Public,24 hours daily,,,2,,,ChargePoint Network,http://www.chargepoint.com/,GPS,41.112090,-74.136560,01/23/2021,123665,2021-01-23 00:19:13,,,,,J1772
ELEC,Greenporter Hotel - Tesla Destination,326 Front St,,Greenport,NY,11944,,631-477-0066  877-798-3752,E,,Public,24 hours daily; for customer use only; see front desk for access,,,1,,,Tesla Destination,https://www.tesla.com/destination-charging,200-9,41.101654,-72.364242,11/03/2020,114947,2020-11-18 00:06:10,P,,,09/01/2016,TESLA
ELEC,Icon 9-11 Park Ave - Tesla Destination,9 - 11 Park Ave,,New York,NY,10016,,212-725-5081  877-798-3752,E,,Public,24 hours daily; for customer use only; see valet for access,,,3,,,Tesla Destination,https://www.tesla.com/destination-charging,200-9,40.747207,-73.980743,11/03/2020,115191,2020-11-18 00:06:10,P,,,11/01/2018,J1772 TESLA
ELEC,Hannaford Supermarket,40 Main Ave,,Wynantskill,NY,12198,,877-455-3833,E,,Public - Card key at all times,24 hours daily,,,,1,,eVgo Network,https://www.evgo.com/,GPS,42.697500,-73.648487,01/23/2021,93540,2021-01-23 01:19:54,,,,,CHADEMO J1772COMBO
ELEC,Central Parking 200 Chambers - Tesla Destination,200 Chambers St,,New York,NY,10007,,800-836-6666  877-798-3752,E,,Public,24 hours daily; pay lot; see valet for access,,,3,,,Tesla Destination,https://www.tesla.com/destination-charging,200-9,40.716579,-74.012393,11/03/2020,115038,2020-11-18 00:06:10,P,,,11/01/2018,J1772 TESLA
ELEC,NLH1,99 E State Street,NLH 1; -,Gloversville,NY,12078,,888-758-4389,E,,Public,24 hours daily,,,2,,,ChargePoint Network,http://www.chargepoint.com/,GPS,43.071773,-74.330608,01/23/2021,162476,2021-01-23 00:19:13,,,,,J1772
ELEC,NATIONAL GRID,1536 Military Rd,CHILI'S NIAGARA; Chiliâ€™s parking lot near front entrance,Niagara Falls,NY,14304,,888-758-4389,E,,Public,24 hours daily,,,2,,,ChargePoint Network,http://www.chargepoint.com/,GPS,43.094737,-78.973192,01/23/2021,162207,2021-01-23 00:19:13,,,,,J1772
ELEC,Champion Parking 60 E 8th - Tesla Destination,60-68 E 8th St,,New York,NY,10003,,212-473-9061  877-798-3752,E,,Public,24 hours daily; see valet for access,,,3,,,Tesla Destination,https://www.tesla.com/destination-charging,200-9,40.730501,-73.993075,11/03/2020,115172,2020-11-18 00:06:10,P,,,02/01/2015,J1772 TESLA
ELEC,iPark 200 West Garage Corp. - Tesla Destination,220 W 26th St,,New York,NY,10001,,646-486-2148  877-798-3752,E,,Public,24 hours daily; pay lot; see valet for access,,,3,,,Tesla Destination,https://www.tesla.com/destination-charging,200-9,40.746142,-73.995221,11/03/2020,115055,2020-11-18 00:06:10,P,,,11/01/2018,J1772 TESLA
ELEC,ImPark 500 4th Ave - Tesla Destination,212 12th St,,Brooklyn,NY,11215,,212-937-8660  877-798-3752,E,,Public,24 hours daily; pay lot; see valet for access,,,4,,,Tesla Destination,https://www.tesla.com/destination-charging,200-8,40.668403,-73.990389,11/03/2020,122471,2020-11-18 00:06:10,P,,,03/01/2019,TESLA
ELEC,University at Albany - Indian Quad Parking Area,1400 Washington Ave,Life Sciences Ln and Center Dr E,Albany,NY,12222,,,E,,Public,24 hours daily,,,2,,,EV Connect,http://evconnect.com/,GPS,42.683683,-73.821903,03/03/2020,123303,2020-03-03 21:13:47,P,,,04/01/2018,J1772
ELEC,Star Nissan,20602 Northern Blvd,,Bayside,NY,11361,,718-423-0500,E,,Public - Call ahead,Dealership business hours,,,1,,,Non-Networked,,200-8,40.758245,-73.776954,06/09/2020,44323,2020-06-09 16:47:26,P,,,11/30/2011,J1772
ELEC,MUNICIPAL EVSE,75 Bush St,HAVILAND COVE,Glens Falls,NY,12801,,888-758-4389,E,,Public,24 hours daily,,,2,,,ChargePoint Network,http://www.chargepoint.com/,GPS,43.292145,-73.652280,01/23/2021,155286,2021-01-23 00:19:13,,,,,J1772
ELEC,The Custer Institute,1115 Main Bayview Rd,,Southold,NY,11971,,888-780-0062,E,,Public,24 hours daily,,,4,,,EV Connect,http://evconnect.com/,GPS,41.052046,-72.434680,04/08/2020,152743,2020-04-08 12:29:55,P,,,01/20/2020,J1772
ELEC,The Kartrite Resort & Indoor Waterpark - Tesla Destination,555 Resorts World Dr,,Monticello,NY,12701,,844-527-8748  877-798-3752,E,,Public,24 hours daily; for customer use only; see front desk for access,,,2,,,Tesla Destination,https://www.tesla.com/destination-charging,200-9,41.661828,-74.644777,11/03/2020,150611,2020-11-18 00:06:10,P,,,09/30/2019,TESLA
ELEC,WW BMW,125 NY-59,STATION 01; Front right unit,Spring Valley,NY,10977,,888-758-4389,E,,Public,24 hours daily,,,2,,,ChargePoint Network,http://www.chargepoint.com/,GPS,41.107291,-74.037169,01/23/2021,120820,2021-01-23 00:19:13,,,,,J1772
ELEC,iPark 400 E 85th St - Tesla Destination,400 E 85th St,,Manhattan,NY,10028,,212-650-1683  877-798-3752,E,,Public,24 hours daily; pay lot; see valet for access,,,4,,,Tesla Destination,https://www.tesla.com/destination-charging,200-8,40.776008,-73.949934,11/03/2020,122489,2020-11-18 00:06:10,P,,,03/01/2019,TESLA
ELEC,Blauvelt Funeral Home,625 Broad St,,Waverly,NY,14892,,866-816-7584,E,,Public,24 hours daily,,,4,,,EV Connect,http://evconnect.com/,GPS,42.003208,-76.524565,06/09/2020,157948,2020-06-09 16:47:26,P,,,05/15/2020,J1772
ELEC,Hunt County Vineyards - Tesla Destination,4021 Italy Hill Rd,,Branchport,NY,14418,,315-595-2812  877-798-3752,E,,Public,24 hours daily; for customer use only,,,5,,,Tesla Destination,https://www.tesla.com/destination-charging,200-9,42.591377,-77.172899,11/03/2020,114886,2020-11-18 00:06:10,P,,,11/01/2018,J1772 TESLA
ELEC,NATIONAL GRID,23725 NY-342,LONGWAYS DINER; Side parking area of Longways Diner,Watertown,NY,13601,,888-758-4389,E,,Public,24 hours daily,,,2,,,ChargePoint Network,http://www.chargepoint.com/,GPS,44.041112,-75.899785,01/23/2021,162240,2021-01-23 00:19:13,,,,,J1772
ELEC,GGMC 91 E 9th Street - Tesla Destination,91 East 9th Street,,New York,NY,10003,,877-798-3752  877-798-3752,E,,Public,24 hours daily; for customer use only; see front desk for access,,,3,,,Tesla Destination,https://www.tesla.com/destination-charging,200-8,40.730990,-73.990963,11/03/2020,168794,2020-11-18 00:06:10,P,,,11/03/2020,J1772 TESLA
ELEC,LAFAYETTE BOYNT,901 Boynton Ave,"LAF BOYNT 1; Lot entrance at Story and Elder, charging station is immediately to the right of the entrance, between spaces 579 &amp; 580",Bronx,NY,10473,,888-758-4389,E,,Public,24 hours daily,,,2,,,ChargePoint Network,http://www.chargepoint.com/,GPS,40.821451,-73.877642,01/23/2021,162499,2021-01-23 00:19:13,,,,,J1772
ELEC,Gerard Garage,70-25 Yellowstone Boulevard,,Forest Hills,NY,11375,,888-998-2546,E,,Public,MON: 24 hours | TUE: 24 hours | WED: 24 hours | THU: 24 hours | FRI: 24 hours | SAT: 24 hours | SUN: 24 hours,,,1,,,Blink Network,http://www.blinkcharging.com/,GPS,40.722050,-73.849351,01/22/2021,164747,2021-01-22 22:55:21,,,,,J1772
ELEC,Hampton Inn - British American Blvd,45 British American Blvd,,Latham,NY,12110,,866-816-7584,E,,Public,24 hours daily,,,2,,,EV Connect,http://evconnect.com/,GPS,42.768177,-73.820620,01/14/2021,72918,2021-01-14 18:42:41,P,,,01/07/2021,J1772
ELEC,Adam Ramp,343 Washington St,,Buffalo,NY,14203,,716-849-5812  866-816-7584,E,,Public - Credit card at all times,24 hours daily; must use EVConnect app for payment,A D Debit M V,,6,,,EV Connect,http://evconnect.com/,GPS,42.883894,-78.873775,06/09/2020,104731,2020-06-09 16:47:26,LG,,,04/01/2018,J1772
ELEC,Pearl River Train Station,19 S Main St,,Pearl River,NY,10965,,866-816-7584,E,,Public,24 hours daily,,,4,,,EV Connect,http://evconnect.com/,200-9,41.057840,-74.022247,05/06/2020,155355,2020-05-06 17:56:57,LG,,,04/01/2020,J1772
ELEC,iPark NYC The Carnegie Garage - Tesla Destination,200 E 94th St,,New York,NY,10128,,855-472-7569  877-798-3752,E,,Public,24 hours daily; for customer use only; see valet for access,,,3,,,Tesla Destination,https://www.tesla.com/destination-charging,200-9,40.783355,-73.949998,11/03/2020,115043,2020-11-18 00:06:10,P,,,09/01/2016,J1772 TESLA
ELEC,Baron Nissan,235 Glen Cove Rd,,Greenvale,NY,11548,,516-621-2300,E,,Public - Call ahead,Dealership business hours,,,1,,,Non-Networked,,GPS,40.816267,-73.625869,06/09/2020,47721,2020-06-09 16:47:26,P,,,01/31/2012,J1772
ELEC,Lake Mohonk,1000 Mountain Rest Road,These charging stations are available to guests with additional property access. Please see Valet or Guest Services for more information at 845-245-1000.  Pricing is set through guest services.,New Paltz,NY,12561,,800-663-5633,E,,Public,MO: 12:00am-12:00am; TU: 12:00am-12:00am; WE: 12:00am-12:00am; TH: 12:00am-12:00am; FR: 12:00am-12:00am; SA: 12:00am-12:00am; SU: 12:00am-12:00am,,,4,,,SemaCharge Network,https://semaconnect.com/,GPS,41.768279,-74.156017,01/23/2021,148083,2021-01-23 00:11:44,,,,,J1772
ELEC,Amagansett Village Parking Lot,215 Main St,,Amagansett,NY,11954,,866-816-7584,E,,Public - Credit card at all times,24 hours daily,A D Debit M V,,4,,,EV Connect,http://evconnect.com/,GPS,40.975937,-72.142269,07/13/2020,163946,2020-07-13 20:30:49,P,,,06/26/2020,J1772
ELEC,SAVARINO COMPAN,"BRL Covered Lot, dual charger 1 South Street",BRL 2; -,Buffalo,NY,14204,,888-758-4389,E,,Public,24 hours daily,,,2,,,ChargePoint Network,http://www.chargepoint.com/,GPS,42.864180,-78.868160,01/23/2021,164504,2021-01-23 00:19:13,,,,,J1772
ELEC,NYSE Thruway - NYPA,Plattekill Travel Plaza,,Plattekill,NY,12568,,866-816-7584,E,,Public,24 hours daily,A D M V,,,2,,EV Connect,http://evconnect.com/,GPS,41.577842,-74.085424,11/09/2020,167631,2020-11-09 16:53:32,SG,,,06/23/2020,CHADEMO J1772COMBO
ELEC,Capital Region Welcome Center,"New Baltimore Service Area - Northbound, New",,Hannacroix,NY,12087,,855-900-7584,E,,Public,24 hours daily,,,,2,,Greenlots,http://greenlots.com/,GPS,42.427962,-73.805549,01/23/2021,170877,2021-01-23 01:21:30,,,,,CHADEMO J1772COMBO
ELEC,BMW CAR SHARING,20 River Terrace,THE SOLAIRE ST1,New York,NY,10282,,888-758-4389,E,,Public,24 hours daily,,,,1,,ChargePoint Network,http://www.chargepoint.com/,200-9,40.716305,-74.016194,01/23/2021,162413,2021-01-23 00:19:13,,,,,J1772COMBO
ELEC,5TH AVE,461 Broadway,5TH AVE GARAGE; Parking level 3 North Wall,Troy,NY,12180,,888-758-4389,E,,Public,24 hours daily,,,2,,,ChargePoint Network,http://www.chargepoint.com/,GPS,42.730713,-73.688080,01/23/2021,147339,2021-01-23 00:19:13,,,,,J1772
ELEC,DAVISANDKINGDDS,863 Route 146,STATION 1; Near the rear entrance,Clifton Park,NY,12065,,888-758-4389,E,,Public,24 hours daily,,,2,,,ChargePoint Network,http://www.chargepoint.com/,GPS,42.865273,-73.789560,01/23/2021,163548,2021-01-23 00:19:13,,,,,J1772
ELEC,MTP Parking 568 Union Ave - Tesla Destination,568 Union Ave,,Brooklyn,NY,11211,,718-218-6688  877-798-3752,E,,Public,24 hours daily; pay lot; see valet for access,,,4,,,Tesla Destination,https://www.tesla.com/destination-charging,200-9,40.717801,-73.951805,11/03/2020,122477,2020-11-18 00:06:10,P,,,03/01/2019,TESLA
ELEC,WOC411HEMP,502 Waverly Ave,502 WAVERLY; Inside Cielo Garage,Brooklyn,NY,11238,,888-758-4389,E,,Public,24 hours daily,,,2,,,ChargePoint Network,http://www.chargepoint.com/,GPS,40.682964,-73.965820,01/23/2021,147509,2021-01-23 00:19:13,,,,,J1772
ELEC,GGMC Parking MODA - Tesla Destination,89-14 Parsons Blvd,,Jamaica,NY,11432,,718-523-1475  877-798-3752,E,,Public,24 hours daily; pay lot; see valet for access,,,7,,,Tesla Destination,https://www.tesla.com/destination-charging,200-9,40.705192,-73.802230,11/03/2020,150686,2020-11-18 00:06:10,P,,,09/30/2019,J1772 TESLA
ELEC,Cloudsplitter Outfitters LLC,5302 Rt 28N,,Newcomb,NY,12852,,866-816-7584,E,,Public,24 hours daily; Also accepts Paypal,A D M V,,2,,,EV Connect,http://evconnect.com/,GPS,43.966471,-74.130182,04/08/2020,154919,2020-04-08 12:29:55,P,,,04/13/2019,J1772
ELEC,Stewartâ€™s Shop - Tesla Supercharger,2300 Salt Point Turnpike,,Clinton Corners,NY,12514,,877-798-3752,E,,Public,24 hours daily; for Tesla use only,,,,8,,Tesla,http://www.teslamotors.com/supercharger,200-9,41.825400,-73.770400,08/10/2020,102329,2020-08-27 20:39:12,P,,,07/23/2018,TESLA
ELEC,ERIE COUNTY,2220 Como Park Blvd,COMO PARK; -,Lancaster,NY,14086,,888-758-4389,E,,Public,24 hours daily,,,2,,,ChargePoint Network,http://www.chargepoint.com/,GPS,42.888170,-78.660489,01/23/2021,162153,2021-01-23 00:19:13,,,,,J1772
ELEC,"Walmart 2104 - Newburgh, NY",1201 Route 300,,Newburgh,NY,12550,,833-632-2778,E,,Public,24 hours daily,,,,4,,Electrify America,https://www.electrifyamerica.com/,GPS,41.497759,-74.073189,01/23/2021,168489,2021-01-23 01:23:19,,,,,CHADEMO J1772COMBO
ELEC,"HHPR, LLC",2-234 High Street Extension,240 HIGH STREET; -,Victor,NY,14564,,888-758-4389,E,,Public,24 hours daily,,,1,,,ChargePoint Network,http://www.chargepoint.com/,GPS,43.026756,-77.437792,01/23/2021,162524,2021-01-23 00:19:13,,,,,J1772
ELEC,Chappaqua Train Station,Allan Pl,,Chappaqua,NY,10514,,866-816-7584,E,,Public,24 hours daily,,,2,,,EV Connect,http://evconnect.com/,GPS,41.159024,-73.773454,04/08/2020,123143,2020-04-08 12:29:55,LG,,,04/01/2019,J1772
ELEC,Essex County - Public Safety Building,702 Stowersville Rd,,Lewis,NY,12950,,518-873-3900,E,,Public,24 hours Daily,,,2,,,ChargePoint Network,http://www.chargepoint.com/,200-9,44.281549,-73.536445,03/03/2020,142582,2020-03-03 21:13:47,LG,,,06/01/2019,J1772
ELEC,COLE GROUP,32 Columbia Gardens,COLUMBIA 1COLUMBIA 2,Cohoes,NY,12047,,888-758-4389,E,,Public,24 hours daily,,,4,,,ChargePoint Network,http://www.chargepoint.com/,200-8,42.770940,-73.716286,01/23/2021,154056,2021-01-23 00:19:13,,,,,J1772
ELEC,Heritage Park - Heritage Trust,633 Mount Sinai-Coram Rd,,Mt. Sinai,NY,11766,,866-816-7584,E,,Public,24 hours daily,,,4,,,EV Connect,http://evconnect.com/,GPS,40.935053,-73.011471,11/09/2020,123126,2020-11-12 18:53:31,P,,,04/01/2019,J1772
ELEC,Seneca Allegany Resort & Casino - Tesla Supercharger,777 Seneca Allegany Boulevard,,Salamanca,NY,14779,,877-798-3752,E,,Public,24 hours daily; for Tesla use only,A D Debit M V,,,8,,Tesla,http://www.teslamotors.com/supercharger,GPS,42.153300,-78.747900,08/10/2020,117729,2020-08-27 20:39:12,P,,,12/01/2018,TESLA
ELEC,THE FALLS,158 Union Turnpike,THE FALLS,Hudson,NY,12534,,888-758-4389,E,,Public,24 hours daily,,,2,,,ChargePoint Network,http://www.chargepoint.com/,GPS,42.251750,-73.763920,01/23/2021,149522,2021-01-23 00:19:13,,,,,J1772
ELEC,SUNY NEW PALTZ,33 Southside Ave,STATION 1,New Paltz,NY,12561,,888-758-4389,E,,Public,24 hours daily,,,2,,,ChargePoint Network,http://www.chargepoint.com/,GPS,41.741585,-74.088317,01/23/2021,122787,2021-01-23 00:19:13,,,,,J1772
ELEC,Salamanca City Hall,225 Wildwood Ave,,Salamanca,NY,14779,,716-945-4620,E,,Public,24 hours daily,,,1,,,Non-Networked,,GPS,42.157913,-78.708146,06/09/2020,157959,2020-06-09 16:47:26,P,,,05/15/2020,J1772
ELEC,ROCHESTER NY,10 Fitzhugh St N,SISTERS CITY 2; level 1 adjacent to the entrance,Rochester,NY,14614,,888-758-4389,E,,Public,24 hours daily,,,2,,,ChargePoint Network,http://www.chargepoint.com/,GPS,43.155933,-77.614075,01/23/2021,145539,2021-01-23 00:19:13,,,,,J1772
ELEC,Village of Montour Falls,300 W Main St,Behind Main Street Park,Montour Falls,NY,14865,,607-535-7367  866-816-7584,E,,Public,24 hours daily,,,2,,,EV Connect,http://evconnect.com/,GPS,42.346621,-76.848004,06/09/2020,121285,2020-06-09 16:47:26,LG,,,04/01/2018,J1772
ELEC,Amtrak - Niagara Falls,825 Depot Ave W,,Niagara Falls,NY,14305,,716-285-0242,E,,Public,24 hours daily,,,2,,,Non-Networked,,GPS,43.110202,-79.055430,06/09/2020,147094,2020-06-09 16:47:26,P,,,10/01/2019,J1772
ELEC,Strathmore,400 E 84th St,,New York,NY,10128,,888-998-2546,E,,Public,MON: 24 hours | TUE: 24 hours | WED: 24 hours | THU: 24 hours | FRI: 24 hours | SAT: 24 hours | SUN: 24 hours,,,2,,,Blink Network,http://www.blinkcharging.com/,GPS,40.775203,-73.950295,01/22/2021,124832,2021-01-22 22:55:21,,,,,J1772
ELEC,K&H STATION 1,66 Southern Blvd,KELLY & HAYES; Parking Lot Left Front of Building,Nesconset,NY,11767,,888-758-4389,E,,Public,24 hours daily,,,2,,,ChargePoint Network,http://www.chargepoint.com/,GPS,40.853892,-73.159923,01/23/2021,162292,2021-01-23 00:19:13,,,,,J1772
ELEC,EXECUTIVE PARK,2 Executive Blvd,EXECUTIVE #2EXECUTIVE #3EXECUTIVE #4EXECUTIVE LOT,Montebello,NY,10901,,888-758-4389,E,,Public,24 hours daily,,,8,,,ChargePoint Network,http://www.chargepoint.com/,200-9,41.119452,-74.115851,01/23/2021,158243,2021-01-23 00:19:13,,,,,J1772
ELEC,SHELTER ISLAND,2-6 E Thomas St,STATION 1; Shelter Island Police Department,Shelter Island,NY,11964,,888-758-4389,E,,Public,24 hours daily,,,2,,,ChargePoint Network,http://www.chargepoint.com/,GPS,41.069794,-72.338548,01/23/2021,162356,2021-01-23 00:19:13,,,,,J1772
ELEC,Village of Greenport,310 1st St,,Greenport,NY,11944,,866-816-7584,E,,Public,24 hours daily,,,,2,,EV Connect,http://evconnect.com/,GPS,41.102901,-72.360439,04/08/2020,154668,2020-04-08 12:29:55,P,,,03/13/2020,CHADEMO J1772COMBO
ELEC,Courtyard Marriott,631 Midland Ave,,Rye,NY,10580,,866-816-7584,E,,Public - Call ahead,24 hours daily; for hotel guest use only,,,2,,,EV Connect,http://evconnect.com/,200-9,40.989535,-73.672445,04/08/2020,94858,2020-04-08 12:29:55,P,,,03/01/2014,J1772
ELEC,Village of Sodus,14-16 Mill St,Enter municipal lot from Main or Gaylord Streets,Sodus,NY,14551,,315-483-9821,E,,Public,24 hours daily,,,2,,,Non-Networked,,200-9,43.235555,-77.061621,03/03/2020,92116,2020-03-03 21:13:47,LG,,,08/01/2017,J1772
ELEC,East West Tower Garage - Tesla Destination,142-38 37th Ave,,Flushing,NY,11354,,718-228-4324  877-798-3752,E,,Public,24 hours daily; pay lot; see valet for access,,,4,,,Tesla Destination,https://www.tesla.com/destination-charging,200-8,40.762536,-73.826279,11/03/2020,150531,2020-11-18 00:06:10,P,,,09/30/2019,TESLA
ELEC,New York City Transit Authority - Surface Transit Headquarters,25 Jamaica Ave,,Brooklyn,NY,11207,,866-816-7584,E,,Public,24 hours daily,,,1,,,EV Connect,http://evconnect.com/,GPS,40.678067,-73.899729,04/08/2020,123088,2020-04-08 12:29:55,LG,,,04/01/2019,J1772
ELEC,Sheraton Tarrytown Hotel - Tesla Supercharger,600 White Plains Road,,Tarrytown,NY,10591,,877-798-3752,E,,Public,24 hours daily; for Tesla use only,,,,12,,Tesla,http://www.teslamotors.com/supercharger,200-8,41.061500,-73.836500,08/10/2020,102346,2020-08-27 20:39:12,P,,,01/15/2017,TESLA
ELEC,SCHENECTADY,154 Erie Blvd,ERIE BLVD; Street parking on Erie Boulevard between State Street and I-890,Schenectady,NY,12305,,888-758-4389,E,,Public,24 hours daily,,,2,,,ChargePoint Network,http://www.chargepoint.com/,GPS,42.813077,-73.945836,01/23/2021,162344,2021-01-23 00:19:13,,,,,J1772
ELEC,JATC LU840,1401 NY-5,JATC LU840,Geneva,NY,14456,,888-758-4389,E,,Public,24 hours daily,,,2,,,ChargePoint Network,http://www.chargepoint.com/,GPS,42.860740,-77.049868,01/23/2021,162175,2021-01-23 00:19:13,,,,,J1772
ELEC,Outerbridge Commons - Tesla Supercharger,2925 Veterans Road West,,Staten Island,NY,10309,,877-798-3752,E,,Public,24 hours daily; for Tesla use only,,,,12,,Tesla,http://www.teslamotors.com/supercharger,GPS,40.527500,-74.231300,08/10/2020,152158,2020-08-27 20:39:12,P,,,01/20/2020,TESLA
ELEC,STONY BROOK UNV,Tabler Dr,TABLER; -,Stony Brook,NY,11790,,888-758-4389,E,,Public,24 hours daily,,,2,,,ChargePoint Network,http://www.chargepoint.com/,GPS,40.909578,-73.125004,01/23/2021,162458,2021-01-23 00:19:13,,,,,J1772
ELEC,VILLAGEHALL,55 E Market St,RHINEBECK 2RHINEBECK 3,Rhinebeck,NY,12572,,888-758-4389,E,,Public,24 hours daily,,,4,,,ChargePoint Network,http://www.chargepoint.com/,200-9,41.927408,-73.910758,01/23/2021,153652,2021-01-23 00:19:13,,,,,J1772
ELEC,GGMC Parking 350 W 43rd Street Garage - Tesla Destination,350 West 43rd St,,New York,NY,10036,,212-315-1646  877-798-3752,E,,Public,24 hours daily; see valet for access,,,3,,,Tesla Destination,https://www.tesla.com/destination-charging,200-9,40.758503,-73.991285,11/03/2020,115109,2020-11-18 00:06:10,P,,,01/01/2016,J1772 TESLA
ELEC,Albany International Airport,737 Albany Shaker Rd,Located in the long-term parking lot and the garage on level P2 near the pedestrian bridge,Albany,NY,12205,,518-242-2299  866-816-7584,E,,Public,24 hours daily; pay parking lot,,,6,,,EV Connect,http://evconnect.com/,200-8,42.739746,-73.808186,04/08/2020,64131,2020-04-08 12:29:55,P,,,06/10/2014,J1772
ELEC,SIBLEY SQUARE,83 Mortimer St,MORTIMER FL3 LS; 3rd Floor Near Elevator / StairsMORTIMER FL3CTR; 3rd Floor Near Elevator / StairsMORTIMER GW FL3; 3rd Floor Near Elevator / Stairs,Rochester,NY,14604,,888-758-4389,E,,Public,24 hours daily,,,6,,,ChargePoint Network,http://www.chargepoint.com/,200-9,43.157829,-77.607583,01/23/2021,162273,2021-01-23 00:19:13,,,,,J1772
ELEC,SAVARINO COMPAN,"BRL Covered Lot, single charger 1 South Street",BRL #1; -,Buffalo,NY,14204,,888-758-4389,E,,Public,24 hours daily,,,1,,,ChargePoint Network,http://www.chargepoint.com/,GPS,42.864134,-78.868096,01/23/2021,164159,2021-01-23 00:19:13,,,,,J1772
ELEC,SULLIVAN PARK,121 Center Way,CENTER WAY 1CENTER WAY 2,Corning,NY,14830,,888-758-4389,E,,Public,24 hours daily,,,4,,,ChargePoint Network,http://www.chargepoint.com/,200-9,42.152965,-77.054137,01/23/2021,122698,2021-01-23 00:19:13,,,,,J1772
ELEC,Rapidpark 254 W 79th Street - Tesla Destination,254 W 79th St,,New York,NY,10024,,212-580-1876  877-798-3752,E,,Public,24 hours daily; see valet for access,,,3,,,Tesla Destination,https://www.tesla.com/destination-charging,200-8,40.783860,-73.980521,11/03/2020,115072,2020-11-18 00:06:10,P,,,09/01/2017,J1772 TESLA
ELEC,WIDE WORLD BMW,114 NY-59,STATION 01,Spring Valley,NY,10977,,888-758-4389,E,,Public,24 hours daily,,,2,,,ChargePoint Network,http://www.chargepoint.com/,GPS,41.107050,-74.035853,01/23/2021,162447,2021-01-23 00:19:13,,,,,J1772
ELEC,Enterprise 309 Gold Street - Tesla Destination,309 Gold St,,Brooklyn,NY,11201,,212-564-3199  877-798-3752,E,,Public,24 hours daily; for customer use only; see valet for access,,,3,,,Tesla Destination,https://www.tesla.com/destination-charging,200-9,40.695013,-73.982843,11/03/2020,114897,2020-11-18 00:06:10,P,,,03/01/2017,J1772 TESLA
ELEC,CHATHAM EVC,51 Railroad Ave,CHATHAM; Near Chatham Brewery,Chatham,NY,12037,,888-758-4389,E,,Public,24 hours daily,,,2,,,ChargePoint Network,http://www.chargepoint.com/,GPS,42.363258,-73.594529,01/23/2021,162257,2021-01-23 00:19:13,,,,,J1772
ELEC,New York State Department of Transportation,367 NY-59,,Nanuet,NY,10954,,866-816-7584,E,,Public - Call ahead,24 hours daily; for hotel guest use only,,,2,,,EV Connect,http://evconnect.com/,200-9,41.102018,-74.028010,04/08/2020,94851,2020-06-10 15:37:23,P,,,12/06/2016,J1772
ELEC,Riverhead Auto Mall,1800 Old Country Rd,,Riverhead,NY,11901,,631-369-0600,E,,Public - Call ahead,Dealership business hours,,,2,2,,Non-Networked,,GPS,40.924758,-72.704752,12/03/2020,44186,2020-12-03 22:33:12,P,,,11/30/2011,CHADEMO J1772 J1772COMBO
ELEC,"Country Inn & Suites By Carlson, Cortland, NY - Tesla Destination",3707 State Rte 281,,Cortland,NY,13045,,607-753-8300  877-798-3752,E,,Public,24 hours daily; for customer use only; see front desk for access,,,3,,,Tesla Destination,https://www.tesla.com/destination-charging,GPS,42.586516,-76.211675,11/03/2020,114930,2020-11-18 00:06:10,P,,,11/01/2018,J1772 TESLA
ELEC,GGMC Parking 75 Smith St Garage - Tesla Destination,75 Smith St,,Brooklyn,NY,11201,,718-643-0593  877-798-3752,E,,Public,24 hours daily; see valet for access,,,3,,,Tesla Destination,https://www.tesla.com/destination-charging,200-9,40.688799,-73.988642,11/03/2020,114913,2020-11-18 00:06:10,P,,,01/01/2016,J1772 TESLA
ELEC,Home2 Suites by Hilton Oswego - Tesla Destination,252 NY-104,,Oswego,NY,13126,,315-343-2000  877-798-3752,E,,Public,24 hours daily; for customer use only,,,3,,,Tesla Destination,https://www.tesla.com/destination-charging,GPS,43.460055,-76.482728,11/03/2020,115206,2020-11-18 00:06:10,P,,,11/01/2018,J1772 TESLA
ELEC,iPark NYC Central Harlem Garage Corp. - Tesla Destination,49 W 116th St,,New York,NY,10026,,212-860-7691  877-798-3752,E,,Public,24 hours daily; see valet for access,,,3,,,Tesla Destination,https://www.tesla.com/destination-charging,200-8,40.801497,-73.947920,11/03/2020,115141,2020-11-18 00:06:10,P,,,08/15/2016,J1772 TESLA
ELEC,Hampton Inn East Aurora - Tesla Destination,49 Olean St,,East Aurora,NY,14052,,716-655-3300  877-798-3752,E,,Public,24 hours daily; for customer use only; see front desk for access,,,3,,,Tesla Destination,https://www.tesla.com/destination-charging,200-8,42.766365,-78.608141,11/03/2020,114936,2020-11-18 00:06:10,P,,,11/01/2018,J1772 TESLA
ELEC,Putnam Plaza Shopping Center,1872 Route 6,,Carmel,NY,10512,,877-455-3833,E,,Public - Card key at all times,24 hours daily,,,,1,,eVgo Network,https://www.evgo.com/,GPS,41.412844,-73.667098,01/23/2021,93701,2021-01-23 01:19:54,,,,,CHADEMO J1772COMBO
ELEC,SARATOGA HONDA,3402 U.S. 9,SHOP02,Saratoga Springs,NY,12866,,888-758-4389,E,,Public,24 hours daily,,,1,,,ChargePoint Network,http://www.chargepoint.com/,GPS,43.057407,-73.787004,01/23/2021,122210,2021-01-23 00:19:13,,,,,J1772
ELEC,COHEN BROTHERS,3 E 54th St,E 54TH ST 01; -,New York,NY,10022,,888-758-4389,E,,Public,24 hours daily,,,1,,,ChargePoint Network,http://www.chargepoint.com/,GPS,40.760960,-73.974649,01/23/2021,162395,2021-01-23 00:19:13,,,,,J1772
ELEC,NATIONAL GRID,1300 Elmwood Ave,BUFFALO STATE,Buffalo,NY,14222,,888-758-4389,E,,Public,24 hours daily,,,2,,,ChargePoint Network,http://www.chargepoint.com/,GPS,42.931359,-78.879109,01/23/2021,162136,2021-01-23 00:19:13,,,,,J1772
ELEC,Doubletree by Hilton Hotel Utica - Tesla Destination,102 Lafayette St,,Utica,NY,13502,,315-724-7829  877-798-3752,E,,Public,24 hours daily; for customer use only; see front desk for access,,,3,,,Tesla Destination,https://www.tesla.com/destination-charging,200-9,43.102844,-75.230952,11/03/2020,122497,2020-11-18 00:06:10,P,,,03/01/2019,J1772 TESLA
ELEC,Faust Motel - Tesla Destination,151 Main St,,Tupper Lake,NY,12986,,518-420-8461  877-798-3752,E,,Public,24 hours daily; for customer use only,,,3,,,Tesla Destination,https://www.tesla.com/destination-charging,200-9,44.243737,-74.487414,11/03/2020,115244,2020-11-18 00:06:10,P,,,11/01/2018,J1772 TESLA
ELEC,W DELAVAN,722 W Delavan Ave,DELAVAN (1),Buffalo,NY,14222,,888-758-4389,E,,Public,24 hours daily,,,2,,,ChargePoint Network,http://www.chargepoint.com/,GPS,42.922743,-78.873098,01/23/2021,154370,2021-01-23 00:19:13,,,,,J1772
ELEC,SUNY BUFFALO,50 Augspurger Rd,,Buffalo,NY,14228,,888-758-4389,E,,Public,24 hours daily,,,16,,,ChargePoint Network,http://www.chargepoint.com/,GPS,42.998860,-78.787320,01/23/2021,171344,2021-01-23 00:19:13,,,,,J1772
ELEC,CONVENIENT MED,319 Bay Rd,CONV. MED EV 1CONV. MED EV 2,Queensbury,NY,12804,,888-758-4389,E,,Public,24 hours daily,,,4,,,ChargePoint Network,http://www.chargepoint.com/,200-9,43.330839,-73.653033,01/23/2021,168351,2021-01-23 00:19:13,,,,,J1772
ELEC,BEDFORD_EV,2-42 Jay St Jay Street Lot,JAY ST LOT; Katonah Metro North Train Station - Jay St. Lot,Katonah,NY,10536,,888-758-4389,E,,Public,24 hours daily,,,2,,,ChargePoint Network,http://www.chargepoint.com/,GPS,41.259179,-73.682656,01/23/2021,162334,2021-01-23 00:19:13,,,,,J1772
ELEC,Maguire Nissan,504 S Meadow St,,Ithaca,NY,14850,,607-272-8000,E,,Public - Call ahead,Dealership business hours,,,1,,,Non-Networked,,200-9,42.435042,-76.508800,06/09/2020,44338,2020-06-09 16:47:26,P,,,11/30/2011,J1772
ELEC,OUTSIDE,175 Freemans Bridge Rd,SHOP01SHOP02,Schenectady,NY,12302,,888-758-4389,E,,Public,24 hours daily,,,2,,,ChargePoint Network,http://www.chargepoint.com/,200-9,42.846224,-73.943511,01/23/2021,162192,2021-01-23 00:19:13,,,,,J1772
ELEC,One Seneca Tower,1 HSBC Center,,Buffalo,NY,14202,,866-816-7584,E,,Public,24 hours daily,,,2,,,EV Connect,http://evconnect.com/,GPS,42.879939,-78.876219,04/08/2020,123259,2020-04-08 12:29:55,P,,,04/01/2019,J1772
ELEC,Home2 Suites by Hilton Middletown - Tesla Destination,600 Route 211 E,,Middletown,NY,10941,,845-703-8000  877-798-3752,E,,Public,24 hours daily,,,3,,,Tesla Destination,https://www.tesla.com/destination-charging,200-9,41.462968,-74.368183,11/03/2020,114976,2020-11-18 00:06:10,P,,,03/01/2017,J1772 TESLA
ELEC,"Trump Golf Links, Ferry Point - Tesla Destination",500 Hutchinson River Parkway,,Bronx,NY,10465,,877-798-3752  877-798-3752,E,,Public,24 hours daily; for customer use only; see front desk for access,,,8,,,Tesla Destination,https://www.tesla.com/destination-charging,200-8,40.811072,-73.835502,11/03/2020,169223,2020-11-18 00:06:10,P,,,11/03/2020,TESLA
ELEC,Rochester Institute of Technology - Lot M,1 Lomb Memorial Dr,,Rochester,NY,14623,,585-475-2074,E,,Public,24 hours daily; parking pass required,,,2,,,Non-Networked,,200-9,43.087790,-77.674413,03/03/2020,75944,2020-03-03 21:13:47,P,,,01/01/2016,J1772
ELEC,Queens Family Court Garage,150-07 Archer St,,Queens,NY,11433,,866-816-7584,E,,Public,24 hours daily,,,3,,,EV Connect,http://evconnect.com/,GPS,40.704480,-73.792724,04/08/2020,123069,2020-04-08 12:29:55,P,,,04/01/2019,J1772
ELEC,Icon Parking 279 East 65th Street - Tesla Destination,279 E 65th St,,New York,NY,10065,,212-644-7413  877-798-3752,E,,Public,24 hours daily; pay lot; see valet for access,,,3,,,Tesla Destination,https://www.tesla.com/destination-charging,200-8,40.764758,-73.962042,11/03/2020,115077,2020-11-18 00:06:10,P,,,11/01/2018,J1772 TESLA
ELEC,iPark NYC 88th Street Garage - Tesla Destination,101 W 88th St,,New York,NY,10024,,212-874-8442  877-798-3752,E,,Public,24 hours daily; for customer use only; see valet for access,,,3,,,Tesla Destination,https://www.tesla.com/destination-charging,200-8,40.787976,-73.971145,11/03/2020,114993,2020-11-18 00:06:10,P,,,05/01/2016,J1772 TESLA
ELEC,STATION TOR1,122 North Ridge St.,CRAWFORD SOUTH; In Crawford Park Mansion Community Center Parking Lot,Rye Brook,NY,10573,,888-758-4389,E,,Public,24 hours daily,,,2,,,ChargePoint Network,http://www.chargepoint.com/,GPS,41.015297,-73.685720,01/23/2021,146604,2021-01-23 00:19:13,,,,,J1772
ELEC,Long Island Welcome Center,I-495 E,Between exits 51 and 52,Dix Hills,NY,11746,,631-254-0414,E,,Public,24 hours daily,,,,2,,Non-Networked,,GPS,40.802658,-73.316725,03/03/2020,87914,2020-03-03 21:13:47,SG,,,10/01/2016,CHADEMO
ELEC,Cazenovia College,10 Seminary St,,Cazenovia,NY,13035,,866-816-7584,E,,Public - Credit card at all times,24 hours daily; Also accepts Paypal,A D M V,,2,,,EV Connect,http://evconnect.com/,200-9,42.930786,-75.853945,10/09/2020,166323,2020-10-09 12:41:43,P,,,03/31/2020,J1772
ELEC,ROC,Airport Rd,SMART PHONE LOT; Located in Smart Phone Lot,Rochester,NY,14624,,888-758-4389,E,,Public,24 hours daily,,,2,,,ChargePoint Network,http://www.chargepoint.com/,GPS,43.129664,-77.669158,01/23/2021,162378,2021-01-23 00:19:13,,,,,J1772
ELEC,Augspurger Ramp,362 Pearl St,,Buffalo,NY,14202,,716-849-5812  866-816-7584,E,,Public - Credit card at all times,24 hours daily; must use EVConnect app for payment,A D Debit M V,,6,,,EV Connect,http://evconnect.com/,200-8,42.889784,-78.874463,04/08/2020,104726,2020-04-08 12:29:55,LG,,,04/01/2018,J1772
ELEC,ULSTER COUNTY,50 Center St,"TRUDY RESNICK; Ulster County's fee for public charging is $0.50 per hour, effective 1-1-2020.",Ellenville,NY,12428,,888-758-4389,E,,Public,24 hours daily,,,2,,,ChargePoint Network,http://www.chargepoint.com/,GPS,41.717754,-74.396401,01/23/2021,162130,2021-01-23 00:19:13,,,,,J1772
ELEC,Country Club Imports,55 Oneida St,,Oneonta,NY,13820,,607-432-2800,E,,Public - Call ahead,Dealership business hours; see service desk for access,,,2,2,,Non-Networked,,GPS,42.451285,-75.100333,06/09/2020,44176,2020-06-09 16:47:26,P,,,11/30/2011,CHADEMO J1772 J1772COMBO
ELEC,Nap York - Tesla Destination,480 7th Avenue,,New York,NY,10018,,877-798-3752  877-798-3752,E,,Public,24 hours daily; for customer use only; see front desk for access,,,1,,,Tesla Destination,https://www.tesla.com/destination-charging,200-9,40.752301,-73.990000,11/03/2020,168977,2020-11-18 00:06:10,P,,,11/03/2020,TESLA
ELEC,ABM Parking 866 UN Plaza - Tesla Destination,430 E 49th St,,New York,NY,10017,,877-727-5452  877-798-3752,E,,Public,24 hours daily; for customer use only; see valet for access,,,3,,,Tesla Destination,https://www.tesla.com/destination-charging,200-8,40.752516,-73.965347,11/03/2020,115136,2020-11-18 00:06:10,P,,,11/01/2018,J1772 TESLA
ELEC,BROADSTCW,203 Broad St,ADK CAR WASH 1,Glens Falls,NY,12801,,888-758-4389,E,,Public,24 hours daily,,,2,,,ChargePoint Network,http://www.chargepoint.com/,GPS,43.303116,-73.662150,01/23/2021,170005,2021-01-23 00:19:13,,,,,J1772
ELEC,Bread Alone Bakery,3962 Route 28,,Boiceville,NY,12412,,866-816-7584,E,,Public,24 hours daily,,,2,,,EV Connect,http://evconnect.com/,GPS,41.997247,-74.263752,04/08/2020,123108,2020-04-08 12:29:55,P,,,04/01/2019,J1772
ELEC,New Lab,19 Morris Ave,,Brooklyn,NY,11205,,866-816-7584,E,,Public,24 hours daily,,,2,,,EV Connect,http://evconnect.com/,GPS,40.699530,-73.974315,04/08/2020,123075,2020-04-08 12:29:55,P,,,04/01/2019,J1772
ELEC,BCC,528 Valley Rd,BROOKTONDALE; Park and Ride lot,Brooktondale,NY,14817,,888-758-4389,E,,Public,24 hours daily,,,2,,,ChargePoint Network,http://www.chargepoint.com/,GPS,42.380747,-76.393341,01/23/2021,162329,2021-01-23 00:19:13,,,,,J1772
ELEC,Hampton Inn Garden City - Tesla Destination,1 North Ave,,Garden City,NY,11530,,516-227-2720  877-798-3752,E,,Public,24 hours daily; for customer use only; see front desk for access,,,3,,,Tesla Destination,https://www.tesla.com/destination-charging,200-9,40.741668,-73.609459,11/03/2020,114943,2020-11-18 00:06:10,P,,,08/15/2016,J1772 TESLA
ELEC,Nissan - Huntington,850 E Jericho Turnpike,,Huntington Station,NY,11746,,,E,,Public - Call ahead,Dealership business hours; contact 631-439-7000 for more information,,,1,1,,Non-Networked,,GPS,40.834455,-73.379693,06/09/2020,44350,2020-06-09 16:47:26,P,,,11/30/2011,CHADEMO J1772
ELEC,Town of Veteran,4049 Watkins Rd,Located in the back on white outbuilding; near the parking spaces reserved for electric vehicles,Millport,NY,14864,,607-739-1476,E,,Public,24 hours daily,,,2,,,Non-Networked,,200-9,42.250834,-76.838332,03/03/2020,99950,2020-03-03 21:13:47,LG,,,07/01/2018,J1772
ELEC,Fairport Junction,9 Liftbridge Ln E,Rear of Public Parking Lot,Fairport,NY,14452,,585-223-9500,E,,Public,24 hours daily,,,6,,,EV Connect,http://evconnect.com/,GPS,43.102618,-77.441143,06/09/2020,152215,2020-06-09 16:47:26,LG,,,12/27/2019,J1772
ELEC,STATION 4TH FL,688 Main St,MOTORGATE #1; Motorgate Garage -Fourth Level,New York,NY,10044,,888-758-4389,E,,Public,24 hours daily,,,2,,,ChargePoint Network,http://www.chargepoint.com/,GPS,40.764430,-73.946793,01/23/2021,169880,2021-01-23 00:19:13,,,,,J1772
ELEC,Lakeville United Church of Christ,5687 Big Tree Rd,,Lakeville,NY,14480,,866-816-7584,E,,Public - Credit card at all times,24 hours daily; Also accepts PayPal and Apple Pay,A D M V,,4,,,EV Connect,http://evconnect.com/,GPS,42.836545,-77.710443,12/03/2020,168419,2020-12-03 22:33:12,P,,,08/01/2020,J1772
ELEC,MONTEBELLO,1 Montebello Rd,VILLAGE HALL 1,Suffern,NY,10901,,888-758-4389,E,,Public,24 hours daily,,,2,,,ChargePoint Network,http://www.chargepoint.com/,GPS,41.119250,-74.110230,01/23/2021,155122,2021-01-23 00:19:13,,,,,J1772
ELEC,MTP 625 W 57th Street - Tesla Destination,625  W 57th St,,New York,NY,10019,,212-247-0700  877-798-3752,E,,Public,24 hours daily; see valet for access,,,3,,,Tesla Destination,https://www.tesla.com/destination-charging,200-9,40.771431,-73.992964,11/03/2020,115176,2020-11-18 00:06:10,P,,,09/01/2017,TESLA
ELEC,ULSTER COUNTY,124 Marys Ave,"SUNY EXTENSION; Station is located in student lot at rear of building. Ulster County's fee for public charging is $0.50 per hour, effective 1-1-2020.",Kingston,NY,12401,,888-758-4389,E,,Public,24 hours daily,,,2,,,ChargePoint Network,http://www.chargepoint.com/,GPS,41.923610,-73.998496,01/23/2021,162470,2021-01-23 00:19:13,,,,,J1772
ELEC,NORTH WOOD,700 Warren Rd,STATION 1; -,Ithaca,NY,14850,,888-758-4389,E,,Public,24 hours daily,,,2,,,ChargePoint Network,http://www.chargepoint.com/,GPS,42.486806,-76.470601,01/23/2021,162227,2021-01-23 00:19:13,,,,,J1772
ELEC,ADAMS STATION,101 Baxter Ct,101 BAXTER CT; Bldg 100-106,Delmar,NY,12054,,888-758-4389,E,,Public,24 hours daily,,,2,,,ChargePoint Network,http://www.chargepoint.com/,GPS,42.608080,-73.848670,01/23/2021,165398,2021-01-23 00:19:13,,,,,J1772
ELEC,Champion Parking 230 W 55th Street - Tesla Destination,230 W 55th St,,New York,NY,10019,,646-402-6984  877-798-3752,E,,Public,24 hours daily; see valet for access,,,3,,,Tesla Destination,https://www.tesla.com/destination-charging,200-9,40.764693,-73.982708,11/03/2020,115061,2020-11-18 00:06:10,P,,,01/01/2016,J1772 TESLA
ELEC,RIVERHEAD,1947 Old Country Road,RIVER 1 #1; The station is located in the parking area near the Tanger Mall entranceRIVER 1 #2; Tanger 1 - Suite 200.  Three dual level chargers located in the parking lot across from Shopper Services.  RIVER 1 #3; Tanger 1 - Suite 200.  Three dual level chargers located in the parking lot across from Shopper Services.RIVER 2 #1; Tanger 2 - Suite 906. Three duel level chargers located in the parking lot between Cole Haan and Nike.RIVER 2 #2; The station is located in the parking area near the Tanger Mall entranceRIVER 2 #3; Tanger 2 - Suite 906.  Three duel level chargers located in the parking lot between Cole Haan and Nike.,Riverhead,NY,11901,,888-758-4389,E,,Public,24 hours daily,,,12,,,ChargePoint Network,http://www.chargepoint.com/,200-8,40.922813,-72.711690,01/23/2021,162400,2021-01-23 00:19:13,,,,,J1772
ELEC,Glenwood Belmont Parking - Tesla Destination,320 E 46th St,,New York,NY,10021,,212-599-9495  877-798-3752,E,,Public,24 hours daily; see valet for access,,,2,,,Tesla Destination,https://www.tesla.com/destination-charging,200-8,40.751784,-73.969463,11/03/2020,115094,2020-11-18 00:06:10,P,,,11/01/2018,J1772 TESLA
ELEC,Residence Inn New York Manhattan - Tesla Destination,1717 Broadway,,New York,NY,10019,,212-324-3774  877-798-3752,E,,Public,24 hours daily; for customer use only; see valet for access,,,2,,,Tesla Destination,https://www.tesla.com/destination-charging,200-9,40.764369,-73.982707,11/03/2020,115031,2020-11-18 00:06:10,P,,,01/01/2016,J1772 TESLA
ELEC,Courtyard Marriott - Rye,631 Midland Ave,,Rye,NY,10580,,877-455-3833,E,,Public - Card key at all times,24 hours daily,,,,4,,eVgo Network,https://www.evgo.com/,GPS,40.989586,-73.671855,01/23/2021,122804,2021-01-23 01:19:54,,,,,CHADEMO J1772COMBO
ELEC,Quad Graphics,56 Duplainville Rd,,Saratoga Springs,NY,12866,,866-816-7584,E,,Public,24 hours daily,,,2,,,EV Connect,http://evconnect.com/,GPS,43.061533,-73.829697,04/08/2020,123120,2020-04-08 12:29:55,P,,,04/01/2019,J1772
ELEC,19-80 Steinway - Tesla Destination,1980 Steinway St,,Astoria,NY,11105,,347-697-6733  877-798-3752,E,,Public,24 hours daily; pay lot; see valet for access,,,4,,,Tesla Destination,https://www.tesla.com/destination-charging,200-8,40.776944,-73.901382,11/03/2020,150649,2020-11-18 00:06:10,P,,,09/30/2019,TESLA
ELEC,Little Man Parking (Queens West) - Tesla Destination,4-76  47th Ave,,Long Island City,NY,11109,,718-606-1760  877-798-3752,E,,Public,24 hours daily; see valet for access,,,3,,,Tesla Destination,https://www.tesla.com/destination-charging,200-8,40.745810,-73.955812,11/03/2020,114970,2020-11-18 00:06:10,P,,,03/01/2017,J1772 TESLA
ELEC,B & C Auto Service,725 Route 6,,Mahopac,NY,10541,,866-816-7584,E,,Public - Credit card at all times,24 hours daily; Also accepts Paypal,A D M V,,2,,,EV Connect,http://evconnect.com/,200-9,41.375328,-73.726893,10/09/2020,166305,2020-10-09 12:41:43,P,,,06/23/2020,J1772
ELEC,Central Parking - 222 E 65th St,222 East 65th Street,,New York,NY,10065,,888-998-2546,E,,Public,MON: 24 hours | TUE: 24 hours | WED: 24 hours | THU: 24 hours | FRI: 24 hours | SAT: 24 hours | SUN: 24 hours,,,2,,,Blink Network,http://www.blinkcharging.com/,GPS,40.764616,-73.962228,01/22/2021,164753,2021-01-22 22:55:21,,,,,J1772
ELEC,Quik Park 1133 Garage LLC - Tesla Destination,1133 6th Ave,,New York,NY,10036,,212-398-0464  877-798-3752,E,,Public,24 hours daily; see valet for access,,,3,,,Tesla Destination,https://www.tesla.com/destination-charging,200-9,40.756071,-73.983920,11/03/2020,115002,2020-11-18 00:06:10,P,,,04/01/2015,J1772 TESLA
ELEC,FAIRFIELD VERON,5280 Willow Pl,FAIRFIELD 1.1FAIRFIELD 1.2FAIRFIELD 1.3,Verona,NY,13478,,888-758-4389,E,,Public,24 hours daily,,,6,,,ChargePoint Network,http://www.chargepoint.com/,200-9,43.117657,-75.595981,01/23/2021,153308,2021-01-23 00:19:13,,,,,J1772
ELEC,BMW WESTCHER,525 Tarrytown Rd,STATION 01,White Plains,NY,10607,,888-758-4389,E,,Public,24 hours daily,,,2,,,ChargePoint Network,http://www.chargepoint.com/,GPS,41.043314,-73.802255,01/23/2021,162436,2021-01-23 00:19:13,,,,,J1772
ELEC,Mall at Bay Plaza - Tesla Supercharger,260 Baychester Avenue,,Bronx,NY,10475,,877-798-3752,E,,Public,24 hours daily; for Tesla use only,,,,12,,Tesla,http://www.teslamotors.com/supercharger,200-9,40.863200,-73.828800,08/10/2020,149299,2020-08-27 20:39:12,P,,,09/30/2019,TESLA
ELEC,EPLLC,318 Continuum Dr,LOCKHEED 5,Liverpool,NY,13088,,888-758-4389,E,,Public,24 hours daily,,,2,,,ChargePoint Network,http://www.chargepoint.com/,GPS,43.107190,-76.189545,01/23/2021,145762,2021-01-23 00:19:13,,,,,J1772
ELEC,Rapidpark 920 Park Avenue - Tesla Destination,920 Park Ave,,New York,NY,10025,,212-794-7245  877-798-3752,E,,Public - Call ahead,24 hours daily,,,3,,,Tesla Destination,https://www.tesla.com/destination-charging,200-9,40.776673,-73.960253,11/03/2020,115195,2020-11-18 00:06:10,P,,,09/01/2017,J1772 TESLA
ELEC,PEPSICO INC,50 E Stevens Ave,STATION 1; -,Valhalla,NY,10595,,888-758-4389,E,,Public,24 hours daily,,,2,,,ChargePoint Network,http://www.chargepoint.com/,GPS,41.096363,-73.775380,01/23/2021,152440,2021-01-23 00:19:13,,,,,J1772
ELEC,Railroad Museum of Long Island - Tesla Destination,416 Griffing Ave,,Riverhead,NY,11901,,631-727-7920  877-798-3752,E,,Public - Call ahead,24 hours daily,,,2,,,Tesla Destination,https://www.tesla.com/destination-charging,200-9,40.920448,-72.666154,11/03/2020,150537,2020-11-18 00:06:10,P,,,09/30/2019,TESLA
ELEC,Seeley Office Supply,95 Broad St,,Glen Falls,NY,12801,,866-816-7584,E,,Public,24 hours daily; Also accepts Paypal,A D M V,,2,,,EV Connect,http://evconnect.com/,GPS,43.306490,-73.653828,04/08/2020,155028,2020-04-08 12:29:55,P,,,04/13/2019,J1772
ELEC,TUCKAHOE#1,44 Crescent Pl,STATION#1; In the Fisher Avenue Municipal Parking Lot,Tuckahoe,NY,10707,,888-758-4389,E,,Public,24 hours daily,,,2,,,ChargePoint Network,http://www.chargepoint.com/,GPS,40.958404,-73.819575,01/23/2021,162411,2021-01-23 00:19:13,,,,,J1772
ELEC,LOCKS PLAZA,1 Locks Plaza,LOCK PLAZA; In front of Lockport Municipal Building,Lockport,NY,14094,,888-758-4389,E,,Public,24 hours daily,,,2,,,ChargePoint Network,http://www.chargepoint.com/,GPS,43.169320,-78.695433,01/23/2021,162160,2021-01-23 00:19:13,,,,,J1772
ELEC,The Precipart Group,100 Finn Ct,,Farmingdale,NY,11735,,866-816-7584,E,,Public,24 hours daily; Also accepts Paypal,A D M V,,2,,,EV Connect,http://evconnect.com/,GPS,40.759225,-73.403379,04/08/2020,155098,2020-04-08 12:29:55,P,,,04/07/2019,J1772
ELEC,"Country Inn & Suites by Radisson, Rochester Airport - Tesla Destination",797 E Henrietta Rd,,Rochester,NY,14623,,585-427-0131  877-798-3752,E,,Public,24 hours daily; for customer use only; see front desk for access,,,3,,,Tesla Destination,https://www.tesla.com/destination-charging,200-9,43.104420,-77.616685,11/03/2020,115225,2020-11-18 00:06:10,P,,,11/01/2018,J1772 TESLA
ELEC,Best Western Adirondack Inn - Tesla Destination,2625 Main St,,Lake Placid,NY,12946,,518-523-2424  877-798-3752,E,,Public,24 hours daily; for customer use only; see front desk for access,,,3,,,Tesla Destination,https://www.tesla.com/destination-charging,200-9,44.284065,-73.983532,11/03/2020,114965,2020-11-18 00:06:10,P,,,01/01/2016,J1772 TESLA
ELEC,ADAMS STATION,1 Juniper Dr,CLUBHOUSE; -,Delmar,NY,12054,,888-758-4389,E,,Public,24 hours daily,,,2,,,ChargePoint Network,http://www.chargepoint.com/,GPS,42.607350,-73.847720,01/23/2021,164115,2021-01-23 00:19:13,,,,,J1772
ELEC,Atlantic Golf Club - Tesla Destination,1040 Scuttle Hole Rd,,Bridgehampton,NY,11976,,877-798-3752  877-798-3752,E,,Public,24 hours daily; for customer use only; see front desk for access,,,2,,,Tesla Destination,https://www.tesla.com/destination-charging,200-8,40.945293,-72.331267,11/03/2020,168591,2020-11-18 00:06:10,P,,,11/03/2020,TESLA
ELEC,Vassar College,124 Raymond Ave,,Poughkeepsie,NY,12604,,866-816-7584,E,,Public,24 hours daily,,,2,,,EV Connect,http://evconnect.com/,GPS,41.690219,-73.898165,10/09/2020,123064,2020-10-09 12:41:43,P,,,04/01/2019,J1772
ELEC,Brookfield,250 Vesey St,,New York,NY,10281,,855-900-7584,E,,Public,24 hours daily,,,2,,,Greenlots,http://greenlots.com/,200-9,40.714193,-74.015130,01/23/2021,99159,2021-01-23 01:21:30,,,,,J1772
ELEC,24 STATE STREET,14 State St,PITTSFORD; Off State behind library.,Pittsford,NY,14534,,888-758-4389,E,,Public,24 hours daily,,,2,,,ChargePoint Network,http://www.chargepoint.com/,GPS,43.091210,-77.514398,01/23/2021,162347,2021-01-23 00:19:13,,,,,J1772
ELEC,TOM,740 W Boston Post Rd,TOWN CENTER; Near Town Offices Entrance,Mamaroneck,NY,10543,,888-758-4389,E,,Public,24 hours daily,,,2,,,ChargePoint Network,http://www.chargepoint.com/,GPS,40.943074,-73.741147,01/23/2021,143287,2021-01-23 00:19:13,,,,,J1772
ELEC,TOM,4 Baldwin Ave,MEMORIAL PARK,Larchmont,NY,10538,,888-758-4389,E,,Public,24 hours daily,,,2,,,ChargePoint Network,http://www.chargepoint.com/,GPS,40.935344,-73.760352,01/23/2021,145333,2021-01-23 00:19:13,,,,,J1772
ELEC,The Lovett Group,109-15 14th Ave,,College Point,NY,11356,,866-816-7584,E,,Public,Office business hours; for employee and guest use only,,,8,,,EV Connect,http://evconnect.com/,200-8,40.785772,-73.857401,04/08/2020,94836,2020-04-08 12:29:55,P,,,06/22/2016,J1772
ELEC,Vision Nissan,2409 Rochester Rd,,Canandaigua,NY,14424,,585-393-0042,E,,Public,Dealership business hours,,,1,,,Non-Networked,,200-9,42.916433,-77.300722,06/09/2020,74632,2020-06-09 16:47:26,P,,,03/01/2016,J1772
ELEC,518 EYES LLC,9 Gleason Rd,STATION 1,Schenectady,NY,12302,,888-758-4389,E,,Public,24 hours daily,,,2,,,ChargePoint Network,http://www.chargepoint.com/,GPS,42.890347,-73.923935,01/23/2021,149926,2021-01-23 00:19:13,,,,,J1772
ELEC,ULSTER COUNTY,239 Golden Hill Dr,"HEALTH DEPT 1; Ulster County's fee for public charging is $0.50 per hour, effective 1-1-2020.HEALTH DEPT 2; Ulster County's fee for public charging is $0.50 per hour, effective 1-1-2020.HEALTH DEPT 3; Ulster County's fee for public charging is $0.50 per hour, effective 1-1-2020.",Kingston,NY,12401,,888-758-4389,E,,Public,24 hours daily,,,6,,,ChargePoint Network,http://www.chargepoint.com/,200-9,41.916073,-74.018603,01/23/2021,162170,2021-01-23 00:19:13,,,,,J1772
ELEC,Locey Lane,1 Locey Ln,,Central Valley,NY,10917,,866-816-7584,E,,Public,24 hours daily,,,2,,,EV Connect,http://evconnect.com/,200-8,41.315289,-74.135275,07/13/2020,158614,2020-07-13 20:30:49,P,,,02/20/2020,J1772
ELEC,Village of Churchville,23 E Buffalo St,,Churchville,NY,14428,,585-293-3720,E,,Public,24 hours daily,,,2,,,Non-Networked,,GPS,43.104011,-77.883046,06/09/2020,157966,2020-06-09 16:47:26,P,,,05/15/2020,J1772
ELEC,The Spur - Tesla Destination,280 Elm Street,,Southampton,NY,11968,,877-798-3752  877-798-3752,E,,Public,24 hours daily; for customer use only; see front desk for access,,,4,,,Tesla Destination,https://www.tesla.com/destination-charging,200-9,40.895390,-72.388254,11/03/2020,169200,2020-11-18 00:06:10,P,,,11/03/2020,J1772 TESLA
ELEC,iPark NYC E 77th Street - Tesla Destination,165 E 77th St,,New York,NY,10014,,855-472-7569  877-798-3752,E,,Public,24 hours daily; for customer use only; see valet for access,,,3,,,Tesla Destination,https://www.tesla.com/destination-charging,200-8,40.773640,-73.959302,11/03/2020,115028,2020-11-18 00:06:10,P,,,03/01/2016,J1772 TESLA
ELEC,WYOMING COUNTY,23 W Buffalo St,STATION 1; West side of rt. 20A,Warsaw,NY,14569,,888-758-4389,E,,Public,24 hours daily,,,2,,,ChargePoint Network,http://www.chargepoint.com/,GPS,42.740624,-78.133705,01/23/2021,162368,2021-01-23 00:19:13,,,,,J1772
ELEC,Village of Bergen - Municipal Parking,18 Buffalo St,Located in the Village of Bergen Municipal Parking Lot between 16 & 18 Buffalo Street,Bergen,NY,14416,,585-494-1513,E,,Public,24 hours daily,,,2,,,Non-Networked,,GPS,43.085186,-77.943321,06/09/2020,116923,2020-06-09 16:47:26,LG,,,11/19/2018,J1772
ELEC,Parkit 310 E 11th Street - Tesla Destination,310  E 11th St,,New York,NY,10003,,212-475-5262  877-798-3752,E,,Public,24 hours daily; see valet for access,,,3,,,Tesla Destination,https://www.tesla.com/destination-charging,200-9,40.729871,-73.985680,11/03/2020,115089,2020-11-18 00:06:10,P,,,03/01/2017,J1772 TESLA
ELEC,La Belle Vie Bed & Breakfast - Tesla Destination,208 Main St,,Penn Yan,NY,14527,,315-694-7273  877-798-3752,E,,Public,24 hours daily; see front desk for access,,,2,,,Tesla Destination,https://www.tesla.com/destination-charging,200-9,42.663782,-77.056454,11/03/2020,115210,2020-11-18 00:06:10,P,,,01/01/2016,TESLA
ELEC,Nissan of Bay Shore,1521 Sunrise Hwy,,Bay Shore,NY,11706,,631-230-5860,E,,Public - Call ahead,Dealership business hours,,,1,,,Non-Networked,,GPS,40.735644,-73.250949,06/09/2020,149478,2020-06-09 16:47:26,P,,,05/01/2019,J1772
ELEC,RTS,225 W Academy St,RTS ORLEANS; By front entrance of RTS Orleans building,Albion,NY,14411,,888-758-4389,E,,Public,24 hours daily,,,2,,,ChargePoint Network,http://www.chargepoint.com/,GPS,43.239445,-78.198180,01/23/2021,154334,2021-01-23 00:19:13,,,,,J1772
ELEC,ITHACA VISITORS,Conservatory Dr,ITHACA COLLEGE; Visitors Lot,Ithaca,NY,14850,,888-758-4389,E,,Public,24 hours daily,,,2,,,ChargePoint Network,http://www.chargepoint.com/,GPS,42.420935,-76.500084,01/23/2021,162315,2021-01-23 00:19:13,,,,,J1772
ELEC,MOTM,150 Crossways Park Dr. West,WOODBURY; -,Woodbury,NY,11797,,888-758-4389,E,,Public,24 hours daily,,,2,,,ChargePoint Network,http://www.chargepoint.com/,GPS,40.807074,-73.488735,01/23/2021,170244,2021-01-23 00:19:13,,,,,J1772
ELEC,Jerome-Gun Hill Road - Municipal Parking Garage,3510 Jerome Ave,,New York,NY,10467,,866-816-7584,E,,Public,24 hours daily,,,5,,,EV Connect,http://evconnect.com/,GPS,40.882958,-73.880725,04/08/2020,123102,2020-04-08 12:29:55,P,,,04/01/2019,J1772
ELEC,IMPark 302 2nd St - Tesla Destination,302  2nd St,,Brooklyn,NY,11215,,718-499-1235  877-798-3752,E,,Public,24 hours daily; pay lot; see valet for access,,,4,,,Tesla Destination,https://www.tesla.com/destination-charging,200-9,40.674253,-73.985057,11/03/2020,150581,2020-11-18 00:06:10,P,,,09/30/2019,TESLA
ELEC,BEVERWYCK,3 Autumn Dr,STATION 1STATION 2,Slingerlands,NY,12159,,888-758-4389,E,,Public,24 hours daily,,,4,,,ChargePoint Network,http://www.chargepoint.com/,200-8,42.658693,-73.838737,01/23/2021,164420,2021-01-23 00:19:13,,,,,J1772
ELEC,Ultralife Corp,2000 Technology Pkwy,,Newark,NY,14513,,866-816-7584,E,,Public,24 hours daily; Also accepts Paypal,A D M V,,2,,,EV Connect,http://evconnect.com/,GPS,43.026445,-77.091189,04/08/2020,154908,2020-04-08 12:29:55,P,,,04/23/2019,J1772
ELEC,Staten Island Mall - Richmond Ave Entrance,2655 Richmond Ave,,Staten Island,NY,10314,,888-264-2208,E,,Public,6am-12am daily,,,2,,,Volta,https://voltacharging.com/,GPS,40.581751,-74.168466,10/09/2020,166729,2020-10-09 12:41:43,P,,,08/31/2020,J1772
ELEC,Icon Parking - Patriot Parking,376 Greenwich Street,,New York,NY,10013,,888-998-2546,E,,Public,MON: 24 hours | TUE: 24 hours | WED: 24 hours | THU: 24 hours | FRI: 24 hours | SAT: 24 hours | SUN: 24 hours,,,1,,,Blink Network,http://www.blinkcharging.com/,GPS,40.719772,-74.010475,01/22/2021,164680,2021-01-22 22:55:21,,,,,J1772
ELEC,VIC AND CAMPUS,7787 NY-30,LOT 13 1.1; In student parking of lot 13LOT 13 1.2; Student parking of lot 13,Paul Smiths,NY,12970,,888-758-4389,E,,Public,24 hours daily,,,4,,,ChargePoint Network,http://www.chargepoint.com/,200-8,44.435781,-74.246071,01/23/2021,154725,2021-01-23 00:19:13,,,,,J1772
ELEC,NYSE Thruway - Exit 18 - New Paltz,NY State Thruway,,New Paltz,NY,12561,,866-816-7584,E,,Public,24 hours daily,,,2,,,EV Connect,http://evconnect.com/,GPS,41.740228,-74.062190,10/09/2020,167127,2020-10-09 12:41:43,P,,,09/21/2020,J1772
ELEC,Castle Village Parking Garage,200 Cabrini Boulevard,Garage entrance is from Cabrini Blvd. Unit is on the Main Floor. Pull down the drive way and make your first left.,New York,NY,10033,,888-998-2546,E,,Public,MON: 24 hours | TUE: 24 hours | WED: 24 hours | THU: 24 hours | FRI: 24 hours | SAT: 24 hours | SUN: 24 hours,,,1,,,Blink Network,http://www.blinkcharging.com/,GPS,40.854693,-73.939432,01/22/2021,95779,2021-01-22 22:55:21,,,,,J1772
ELEC,iPark Eleventh Avenue Garage Corp. - Tesla Destination,552 W 30th St,,New York,NY,10001,,212-967-7872  877-798-3752,E,,Public,24 hours daily; see valet for access,,,3,,,Tesla Destination,https://www.tesla.com/destination-charging,200-8,40.752693,-74.002954,11/03/2020,115161,2020-11-18 00:06:10,P,,,09/01/2017,J1772 TESLA
ELEC,Central Parking - 58 West 58th St,58 West 58th Street,,New York,NY,10019,,888-998-2546,E,,Public,MON: 24 hours | TUE: 24 hours | WED: 24 hours | THU: 24 hours | FRI: 24 hours | SAT: 24 hours | SUN: 24 hours,,,2,,,Blink Network,http://www.blinkcharging.com/,GPS,40.764655,-73.976100,01/22/2021,124146,2021-01-22 22:55:21,,,,,J1772
ELEC,CITY OF ITHACA,202 NY-79,SENECA STREET; 3rd floor,Ithaca,NY,14850,,888-758-4389,E,,Public,24 hours daily,,,2,,,ChargePoint Network,http://www.chargepoint.com/,GPS,42.440667,-76.496214,01/23/2021,162307,2021-01-23 00:19:13,,,,,J1772
ELEC,CONVENTUS,1001 Main Street,CONVENTUS; level P1 of the parking garage,Buffalo,NY,14203,,888-758-4389,E,,Public,24 hours daily,,,2,,,ChargePoint Network,http://www.chargepoint.com/,GPS,42.900489,-78.868369,01/23/2021,165111,2021-01-23 00:19:13,,,,,J1772
ELEC,RRH,1415 Portland Ave,"CARTER 1 FL GW1; -CARTER 1 FL NGW; -CARTER 2 FL NG3; 2nd Floor, East Side, Near ElevatorCARTER 2FL NGW2; 2nd Floor East Side near ElevatorCARTER 2FLGW1; 2nd Floor, East Side, Near Elevator",Rochester,NY,14621,,888-758-4389,E,,Public,24 hours daily,,,10,,,ChargePoint Network,http://www.chargepoint.com/,200-9,43.191611,-77.588011,01/23/2021,145395,2021-01-23 00:19:13,,,,,J1772
ELEC,ICON-1 PENN PLA,One Penn Plaza,Entrance on 33rd St or 34th St between 7th Ave & 8th Ave.,New York,NY,10001,,888-998-2546,E,,Public,MON: 24 hours | TUE: 24 hours | WED: 24 hours | THU: 24 hours | FRI: 24 hours | SAT: 24 hours | SUN: 24 hours,,,1,,,Blink Network,http://www.blinkcharging.com/,GPS,40.751129,-73.992471,01/22/2021,169894,2021-01-22 22:55:21,,,,,J1772
ELEC,ROCKLAND LANDNG,1200 Rt 9w,ROCKLAND; Rockland Comfort station,South Nyack,NY,10960,,888-758-4389,E,,Public,24 hours daily,,,2,,,ChargePoint Network,http://www.chargepoint.com/,GPS,41.081534,-73.922049,01/23/2021,165270,2021-01-23 00:19:13,,,,,J1772
ELEC,Rapidpark 411 W 55th Street - Tesla Destination,411 W 55th St,,New York,NY,10019,,212-265-7854  877-798-3752,E,,Public,24 hours daily; for customer use only; see valet for access,,,3,,,Tesla Destination,https://www.tesla.com/destination-charging,200-9,40.767111,-73.987232,11/03/2020,115126,2020-11-18 00:06:10,P,,,09/01/2017,J1772 TESLA
ELEC,MARKET 32 EV,1 S Barney Rd,"BARNEY RD EV2; To the left of building, poolsideBARNEY RD EV4; To the left of building, poolside",Clifton Park,NY,12065,,888-758-4389,E,,Public,24 hours daily,,,4,,,ChargePoint Network,http://www.chargepoint.com/,200-9,42.840517,-73.806182,01/23/2021,156641,2021-01-23 00:19:13,,,,,J1772
ELEC,TPS AMC,22 Holland Ave,DOWNTOWN,Albany,NY,12209,,888-758-4389,E,,Public,24 hours daily,,,2,,,ChargePoint Network,http://www.chargepoint.com/,GPS,42.646230,-73.772930,01/23/2021,162141,2021-01-23 00:19:13,,,,,J1772
ELEC,Icon Parking 245 E 19th St. - Tesla Destination,245  E 19th St,,New York,NY,10010,,212-228-7973  877-798-3752,E,,Public,24 hours daily; see valet for access,,,3,,,Tesla Destination,https://www.tesla.com/destination-charging,200-8,40.735910,-73.983331,11/03/2020,150520,2020-11-18 00:06:10,P,,,09/30/2019,J1772 TESLA
ELEC,CEB Bldg,1 ResearchCircle,None,Niskayuna,NY,12309,,800-663-5633,E,,Public,MO: Not Specified; TU: Not Specified; WE: Not Specified; TH: Not Specified; FR: Not Specified; SA: Not Specified; SU: Not Specified,,,10,,,SemaCharge Network,https://semaconnect.com/,GPS,42.828910,-73.874200,01/23/2021,148043,2021-01-23 00:11:44,,,,,J1772
ELEC,WARRENCOUNTY,1376 U.S. 9,DPW 4,Lake George,NY,12845,,888-758-4389,E,,Public,24 hours daily,,,2,,,ChargePoint Network,http://www.chargepoint.com/,GPS,43.359200,-73.701305,01/23/2021,150256,2021-01-23 00:19:13,,,,,J1772
ELEC,MOHAWK HARBOR01,200 Harborside Dr,STATION #1; Parking deckSTATION #4; Parking deck,Schenectady,NY,12305,,888-758-4389,E,,Public,24 hours daily,,,4,,,ChargePoint Network,http://www.chargepoint.com/,200-9,42.824533,-73.932236,01/23/2021,170028,2021-01-23 00:19:13,,,,,J1772
ELEC,Angelina's Ristorante - Tesla Destination,399 Ellis St,,Staten Island,NY,10307,,718-227-2900  877-798-3752,E,,Public,24 hours daily; see front desk for access,,,3,,,Tesla Destination,https://www.tesla.com/destination-charging,200-9,40.513370,-74.251370,11/03/2020,115240,2020-11-18 00:06:10,P,,,11/01/2018,TESLA
ELEC,VOEASTROCHESTER,120 W Commercial St,EAST ROCH GW1; Behind village office next to police parking.,East Rochester,NY,14445,,888-758-4389,E,,Public,24 hours daily,,,2,,,ChargePoint Network,http://www.chargepoint.com/,GPS,43.112972,-77.485756,01/23/2021,143377,2021-01-23 00:19:13,,,,,J1772
ELEC,City Parking Linc Garage - Tesla Destination,62 Northside Piers,,Brooklyn,NY,11249,,718-963-7048  877-798-3752,E,,Public,24 hours daily; see valet for access,,,3,,,Tesla Destination,https://www.tesla.com/destination-charging,200-8,40.719550,-73.964130,11/03/2020,114909,2020-11-18 00:06:10,P,,,09/01/2017,J1772 TESLA
ELEC,NORTHLAND,683 Northland Ave,12,Buffalo,NY,14211,,888-758-4389,E,,Public,24 hours daily,,,4,,,ChargePoint Network,http://www.chargepoint.com/,200-9,42.918127,-78.835197,01/23/2021,162269,2021-01-23 00:19:13,,,,,J1772
ELEC,NATIONAL GRID,8 Clarkson Ave,CLARKSON U,Potsdam,NY,13676,,888-758-4389,E,,Public,24 hours daily,,,2,,,ChargePoint Network,http://www.chargepoint.com/,GPS,44.662770,-74.998241,01/23/2021,162363,2021-01-23 00:19:13,,,,,J1772
ELEC,NATIONAL GRID,Collins Circle,U OF ALBANY; Visitor Parking 1 @ SUNY Albany,Albany,NY,12206,,888-758-4389,E,,Public,24 hours daily,,,2,,,ChargePoint Network,http://www.chargepoint.com/,GPS,42.688932,-73.823026,01/23/2021,162194,2021-01-23 00:19:13,,,,,J1772
ELEC,HARMONY MILLS 1,100 N Mohawk St,FALLSVIEW 1.4FALLSVIEW 1.5WEST 1 1.3WEST 1 1.4WEST 1 1.5WEST 2 2.1WEST 2 2.2WEST 2 2.3,Cohoes,NY,12047,,888-758-4389,E,,Public,24 hours daily,,,16,,,ChargePoint Network,http://www.chargepoint.com/,200-9,42.780881,-73.705676,01/23/2021,149625,2021-01-23 00:19:13,,,,,J1772
ELEC,SCCC,701 County Rd 106,GRANT CAMPUS 1GRANT CAMPUS 2,Brentwood,NY,11717,,888-758-4389,E,,Public,24 hours daily,,,4,,,ChargePoint Network,http://www.chargepoint.com/,200-9,40.796440,-73.272793,01/23/2021,67158,2021-01-23 00:19:13,,,,,J1772
ELEC,BMW OYSTER BAY,143-145 NY-106,STATION 01,Oyster Bay,NY,11771,,888-758-4389,E,,Public,24 hours daily,,,2,,,ChargePoint Network,http://www.chargepoint.com/,GPS,40.857858,-73.534565,01/23/2021,162454,2021-01-23 00:19:13,,,,,J1772
ELEC,TOWN OF AURORA,113 King St,AURORA; Side parking lot,East Aurora,NY,14052,,888-758-4389,E,,Public,24 hours daily,,,2,,,ChargePoint Network,http://www.chargepoint.com/,GPS,42.764935,-78.613315,01/23/2021,162314,2021-01-23 00:19:13,,,,,J1772
ELEC,HUDSON PRESERVE,1002 Beryl Way,BLDG 12 #10,Watervliet,NY,12189,,888-758-4389,E,,Public,24 hours daily,,,2,,,ChargePoint Network,http://www.chargepoint.com/,GPS,42.731360,-73.725970,01/23/2021,144375,2021-01-23 00:19:13,,,,,J1772
ELEC,iPark 22/34 N 6th Garage Corp - Tesla Destination,22 N 5th St,,Brooklyn,NY,11211,,718-218-7570  877-798-3752,E,,Public,24 hours daily; see valet for access,,,4,,,Tesla Destination,https://www.tesla.com/destination-charging,200-8,40.718794,-73.962594,11/03/2020,114893,2020-11-18 00:06:10,P,,,03/01/2017,J1772 TESLA
ELEC,HAMPTON INN,1120 South Ave,STATION 1; Side of Hampton Inn &amp; SuitesSTATION 2; Side of Hampton Inn &amp; SuitesSTATION 3; Side of Hampton Inn &amp; SuitesSTATION 4; Side of Hampton Inn &amp; SuitesSTATION 5; Side of Hampton Inn &amp; Suites,Staten Island,NY,10314,,888-758-4389,E,,Public,24 hours daily,,,10,,,ChargePoint Network,http://www.chargepoint.com/,200-8,40.612767,-74.175538,01/23/2021,168146,2021-01-23 00:19:13,,,,,J1772
ELEC,Enterprise Parking 147 Flatbush Avenue Extension - Tesla Destination,147 Flatbush Ave Ext,,Brooklyn,NY,11201,,718-855-7050  877-798-3752,E,,Public,24 hours daily; pay lot; see valet for access,,,4,,,Tesla Destination,https://www.tesla.com/destination-charging,200-9,40.695040,-73.983940,11/03/2020,150576,2020-11-18 00:06:10,P,,,09/30/2019,TESLA
ELEC,EVPASS,150 East Locust St,R FF-1; 1 unit at lot near corner of N James St,Rome,NY,13440,,888-758-4389,E,,Public,24 hours daily,,,1,,,ChargePoint Network,http://www.chargepoint.com/,GPS,43.223629,-75.446960,01/23/2021,162515,2021-01-23 00:19:13,,,,,J1772
ELEC,Tarrytown Metro - North Train Station,4173 Green St,East side of the tracks near Marina. Parking spaces are against the fence by the tracks,Tarrytown,NY,10591,,914-631-7873  866-816-7584,E,,Public,24 hours daily; pay lot,,,3,,,EV Connect,http://evconnect.com/,GPS,41.076261,-73.865686,04/08/2020,65271,2020-04-08 12:29:55,SG,,,11/01/2014,J1772
ELEC,Rapidpark 340 94th Street - Tesla Destination,340 E 94th St,,New York,NY,10128,,212-369-8681  877-798-3752,E,,Public - Call ahead,24 hours daily,,,3,,,Tesla Destination,https://www.tesla.com/destination-charging,200-8,40.781961,-73.946209,11/03/2020,115104,2020-11-18 00:06:10,P,,,01/01/2016,J1772 TESLA
ELEC,Town of Pine Plains,2971 Church St,,Pine Plains,NY,12567,,866-816-7584,E,,Public,24 hours daily,,,1,,,EV Connect,http://evconnect.com/,GPS,41.979823,-73.656058,04/08/2020,123096,2020-04-08 12:29:55,P,,,04/01/2019,J1772
ELEC,Icon Liberty View Parking - Tesla Destination,400 Murray St,,New York,NY,10016,,212-842-2305  877-798-3752,E,,Public,24 hours daily; see valet for access,,,3,,,Tesla Destination,https://www.tesla.com/destination-charging,GPS,40.716079,-74.015929,11/03/2020,115121,2020-11-18 00:06:10,P,,,09/01/2017,J1772 TESLA
ELEC,COMMON-ROOTS,58 Saratoga Road,COMMON ROOTS; On the side parking lot of common roots brewery,South Glens Falls,NY,12803,,888-758-4389,E,,Public,24 hours daily,,,2,,,ChargePoint Network,http://www.chargepoint.com/,GPS,43.295242,-73.636850,01/23/2021,164333,2021-01-23 00:19:13,,,,,J1772
ELEC,BURNS MGT,21 Carr Rd,CARRIAGE 1; -,Saratoga Springs,NY,12866,,888-758-4389,E,,Public,24 hours daily,,,2,,,ChargePoint Network,http://www.chargepoint.com/,GPS,43.131242,-73.752015,01/23/2021,121487,2021-01-23 00:19:13,,,,,J1772
ELEC,Fairfield Inn by Marriott Corning Riverside - Tesla Destination,3 S Buffalo St,,Corning,NY,14830,,607-937-9600  877-798-3752,E,,Public,24 hours daily; for customer use only; see front desk for access,,,3,,,Tesla Destination,https://www.tesla.com/destination-charging,200-9,42.153255,-77.080389,11/03/2020,114926,2020-11-18 00:06:10,P,,,11/01/2018,J1772 TESLA
ELEC,The American Hotel-Sag Harbor - Tesla Destination,45 Main St,,Sag Harbor,NY,11963,,631-725-3535  877-798-3752,E,,Public,24 hours daily; see front desk for access,,,3,,,Tesla Destination,https://www.tesla.com/destination-charging,200-9,41.001268,-72.295030,11/03/2020,150489,2020-11-18 00:06:10,P,,,09/30/2019,TESLA
ELEC,Rapidpark 124 W 20th Street - Tesla Destination,124  W 20th St,,New York,NY,10011,,212-627-7739  877-798-3752,E,,Public,24 hours daily; see valet for access,,,3,,,Tesla Destination,https://www.tesla.com/destination-charging,200-9,40.741371,-73.995533,11/03/2020,115008,2020-11-18 00:06:10,P,,,09/01/2017,J1772 TESLA
ELEC,HYATT POUGHKEPS,2165 South Rd,HYATT POUGHKEPS,Poughkeepsie,NY,12601,,888-758-4389,E,,Public,24 hours daily,,,2,,,ChargePoint Network,http://www.chargepoint.com/,GPS,41.636660,-73.919620,01/23/2021,143493,2021-01-23 00:19:13,,,,,J1772
ELEC,Bread Alone Bakery,2121 Ulster Ave,,Lake Katrine,NY,12449,,866-816-7584,E,,Public,24 hours daily,,,2,,,EV Connect,http://evconnect.com/,GPS,41.994860,-73.986487,04/08/2020,123081,2020-04-08 12:29:55,P,,,04/01/2019,J1772
ELEC,MASPETH FEDERAL,56-18 69th St,MASPETH 1; -,Maspeth,NY,11378,,888-758-4389,E,,Public,24 hours daily,,,2,,,ChargePoint Network,http://www.chargepoint.com/,GPS,40.726232,-73.895705,01/23/2021,162165,2021-01-23 00:19:13,,,,,J1772
ELEC,Town of Penfield - Library,1985 Baird Rd,,Penfield,NY,14526,,585-340-8720,E,,Public,6am-9pm daily,,,1,,,Non-Networked,,200-9,43.137476,-77.465214,03/03/2020,49941,2020-03-03 21:13:47,LG,,,04/01/2012,J1772
ELEC,Nissan of Staten Island,1976 Hylan Blvd,,Staten Island,NY,10306,,718-447-3800,E,,Public,Dealership business hours,,,1,,,Non-Networked,,200-9,40.581432,-74.097694,06/09/2020,99500,2020-06-09 16:47:26,P,,,06/28/2018,J1772
ELEC,SCHENECTADY,PTL Arthur Chaires Ln,CENTRAL PARK; In front of the tennis court,Schenectady,NY,12309,,888-758-4389,E,,Public,24 hours daily,,,2,,,ChargePoint Network,http://www.chargepoint.com/,GPS,42.799875,-73.908554,01/23/2021,162341,2021-01-23 00:19:13,,,,,J1772
ELEC,Montauk Yacht Club Resort & Marina - Tesla Destination,32 Star Island Rd,,Montauk,NY,11954,,631-668-3100  877-798-3752,E,,Public,24 hours daily; for customer use only; see front desk for access,,,2,,,Tesla Destination,https://www.tesla.com/destination-charging,200-9,41.069404,-71.932673,11/03/2020,114980,2020-11-18 00:06:10,P,,,04/01/2015,TESLA
ELEC,Town of Ashford,9377 Route 240,,West Valley,NY,14171,,716-942-6016,E,,Public,24 hours daily,,2,,,,Non-Networked,,200-9,42.406807,-78.612777,03/03/2020,92004,2020-03-03 21:13:47,LG,,,02/01/2018,NEMA520
ELEC,ITHACA VISITORS,College Cir,COLLEGE CIRCLE; -,Ithaca,NY,14850,,888-758-4389,E,,Public,24 hours daily,,,2,,,ChargePoint Network,http://www.chargepoint.com/,GPS,42.411718,-76.500837,01/23/2021,162263,2021-01-23 00:19:13,,,,,J1772
ELEC,ULSTER COUNTY,380 Boulevard,"UCLEC; Station is located o the North East side of building. Ulster County's fee for public charging is $0.50 per hour, effective 1-1-2020.",Kingston,NY,12401,,888-758-4389,E,,Public,24 hours daily,,,4,,,ChargePoint Network,http://www.chargepoint.com/,200-8,41.912973,-74.018094,01/23/2021,162466,2021-01-23 00:19:13,,,,,J1772
ELEC,The Wild Center,451 Museum Dr,,Tupper Lake,NY,12986,,866-816-7584,E,,Public,24 hours daily,,,1,,,EV Connect,http://evconnect.com/,GPS,44.220318,-74.439916,04/08/2020,123114,2020-04-08 12:29:55,P,,,04/01/2019,J1772
ELEC,MARKET 32 EV,1 Barney Rd,"BARNEY RD EV1; To the left of building, poolsideBARNEY RD EV3; To the left of building, poolsideBARNEY RD EV5; To the left of building, poolside",Clifton Park,NY,12065,,888-758-4389,E,,Public,24 hours daily,,,6,,,ChargePoint Network,http://www.chargepoint.com/,200-9,42.845426,-73.808152,01/23/2021,156642,2021-01-23 00:19:13,,,,,J1772
ELEC,2702 Queens Plaza South - Tesla Destination,2702 Queens Plaza S,,Long Island City,NY,11101,,718-864-2992  877-798-3752,E,,Public,24 hours daily; pay lot; see valet for access,,,6,,,Tesla Destination,https://www.tesla.com/destination-charging,200-9,40.749893,-73.939758,11/03/2020,150653,2020-11-18 00:06:10,P,,,09/30/2019,TESLA
ELEC,EPLLC,143 Ocean Channel Way,LOCKHEED 3LOCKHEED 4,Liverpool,NY,13088,,888-758-4389,E,,Public,24 hours daily,,,4,,,ChargePoint Network,http://www.chargepoint.com/,200-8,43.109913,-76.186817,01/23/2021,145763,2021-01-23 00:19:13,,,,,J1772
ELEC,South Meadow Marketplace - Tesla Supercharger,740 South Meadow Street,,Ithaca,NY,14850,,877-798-3752,E,,Public,24 hours daily; for Tesla use only,,,,8,,Tesla,http://www.teslamotors.com/supercharger,200-9,42.428600,-76.509100,08/10/2020,149318,2020-08-27 20:39:12,P,,,09/30/2019,TESLA
ELEC,iPark 107 West 13th Street - Tesla Destination,107 W 13th St,,New York,NY,10011,,646-870-9022  877-798-3752,E,,Public,24 hours daily; pay lot; see valet for access,,,3,,,Tesla Destination,https://www.tesla.com/destination-charging,200-9,40.737094,-73.997754,11/03/2020,114997,2020-11-18 00:06:10,P,,,11/01/2018,J1772 TESLA
ELEC,BURNS MGT,6211 Johnston Rd,OXFORD 1; Located in front of the Leasing Office.,Albany,NY,12203,,888-758-4389,E,,Public,24 hours daily,,,2,,,ChargePoint Network,http://www.chargepoint.com/,GPS,42.684760,-73.868250,01/23/2021,162126,2021-01-23 00:19:13,,,,,J1772
ELEC,Simon-Simth Haven Mall,313 SMITH HAVEN MALL,,Lake Grove,NY,11755,,833-632-2778,E,,Public,24 hours daily,,,1,3,,Electrify America,https://www.electrifyamerica.com/,GPS,40.862452,-73.128752,01/23/2021,169949,2021-01-23 01:23:19,,,,,CHADEMO J1772 J1772COMBO
ELEC,Icon Parking - Claridge 87 Parking,200-206 E 88th Street,Entrance on 205 E 87th St or 206 E 88th St between 2nd & 3rd Ave,New York,NY,10128,,888-998-2546,E,,Public,MON: 24 hours | TUE: 24 hours | WED: 24 hours | THU: 24 hours | FRI: 24 hours | SAT: 24 hours | SUN: 24 hours,,,1,,,Blink Network,http://www.blinkcharging.com/,GPS,40.779687,-73.952595,01/22/2021,169359,2021-01-22 22:55:21,,,,,J1772
ELEC,BURDICK BMW,5947 E Circle Dr,STATION 01,Cicero,NY,13039,,888-758-4389,E,,Public,24 hours daily,,,1,,,ChargePoint Network,http://www.chargepoint.com/,GPS,43.152611,-76.113010,01/23/2021,162439,2021-01-23 00:19:13,,,,,J1772
ELEC,Mott Street Parking - Tesla Supercharger,106 Mott Street,,New York,NY,10013,,877-798-3752,E,,Public,24 hours daily; for Tesla use only,,,,2,,Tesla,http://www.teslamotors.com/supercharger,200-9,40.717500,-73.997300,08/10/2020,102334,2020-08-27 20:39:12,P,,,07/23/2018,TESLA
ELEC,Central Valley Park and Ride Lot,100 Maher Ln,,Harriman,NY,10926,,866-816-7584,E,,Public,24 hours daily; Also accepts Paypal,A D M V,,4,,,EV Connect,http://evconnect.com/,GPS,41.312636,-74.140421,04/08/2020,155099,2020-04-08 12:29:55,SG,,,08/26/2019,J1772
ELEC,LPCL,30 Lake Placid Club Way,STATION 2; Behind Registration BuildingSTATION1; Behind Registration Building,Lake Placid,NY,12946,,888-758-4389,E,,Public,24 hours daily,,,4,,,ChargePoint Network,http://www.chargepoint.com/,200-9,44.282826,-73.979303,01/23/2021,123468,2021-01-23 00:19:13,,,,,J1772
ELEC,Poughkeepsie Nissan,1445 Route 9,,Wappingers Falls,NY,12590,,845-297-4314,E,,Public - Call ahead,Dealership business hours,,,1,,,Non-Networked,,200-9,41.587383,-73.908392,06/09/2020,44206,2020-06-09 16:47:26,P,,,11/30/2011,J1772
ELEC,iPark 245 East 63rd Street - Tesla Destination,245 East 63rd St,,New York,NY,10025,,212-752-0485  877-798-3752,E,,Public,24 hours daily; see valet for access,,,3,,,Tesla Destination,https://www.tesla.com/destination-charging,200-8,40.763562,-73.963079,11/03/2020,115065,2020-11-18 00:06:10,P,,,11/01/2018,J1772 TESLA
ELEC,GMC - BEEKMAN 2,420 E 51st St,Located between 1st Ave & FDR. - Attendant will assist in charging vehicle.  Parking rates apply. Inquire within,New York,NY,10022,,888-998-2546,E,,Public,MON: 24 hours | TUE: 24 hours | WED: 24 hours | THU: 24 hours | FRI: 24 hours | SAT: 24 hours | SUN: 24 hours,,,1,,,Blink Network,http://www.blinkcharging.com/,GPS,40.754022,-73.965166,01/22/2021,118347,2021-01-22 22:55:21,,,,,J1772
ELEC,PATCHVILLAGE,14 Baker St,PATCHOGUE; -,Patchogue,NY,11772,,888-758-4389,E,,Public,24 hours daily,,,2,,,ChargePoint Network,http://www.chargepoint.com/,GPS,40.761692,-73.012230,01/23/2021,152239,2021-01-23 00:19:13,,,,,J1772
ELEC,ERIE COUNTY,800 Niagara St,ISLEVIEW,Tonawanda,NY,14150,,888-758-4389,E,,Public,24 hours daily,,,2,,,ChargePoint Network,http://www.chargepoint.com/,GPS,43.010323,-78.907524,01/23/2021,164077,2021-01-23 00:19:13,,,,,J1772
ELEC,NATIONAL GRID,22050 US-11,"TOPS WATERTOWN; Side of Tops supermarket, spots marked in green",Watertown,NY,13601,,888-758-4389,E,,Public,24 hours daily,,,2,,,ChargePoint Network,http://www.chargepoint.com/,GPS,43.994810,-75.901730,01/23/2021,162231,2021-01-23 00:19:13,,,,,J1772
ELEC,Icon Parking 203 E 61 Street - Tesla Destination,203 E 61 St,,New York,NY,10021,,212-308-9248  877-798-3752,E,,Public,24 hours daily; see valet for access,,,3,,,Tesla Destination,https://www.tesla.com/destination-charging,200-8,40.762948,-73.965513,11/03/2020,115046,2020-11-18 00:06:10,P,,,05/01/2016,J1772 TESLA
ELEC,Rapidpark 70 Riverside Dr - Tesla Destination,70 Riverside Dr,,New York,NY,10024,,212-873-1277  877-798-3752,E,,Public,24 hours daily; see valet for access,,,2,,,Tesla Destination,https://www.tesla.com/destination-charging,200-9,40.785014,-73.982037,11/03/2020,115180,2020-11-18 00:06:10,P,,,11/01/2016,TESLA
ELEC,Queens Borough Hall - Municipal Parking Lot,80-25 126th St,,Queens,NY,11415,,866-816-7584,E,,Public,24 hours daily,,,4,,,EV Connect,http://evconnect.com/,GPS,40.714376,-73.826095,04/08/2020,123134,2020-04-08 12:29:55,P,,,04/01/2019,J1772
ELEC,Red Coach Inn - Tesla Destination,2 Buffalo Ave,,Niagara Falls,NY,14303,,716-282-1459  877-798-3752,E,,Public,24 hours daily; for customer use only; see front desk for access,,,2,,,Tesla Destination,https://www.tesla.com/destination-charging,200-8,43.084562,-79.063781,11/03/2020,115199,2020-11-18 00:06:10,P,,,12/15/2016,TESLA
ELEC,Brighton Memorial Library,2300 Elmwood Ave,,Rochester,NY,14618,,585-784-5300,E,,Public,24 hours daily,,,1,,,Non-Networked,,200-9,43.127059,-77.575573,09/03/2020,149107,2020-09-03 19:35:48,LG,,,09/26/2016,J1772
ELEC,Icon Parking 1056 5th Avenue - Tesla Destination,10 E 87th St,,New York,NY,10028,,212-534-9437  877-798-3752,E,,Public,24 hours daily; see valet for access,,,3,,,Tesla Destination,https://www.tesla.com/destination-charging,GPS,40.782031,-73.959484,11/03/2020,114985,2020-11-18 00:06:10,P,,,09/01/2017,J1772 TESLA
ELEC,AUSTERLITZ EVSE,812 NY-203,AUSTERLITZ EVSE; Austerlitz Town Hall and Court Parking Lot,Spencertown,NY,12165,,888-758-4389,E,,Public,24 hours daily,,,2,,,ChargePoint Network,http://www.chargepoint.com/,GPS,42.323037,-73.545487,01/23/2021,162193,2021-01-23 00:19:13,,,,,J1772
ELEC,Icon Parking E 88th Street - Tesla Destination,536 E 88th St,,New York,NY,10128,,877-727-5464  877-798-3752,E,,Public,24 hours daily; see valet for access,,,3,,,Tesla Destination,https://www.tesla.com/destination-charging,200-8,40.776302,-73.944521,11/03/2020,115153,2020-11-18 00:06:10,P,,,01/01/2016,J1772 TESLA
ELEC,JATC LU 363,67 Commerce Dr S,LU 363 1; Second Left After You Enter The Parking Lot,Harriman,NY,10926,,888-758-4389,E,,Public,24 hours daily,,,2,,,ChargePoint Network,http://www.chargepoint.com/,GPS,41.309697,-74.133096,01/23/2021,162182,2021-01-23 00:19:13,,,,,J1772
ELEC,Icon Parking 240 East Broadway - Tesla Destination,188 Clinton St,,New York,NY,10002,,212-253-0240  877-798-3752,E,,Public,24 hours daily; see valet for access,,,3,,,Tesla Destination,https://www.tesla.com/destination-charging,200-8,40.715074,-73.986927,11/03/2020,115035,2020-11-18 00:06:10,P,,,11/01/2018,J1772 TESLA
ELEC,Jamestown Board of Public Utilities,2870 N Main St Extension,,Jamestown,NY,14701,,866-816-7584,E,,Public - Credit card at all times,24 hours daily; Also accepts Paypalv,A D M V,,2,,,EV Connect,http://evconnect.com/,200-9,42.122304,-79.240492,10/09/2020,166352,2020-10-09 12:41:43,P,,,05/21/2019,J1772
ELEC,Icon Parking E 72nd Street - Tesla Destination,515 E 72nd St,,New York,NY,10021,,212-249-8196  877-798-3752,E,,Public,24 hours daily; see valet for access,,,5,,,Tesla Destination,https://www.tesla.com/destination-charging,200-9,40.766857,-73.952647,11/03/2020,115148,2020-11-18 00:06:10,P,,,05/01/2016,J1772 TESLA
ELEC,EVCS1,105 S Main St,CANANDAIGUA; Municipal parking lot.,Canandaigua,NY,14424,,888-758-4389,E,,Public,24 hours daily,,,2,,,ChargePoint Network,http://www.chargepoint.com/,GPS,42.886636,-77.279258,01/23/2021,162360,2021-01-23 00:19:13,,,,,J1772
ELEC,MONTEFIOREMOSES,111 E 210th St,"MOSES; Located in the Montefiori Moses Center parking garage, Rochambeau entrance",New York,NY,10467,,888-758-4389,E,,Public,24 hours daily,,,2,,,ChargePoint Network,http://www.chargepoint.com/,GPS,40.879718,-73.880394,01/23/2021,162486,2021-01-23 00:19:13,,,,,J1772
ELEC,Icon Parking 11 5th Ave - Tesla Destination,11 5th Ave,,New York,NY,10003,,212-475-9562  877-798-3752,E,,Public,24 hours daily; see valet for access,,,3,,,Tesla Destination,https://www.tesla.com/destination-charging,200-8,40.732257,-73.996080,11/03/2020,114998,2020-11-18 00:06:10,P,,,01/01/2016,J1772 TESLA
ELEC,"The Standard, East Village - Tesla Destination",25 Cooper Street,,New York,NY,10034,,877-798-3752  877-798-3752,E,,Public,24 hours daily; for customer use only; see front desk for access,,,3,,,Tesla Destination,https://www.tesla.com/destination-charging,200-9,40.867375,-73.924227,11/03/2020,169201,2020-11-18 00:06:10,P,,,11/03/2020,J1772 TESLA
ELEC,NYPA - Hawkins Point Visitors Center,21 Hawkins Point Rd,,Massena,NY,13662,,315-764-0226,E,,Public,24 hours daily,,,6,,,Non-Networked,,GPS,44.999505,-74.797209,09/03/2020,165351,2020-09-03 19:35:48,P,,,08/10/2020,J1772
ELEC,SANTOSHI CORP,412 Cornelia St,STATION 1.1; Back corner of hotel parking lot.,Plattsburgh,NY,12901,,888-758-4389,E,,Public,24 hours daily,,,2,,,ChargePoint Network,http://www.chargepoint.com/,GPS,44.698734,-73.488110,01/23/2021,164861,2021-01-23 00:19:13,,,,,J1772
ELEC,14 HUDSON,14 Hudson Ave,14 HUDSON 1.114 HUDSON 1.2,Glens Falls,NY,12801,,888-758-4389,E,,Public,24 hours daily,,,4,,,ChargePoint Network,http://www.chargepoint.com/,200-9,43.308069,-73.645638,01/23/2021,153509,2021-01-23 00:19:13,,,,,J1772
ELEC,NATIONAL GRID,2223 Canada St,HOLIDAY INN; Holiday Inn Resort Lake George rear parking lot,Lake George,NY,12845,,888-758-4389,E,,Public,24 hours daily,,,2,,,ChargePoint Network,http://www.chargepoint.com/,GPS,43.414528,-73.714398,01/23/2021,162215,2021-01-23 00:19:13,,,,,J1772
ELEC,RRH,89 Genesee St,ST MARYS 1; 2nd floor on south end of parking garageST MARYS 2; 2nd floor on south end of parking garageST MARYS 3; 2nd floor south side of parking garageST MARYS 4; 2nd floor on south end of parking garageST MARYS 5; 2nd floor on south end of parking garage,Rochester,NY,14611,,888-758-4389,E,,Public,24 hours daily,,,10,,,ChargePoint Network,http://www.chargepoint.com/,200-8,43.148936,-77.636263,01/23/2021,145392,2021-01-23 00:19:13,,,,,J1772
ELEC,McDonough's Valley Hardware,1901 N Main St,To the left of the store,Keene Valley,NY,12943,,518-576-4330,E,,Public,24 hours daily,,,1,,,Non-Networked,,GPS,44.191560,-73.786713,02/06/2020,153287,2020-02-06 21:24:11,P,,,06/24/2019,J1772
ELEC,iPark NYC 333 E 38th NYU - Tesla Destination,333 E 38th St,,New York,NY,10016,,855-472-7569  877-798-3752,E,,Public,24 hours daily; for customer use only; see valet for access,,,3,,,Tesla Destination,https://www.tesla.com/destination-charging,200-8,40.746891,-73.972547,11/03/2020,115101,2020-11-18 00:06:10,P,,,03/01/2016,J1772 TESLA
ELEC,Village of Irvington,12 S Astor St,,Irvington,NY,10533,,866-816-7584,E,,Public - Credit card at all times,24 hours daily; Also accepts PayPal and Apple Pay,A D M V,,2,,,EV Connect,http://evconnect.com/,GPS,41.039432,-73.872665,12/03/2020,168428,2020-12-03 22:33:12,LG,,,08/27/2020,J1772
ELEC,LEGEND VW,158 Merrick Rd,VW_408126_A,Amityville,NY,11701,,888-758-4389,E,,Public,24 hours daily,,,2,,,ChargePoint Network,http://www.chargepoint.com/,GPS,40.671178,-73.415823,01/23/2021,162423,2021-01-23 00:19:13,,,,,J1772
ELEC,1280BROADHOLLOW,1280 Broadhollow Rd,1280GATEWAY; Rear Corner of Upper Lot,Farmingdale,NY,11735,,888-758-4389,E,,Public,24 hours daily,,,2,,,ChargePoint Network,http://www.chargepoint.com/,GPS,40.734317,-73.424248,01/23/2021,162388,2021-01-23 00:19:13,,,,,J1772
ELEC,Rapidpark 9-11 W 100th Street - Tesla Destination,9 W 100th St,,New York,NY,10024,,212-531-4228  877-798-3752,E,,Public,24 hours daily; see valet for access,,,3,,,Tesla Destination,https://www.tesla.com/destination-charging,200-9,40.794681,-73.963228,11/03/2020,115192,2020-11-18 00:06:10,P,,,03/01/2017,J1772 TESLA
ELEC,Glenwood Management - Paramount Garage,221 E 38th St,,New York,NY,10016,,212-599-8610,E,,Public,24 hours daily,A Cash D Debit M V,,1,,,Non-Networked,,200-9,40.747930,-73.974556,03/03/2020,147009,2020-03-03 21:13:47,P,,,01/01/2016,J1772
ELEC,HUDSON PRESERVE,1701 Beryl Way,BLDG 17 #11,Watervliet,NY,12189,,888-758-4389,E,,Public,24 hours daily,,,2,,,ChargePoint Network,http://www.chargepoint.com/,GPS,42.731262,-73.726420,01/23/2021,143243,2021-01-23 00:19:13,,,,,J1772
ELEC,ProPark 29-10 Broadway - Tesla Destination,29-10 Broadway,,Astoria,NY,11106,,718-728-0460  877-798-3752,E,,Public,24 hours daily; pay lot; see valet for access,,,4,,,Tesla Destination,https://www.tesla.com/destination-charging,200-9,40.762417,-73.926985,11/03/2020,150616,2020-11-18 00:06:10,P,,,09/30/2019,TESLA
ELEC,BMW FREEPORT,100 Cleveland Ave,STATION 01; -,Freeport,NY,11520,,888-758-4389,E,,Public,24 hours daily,,,2,,,ChargePoint Network,http://www.chargepoint.com/,GPS,40.654208,-73.569134,01/23/2021,162449,2021-01-23 00:19:13,,,,,J1772
ELEC,Parkit 221 Thompson Street - Tesla Destination,221  Thompson St,,New York,NY,10012,,212-929-9404  877-798-3752,E,,Public,24 hours daily; see valet for access,,,3,,,Tesla Destination,https://www.tesla.com/destination-charging,200-9,40.729372,-73.999217,11/03/2020,115056,2020-11-18 00:06:10,P,,,01/01/2016,J1772 TESLA
ELEC,SAVARINO COMPAN,Myrtle St Lot Charger 1 500 Seneca Street,500 SENECA 1; -,Buffalo,NY,14204,,888-758-4389,E,,Public,24 hours daily,,,2,,,ChargePoint Network,http://www.chargepoint.com/,GPS,42.878372,-78.857750,01/23/2021,164151,2021-01-23 00:19:13,,,,,J1772
ELEC,Fuccillo Nissan - Latham,976 New Loudon Rd,,Latham,NY,12110,,518-250-4380,E,,Public - Call ahead,Dealership business hours,,,1,,,Non-Networked,,200-9,42.769430,-73.754611,06/09/2020,70452,2020-06-09 16:47:26,P,,,01/11/2012,J1772
ELEC,"Country Inn & Suites By Carlson, Rochester-Pittsford - Tesla Destination",2835 Monroe Ave,,Rochester,NY,14618,,585-784-8400  877-798-3752,E,,Public,24 hours daily; for customer use only; see front desk for access,,,3,,,Tesla Destination,https://www.tesla.com/destination-charging,200-8,43.111488,-77.548676,11/03/2020,115221,2020-11-18 00:06:10,P,,,09/01/2017,TESLA
ELEC,Simmons Rockwell Nissan,224 Colonial Dr,,Horseheads,NY,14845,,,E,,Public - Call ahead,Dealership business hours; contact 607-398-6666 for more information,,,1,1,,Non-Networked,,GPS,42.162460,-76.867435,06/09/2020,44348,2020-06-09 16:47:26,P,,,11/30/2011,CHADEMO J1772 J1772COMBO
ELEC,TIBA,43373/521 Collins Landing Rd,45766 N COUNTRY; 45766-North Country Welcome Center,Alexandria Bay,NY,13607,,888-758-4389,E,,Public,24 hours daily,,,,2,,ChargePoint Network,http://www.chargepoint.com/,GPS,44.294820,-75.975867,01/23/2021,162187,2021-01-23 00:19:13,,,,,CHADEMO J1772COMBO
ELEC,Quik Park West 23rd Street Garage LLC - Tesla Destination,423-431  W 23rd St,,New York,NY,10011,,212-352-0514  877-798-3752,E,,Public,24 hours daily; for customer use only; see valet for access,,,3,,,Tesla Destination,https://www.tesla.com/destination-charging,200-8,40.746762,-74.001428,11/03/2020,115133,2020-11-18 00:06:10,P,,,02/01/2015,J1772 TESLA
ELEC,Bard College,11 Henderson Circle Dr,,Annandale-on-Hudson,NY,12504,,866-816-7584,E,,Public,24 hours daily,,,2,,,EV Connect,http://evconnect.com/,GPS,42.020108,-73.907296,05/06/2020,123057,2020-05-06 17:56:57,P,,,04/01/2019,J1772
ELEC,RRH,1445 Portland Ave,PORTLAND L1; -,Rochester,NY,14621,,888-758-4389,E,,Public,24 hours daily,,,2,,,ChargePoint Network,http://www.chargepoint.com/,GPS,43.192753,-77.585720,01/23/2021,156614,2021-01-23 00:19:13,,,,,J1772
ELEC,iPark NYC 2234 North 6th - Tesla Destination,34 North 6th St,,Brooklyn,NY,11249,,855-472-7569  877-798-3752,E,,Public,24 hours daily; see valet for access,,,3,,,Tesla Destination,https://www.tesla.com/destination-charging,200-9,40.719756,-73.962933,11/03/2020,114898,2020-11-18 00:06:10,P,,,01/01/2016,J1772 TESLA
ELEC,WARRENCOUNTY,1342 U.S. 9,DPW 1,Lake George,NY,12845,,888-758-4389,E,,Public,24 hours daily,,,2,,,ChargePoint Network,http://www.chargepoint.com/,GPS,43.359015,-73.701072,01/23/2021,150259,2021-01-23 00:19:13,,,,,J1772
ELEC,iPark NYC 549 W 23rd Street - Tesla Destination,549  W 23rd St,,New York,NY,10011,,855-472-7569  877-798-3752,E,,Public,24 hours daily; for customer use only; see valet for access,,,3,,,Tesla Destination,https://www.tesla.com/destination-charging,200-9,40.748931,-74.006078,11/03/2020,115158,2020-11-18 00:06:10,P,,,03/01/2016,J1772 TESLA
ELEC,860 5th Avenue,860 5th Avenue,Located on 67th St between 5th Ave & Madison Ave. - Attendant will assist in charging vehicle.  Parking rates apply. Inquire within.,New York,NY,10065,,888-998-2546,E,,Public,MON: 24 hours | TUE: 24 hours | WED: 24 hours | THU: 24 hours | FRI: 24 hours | SAT: 24 hours | SUN: 24 hours,,,1,,,Blink Network,http://www.blinkcharging.com/,GPS,40.769134,-73.968707,01/22/2021,164702,2021-01-22 22:55:21,,,,,J1772
ELEC,HGI TROY,243 Hoosick St,HILTON TROY 1.1; In rear parking lot of Hilton HILTON TROY 1.2; Rear parking lot of the Hilton,Troy,NY,12180,,888-758-4389,E,,Public,24 hours daily,,,4,,,ChargePoint Network,http://www.chargepoint.com/,200-9,42.738620,-73.671217,01/23/2021,154778,2021-01-23 00:19:13,,,,,J1772
ELEC,ERLOWEST,Erlowest,ERLOWEST #2,Lake George,NY,12845,,888-758-4389,E,,Public,24 hours daily,,,2,,,ChargePoint Network,http://www.chargepoint.com/,GPS,43.447598,-73.695860,01/23/2021,143591,2021-01-23 00:19:13,,,,,J1772
ELEC,NATIONAL GRID,207 Troy Schenectady Rd,VENTLATHAM,Watervliet,NY,12189,,888-758-4389,E,,Public,24 hours daily,,,2,,,ChargePoint Network,http://www.chargepoint.com/,GPS,42.740120,-73.731328,01/23/2021,162364,2021-01-23 00:19:13,,,,,J1772
ELEC,HARMONY MILLS 1,N Mohawk St & Vliet St,RIVERVIEW 1.1RIVERVIEW 1.2; Near garage door entrance,Cohoes,NY,12047,,888-758-4389,E,,Public,24 hours daily,,,4,,,ChargePoint Network,http://www.chargepoint.com/,GPS,42.780510,-73.704094,01/23/2021,149628,2021-01-23 00:19:13,,,,,J1772
ELEC,BA #1,29 British American Blvd,29 BRITISH AMER,Latham,NY,12110,,888-758-4389,E,,Public,24 hours daily,,,2,,,ChargePoint Network,http://www.chargepoint.com/,GPS,42.762638,-73.822044,01/23/2021,143440,2021-01-23 00:19:13,,,,,J1772
ELEC,Home 2 Suites Queensbury - Tesla Destination,524 Aviation Rd,,Queensbury,NY,12804,,518-741-7600  877-798-3752,E,,Public,24 hours daily; for customer use only,,,4,,,Tesla Destination,https://www.tesla.com/destination-charging,200-9,43.328380,-73.681677,11/03/2020,115216,2020-11-18 00:06:10,P,,,11/01/2018,J1772 TESLA
ELEC,Prime Parking Systems - 155 E 68th Street - Tesla Destination,155 E 68th St,,New York,NY,10065,,212-327-2626  877-798-3752,E,,Public,24 hours daily; for customer use only; see valet for access,,,3,,,Tesla Destination,https://www.tesla.com/destination-charging,200-8,40.768032,-73.963983,11/03/2020,115024,2020-11-18 00:06:10,P,,,01/01/2016,J1772 TESLA
ELEC,300 W 135 St - Little Man Parking - Tesla Destination,300 W 135 St,,New York,NY,10030,,212-714-3571  877-798-3752,E,,Public,24 hours daily; pay lot; see valet for access,,,4,,,Tesla Destination,https://www.tesla.com/destination-charging,200-9,40.816366,-73.947365,11/03/2020,150596,2020-11-18 00:06:10,P,,,09/30/2019,TESLA
ELEC,NATIONAL GRID,5274 Main St,"TOPSWILLIAMSVLL; Tops, next to the entrance with bottle recycling machines.",Williamsville,NY,14221,,888-758-4389,E,,Public,24 hours daily,,,2,,,ChargePoint Network,http://www.chargepoint.com/,GPS,42.962402,-78.757219,01/23/2021,162248,2021-01-23 00:19:13,,,,,J1772
ELEC,TONAWANDA YPR,151 Thorncliff Rd,POOL PLAZA 2; -,Buffalo,NY,14223,,888-758-4389,E,,Public,24 hours daily,,,2,,,ChargePoint Network,http://www.chargepoint.com/,GPS,42.982760,-78.866790,01/23/2021,154518,2021-01-23 00:19:13,,,,,J1772
ELEC,SCOTIA EVCHARGE,138 Mohawk Ave,SCOTIA EV1; Facing the main road.SCOTIA EV2; Facing the main road.SCOTIA LEVEL 3; Facing the main road.,Scotia,NY,12302,,888-758-4389,E,,Public,24 hours daily,,,4,2,,ChargePoint Network,http://www.chargepoint.com/,200-9,42.826562,-73.963540,01/23/2021,155135,2021-01-23 00:19:13,,,,,CHADEMO J1772 J1772COMBO
ELEC,NATIONAL GRID,977 Loudon rd,CENTURY HOUSE,Cohoes,NY,12047,,888-758-4389,E,,Public,24 hours daily,,,2,,,ChargePoint Network,http://www.chargepoint.com/,GPS,42.771298,-73.752656,01/23/2021,162221,2021-01-23 00:19:13,,,,,J1772
ELEC,Village of Webster,28 W Main St,"Located along south side of building in Village Parking Lot. The parking lot is accessible from South Ave, from the Corning Park entrance, and from the West Main entrance located west of the Village Hall building",Webster,NY,14580,,585-265-3770,E,,Public,6am-2am daily,,,2,,,EV Connect,http://evconnect.com/,GPS,43.211389,-77.431667,06/09/2020,116756,2020-06-09 16:47:26,LG,,,08/31/2018,J1772
ELEC,E.H. VILLAGE,2 Gingerbread Ln,LONGTERMLOT1; Station is located in the northeast corner of the Lumber Lane parking lot.,East Hampton,NY,11937,,888-758-4389,E,,Public,24 hours daily,,,2,,,ChargePoint Network,http://www.chargepoint.com/,GPS,40.963082,-72.192633,01/23/2021,162303,2021-01-23 00:19:13,,,,,J1772
ELEC,CHEEKTOWAGA,211 Ridge Park Ave,CHEEKTOWAGA,Cheektowaga,NY,14225,,888-758-4389,E,,Public,24 hours daily,,,2,,,ChargePoint Network,http://www.chargepoint.com/,GPS,42.913478,-78.789878,01/23/2021,162313,2021-01-23 00:19:13,,,,,J1772
ELEC,SOLOMON,1A Lakeview Drive,TWIN LAKES APT; Near leasing office,Clifton Park,NY,12065,,888-758-4389,E,,Public,24 hours daily,,,2,,,ChargePoint Network,http://www.chargepoint.com/,GPS,42.854624,-73.768548,01/23/2021,162226,2021-01-23 00:19:13,,,,,J1772
ELEC,TOWNOFLEWISTON1,1375 Ridge Rd,LEWITSON 1,Lewiston,NY,14092,,888-758-4389,E,,Public,24 hours daily,,,2,,,ChargePoint Network,http://www.chargepoint.com/,GPS,43.179582,-78.984100,01/23/2021,162148,2021-01-23 00:19:13,,,,,J1772
ELEC,Ferguson Distribution Center,11545 US-9W,,Coxsackie,NY,12051,,866-816-7584,E,,Public,24 hours daily; Also accepts Paypal,A D M V,,4,,,EV Connect,http://evconnect.com/,GPS,42.356934,-73.844479,04/08/2020,154881,2020-04-08 12:29:55,P,,,08/13/2019,J1772
ELEC,QUEENSBURY TOWN,742 Bay Rd,ACT CTR 1; Rear parking lot of Queensbury activity centerACT CTR 2; Rear parking lot of Queensbury activity center,Queensbury,NY,12804,,888-758-4389,E,,Public,24 hours daily,,,4,,,ChargePoint Network,http://www.chargepoint.com/,200-9,43.359690,-73.656517,01/23/2021,165632,2021-01-23 00:19:13,,,,,J1772
ELEC,MARKET 32 EV,3045 rt 50,MARKET32 SAR SP; In front of building.,Saratoga Springs,NY,12866,,888-758-4389,E,,Public,24 hours daily,,,2,,,ChargePoint Network,http://www.chargepoint.com/,GPS,43.102972,-73.742407,01/23/2021,154240,2021-01-23 00:19:13,,,,,J1772
ELEC,Longhouse Reserve - Tesla Destination,133 Hands Creek Rd,,East Hampton,NY,11937,,631-329-3568  877-798-3752,E,,Public,24 hours daily,,,4,,,Tesla Destination,https://www.tesla.com/destination-charging,200-9,40.981539,-72.199841,11/03/2020,150564,2020-11-18 00:06:10,P,,,09/30/2019,TESLA
ELEC,Standard Parking 58 W 58th Street - Tesla Destination,58 W 58th St,,New York,NY,10019,,800-836-6666  877-798-3752,E,,Public,24 hours daily; see valet for access,,,3,,,Tesla Destination,https://www.tesla.com/destination-charging,200-9,40.764459,-73.976349,11/03/2020,115165,2020-11-18 00:06:10,P,,,09/01/2017,J1772 TESLA
ELEC,NYC FLEET,10 Central Rd,DPR_ICAHN_1_L3; -DPR_ICAHN_2_L3DPR_ICAHN_3_L3,New York,NY,10035,,888-758-4389,E,,Public,24 hours daily,,,,6,,ChargePoint Network,http://www.chargepoint.com/,200-8,40.792639,-73.922965,01/23/2021,170122,2021-01-23 00:19:13,,,,,CHADEMO J1772COMBO
ELEC,HOTEL,50 Red Oaks Mill Rd,INN AT THE FALL; In rear lot,Poughkeepsie,NY,12603,,888-758-4389,E,,Public,24 hours daily,,,2,,,ChargePoint Network,http://www.chargepoint.com/,GPS,41.654736,-73.870968,01/23/2021,162326,2021-01-23 00:19:13,,,,,J1772
ELEC,RTC,1 Walsh Cir,WALSH 1WALSH 2WALSH 3WALSH 4WALSH 5,Syracuse,NY,13208,,888-758-4389,E,,Public,24 hours daily,,,9,,,ChargePoint Network,http://www.chargepoint.com/,200-9,43.076712,-76.169225,01/23/2021,152409,2021-01-23 00:19:13,,,,,J1772
ELEC,St. Josephs Hospital - Tesla Destination,4295 Hempstead Turnpike,,Bethpage,NY,11714,,877-798-3752  877-798-3752,E,,Public,24 hours daily; for customer use only; see front desk for access,,,4,,,Tesla Destination,https://www.tesla.com/destination-charging,200-8,40.725995,-73.478764,11/03/2020,169127,2020-11-18 00:06:10,P,,,11/03/2020,TESLA
ELEC,University Avenue Garage Unit 1,1101 East Adams Street,,Syracuse,NY,13244,,800-663-5633,E,,Public,MO: Not Specified; TU: Not Specified; WE: Not Specified; TH: Not Specified; FR: Not Specified; SA: Not Specified; SU: Not Specified,,,1,,,SemaCharge Network,https://semaconnect.com/,GPS,43.043475,-76.133898,01/23/2021,147904,2021-01-23 00:11:44,,,,,J1772
ELEC,FMCC,2805 NY-67,FMCC 1; Parking Lot A near Ball FieldsFMCC 2; Parking Lot 3 - Allen House and Student Welcome Center,Johnstown,NY,12095,,888-758-4389,E,,Public,24 hours daily,,,4,,,ChargePoint Network,http://www.chargepoint.com/,200-9,42.983007,-74.295099,01/23/2021,147461,2021-01-23 00:19:13,,,,,J1772
ELEC,The Whiteface Lodge - Tesla Destination,7 Whiteface Inn Ln,,Lake Placid,NY,12946,,518-523-0500  877-798-3752,E,,Public - Call ahead,24 hours daily; for customer use only,,,3,,,Tesla Destination,https://www.tesla.com/destination-charging,200-9,44.297026,-74.010764,11/03/2020,114966,2020-11-18 00:06:10,P,,,01/01/2016,J1772 TESLA
ELEC,BA #1,11 British American Blvd,11 BRITISH AMER,Latham,NY,12110,,888-758-4389,E,,Public,24 hours daily,,,2,,,ChargePoint Network,http://www.chargepoint.com/,GPS,42.761303,-73.817540,01/23/2021,143437,2021-01-23 00:19:13,,,,,J1772
ELEC,Lyons Place Municipal Parking Garage,4 Lyons Pl,"North of Maple Ave. Located on 1st level, just right of entrance",White Plains,NY,10601,,914-422-1392,E,,Public,24 hours daily; pay lot,,,2,,,EV Connect,http://evconnect.com/,200-8,41.028940,-73.763727,03/03/2020,65276,2020-03-03 21:13:47,SG,,,11/01/2014,J1772
ELEC,Tupper Lake Playground,Martin St,,Tupper Lake,NY,12986,,866-816-7584,E,,Public,24 hours daily,,,1,,,EV Connect,http://evconnect.com/,GPS,44.224994,-74.465687,04/08/2020,123144,2020-04-08 12:29:55,P,,,04/01/2019,J1772
ELEC,BETHLEHEM EV,265 Elm Ave,,Delmar,NY,12054,,888-758-4389,E,,Public,24 hours daily,,,2,,,ChargePoint Network,http://www.chargepoint.com/,GPS,42.599927,-73.839915,01/23/2021,171218,2021-01-23 00:19:13,,,,,J1772
ELEC,Embassy Suites by Hilton Saratoga Springs - Tesla Destination,86 Congress St,,Saratoga Springs,NY,12866,,518-290-9090  877-798-3752,E,,Public,24 hours daily; for customer use only; see front desk for access,,,2,,,Tesla Destination,https://www.tesla.com/destination-charging,200-9,43.078850,-73.789832,11/03/2020,115236,2020-11-18 00:06:10,P,,,08/15/2016,J1772 TESLA
ELEC,VOB,15 Kensington Rd,STATION 2; Parking garage p1,Bronxville,NY,10708,,888-758-4389,E,,Public,24 hours daily,,,2,,,ChargePoint Network,http://www.chargepoint.com/,GPS,40.942715,-73.834440,01/23/2021,165220,2021-01-23 00:19:13,,,,,J1772
ELEC,"Town of East Hampton/Montauk, NY",70 South Euclid Ave,,Montauk,NY,11954,,833-632-2778,E,,Public,24 hours daily,,,,4,,Electrify America,https://www.electrifyamerica.com/,GPS,41.035911,-71.943488,01/23/2021,170247,2021-01-23 01:23:19,,,,,CHADEMO J1772COMBO
ELEC,444 Kent Avenue,444 Kent Avenue,Attendant will assist in charging vehicle.  Parking rates apply. Inquire within.,Brooklyn,NY,11211,,888-998-2546,E,,Public,MON: 24 hours | TUE: 24 hours | WED: 24 hours | THU: 24 hours | FRI: 24 hours | SAT: 24 hours | SUN: 24 hours,,,2,,,Blink Network,http://www.blinkcharging.com/,GPS,40.709168,-73.968491,01/22/2021,144095,2021-01-22 22:55:21,,,,,J1772
ELEC,Staten Island Mall - Tommyâ€™s Tavern + Tap,2655 Richmond Ave,,Staten Island,NY,10314,,888-264-2208,E,,Public,6am-12am daily,,,2,,,Volta,https://voltacharging.com/,GPS,40.581132,-74.167932,10/09/2020,166730,2020-10-09 12:41:43,P,,,08/31/2020,J1772
ELEC,THERMAL,11 Sitterly Rd,QUICK AG EV1; Pull in on the right.QUICK AG EV2; Pull in on the right.QUICK AG EV3; Pull in station will be on the left.QUICK AG EV4; Pull in station will be on the left.,Clifton Park,NY,12065,,888-758-4389,E,,Public,24 hours daily,,,8,,,ChargePoint Network,http://www.chargepoint.com/,200-9,42.850517,-73.757532,01/23/2021,168029,2021-01-23 00:19:13,,,,,J1772
ELEC,iPark 3 E 67th Street - Tesla Destination,3 E 67th St,,New York,NY,10065,,212-650-0996  877-798-3752,E,,Public,24 hours daily; see valet for access,,,3,,,Tesla Destination,https://www.tesla.com/destination-charging,200-8,40.769386,-73.969137,11/03/2020,115080,2020-11-18 00:06:10,P,,,03/01/2017,J1772 TESLA
ELEC,NATIONAL GRID,1220 NY-146,VENT CLIFTON,Clifton Park,NY,12065,,888-758-4389,E,,Public,24 hours daily,,,2,,,ChargePoint Network,http://www.chargepoint.com/,GPS,42.869606,-73.823986,01/23/2021,162198,2021-01-23 00:19:13,,,,,J1772
ELEC,GREATNECK PLAZA,2 Gussack Plaza,"PLAZA CENTER; Village of Great Neck Plaza ""Plaza Centre"" parking garage, follow traffic flow signs back down to street level B, station to the right.",Great Neck,NY,11022,,888-758-4389,E,,Public,24 hours daily,,,2,,,ChargePoint Network,http://www.chargepoint.com/,GPS,40.787424,-73.729999,01/23/2021,162375,2021-01-23 00:19:13,,,,,J1772
ELEC,PICOTTE,1450 western ave,1450 WESTERN 1.1450 WESTERN 2,Albany,NY,12203,,888-758-4389,E,,Public,24 hours daily,,,4,,,ChargePoint Network,http://www.chargepoint.com/,200-9,42.680278,-73.837669,01/23/2021,154452,2021-01-23 00:19:13,,,,,J1772
ELEC,EVPASS,599 Towne Dr,FYTCT-1; 3 Units in lot on left entering from N Burdick StFYTCT-2; 3 Units in lot on left entering from N Burdick StFYTCT-3; 3 Units in lot on left entering from N Burdick St,Fayetteville,NY,13066,,888-758-4389,E,,Public,24 hours daily,,,3,,,ChargePoint Network,http://www.chargepoint.com/,GPS,43.033478,-76.018288,01/23/2021,162507,2021-01-23 00:19:13,,,,,J1772
ELEC,ATA HOUSING,249 Thomas S Boyland St,"BOYLAN ST. 2; In underground parking garage at Pacific St. entrance on the left side, between spaces #408 &amp; 409",Brooklyn,NY,11233,,888-758-4389,E,,Public,24 hours daily,,,2,,,ChargePoint Network,http://www.chargepoint.com/,GPS,40.675072,-73.913132,01/23/2021,162517,2021-01-23 00:19:13,,,,,J1772
ELEC,ERIE COUNTY,Oak St,ECC STATION 1; -,Buffalo,NY,14203,,888-758-4389,E,,Public,24 hours daily,,,2,,,ChargePoint Network,http://www.chargepoint.com/,GPS,42.883036,-78.871288,01/23/2021,170240,2021-01-23 00:19:13,,,,,J1772
ELEC,RPI 1,Sage Ave,E DORM N LOT S1; RPI North lot near E-DormE DORM N LOT S2; RPI North lot near North Hall,Troy,NY,12180,,888-758-4389,E,,Public,24 hours daily,,,4,,,ChargePoint Network,http://www.chargepoint.com/,GPS,42.731644,-73.679579,01/23/2021,121294,2021-01-23 00:19:13,,,,,J1772
ELEC,Queensbury Rest Area - Northbound,368 Big Boom Rd,I-87,Queensbury,NY,12804,,518-457-6195,E,,Public,24 hours daily,,,,2,,Non-Networked,,GPS,43.273451,-73.674594,03/03/2020,104978,2020-03-03 21:13:47,SG,,,09/20/2018,CHADEMO J1772COMBO
ELEC,1345 Parking Garage - Tesla Destination,1345 6th Ave,,New York,NY,10105,,212-245-8708  877-798-3752,E,,Public,24 hours daily; pay lot; see valet for access,,,3,,,Tesla Destination,https://www.tesla.com/destination-charging,GPS,40.763510,-73.979364,11/03/2020,115012,2020-11-18 00:06:10,P,,,11/01/2018,J1772 TESLA
ELEC,Icon Parking Wall Park - Tesla Destination,39  Exchange Pl,,New York,NY,10005,,212-825-0700  877-798-3752,E,,Public,24 hours daily; see valet for access,,,3,,,Tesla Destination,https://www.tesla.com/destination-charging,200-8,40.706109,-74.010148,11/03/2020,115116,2020-11-18 00:06:10,P,,,03/01/2017,J1772 TESLA
ELEC,ERIE COUNTY,2084 Emery Rd,EMERY,South Wales,NY,14139,,888-758-4389,E,,Public,24 hours daily,,,2,,,ChargePoint Network,http://www.chargepoint.com/,GPS,42.715504,-78.595665,01/23/2021,164390,2021-01-23 00:19:13,,,,,J1772
ELEC,JATC IBEW LU910,111 Ohio Ave,OHIO AVE 1,Plattsburgh,NY,12901,,888-758-4389,E,,Public,24 hours daily,,,2,,,ChargePoint Network,http://www.chargepoint.com/,GPS,44.683044,-73.447391,01/23/2021,162161,2021-01-23 00:19:13,,,,,J1772
ELEC,STONY BROOK UNV,Campus Dr,ESS; -,Stony Brook,NY,11790,,888-758-4389,E,,Public,24 hours daily,,,2,,,ChargePoint Network,http://www.chargepoint.com/,GPS,40.914369,-73.125742,01/23/2021,162403,2021-01-23 00:19:13,,,,,J1772
ELEC,OSSINING TOWN,Cedar Lane Park 235 Cedar Lane,"CEDAR LANE; Once in Park, follow sign to Arts Center",Ossining,NY,10562,,888-758-4389,E,,Public,24 hours daily,,,2,,,ChargePoint Network,http://www.chargepoint.com/,GPS,41.191608,-73.854692,01/23/2021,162298,2021-01-23 00:19:13,,,,,J1772
ELEC,Amada Tool America Inc,4A Treadeasy Ave,,Batavia,NY,14020,,866-816-7584,E,,Public,24 hours daily,,,2,,,EV Connect,http://evconnect.com/,GPS,42.993306,-78.207766,06/09/2020,157943,2020-06-09 16:47:26,P,,,05/15/2020,J1772
ELEC,NATIONAL GRID,1814 Central Ave,KOHLS ALBANY,Albany,NY,12205,,888-758-4389,E,,Public,24 hours daily,,,2,,,ChargePoint Network,http://www.chargepoint.com/,GPS,42.729741,-73.851066,01/23/2021,162203,2021-01-23 00:19:13,,,,,J1772
ELEC,Lia Nissan,2233 Central Ave,,Schenectady,NY,12304,,518-579-2000,E,,Public - Call ahead,Dealership business hours,,,1,,,Non-Networked,,200-9,42.764517,-73.885220,06/09/2020,44192,2020-06-09 16:47:26,P,,,11/30/2011,J1772
ELEC,Oakwood Commons Parking Garage,2507 South Rd,,Poughkeepsie,NY,12601,,845-463-1701,E,,Public,24 hours daily,,,2,,,Non-Networked,,GPS,41.659072,-73.932101,10/09/2020,167129,2020-10-09 12:41:43,P,,,09/21/2020,J1772
ELEC,Country Pointe Plainview - Tesla Supercharger,1427 Old Country Road,,Plainview,NY,11803,,877-798-3752,E,,Public,24 hours daily; for Tesla use only,,,,8,,Tesla,http://www.teslamotors.com/supercharger,200-8,40.779900,-73.450700,08/10/2020,102339,2020-08-27 20:39:12,P,,,07/23/2018,TESLA
ELEC,Fairport Electric,43 Lift Bridge Ln E,Located near S Water St,Fairport,NY,14450,,585-223-9500,E,,Public,24 hours daily,,,1,,,EV Connect,http://evconnect.com/,GPS,43.101870,-77.439360,06/09/2020,82260,2020-06-09 16:47:26,LG,,,12/27/2019,J1772
ELEC,233 LAKE AVE,233 Lake Ave,GROVE 1.1GROVE 1.2GROVE 1.3GROVE 1.4,Saratoga Springs,NY,12866,,888-758-4389,E,,Public,24 hours daily,,,10,,,ChargePoint Network,http://www.chargepoint.com/,200-9,43.085282,-73.764884,01/23/2021,170449,2021-01-23 00:19:13,,,,,J1772
ELEC,Union College - Nott/Lennox Lot,894 Nott St,,Schenectady,NY,12308,,866-816-7584,E,,Public,24 hours daily,,,4,,,EV Connect,http://evconnect.com/,GPS,42.819693,-73.924193,05/06/2020,156045,2020-05-06 17:56:57,P,,,05/01/2020,J1772
ELEC,Vision Nissan Greece,4000 W Ridge Rd,,Rochester,NY,14626,,585-227-3800,E,,Public - Call ahead,Dealership business hours,,,3,,,Non-Networked,,200-9,43.216099,-77.736190,06/09/2020,49676,2020-06-09 16:47:26,P,,,10/25/2012,J1772
ELEC,TOWN OF RED HK,7336 S Broadway,RED HOOK 1; East parking lotRED HOOK 2; East Parking LotREDHOOK 3; -REDHOOK 4; -,Red Hook,NY,12571,,888-758-4389,E,,Public,24 hours daily,,,8,,,ChargePoint Network,http://www.chargepoint.com/,200-9,41.986926,-73.880754,01/23/2021,86019,2021-01-23 00:19:13,,,,,J1772
ELEC,BA #1,19 British American Blvd,19 BA 2,Latham,NY,12110,,888-758-4389,E,,Public,24 hours daily,,,2,,,ChargePoint Network,http://www.chargepoint.com/,GPS,42.761402,-73.822040,01/23/2021,153091,2021-01-23 00:19:13,,,,,J1772
ELEC,ProPark 184 Kent Ave - Tesla Destination,184 Kent Ave,,Brooklyn,NY,11249,,718-559-5699  877-798-3752,E,,Public,24 hours daily; pay lot; see valet for access,,,4,,,Tesla Destination,https://www.tesla.com/destination-charging,200-9,40.718763,-73.964599,11/03/2020,122470,2020-11-18 00:06:10,P,,,03/01/2019,TESLA
ELEC,ADAMS STATION,101 Derzee Ct,101 DERZEE CT; Bldg 101-108,Delmar,NY,12054,,888-758-4389,E,,Public,24 hours daily,,,2,,,ChargePoint Network,http://www.chargepoint.com/,GPS,42.606556,-73.849920,01/23/2021,165393,2021-01-23 00:19:13,,,,,J1772
ELEC,FEHBOCES,711 NY-3,ADK ED CNTR 1,Saranac Lake,NY,12983,,888-758-4389,E,,Public,24 hours daily,,,2,,,ChargePoint Network,http://www.chargepoint.com/,GPS,44.350820,-74.115150,01/23/2021,149380,2021-01-23 00:19:13,,,,,J1772
ELEC,BURNS MGT,86 Circular Street,SKIDMORE APTS; -,Saratoga Springs,NY,12866,,888-758-4389,E,,Public,24 hours daily,,,2,,,ChargePoint Network,http://www.chargepoint.com/,GPS,43.078698,-73.781219,01/23/2021,123595,2021-01-23 00:19:13,,,,,J1772
ELEC,U OF R,211 Bailey Rd,BAILEY RD 1; -,West Henrietta,NY,14586,,888-758-4389,E,,Public,24 hours daily,,,2,,,ChargePoint Network,http://www.chargepoint.com/,GPS,43.071465,-77.677611,01/23/2021,154412,2021-01-23 00:19:13,,,,,J1772
ELEC,Hannaford Supermarket,9 126th St,,Troy,NY,12182,,877-455-3833,E,,Public - Card key at all times,24 hours daily,,,,1,,eVgo Network,https://www.evgo.com/,GPS,42.788251,-73.672111,01/23/2021,93507,2021-01-23 01:19:54,,,,,CHADEMO J1772COMBO
ELEC,GGMC Parking 50 E 79th St Garage - Tesla Destination,50 E 79th St,,New York,NY,10075,,212-879-0670  877-798-3752,E,,Public,24 hours daily; see valet for access,,,2,,,Tesla Destination,https://www.tesla.com/destination-charging,200-9,40.775932,-73.961937,11/03/2020,115144,2020-11-18 00:06:10,P,,,01/01/2016,TESLA
ELEC,750 Columbus Avenue,750 Columbus Avenue,Entrance on 110 West 97th St. - Attendant will assist in charging vehicle.  Parking rates apply. Inquire within.,New York,NY,10025,,888-998-2546,E,,Public,MON: 24 hours | TUE: 24 hours | WED: 24 hours | THU: 24 hours | FRI: 24 hours | SAT: 24 hours | SUN: 24 hours,,,2,,,Blink Network,http://www.blinkcharging.com/,GPS,40.793416,-73.967719,01/22/2021,164714,2021-01-22 22:55:21,,,,,J1772
ELEC,Western New York Welcome Center,2182 Alvin Rd,Accessible from I-190 exit 19 via Alvin Road,Grand Island,NY,14072,,518-436-2831,E,,Public,24 hours daily,,,,3,,Non-Networked,,GPS,43.019316,-78.974808,03/03/2020,104725,2020-03-03 21:13:47,P,,,08/01/2018,CHADEMO J1772COMBO
ELEC,Surfside on the Lake Hotel - Tesla Destination,400 Canada St,,Lake George,NY,12845,,518-668-2442  877-798-3752,E,,Public,24 hours daily; for customer use only; see front desk for access,,,4,,,Tesla Destination,https://www.tesla.com/destination-charging,200-9,43.429712,-73.710506,11/03/2020,122484,2020-11-18 00:06:10,P,,,03/01/2019,TESLA
ELEC,Rapidpark 15 W 72nd Street - Tesla Destination,15 W 72nd St,,New York,NY,10023,,212-874-9904  877-798-3752,E,,Public,24 hours daily; for customer use only; see valet for access,,,3,,,Tesla Destination,https://www.tesla.com/destination-charging,200-9,40.777008,-73.976890,11/03/2020,115017,2020-11-18 00:06:10,P,,,09/01/2017,J1772 TESLA
ELEC,Hunter's Point South Crossing,1-55 Borden Avenue,Enter via. Borden Ave.,Queens,NY,11101,,888-998-2546,E,,Public,MON: 24 hours | TUE: 24 hours | WED: 24 hours | THU: 24 hours | FRI: 24 hours | SAT: 24 hours | SUN: 24 hours,,,2,,,Blink Network,http://www.blinkcharging.com/,GPS,40.742397,-73.959225,01/22/2021,95054,2021-01-22 22:55:21,,,,,J1772
ELEC,MORRISVILLE,Chenango Rd,MORRISVILLE; On sidewalk in front of building,Morrisville,NY,13408,,888-758-4389,E,,Public,24 hours daily,,,2,,,ChargePoint Network,http://www.chargepoint.com/,GPS,42.896779,-75.641568,01/23/2021,162480,2021-01-23 00:19:13,,,,,J1772
ELEC,Jones Beach Theater,1000 Ocean Pkwy,,Wantaugh,NY,11793,,866-816-7584,E,,Public,24 hours daily,,,1,,,EV Connect,http://evconnect.com/,GPS,40.601141,-73.502518,04/08/2020,123264,2020-04-08 12:29:55,P,,,04/01/2019,J1772
ELEC,Standard Parking 21 East 15th Street - Tesla Destination,21 E 15th St,,New York,NY,10003,,800-836-6666  877-798-3752,E,,Public,24 hours daily; see valet for access,,,3,,,Tesla Destination,https://www.tesla.com/destination-charging,200-8,40.736440,-73.992027,11/03/2020,115050,2020-11-18 00:06:10,P,,,12/15/2016,J1772 TESLA
ELEC,ICE RINK,6 Small World Ave,ICE RINK; -,Saugerties,NY,12477,,888-758-4389,E,,Public,24 hours daily,,,2,,,ChargePoint Network,http://www.chargepoint.com/,GPS,42.090709,-73.951019,01/23/2021,162337,2021-01-23 00:19:13,,,,,J1772
ELEC,Champion Parking 60 East End Avenue - Tesla Destination,60 East End Ave,,New York,NY,10028,,212-308-5959  877-798-3752,E,,Public,24 hours daily; see valet for access,,,3,,,Tesla Destination,https://www.tesla.com/destination-charging,200-9,40.772794,-73.946969,11/03/2020,115168,2020-11-18 00:06:10,P,,,01/01/2016,J1772 TESLA
ELEC,Gallagher Ramp,499 Elmwood Ave,,Buffalo,NY,14222,,716-849-5812  866-816-7584,E,,Public - Credit card at all times,24 hours daily; must use EVConnect app for payment,A D Debit M V,,1,,,EV Connect,http://evconnect.com/,GPS,42.910491,-78.876035,06/09/2020,120916,2020-06-09 16:47:26,LG,,,04/01/2018,J1772
ELEC,EVPASS,400-498 Harrison St,"ONCT-12; 14 units at lot, enter between Harrison and E AdamsONCT-13; 14 units at lot, enter between Harrison and E AdamsONCT-3; 14 units at lot, enter between Harrison and E AdamsONCT-5; 14 units at lot, enter between Harrison and E AdamsONCT-8; 14 units at lot, enter between Harrison and E Adams",Syracuse,NY,13202,,888-758-4389,E,,Public,24 hours daily,,,5,,,ChargePoint Network,http://www.chargepoint.com/,200-8,43.044095,-76.147524,01/23/2021,162504,2021-01-23 00:19:13,,,,,J1772
ELEC,Pratt and Whitney HMI Metal Powders,2395 Main St,,Clayville,NY,13322,,866-816-7584,E,,Public - Credit card at all times,24 hours daily; Also accepts Paypal,A D M V,,2,,,EV Connect,http://evconnect.com/,200-9,42.978010,-75.249586,10/09/2020,166427,2020-10-09 12:41:43,P,,,01/16/2020,J1772
ELEC,MARKET 32 EV,329 Town Square Plaza,MARKET GLENMONT; In front of building,Glenmont,NY,12077,,888-758-4389,E,,Public,24 hours daily,,,2,,,ChargePoint Network,http://www.chargepoint.com/,GPS,42.602394,-73.790830,01/23/2021,152276,2021-01-23 00:19:13,,,,,J1772
ELEC,45 RESEARCH WAY,45 Research Way,45 RESEARCH #1,Setauket- East Setauket,NY,11733,,888-758-4389,E,,Public,24 hours daily,,,2,,,ChargePoint Network,http://www.chargepoint.com/,GPS,40.904465,-73.087780,01/23/2021,147496,2021-01-23 00:19:13,,,,,J1772
ELEC,HYATT PLACE,5020 Main Street,HOTEL AMHERST 1; Near Hyatt Place Buffalo/AmherstHOTEL AMHERST 2; Near Hyatt Place Buffalo/Amherst,Amherst,NY,14226,,888-758-4389,E,,Public,24 hours daily,,,4,,,ChargePoint Network,http://www.chargepoint.com/,200-9,42.960632,-78.769636,01/23/2021,150805,2021-01-23 00:19:13,,,,,J1772
ELEC,Village of Union Springs,26 Creamery Rd,,Union Springs,NY,13160,,866-816-7584,E,,Public,24 hours daily; Also accepts Paypal,A D M V,,2,,,EV Connect,http://evconnect.com/,GPS,42.844732,-76.695984,04/08/2020,155077,2020-04-08 12:29:55,LG,,,04/24/2019,J1772
ELEC,Quik Park Brooklyn Bridge LLC - Tesla Destination,4 Joralemon St,,Brooklyn,NY,11201,,718-488-0099  877-798-3752,E,,Public,24 hours daily; see valet for access,,,3,,,Tesla Destination,https://www.tesla.com/destination-charging,200-8,40.693949,-74.000250,11/03/2020,114904,2020-11-18 00:06:10,P,,,01/01/2016,J1772 TESLA
ELEC,Shops at Skyview center,"40-24 College Point Blvd, Suite B215",,Flushing,NY,11354,,833-632-2778,E,,Public,24 hours daily,,,1,3,,Electrify America,https://www.electrifyamerica.com/,GPS,40.756191,-73.836298,01/23/2021,146876,2021-01-23 01:23:19,,,,,CHADEMO J1772 J1772COMBO
ELEC,NATIONAL GRID,Campus Loop Rd,SUNY IT; SUNY IT Student center parking lot C,Utica,NY,13502,,888-758-4389,E,,Public,24 hours daily,,,2,,,ChargePoint Network,http://www.chargepoint.com/,GPS,43.135329,-75.227342,01/23/2021,162236,2021-01-23 00:19:13,,,,,J1772
ELEC,Quik Park Columbia Garage LLC - Tesla Destination,250 W. 97th St,,New York,NY,10025,,212-864-9352  877-798-3752,E,,Public,24 hours daily; see valet for access,,,3,,,Tesla Destination,https://www.tesla.com/destination-charging,200-8,40.795279,-73.971688,11/03/2020,115069,2020-11-18 00:06:10,P,,,01/01/2016,J1772 TESLA
ELEC,Bottle Bargains,1033 Fort Salonga Rd,,Northport,NY,11768,,800-663-5633,E,,Public,MO: Not Specified; TU: Not Specified; WE: Not Specified; TH: Not Specified; FR: Not Specified; SA: Not Specified; SU: Not Specified,,,2,,,SemaCharge Network,https://semaconnect.com/,GPS,40.908117,-73.315463,01/23/2021,148165,2021-01-23 00:11:44,,,,,J1772
ELEC,MARKET 32 EV,290 Saratoga Rd,290 SARATOGA RD; In front of store,Schenectady,NY,12302,,888-758-4389,E,,Public,24 hours daily,,,2,,,ChargePoint Network,http://www.chargepoint.com/,GPS,42.873020,-73.929504,01/23/2021,152282,2021-01-23 00:19:13,,,,,J1772
ELEC,Icon 80 Riverside Blvd - Tesla Destination,80 Riverside Blvd,,New York,NY,10069,,212-245-1840  877-798-3752,E,,Public,24 hours daily; see valet for access,,,3,,,Tesla Destination,https://www.tesla.com/destination-charging,200-9,40.775054,-73.989946,11/03/2020,115187,2020-11-18 00:06:10,P,,,08/15/2016,J1772 TESLA
ELEC,KEELER BMW,1111 Troy-Schenectady Road,STATION 01; -,Latham,NY,12110,,888-758-4389,E,,Public,24 hours daily,,,1,,,ChargePoint Network,http://www.chargepoint.com/,GPS,42.766981,-73.814216,01/23/2021,162444,2021-01-23 00:19:13,,,,,J1772
ELEC,PANYNJ,LGA West Garage LaGuardia Airport,LGA WEST 3; -LGA WEST 4; -,East Elmhurst,NY,11371,,888-758-4389,E,,Public,24 hours daily,,,2,,,ChargePoint Network,http://www.chargepoint.com/,GPS,40.773009,-73.875324,01/23/2021,162287,2021-01-23 00:19:13,,,,,J1772
ELEC,EPLLC,136 Transistor Pkwy,LOCKHEED 6,Liverpool,NY,13088,,888-758-4389,E,,Public,24 hours daily,,,2,,,ChargePoint Network,http://www.chargepoint.com/,GPS,43.106487,-76.187960,01/23/2021,145761,2021-01-23 00:19:13,,,,,J1772
ELEC,The Nature Conservancy,250 Lawrence Hill Rd,,Cold Spring Harbor,NY,11724,,866-816-7584,E,,Public - Credit card at all times,24 hours daily; Also accepts PayPal and Apple Pay,A D M V,,2,,,EV Connect,http://evconnect.com/,GPS,40.857202,-73.453666,12/03/2020,168452,2020-12-03 22:33:12,LG,,,10/08/2020,J1772
ELEC,Crowne Plaza Lake Placid - Tesla Destination,101 Olympic Dr,,Lake Placid,NY,12946,,518-523-2556  877-798-3752,E,,Public,24 hours daily; for customer use only; see front desk for access,,,2,,,Tesla Destination,https://www.tesla.com/destination-charging,200-8,44.285832,-73.986802,11/03/2020,150742,2020-11-18 00:06:10,P,,,09/30/2019,TESLA
ELEC,TRANSITION,39 Elm St,DELHI; In the back of the parking lot,Delhi,NY,13753,,888-758-4389,E,,Public,24 hours daily,,,2,,,ChargePoint Network,http://www.chargepoint.com/,GPS,42.273618,-74.917881,01/23/2021,162392,2021-01-23 00:19:13,,,,,J1772
ELEC,Icon Parking 200 E 32nd Street - Tesla Destination,200 E 32nd St,,New York,NY,10016,,212-684-2481  877-798-3752,E,,Public,24 hours daily; see valet for access,,,3,,,Tesla Destination,https://www.tesla.com/destination-charging,200-9,40.744029,-73.978952,11/03/2020,115039,2020-11-18 00:06:10,P,,,03/01/2017,J1772 TESLA
ELEC,New Roc Parking Deck,33 Lecount Pl,,New Rochelle,NY,10801,,877-455-3833,E,,Public - Card key at all times,24 hours daily,,,,6,,eVgo Network,https://www.evgo.com/,GPS,40.911425,-73.779194,01/23/2021,125756,2021-01-23 01:19:54,,,,,CHADEMO J1772COMBO
ELEC,ROSENBLUM300,187 Wolf Rd,187 WOLF RD,Albany,NY,12205,,888-758-4389,E,,Public,24 hours daily,,,2,,,ChargePoint Network,http://www.chargepoint.com/,GPS,42.722447,-73.800636,01/23/2021,121068,2021-01-23 00:19:13,,,,,J1772
ELEC,Sherman Parking - Tesla Destination,26 S 6th St,,Brooklyn,NY,11211,,718-243-2688  877-798-3752,E,,Public,24 hours daily; pay lot; see valet for access,,,4,,,Tesla Destination,https://www.tesla.com/destination-charging,200-8,40.711558,-73.967572,11/03/2020,122472,2020-11-18 00:06:10,P,,,03/01/2019,TESLA
ELEC,Icon Parking E 48th Street - Tesla Destination,329 E 48th St,,New York,NY,10017,,877-727-5464  877-798-3752,E,,Public,24 hours daily; see valet for access,,,3,,,Tesla Destination,https://www.tesla.com/destination-charging,200-8,40.753230,-73.967990,11/03/2020,115097,2020-11-18 00:06:10,P,,,01/01/2016,J1772 TESLA
ELEC,COMFORT- CHARGE,4054 ny-9l,WINGATE 1.1WINGATE 1.2WINGATE 1.3,Lake George,NY,12845,,888-758-4389,E,,Public,24 hours daily,,,6,,,ChargePoint Network,http://www.chargepoint.com/,200-9,43.411060,-73.708550,01/23/2021,170683,2021-01-23 00:19:13,,,,,J1772
ELEC,iPark NYC 61 Jane Street - Tesla Destination,61 Jane St,,New York,NY,10014,,855-472-7569  877-798-3752,E,,Public,24 hours daily; for customer use only; see valet for access,,,3,,,Tesla Destination,https://www.tesla.com/destination-charging,200-9,40.738222,-74.005908,11/03/2020,115173,2020-11-18 00:06:10,P,,,01/01/2016,J1772 TESLA
ELEC,The Point Resort - Tesla Destination,222 Beaverwood Rd,,Saranac Lake,NY,12983,,518-891-5674  877-798-3752,E,,Public,24 hours daily; for customer use only; see front desk for access,,,3,,,Tesla Destination,https://www.tesla.com/destination-charging,200-9,44.303141,-74.330399,11/03/2020,115233,2020-11-18 00:06:10,P,,,03/01/2015,J1772 TESLA
ELEC,Pawling - Chamber of Commerce,55 Charles Colman Blvd,,Pawling,NY,12564,,866-816-7584,E,,Public,24 hours daily,,,1,,,EV Connect,http://evconnect.com/,GPS,41.563513,-73.601015,04/08/2020,123119,2020-04-08 12:29:55,LG,,,04/01/2019,J1772
ELEC,AL SIGL,3399 S Winton Rd,WINTON,Rochester,NY,14623,,888-758-4389,E,,Public,24 hours daily,,,2,,,ChargePoint Network,http://www.chargepoint.com/,GPS,43.083538,-77.583260,01/23/2021,163585,2021-01-23 00:19:13,,,,,J1772
ELEC,ULSTER COUNTY,491 Cottekill Rd,"SUNY ULSTER; Ulster County's fee for public charging is $0.50 per hour, effective 1-1-2020.",Stone Ridge,NY,12484,,888-758-4389,E,,Public,24 hours daily,,,2,,,ChargePoint Network,http://www.chargepoint.com/,GPS,41.851332,-74.130956,01/23/2021,123389,2021-01-23 00:19:13,,,,,J1772
ELEC,Emerson Street - Parking Lot,880 Emerson St,,Rochester,NY,14613,,866-816-7584,E,,Public,24 hours daily,,,4,,,EV Connect,http://evconnect.com/,GPS,43.174415,-77.653809,04/08/2020,123139,2020-04-08 12:29:55,P,,,04/01/2019,J1772
ELEC,The Lodge at Gore Mountain - Becks Tavern,881 Peaceful Valley,,North Creek,NY,12853,,866-816-7584,E,,Public,24 hours daily; Also accepts Paypal,A D M V,,2,,,EV Connect,http://evconnect.com/,GPS,43.686398,-73.990326,04/08/2020,154923,2020-04-08 12:29:55,P,,,04/15/2019,J1772
ELEC,577 Baltic Street - Adam America Real Estate - Tesla Destination,577 Baltic Street,,Brooklyn,NY,11217,,718-422-1577  877-798-3752,E,,Public,24 hours daily; for customer use only; see front desk for access,,,4,,,Tesla Destination,https://www.tesla.com/destination-charging,200-9,40.681251,-73.981971,11/03/2020,168557,2020-11-18 00:06:10,P,,,11/03/2020,TESLA
ELEC,Sky Zone Trampoline Park,33 LeCount Pl,,New Rochelle,NY,10801,,866-816-7584,E,,Public,Business hours,,,4,,,EV Connect,http://evconnect.com/,200-9,40.911315,-73.779296,04/08/2020,94853,2020-04-08 12:29:55,P,,,03/28/2016,J1772
ELEC,Enterprise Parking 545 Washington Ave - Tesla Destination,545 Washington Ave,,Brooklyn,NY,11238,,347-889-6642  877-798-3752,E,,Public,24 hours daily; pay lot; see valet for access,,,4,,,Tesla Destination,https://www.tesla.com/destination-charging,200-9,40.681876,-73.964169,11/03/2020,150573,2020-11-18 00:06:10,P,,,09/30/2019,TESLA
ELEC,TOWNE AVW,5255 Genesee street,STATION 1; Located Next To Service Waiting Room,Bowmansville,NY,14026,,888-758-4389,E,,Public,24 hours daily,,,2,,,ChargePoint Network,http://www.chargepoint.com/,GPS,42.939898,-78.687331,01/23/2021,162427,2021-01-23 00:19:13,,,,,J1772
ELEC,imPark 101 Bedford Ave - Tesla Destination,101  Bedford Ave,,Brooklyn,NY,11211,,718-387-1737  877-798-3752,E,,Public,24 hours daily; pay lot; see valet for access,,,3,,,Tesla Destination,https://www.tesla.com/destination-charging,200-9,40.720014,-73.954550,11/03/2020,114918,2020-11-18 00:06:10,P,,,11/01/2018,J1772 TESLA
ELEC,Fairport Village Landing,260 Fairport Village Landing,,Fairport,NY,14450,,855-900-7584,E,,Public,24 hours daily,,,,1,,Greenlots,http://greenlots.com/,GPS,43.101154,-77.443126,01/23/2021,170901,2021-01-23 01:21:30,,,,,CHADEMO J1772COMBO
ELEC,RXR REALTY,333 Earle Ovington Blvd,OMNI,Uniondale,NY,11553,,888-758-4389,E,,Public,24 hours daily,,,2,,,ChargePoint Network,http://www.chargepoint.com/,GPS,40.725338,-73.593701,01/23/2021,143209,2021-01-23 00:19:13,,,,,J1772
ELEC,Capital Region Welcome Center,I-87 N,,Hannacroix,NY,12087,,518-436-2831,E,,Public,Welcome center business hours,,,,2,,Non-Networked,,GPS,42.428584,-73.802626,03/03/2020,117743,2020-03-03 21:13:47,P,,,01/01/2019,CHADEMO J1772COMBO
ELEC,165 E 77 ST Garage,165 E 77th Street,Attendant will assist in charging vehicle.  Parking rates apply. Inquire within.,Manhattan,NY,10075,,888-998-2546,E,,Public,MON: 24 hours | TUE: 24 hours | WED: 24 hours | THU: 24 hours | FRI: 24 hours | SAT: 24 hours | SUN: 24 hours,,,1,,,Blink Network,http://www.blinkcharging.com/,GPS,40.773528,-73.959538,01/22/2021,163507,2021-01-22 22:55:21,,,,,J1772
ELEC,JLRWHITEPLAINS,265 east Main Street,STATION 01; Main lot,White Plains,NY,10601,,888-758-4389,E,,Public,24 hours daily,,,1,,,ChargePoint Network,http://www.chargepoint.com/,GPS,41.034269,-73.764702,01/23/2021,162281,2021-01-23 00:19:13,,,,,J1772
ELEC,TICONDEROGA,1494 Mccormick St,TOWER AVE,Ticonderoga,NY,12883,,888-758-4389,E,,Public,24 hours daily,,,2,,,ChargePoint Network,http://www.chargepoint.com/,GPS,43.849277,-73.422200,01/23/2021,154560,2021-01-23 00:19:13,,,,,J1772
ELEC,Icon Parking Independent - Tesla Destination,417  E 71st St,,New York,NY,10021,,212-288-6874  877-798-3752,E,,Public,24 hours daily; for customer use only; see valet for access,,,3,,,Tesla Destination,https://www.tesla.com/destination-charging,200-8,40.766976,-73.955645,11/03/2020,115129,2020-11-18 00:06:10,P,,,09/01/2017,J1772 TESLA
ELEC,BEVERWYCK,10 Autumn Dr,STATION 3,Slingerlands,NY,12159,,888-758-4389,E,,Public,24 hours daily,,,2,,,ChargePoint Network,http://www.chargepoint.com/,GPS,42.655716,-73.839830,01/23/2021,164422,2021-01-23 00:19:13,,,,,J1772
ELEC,The Farmhouse Bed and Breakfast - Tesla Destination,1855 Depot Ln,,Cutchogue,NY,11935,,631-734-8539  877-798-3752,E,,Public - Call ahead,24 hours daily; for customer use only,,,2,,,Tesla Destination,https://www.tesla.com/destination-charging,200-9,41.015587,-72.489904,11/03/2020,114931,2020-11-18 00:06:10,P,,,09/01/2016,J1772 TESLA
ELEC,Icon Parking 155 E 29th Street - Tesla Destination,155 E 29th St,,New York,NY,10016,,212-684-8259  877-798-3752,E,,Public,24 hours daily; see valet for access,,,3,,,Tesla Destination,https://www.tesla.com/destination-charging,200-9,40.742968,-73.980565,11/03/2020,115022,2020-11-18 00:06:10,P,,,05/01/2016,J1772 TESLA
ELEC,PV Parking 34-11 Steinway - Tesla Destination,34-11 Steinway St,,Astoria,NY,11101,,718-609-1200  877-798-3752,E,,Public,24 hours daily; pay lot; see valet for access,,,4,,,Tesla Destination,https://www.tesla.com/destination-charging,200-9,40.755508,-73.922168,11/03/2020,150584,2020-11-18 00:06:10,P,,,09/30/2019,TESLA
ELEC,RTS,Rochester Tech Park Building 1 777 Elmgrove Rd,ROCH TECH PK1; -ROCH TECH PK2; -,Rochester,NY,14624,,888-758-4389,E,,Public,24 hours daily,,,4,,,ChargePoint Network,http://www.chargepoint.com/,GPS,43.153140,-77.734570,01/23/2021,164272,2021-01-23 00:19:13,,,,,J1772
ELEC,Hampton Inn LaGuardia Airport - Tesla Destination,102-40 Ditmars Blvd,,East Elmhurst,NY,11369,,718-672-6600  877-798-3752,E,,Public,24 hours daily; for customer use only; see front desk for access,,,2,,,Tesla Destination,https://www.tesla.com/destination-charging,200-9,40.767871,-73.867659,11/03/2020,114937,2020-11-18 00:06:10,P,,,03/01/2017,J1772 TESLA
ELEC,OSSINING,101 NY-9A,"EV 1; Drive into driveway, on the right hand side of property",Ossining,NY,10562,,888-758-4389,E,,Public,24 hours daily,,,2,,,ChargePoint Network,http://www.chargepoint.com/,GPS,41.178694,-73.840619,01/23/2021,162463,2021-01-23 00:19:13,,,,,J1772
ELEC,CLARKSON UNVER,"16A,16B Pierrepont Ave",OLD MAIN LOT 1; South End Old Main,Potsdam,NY,13676,,888-758-4389,E,,Public,24 hours daily,,,2,,,ChargePoint Network,http://www.chargepoint.com/,GPS,44.667642,-74.980490,01/23/2021,162484,2021-01-23 00:19:13,,,,,J1772
ELEC,BEST WESTERN PL,6605 Old Collamer Rd S,BEST 1.1; -BEST 1.2; -,East Syracuse,NY,13057,,888-758-4389,E,,Public,24 hours daily,,,4,,,ChargePoint Network,http://www.chargepoint.com/,200-9,43.090362,-76.086324,01/23/2021,169911,2021-01-23 00:19:13,,,,,J1772
ELEC,HOTSARA CHARGER,100 Main St,STATION 1; Hotel side parking lot,Saranac Lake,NY,12983,,888-758-4389,E,,Public,24 hours daily,,,2,,,ChargePoint Network,http://www.chargepoint.com/,GPS,44.326862,-74.130150,01/23/2021,149787,2021-01-23 00:19:13,,,,,J1772
ELEC,Mirabito Convenience Store #69 - Tesla Supercharger,4968 NY-23,,Oneonta,NY,13820,,877-798-3752,E,,Public,24 hours daily; for Tesla use only,,,,8,,Tesla,http://www.teslamotors.com/supercharger,GPS,42.447772,-75.048700,08/10/2020,153792,2020-08-27 20:39:12,P,,,02/14/2020,TESLA
ELEC,SUNY NEW PALTZ,10 Southside Loop,WALLKILL 3,New Paltz,NY,12561,,888-758-4389,E,,Public,24 hours daily,,,2,,,ChargePoint Network,http://www.chargepoint.com/,GPS,41.741484,-74.088126,01/23/2021,122786,2021-01-23 00:19:13,,,,,J1772
ELEC,Cliff's Elbow Too,1085 Franklinville Rd,Located at Main Rd and Aldrich Ln,Laurel,NY,11948,,631-298-3262,E,,Public,24 hours daily,,,1,,,Non-Networked,,200-8,40.968038,-72.562787,03/03/2020,64705,2020-03-03 21:13:47,P,,,08/01/2014,J1772
ELEC,PUBLIC RESTROOM,56 Rock City Rd Woodstock Community Ctr.,WOODSTOCK COMMU; Parking lot in frt of the community center,Woodstock,NY,12498,,888-758-4389,E,,Public,24 hours daily,,,2,,,ChargePoint Network,http://www.chargepoint.com/,GPS,42.044798,-74.118166,01/23/2021,162253,2021-01-23 00:19:13,,,,,J1772
ELEC,Union College,450 Nott St,,Schenectady,NY,12308,,866-816-7584,E,,Public,24 hours daily; Also accepts Paypal,A D M V,,4,,,EV Connect,http://evconnect.com/,GPS,42.820404,-73.935231,04/08/2020,154918,2020-04-08 12:29:55,P,,,04/02/2019,J1772
ELEC,Bristol Harbour Resort,5410 Seneca Point Rd,,Canandaigua,NY,14424,,585-396-0060,E,,Public,Resort business hours; guest and visitor use only,,,1,,,Non-Networked,,GPS,42.753957,-77.336811,06/09/2020,62508,2020-06-09 16:47:26,P,,,07/15/2014,J1772
ELEC,SAVARINO COMPAN,BRL Parking Lot 3rd from Building  1 South Street,BRL 5; -,Buffalo,NY,14204,,888-758-4389,E,,Public,24 hours daily,,,2,,,ChargePoint Network,http://www.chargepoint.com/,GPS,42.863697,-78.868096,01/23/2021,164154,2021-01-23 00:19:13,,,,,J1772
ELEC,CVS Pharmacy,7568 N Broadway,,Red Hook,NY,12571,,877-455-3833,E,,Public - Card key at all times,24 hours daily,,,,1,,eVgo Network,https://www.evgo.com/,GPS,41.997812,-73.873310,01/23/2021,93379,2021-01-23 01:19:54,,,,,CHADEMO J1772COMBO
ELEC,VILLAGE HALL,12-40 Water St,WELCOME CENTER; Near front entrance,Brockport,NY,14420,,888-758-4389,E,,Public,24 hours daily,,,2,,,ChargePoint Network,http://www.chargepoint.com/,GPS,43.215696,-77.937193,01/23/2021,162322,2021-01-23 00:19:13,,,,,J1772
ELEC,Parkit 200 West End Ave - Tesla Destination,200 West End Ave,,New York,NY,10023,,877-798-3752  877-798-3752,E,,Public,24 hours daily; for customer use only; see front desk for access,,,5,,,Tesla Destination,https://www.tesla.com/destination-charging,200-9,40.777982,-73.985407,11/03/2020,169014,2020-11-18 00:06:10,P,,,11/03/2020,J1772 TESLA
ELEC,New Castle Town,200 S Greeley Ave,,Chappaqua,NY,10514,,866-816-7584,E,,Public,24 hours daily,,,1,,,EV Connect,http://evconnect.com/,GPS,41.155422,-73.774644,04/08/2020,123079,2020-04-08 12:29:55,LG,,,04/01/2019,J1772
ELEC,Dana Ford Lincoln,266 W Service Rd,,Staten Island,NY,10314,,718-983-8700,E,,Public - Call ahead,Dealership business hours; for customer use only,,,1,,,Non-Networked,,GPS,40.587162,-74.194747,09/03/2020,64140,2020-09-03 19:35:48,P,,,11/01/2014,J1772
ELEC,Finger Lakes Welcome Center,35 Lake Front Dr,,Geneva,NY,14456,,315-787-0052,E,,Public,24 hours daily; no overnight parking,,,4,,,Non-Networked,,GPS,42.870128,-76.977625,06/09/2020,117604,2020-06-09 16:47:26,P,,,05/01/2018,J1772
ELEC,Town of Dickinson,531 Old Front St,,Binghamton,NY,13905,,866-816-7584,E,,Public,24 hours daily,,,2,,,EV Connect,http://evconnect.com/,200-9,42.119780,-75.912473,04/08/2020,94828,2020-04-08 12:29:55,LG,,,07/12/2017,J1772
ELEC,Thruway Nissan,79 Route 17K,,Newburgh,NY,12550,,845-562-1000,E,,Public - Call ahead,Dealership business hours,,,1,,,Non-Networked,,200-9,41.504105,-74.068916,06/09/2020,44174,2020-06-09 16:47:26,P,,,11/30/2011,J1772
ELEC,MUNICIPAL EVSE,175 Dix Ave,EASTFIELD PARK,Glens Falls,NY,12801,,888-758-4389,E,,Public,24 hours daily,,,2,,,ChargePoint Network,http://www.chargepoint.com/,GPS,43.317240,-73.627280,01/23/2021,155244,2021-01-23 00:19:13,,,,,J1772
ELEC,CASE CENTER LOT,Case Center Dr,CASE LOT; Case lot near community gardens.,Saratoga Springs,NY,12866,,888-758-4389,E,,Public,24 hours daily,,,2,,,ChargePoint Network,http://www.chargepoint.com/,GPS,43.096185,-73.786437,01/23/2021,162371,2021-01-23 00:19:13,,,,,J1772
ELEC,GGMC Parking E 74th Street - Tesla Destination,300  E 74th St,,New York,NY,10021,,212-988-8026  877-798-3752,E,,Public,24 hours daily; see valet for access,,,3,,,Tesla Destination,https://www.tesla.com/destination-charging,200-8,40.769925,-73.957476,11/03/2020,115084,2020-11-18 00:06:10,P,,,03/01/2017,J1772 TESLA
ELEC,Bay Ridge Municipal Parking Garage,8501 5th Ave,Located on the 3rd floor,Brooklyn,NY,11209,,718-439-5699  866-816-7584,E,,Public,24 hours daily,,,5,,,EV Connect,http://evconnect.com/,200-8,40.622150,-74.025650,04/08/2020,65288,2020-04-08 12:29:55,LG,,,06/01/2015,J1772
ELEC,LOUGHLIN DAWN,271 Fuller Rd,SANDIDGE 1.1; Front apartment building parking lot of 100 sandidge way,Albany,NY,12203,,888-758-4389,E,,Public,24 hours daily,,,2,,,ChargePoint Network,http://www.chargepoint.com/,GPS,42.687836,-73.833130,01/23/2021,169976,2021-01-23 00:19:13,,,,,J1772
ELEC,Holiday Inn Express Olean - Tesla Destination,101 Main St,,Olean,NY,14760,,716-375-1000  877-798-3752,E,,Public - Call ahead,24 hours daily; for customer use only,,,3,,,Tesla Destination,https://www.tesla.com/destination-charging,200-9,42.087509,-78.429090,11/03/2020,115202,2020-11-18 00:06:10,P,,,11/01/2018,J1772 TESLA
ELEC,Hilton,598 Broadhollow Rd,,Melville,NY,11747,,866-816-7584,E,,Public - Call ahead,24 hours daily; for hotel guest use only,,,1,,,EV Connect,http://evconnect.com/,200-8,40.763790,-73.423658,04/08/2020,94850,2020-04-08 12:29:55,P,,,04/03/2016,J1772
ELEC,Best Western Maple City Inn - Tesla Destination,1 Canisteo Square,,Hornell,NY,14843,,607-324-4300  877-798-3752,E,,Public,24 hours daily; for customer use only; see front desk for access,,,3,,,Tesla Destination,https://www.tesla.com/destination-charging,200-9,42.322850,-77.662418,11/03/2020,114952,2020-11-18 00:06:10,P,,,11/01/2018,J1772 TESLA
ELEC,ATLANTIC HONDA,1375 Sunrise Hwy,ATLANTIC; LOCATED IN REAR OF BUILDING,Bay Shore,NY,11706,,888-758-4389,E,,Public,24 hours daily,,,2,,,ChargePoint Network,http://www.chargepoint.com/,GPS,40.734634,-73.257183,01/23/2021,162140,2021-01-23 00:19:13,,,,,J1772
ELEC,Village of Spencerport - Town Hall,27 West Ave,Located behind the Village office at South Union Street (Rt. 259),Spencerport,NY,14559,,585-352-4771,E,,Public,24 hours daily,,,2,,,Non-Networked,,GPS,43.191311,-77.801933,06/09/2020,63140,2020-06-09 16:47:26,LG,,,07/20/2014,J1772
ELEC,EDISONPARKFAST,92 Livingston St,LOC # 75,new york,NY,11201,,888-758-4389,E,,Public,24 hours daily,,,1,,,ChargePoint Network,http://www.chargepoint.com/,GPS,40.690920,-73.990464,01/23/2021,162408,2021-01-23 00:19:13,,,,,J1772
ELEC,Paumanok Vineyards - Tesla Destination,1074 Main Rd,,Aquebogue,NY,11931,,631-722-8800  877-798-3752,E,,Public - Call ahead,24 hours daily; for customer use only,,,1,,,Tesla Destination,https://www.tesla.com/destination-charging,GPS,40.948725,-72.602594,11/03/2020,114880,2020-11-18 00:06:10,P,,,09/01/2017,TESLA
ELEC,Continuum - Tesla Destination,55 Bank St,,White Plains,NY,10606,,914-368-9151  877-798-3752,E,,Public,24 hours daily; pay lot; see valet for access,,,8,,,Tesla Destination,https://www.tesla.com/destination-charging,200-9,41.029402,-73.774815,11/03/2020,115248,2020-11-18 00:06:10,P,,,11/01/2018,J1772 TESLA
ELEC,Icon 376 Greenwich Street - Tesla Destination,376 Greenwich St,,New York,NY,10013,,212-227-7035  877-798-3752,E,,Public,24 hours daily; for customer use only; see valet for access,,,3,,,Tesla Destination,https://www.tesla.com/destination-charging,200-8,40.719814,-74.010394,11/03/2020,115112,2020-11-18 00:06:10,P,,,09/01/2017,J1772 TESLA
ELEC,Champion Parking W 57th Street - Tesla Destination,320 W 57th St,,New York,NY,10019,,212-308-5959  877-798-3752,E,,Public,24 hours daily; see valet for access,,,3,,,Tesla Destination,https://www.tesla.com/destination-charging,200-9,40.767194,-73.984544,11/03/2020,115095,2020-11-18 00:06:10,P,,,01/01/2016,J1772 TESLA
ELEC,ProPark 110-45 Queens Blvd - Tesla Destination,110-45 Queens Blvd,,Forest Hills,NY,11375,,718-793-8096  877-798-3752,E,,Public,24 hours daily; pay lot; see valet for access,,,4,,,Tesla Destination,https://www.tesla.com/destination-charging,200-9,40.719610,-73.839340,11/03/2020,150614,2020-11-18 00:06:10,P,,,09/30/2019,TESLA
ELEC,SHELDON SUFFERN,128 Orange Ave,ORANGE APT 2ORANGE AV APT 1,Suffern,NY,10901,,888-758-4389,E,,Public,24 hours daily,,,4,,,ChargePoint Network,http://www.chargepoint.com/,200-9,41.115126,-74.153754,01/23/2021,122632,2021-01-23 00:19:13,,,,,J1772
ELEC,MPG 266 E 97 St - Tesla Destination,266 E 97th St,,New York,NY,10021,,212-410-5270  877-798-3752,E,,Public,24 hours daily; see valet for access,,,3,,,Tesla Destination,https://www.tesla.com/destination-charging,200-8,40.784771,-73.946728,11/03/2020,115073,2020-11-18 00:06:10,P,,,09/01/2017,J1772 TESLA
ELEC,Cayuga Heights Village Court,836 Hanshaw Rd,,Ithaca,NY,14850,,866-816-7584,E,,Public,24 hours daily,,,1,,,EV Connect,http://evconnect.com/,GPS,42.469472,-76.478871,04/08/2020,123137,2020-04-08 12:29:55,LG,,,04/01/2019,J1772
ELEC,LIVEWIRE,2428 Sunrise Hwy,DCFAST HOG OUT; Outside - Customer facing,Bellmore,NY,11710,,888-758-4389,E,,Public,24 hours daily,,,,1,,ChargePoint Network,http://www.chargepoint.com/,GPS,40.665961,-73.536912,01/23/2021,143298,2021-01-23 00:19:13,,,,,J1772COMBO
ELEC,Market 32,19 Centre Dr,,Plattsburgh,NY,12901,,518-562-3560,E,,Public,24 hours daily,,,2,,,Non-Networked,,200-9,44.695363,-73.492162,03/03/2020,65281,2020-03-03 21:13:47,SG,,,11/01/2014,J1772
ELEC,RJCL,9091 NY-22,PARKING 1,Hillsdale,NY,12529,,888-758-4389,E,,Public,24 hours daily,,,2,,,ChargePoint Network,http://www.chargepoint.com/,GPS,42.167957,-73.517820,01/23/2021,166204,2021-01-23 00:19:13,,,,,J1772
ELEC,Hampton Inn Cortland - Tesla Destination,26 River St,,Cortland,NY,13045,,607-662-0007  877-798-3752,E,,Public,24 hours daily; for customer use only; see front desk for access,,,2,,,Tesla Destination,https://www.tesla.com/destination-charging,200-8,42.606836,-76.164117,11/03/2020,114929,2020-11-18 00:06:10,P,,,08/15/2016,J1772 TESLA
ELEC,TRAIL BREAK,1299 U.S. 9,"TRAIL BREAK 1; 1 mile off Exit 28. Turn right onto US Route 9, 1 mile south on right side",Schroon Lake,NY,12870,,888-758-4389,E,,Public,24 hours daily,,,2,,,ChargePoint Network,http://www.chargepoint.com/,GPS,43.851345,-73.757660,01/23/2021,144979,2021-01-23 00:19:13,,,,,J1772
ELEC,Hampton Inn Corning/Painted Post - Tesla Destination,248 Town Center Rd,,Painted Post,NY,14870,,607-936-5020  877-798-3752,E,,Public,24 hours daily; for customer use only; see front desk for access,,,3,,,Tesla Destination,https://www.tesla.com/destination-charging,200-9,42.149988,-77.108033,11/03/2020,115207,2020-11-18 00:06:10,P,,,11/01/2018,J1772 TESLA
ELEC,Gurneys Montauk Resort & Spa - Tesla Destination,290 Old Montauk Hwy,,Montauk,NY,11954,,877-798-3752  877-798-3752,E,,Public,24 hours daily; for customer use only; see front desk for access,,,5,,,Tesla Destination,https://www.tesla.com/destination-charging,200-9,41.015489,-71.992316,11/03/2020,168812,2020-11-18 00:06:10,P,,,11/03/2020,J1772 TESLA
ELEC,1 Hotel Brooklyn Bridge - Tesla Destination,60 Furman St,,Brooklyn,NY,11201,,877-803-1111  877-798-3752,E,,Public,24 hours daily; see valet for access,,,7,,,Tesla Destination,https://www.tesla.com/destination-charging,200-9,40.702241,-73.995539,11/03/2020,114908,2020-11-18 00:06:10,P,,,09/01/2017,J1772 TESLA
ELEC,Dune Deck - Tesla Destination,379 Dune Rd,,Westhampton Beach,NY,11978,,631-998-0050  877-798-3752,E,,Public,24 hours daily; for customer use only; see front desk for access,,,2,,,Tesla Destination,https://www.tesla.com/destination-charging,200-9,40.789543,-72.662605,11/03/2020,115247,2020-11-18 00:06:10,P,,,11/01/2018,TESLA
ELEC,ROSEWOOD PLAZA,New Karner Rd & Watervliet Shaker Rd,STATION 1STATION 3,Albany,NY,12205,,888-758-4389,E,,Public,24 hours daily,,,4,,,ChargePoint Network,http://www.chargepoint.com/,GPS,42.742780,-73.839290,01/23/2021,168352,2021-01-23 00:19:13,,,,,J1772
ELEC,TRANSITION,48 Walnut St,MARGARETVILLE; -,Margaretville,NY,12455,,888-758-4389,E,,Public,24 hours daily,,,2,,,ChargePoint Network,http://www.chargepoint.com/,GPS,42.148730,-74.649075,01/23/2021,162391,2021-01-23 00:19:13,,,,,J1772
ELEC,919 Third Avenue,919 3rd Avenue,Located between 2nd & 3rd Ave,Manhattan,NY,10022,,888-998-2546,E,,Public,MON: 24 hours | TUE: 24 hours | WED: 24 hours | THU: 24 hours | FRI: 24 hours | SAT: 24 hours | SUN: 24 hours,,,1,,,Blink Network,http://www.blinkcharging.com/,GPS,40.759299,-73.968603,01/22/2021,164749,2021-01-22 22:55:21,,,,,J1772
ELEC,TRISTATELUXURY,1249 E Jericho Turnpike,LOT CHARGER,Huntington,NY,11743,,888-758-4389,E,,Public,24 hours daily,,,2,,,ChargePoint Network,http://www.chargepoint.com/,GPS,40.832688,-73.359725,01/23/2021,162157,2021-01-23 00:19:13,,,,,J1772
ELEC,Rochester Optical,1260 Lyell Ave,,Rochester,NY,14606,,866-816-7584,E,,Public,24 hours daily,,,4,,,EV Connect,http://evconnect.com/,GPS,43.165109,-77.658178,06/09/2020,123065,2020-06-09 16:47:26,P,,,04/01/2019,J1772
ELEC,528 W 162nd Garage-PARK-it - Tesla Destination,528 W 162nd St,,Manhattan,NY,10033,,212-929-9404  877-798-3752,E,,Public,24 hours daily; pay lot; see valet for access,,,4,,,Tesla Destination,https://www.tesla.com/destination-charging,200-9,40.836425,-73.941393,11/03/2020,150533,2020-11-18 00:06:10,P,,,09/30/2019,TESLA
ELEC,GMC - BELMONT 1,113 E 84th St,Located between Park Ave & Lexington Ave. - Attendant will assist in charging vehicle.  Parking rates apply. Inquire within.,New York,NY,10028,,888-998-2546,E,,Public,MON: 24 hours | TUE: 24 hours | WED: 24 hours | THU: 24 hours | FRI: 24 hours | SAT: 24 hours | SUN: 24 hours,,,1,,,Blink Network,http://www.blinkcharging.com/,GPS,40.773472,-73.955287,01/22/2021,121020,2021-01-22 22:55:21,,,,,J1772
ELEC,ADIRONDACK,NY-30,EV 1; Located in front of the auditorium,Blue Mountain Lake,NY,12812,,888-758-4389,E,,Public,24 hours daily,,,2,,,ChargePoint Network,http://www.chargepoint.com/,GPS,43.869392,-74.431812,01/23/2021,162396,2021-01-23 00:19:13,,,,,J1772
ELEC,Cortlandt Train Station,2 Memorial Dr,,Cortlandt Manor,NY,10566,,866-816-7584,E,,Public,24 hours daily,,,4,,,EV Connect,http://evconnect.com/,GPS,41.244889,-73.923330,03/30/2020,94837,2020-03-30 21:09:55,P,,,04/24/2015,J1772
ELEC,Price Chopper - Tesla Supercharger,1930 Saranac Ave,,Lake Placid,NY,12946,,877-798-3752,E,,Public,24 hours daily; for Tesla use only,,,,8,,Tesla,http://www.teslamotors.com/supercharger,GPS,44.290000,-74.010000,08/10/2020,164170,2020-08-27 20:39:12,P,,,07/10/2020,TESLA
ELEC,COMPASS VW,200 Dolson Ave,WV_408157_A; -,Middletown,NY,10940,,888-758-4389,E,,Public,24 hours daily,,,2,,,ChargePoint Network,http://www.chargepoint.com/,GPS,41.427106,-74.427890,01/23/2021,162432,2021-01-23 00:19:13,,,,,J1772
ELEC,Rochester Institute of Technology - Tesla Destination,120 Lomb Memorial Dr,,Rochester,NY,14623,,877-798-3752  877-798-3752,E,,Public,24 hours daily; for customer use only; see front desk for access,,,1,,,Tesla Destination,https://www.tesla.com/destination-charging,200-8,43.091646,-77.674855,11/03/2020,169077,2020-11-18 00:06:10,P,,,11/03/2020,TESLA
ELEC,MINNEWASKA,5281 US-44,,Kerhonkson,NY,12446,,888-758-4389,E,,Public,24 hours daily,,,3,,,ChargePoint Network,http://www.chargepoint.com/,200-8,41.737841,-74.233805,01/23/2021,171409,2021-01-23 00:19:13,,,,,J1772
ELEC,WCS,2300 Southern Blvd,NS1 SOUTHERN; -,Bronx,NY,10460,,888-758-4389,E,,Public,24 hours daily,,,2,,,ChargePoint Network,http://www.chargepoint.com/,GPS,40.850625,-73.881132,01/23/2021,162156,2021-01-23 00:19:13,,,,,J1772
ELEC,Hickory Park,51 S Lake Ave,Located in the parking lot,Bergen,NY,14416,,585-494-1513,E,,Public,24 hours daily,,,2,,,Non-Networked,,GPS,43.080709,-77.943679,06/09/2020,116924,2020-06-09 16:47:26,LG,,,11/22/2018,J1772
ELEC,Charlotte Branch Library,3557 Lake Ave,,Rochester,NY,14612,,866-816-7584,E,,Public,24 hours daily,,,2,,,EV Connect,http://evconnect.com/,GPS,43.235635,-77.624667,06/09/2020,123103,2020-06-09 16:47:26,P,,,04/01/2019,J1772
ELEC,SUNY NEW PALTZ,S. Manheim Blvd.,INTERNATIONAL,New Paltz,NY,12561,,888-758-4389,E,,Public,24 hours daily,,,2,,,ChargePoint Network,http://www.chargepoint.com/,GPS,41.741984,-74.080814,01/23/2021,122790,2021-01-23 00:19:13,,,,,J1772
ELEC,Icon Parking 308 Greenwich - Tesla Destination,308 Greenwich St,,New York,NY,10013,,212-227-6940  877-798-3752,E,,Public,24 hours daily; see valet for access,,,3,,,Tesla Destination,https://www.tesla.com/destination-charging,200-9,40.717568,-74.011042,11/03/2020,115088,2020-11-18 00:06:10,P,,,05/01/2016,J1772 TESLA
ELEC,Holiday Inn Hotel & Suites Rochester - Marketplace - Tesla Destination,800 Jefferson Rd,,Rochester,NY,14623,,585-475-9190  877-798-3752,E,,Public,24 hours daily; for customer use only; see front desk for access,,,3,,,Tesla Destination,https://www.tesla.com/destination-charging,200-8,43.087417,-77.616929,11/03/2020,115226,2020-11-18 00:06:10,P,,,11/01/2018,J1772 TESLA
ELEC,Waldorf Astoria New York - Tesla Destination,310 Park Ave,,New York,NY,10022,,212-355-3000  877-798-3752,E,,Public,24 hours daily; for customer use only; see valet for access,,,2,,,Tesla Destination,https://www.tesla.com/destination-charging,200-8,40.757047,-73.974455,11/03/2020,115090,2020-11-18 00:06:10,P,,,11/01/2018,TESLA
ELEC,Homer Recreation Department,53 S Main St,,Homer,NY,13077,,866-816-7584,E,,Public,Business hours,,,2,,,EV Connect,http://evconnect.com/,200-8,42.634650,-76.178589,04/08/2020,94843,2020-04-08 12:29:55,P,,,09/13/2017,J1772
ELEC,5TH AVE,1713 5th Ave,5TH AVE TROY; Lower level 5th Avenue side,Troy,NY,12180,,888-758-4389,E,,Public,24 hours daily,,,2,,,ChargePoint Network,http://www.chargepoint.com/,GPS,42.730522,-73.688060,01/23/2021,162308,2021-01-23 00:19:13,,,,,J1772
ELEC,Essex County - Courthouse,7553 Court St,,Elizabethtown,NY,12932,,518-873-3320,E,,Public,24 hours Daily,,,2,,,Non-Networked,,200-8,44.214426,-73.594677,03/03/2020,142583,2020-03-03 21:13:47,LG,,,06/01/2019,J1772
ELEC,ULSTER COUNTY,285 Wall Street,"COURTHOUSE 1; Enter from Wall Street. Station is located at rear of parking lot near the Crown Street exit. Ulster County's fee for public charging is $0.50 per hour, effective 1-1-2020.",Kingston,NY,12401,,888-758-4389,E,,Public,24 hours daily,,,2,,,ChargePoint Network,http://www.chargepoint.com/,GPS,41.932845,-74.020676,01/23/2021,162171,2021-01-23 00:19:13,,,,,J1772
ELEC,HATCHET HARDWARE,42 SARATOGA AVE,,WATERFORD,NY,12188,,888-356-8911,E,,Public,24 hours daily,,,2,,,FLO,https://flo.ca/,GPS,42.782254,-73.696148,01/23/2021,165117,2021-01-23 01:30:20,,,,,J1772
ELEC,MP 225 LLC,100 Jay St,"NS1-100 JAY ST; Charger located in MPS parking garage level C, area 2A next to parking office",New York,NY,11201,,888-758-4389,E,,Public,24 hours daily,,,2,,,ChargePoint Network,http://www.chargepoint.com/,GPS,40.701821,-73.986824,01/23/2021,162487,2021-01-23 00:19:13,,,,,J1772
ELEC,STRAND THEATRE,3092 NY-28,THE STRAND; Side of Front Door Diner,Old Forge,NY,13420,,888-758-4389,E,,Public,24 hours daily,,,2,,,ChargePoint Network,http://www.chargepoint.com/,GPS,43.710848,-74.972152,01/23/2021,162293,2021-01-23 00:19:13,,,,,J1772
ELEC,333 Schermerhorn Garage - The Hub - Tesla Destination,333 Schermerhorn St,,Brooklyn,NY,11217,,718-395-4072  877-798-3752,E,,Public,24 hours daily; pay lot; see valet for access,,,4,,,Tesla Destination,https://www.tesla.com/destination-charging,200-9,40.687220,-73.981174,11/03/2020,150532,2020-11-18 00:06:10,P,,,09/30/2019,TESLA
ELEC,Parking Garage,2478 Jerome Ave,,Bronx,NY,10468,,866-816-7584,E,,Public,Garage business hours,,,3,,,EV Connect,http://evconnect.com/,200-8,40.863131,-73.900529,04/08/2020,94830,2020-04-08 12:29:55,P,,,01/08/2015,J1772
ELEC,COLE GROUP,4025 Doorstone Dr,COLONIE EAST 1,Latham,NY,12110,,888-758-4389,E,,Public,24 hours daily,,,2,,,ChargePoint Network,http://www.chargepoint.com/,GPS,42.745777,-73.768845,01/23/2021,154060,2021-01-23 00:19:13,,,,,J1772
ELEC,Icon Parking 220 Riverside Blvd - Tesla Destination,220 Riverside Blvd,,New York,NY,10024,,212-501-0016  877-798-3752,E,,Public,24 hours daily; see valet for access,,,6,,,Tesla Destination,https://www.tesla.com/destination-charging,200-9,40.779750,-73.987272,11/03/2020,115054,2020-11-18 00:06:10,P,,,01/01/2016,J1772 TESLA
ELEC,NORDEN LOFTS,121 Westmoreland Ave,NORDEN LOFTS 1; East side of bldg.NORDEN LOFTS 2; West side of bldg,White Plains,NY,10606,,888-758-4389,E,,Public,24 hours daily,,,4,,,ChargePoint Network,http://www.chargepoint.com/,200-9,41.027432,-73.777595,01/23/2021,162258,2021-01-23 00:19:13,,,,,J1772
ELEC,The William Vale Hotel - Tesla Destination,111 N 12th St,,Brooklyn,NY,11249,,718-631-8400  877-798-3752,E,,Public,24 hours daily; for customer use only; see valet for access,,,4,,,Tesla Destination,https://www.tesla.com/destination-charging,200-8,40.722362,-73.957208,11/03/2020,114919,2020-11-18 00:06:10,P,,,10/01/2016,TESLA
ELEC,MPG 530 West 30th - Tesla Destination,530 W 30th,,New York,NY,10001,,212-490-3474  877-798-3752,E,,Public,24 hours daily; see valet for access,,,3,,,Tesla Destination,https://www.tesla.com/destination-charging,200-9,40.752558,-74.002736,11/03/2020,115152,2020-11-18 00:06:10,P,,,11/01/2018,J1772 TESLA
ELEC,NATIONAL GRID,380 US-9W,CHILIS GLENMONT,Glenmont,NY,12077,,888-758-4389,E,,Public,24 hours daily,,,2,,,ChargePoint Network,http://www.chargepoint.com/,GPS,42.603303,-73.790054,01/23/2021,162197,2021-01-23 00:19:13,,,,,J1772
ELEC,Dorschel Nissan,3817 W Henrietta Rd,,Rochester,NY,14623,,585-334-9440,E,,Public - Call ahead,Dealership business hours,,,3,,,Non-Networked,,200-8,43.077581,-77.641934,06/09/2020,44188,2020-06-09 16:47:26,P,,,11/30/2011,J1772
ELEC,Standard Parking Pierepoint Plaza - Tesla Destination,300 Cadman,,Brooklyn,NY,11201,,800-836-6666  877-798-3752,E,,Public,24 hours daily; see valet for access,,,3,,,Tesla Destination,https://www.tesla.com/destination-charging,GPS,40.695115,-73.990993,11/03/2020,114896,2020-11-18 00:06:10,P,,,11/01/2018,J1772 TESLA
ELEC,MPG Parking 98-41 Queens Blvd - Tesla Destination,98-59 65th Rd,,Rego Park,NY,11374,,718-997-0630  877-798-3752,E,,Public,24 hours daily; pay lot; see valet for access,,,4,,,Tesla Destination,https://www.tesla.com/destination-charging,200-8,40.729133,-73.855355,11/03/2020,150577,2020-11-18 00:06:10,P,,,09/30/2019,TESLA
ELEC,EV CHARGE460,460 S Broadway,STATION1; -,Tarrytown,NY,10591,,888-758-4389,E,,Public,24 hours daily,,,2,,,ChargePoint Network,http://www.chargepoint.com/,GPS,41.060996,-73.861524,01/23/2021,162274,2021-01-23 00:19:13,,,,,J1772
ELEC,Carnegie Hill,215 E 96th St,,New York,NY,10128,,888-998-2546,E,,Public,MON: 24 hours | TUE: 24 hours | WED: 24 hours | THU: 24 hours | FRI: 24 hours | SAT: 24 hours | SUN: 24 hours,,,2,,,Blink Network,http://www.blinkcharging.com/,GPS,40.784865,-73.948526,01/22/2021,164751,2021-01-22 22:55:21,,,,,J1772
ELEC,BMW S. ALBANY,521-641 US-9W,STATION 01; -,Glenmont,NY,12077,,888-758-4389,E,,Public,24 hours daily,,,2,,,ChargePoint Network,http://www.chargepoint.com/,GPS,42.588972,-73.797298,01/23/2021,162451,2021-01-23 00:19:13,,,,,J1772
ELEC,Fairfield Inn & Suites by Marriott Elmira Corning - Tesla Destination,1600 County Rd 64,,Horseheads,NY,14845,,607-739-9200  877-798-3752,E,,Public,24 hours daily; for customer use only; see front desk for access,,,3,,,Tesla Destination,https://www.tesla.com/destination-charging,200-9,42.158820,-76.856120,11/03/2020,114953,2020-11-18 00:06:10,P,,,11/01/2018,J1772 TESLA
ELEC,SMITHTOWN,99 W Main St,WEST MAIN ST,Smithtown,NY,11787,,888-758-4389,E,,Public,24 hours daily,,,2,,,ChargePoint Network,http://www.chargepoint.com/,GPS,40.855696,-73.197832,01/23/2021,123551,2021-01-23 00:19:13,,,,,J1772
ELEC,Point Place Casino - Tesla Destination,450-452 NY-31,,Bridgeport,NY,13030,,315-366-9610  877-798-3752,E,,Public,24 hours daily; for customer use only,,,2,,,Tesla Destination,https://www.tesla.com/destination-charging,200-9,43.154875,-75.965306,11/03/2020,114887,2020-11-18 00:06:10,P,,,11/01/2018,TESLA
ELEC,Icon Parking 300 E 59th Street - Tesla Destination,300 E 59th St,,New York,NY,10022,,212-980-0215  877-798-3752,E,,Public,24 hours daily; see front desk for access,,,3,,,Tesla Destination,https://www.tesla.com/destination-charging,200-8,40.760421,-73.964418,11/03/2020,115083,2020-11-18 00:06:10,P,,,05/01/2016,J1772 TESLA
ELEC,ATAHOUSING407,1734-1774 Mulford Ave,"HAZEL TOWERS 1; Restricted for use to residents only, station is between Spaces #158 &amp; #159",Bronx,NY,10461,,888-758-4389,E,,Public,24 hours daily,,,2,,,ChargePoint Network,http://www.chargepoint.com/,GPS,40.846821,-73.834633,01/23/2021,162498,2021-01-23 00:19:13,,,,,J1772
ELEC,IKEA - Brooklyn,One Beard St,,Brooklyn,NY,11231,,888-998-2546,E,,Public,MON: 24 hours | TUE: 24 hours | WED: 24 hours | THU: 24 hours | FRI: 24 hours | SAT: 24 hours | SUN: 24 hours,,,4,,,Blink Network,http://www.blinkcharging.com/,GPS,40.672247,-74.011183,01/22/2021,95209,2021-01-22 22:55:21,,,,,J1772
ELEC,Praxair - Linde Technology Ctr,175 E Park Dr,,Tonawanda,NY,14150,,866-816-7584,E,,Public,24 hours daily; Also accepts Paypal,A D M V,,4,,,EV Connect,http://evconnect.com/,GPS,42.975519,-78.894393,04/08/2020,154911,2020-04-08 12:29:55,P,,,08/13/2019,J1772
ELEC,BEDFORD_EV,307 Bedford Rd,TOWN COURT 2; Near left side enterance,Bedford Hills,NY,10507,,888-758-4389,E,,Public,24 hours daily,,,2,,,ChargePoint Network,http://www.chargepoint.com/,GPS,41.239725,-73.698992,01/23/2021,162137,2021-01-23 00:19:13,,,,,J1772
ELEC,Depot Square,620 Main St,,Sparkill,NY,10976,,866-816-7584,E,,Public,24 hours daily,,,2,,,EV Connect,http://evconnect.com/,200-9,41.029363,-73.928978,05/06/2020,155356,2020-05-06 17:56:57,LG,,,04/01/2020,J1772
ELEC,Champion Parking 113 LLC - Tesla Destination,400 W 113th St,,New York,NY,10025,,212-663-0113  877-798-3752,E,,Public,24 hours daily; pay lot; see valet for access,,,3,,,Tesla Destination,https://www.tesla.com/destination-charging,200-9,40.804007,-73.960887,11/03/2020,115122,2020-11-18 00:06:10,P,,,11/01/2018,J1772 TESLA
ELEC,ICE RINK,207 Market St,GRECO CENTER; On south side of building,Saugerties,NY,12477,,888-758-4389,E,,Public,24 hours daily,,,2,,,ChargePoint Network,http://www.chargepoint.com/,GPS,42.084094,-73.955029,01/23/2021,121871,2021-01-23 00:19:13,,,,,J1772
ELEC,Broccolo Tree and Lawncare Garden Center,2755 Penfield Rd,,Fairport,NY,14450,,585-424-4476,E,,Public,8am-5pm daily,A Cash D M V,,1,,,Non-Networked,,200-9,43.129935,-77.386788,03/03/2020,61760,2020-03-03 21:13:47,P,,,09/01/2013,J1772
ELEC,"Home2 Suites by Hilton Rochester Henrietta, NY - Tesla Destination",999 Jefferson Rd,,Rochester,NY,14623,,585-272-0090  877-798-3752,E,,Public,24 hours daily; for customer use only; see front desk for access,,,3,,,Tesla Destination,https://www.tesla.com/destination-charging,200-9,43.086754,-77.610599,11/03/2020,115228,2020-11-18 00:06:10,P,,,11/01/2018,J1772 TESLA
ELEC,NORTZ & VIRKLER,7468 south state st,NORTZ & VIRKLER,Lowville,NY,13367,,888-758-4389,E,,Public,24 hours daily,,,2,,,ChargePoint Network,http://www.chargepoint.com/,GPS,43.782240,-75.487946,01/23/2021,167491,2021-01-23 00:19:13,,,,,J1772
ELEC,GMC Parking Narragansett - Tesla Destination,124 E 63rd St,,New York,NY,10065,,212-838-2720  877-798-3752,E,,Public,24 hours daily; for customer use only; see valet for access,,,3,,,Tesla Destination,https://www.tesla.com/destination-charging,200-9,40.764767,-73.967021,11/03/2020,115007,2020-11-18 00:06:10,P,,,09/01/2017,J1772 TESLA
ELEC,STAYBRIDGE,39 Wolf Rd Colonie,"TURF 1; The station is located on the north side of the building, next to the entrance",Albany,NY,12205,,888-758-4389,E,,Public,24 hours daily,,,2,,,ChargePoint Network,http://www.chargepoint.com/,GPS,42.712685,-73.811791,01/23/2021,162412,2021-01-23 00:19:13,,,,,J1772
ELEC,AL SIGL,1000 Elmwood Ave,ELMWOOD,Rochester,NY,14620,,888-758-4389,E,,Public,24 hours daily,,,2,,,ChargePoint Network,http://www.chargepoint.com/,GPS,43.125965,-77.611900,01/23/2021,163586,2021-01-23 00:19:13,,,,,J1772
ELEC,RRH,1561 Long Pond Rd,UNITY POB 1; -UNITY POB 2; Side of professional office building UNITY POB 3; Side of professional office building,Rochester,NY,14626,,888-758-4389,E,,Public,24 hours daily,,,6,,,ChargePoint Network,http://www.chargepoint.com/,200-9,43.196899,-77.703881,01/23/2021,150002,2021-01-23 00:19:13,,,,,J1772
ELEC,WFM - NORTHEAST,214 3rd St,"WHOLE FOODS 1; Parking lot, 1st and 2nd parking spaces facing PromenadeWHOLE FOODS 2; Parking lot, 6th and 7th parking spaces facing Promenade",Gowanus,NY,11215,,888-758-4389,E,,Public,24 hours daily,,,4,,,ChargePoint Network,http://www.chargepoint.com/,200-9,40.675124,-73.988492,01/23/2021,154371,2021-01-23 00:19:13,,,,,J1772
ELEC,NY DCFC,21 Westage Dr,"FISHKILL, NY; -",Fishkill,NY,12524,,888-758-4389,E,,Public,24 hours daily,,,,2,,ChargePoint Network,http://www.chargepoint.com/,GPS,41.526606,-73.894750,01/23/2021,170742,2021-01-23 00:19:13,,,,,CHADEMO J1772COMBO
ELEC,Houghton College,1 Willard Ave,,Houghton,NY,14744,,866-816-7584,E,,Public,24 hours daily,,,2,,,EV Connect,http://evconnect.com/,GPS,42.427058,-78.157209,06/09/2020,157942,2020-06-09 16:47:26,P,,,05/15/2020,J1772
ELEC,Hudson Valley Community College - TEC-SMART Building,345 Hermes Rd,,Malta,NY,12020,,518-629-7075,E,,Public,7am-10pm M-Sat,,1,,,,Non-Networked,,GPS,42.971670,-73.774182,03/03/2020,36532,2020-03-03 21:13:47,SG,,,10/15/2010,NEMA520
ELEC,Clemson Bros Brewery - Tesla Destination,22 Cottage St,,Middletown,NY,10940,,845-775-4638  877-798-3752,E,,Public,24 hours daily; for customer use only,,,3,,,Tesla Destination,https://www.tesla.com/destination-charging,200-9,41.446952,-74.415608,11/03/2020,114975,2020-11-18 00:06:10,P,,,11/01/2018,TESLA
ELEC,MOSEY,5195 Main St,MOSEY 1; Inside parking ramp to the left 1st floor,Williamsville,NY,14221,,888-758-4389,E,,Public,24 hours daily,,,2,,,ChargePoint Network,http://www.chargepoint.com/,GPS,42.959882,-78.758655,01/23/2021,149544,2021-01-23 00:19:13,,,,,J1772
ELEC,Crossgates Mall - Tesla Supercharger,1 Crossgates Mall Road,,Guilderland,NY,12203,,877-798-3752,E,,Public,24 hours daily; for Tesla use only,,,,20,,Tesla,http://www.teslamotors.com/supercharger,200-8,42.688700,-73.853300,08/10/2020,102330,2020-08-27 20:39:12,P,,,07/23/2018,TESLA
ELEC,Manhattan Plaza,427 W 42nd St,,New York,NY,10036,,888-998-2546,E,,Public,MON: 24 hours | TUE: 24 hours | WED: 24 hours | THU: 24 hours | FRI: 24 hours | SAT: 24 hours | SUN: 24 hours,,,2,,,Blink Network,http://www.blinkcharging.com/,GPS,40.759223,-73.992703,01/22/2021,164442,2021-01-22 22:55:21,,,,,J1772
ELEC,CITY HALL 12534,542 Warren St,CITY HALL 1CITY HALL 2CITY HALL 3,Hudson,NY,12534,,888-758-4389,E,,Public,24 hours daily,,,6,,,ChargePoint Network,http://www.chargepoint.com/,200-9,42.248767,-73.784959,01/23/2021,149513,2021-01-23 00:19:13,,,,,J1772
ELEC,Jim Barnard Chevrolet,7101 Buffalo Rd,,Churchville,NY,14428,,585-293-2120,E,,Public - Call ahead,Dealership business hours,,,1,,,Non-Networked,,200-9,43.099649,-77.897024,03/03/2020,81608,2020-08-02 19:10:06,P,,,01/01/2010,J1772
ELEC,NYSE Thruway - NYPA,2182 Alvin Rd,,Grand Island,NY,14072,,866-816-7584,E,,Public - Credit card at all times,24 hours daily; Also accepts PayPal and Apple Pay,A D M V,,,6,,EV Connect,http://evconnect.com/,GPS,43.019296,-78.974580,12/03/2020,168457,2020-12-03 22:33:12,LG,,,07/31/2020,CHADEMO J1772COMBO
ELEC,Westchester Medical Center,100 Woods Rd,,Valhalla,NY,10595,,866-816-7584,E,,Public,24 hours daily,,,2,,,EV Connect,http://evconnect.com/,GPS,41.086676,-73.806065,04/08/2020,123262,2020-04-08 12:29:55,P,,,04/01/2019,J1772
ELEC,125-10 Queens Blvd Garage - Tesla Destination,123 83rd Ave,,Kew Gardens,NY,11415,,718-793-7498  877-798-3752,E,,Public,24 hours daily; pay lot; see valet for access,,,4,,,Tesla Destination,https://www.tesla.com/destination-charging,GPS,40.711904,-73.826773,11/03/2020,122483,2020-11-18 00:06:10,P,,,03/01/2019,TESLA
ELEC,Court Square Municipal Parking Garage,45 Court Square,"Located between Court Square East and Court Square West (Anable Street), South of Jackson avenue behind court house",Queens,NY,11101,,866-816-7584,E,,Public,24 hours daily,,,9,,,EV Connect,http://evconnect.com/,200-9,40.745358,-73.942642,06/09/2020,65290,2020-08-10 19:48:46,LG,,,12/29/2014,J1772
ELEC,VIC AND CAMPUS,8023 NY-30,SUGAR SHACK 1.1; Next to sugar shack and VIC centerSUGAR SHACK 1.2; Next to sugar shack at VIC center,Paul Smiths,NY,12970,,888-758-4389,E,,Public,24 hours daily,,,4,,,ChargePoint Network,http://www.chargepoint.com/,200-9,44.452329,-74.260841,01/23/2021,154724,2021-01-23 00:19:13,,,,,J1772
ELEC,Hyatt Place Long Island / East End - Tesla Destination,451 E Main St,,Riverhead,NY,11901,,631-208-0002  877-798-3752,E,,Public - Call ahead,24 hours daily; for customer use only,,,2,,,Tesla Destination,https://www.tesla.com/destination-charging,200-8,40.918664,-72.656139,11/03/2020,115219,2020-11-18 00:06:10,P,,,09/01/2017,TESLA
ELEC,NATIONAL GRID,30 Central Ave,CHADWICK MARINA; Chadwick Bay Marina boat lift,Dunkirk,NY,14048,,888-758-4389,E,,Public,24 hours daily,,,2,,,ChargePoint Network,http://www.chargepoint.com/,GPS,42.487682,-79.335875,01/23/2021,162234,2021-01-23 00:19:13,,,,,J1772
ELEC,Astor Place,445 Lafayette St,,New York,NY,10003,,888-998-2546,E,,Public,MON: 24 hours | TUE: 24 hours | WED: 24 hours | THU: 24 hours | FRI: 24 hours | SAT: 24 hours | SUN: 24 hours,,,2,,,Blink Network,http://www.blinkcharging.com/,GPS,40.729700,-73.991565,01/22/2021,124144,2021-01-22 22:55:21,,,,,J1772
ELEC,BMW MANHATTAN,555 W 57th St,FAST CHARGER 01; 2nd Floor Garage,New York,NY,10019,,888-758-4389,E,,Public,24 hours daily,,,,1,,ChargePoint Network,http://www.chargepoint.com/,GPS,40.770411,-73.990655,01/23/2021,162415,2021-01-23 00:19:13,,,,,J1772COMBO
ELEC,COLE GROUP,173 Doorstone Dr,COLONIE EAST 4,Latham,NY,12110,,888-758-4389,E,,Public,24 hours daily,,,2,,,ChargePoint Network,http://www.chargepoint.com/,GPS,42.745510,-73.770770,01/23/2021,154058,2021-01-23 00:19:13,,,,,J1772
ELEC,SOUTHAMPTON HOS,240 Meeting House Ln,MAIN ENTRANCE,Southampton,NY,11968,,888-758-4389,E,,Public,24 hours daily,,,2,,,ChargePoint Network,http://www.chargepoint.com/,GPS,40.885480,-72.380628,01/23/2021,158485,2021-01-23 00:19:13,,,,,J1772
ELEC,North Utica Shopping Center - Tesla Supercharger,50 Auert Ave.,,Utica,NY,13502,,877-798-3752,E,,Public,24 hours daily; for Tesla use only,,,,8,,Tesla,http://www.teslamotors.com/supercharger,200-9,43.113900,-75.206900,08/10/2020,102347,2020-08-27 20:39:12,P,,,02/01/2015,TESLA
ELEC,STONY BROOK UNV,Circle Rd,LIFE SCIENCES; -,Stony Brook,NY,11790,,888-758-4389,E,,Public,24 hours daily,,,2,,,ChargePoint Network,http://www.chargepoint.com/,GPS,40.910667,-73.119738,01/23/2021,162457,2021-01-23 00:19:13,,,,,J1772
ELEC,Icon Parking 810 Seventh Ave - Tesla Destination,207  W 52nd St,,New York,NY,10019,,212-247-4372  877-798-3752,E,,Public,24 hours daily; see valet for access,,,3,,,Tesla Destination,https://www.tesla.com/destination-charging,200-8,40.762891,-73.983151,11/03/2020,115049,2020-11-18 00:06:10,P,,,08/15/2016,J1772 TESLA
ELEC,Rockland Nissan,608 Route 303,,Blauvelt,NY,10913,,845-358-6700,E,,Public - Call ahead,Dealership business hours,,,1,,,Non-Networked,,200-9,41.071072,-73.950866,06/09/2020,44325,2020-06-09 16:47:26,P,,,11/30/2011,J1772
ELEC,Price Chopper,55 Railroad Pl,,Saratoga Springs,NY,12866,,518-584-9400,E,,Public,24 hours daily,,,2,,,Non-Networked,,200-9,43.082251,-73.788133,03/03/2020,63997,2020-03-03 21:13:47,P,,,04/01/2020,J1772
ELEC,iPark 650 Parking Corp - Tesla Destination,80  E 67th St,,New York,NY,10065,,212-472-2596  877-798-3752,E,,Public,24 hours daily; see valet for access,,,3,,,Tesla Destination,https://www.tesla.com/destination-charging,200-8,40.767935,-73.966710,11/03/2020,115185,2020-11-18 00:06:10,P,,,11/01/2018,J1772 TESLA
ELEC,WW BMW,125 NY-59,STATION 02; Front left unit,Nanuet,NY,10954,,888-758-4389,E,,Public,24 hours daily,,,2,,,ChargePoint Network,http://www.chargepoint.com/,GPS,41.107337,-74.037243,01/23/2021,120837,2021-01-23 00:19:13,,,,,J1772
ELEC,PET PARTNERS #1,365 Saratoga Ave,PET PARTNERS 1,Ballston Spa,NY,12020,,888-758-4389,E,,Public,24 hours daily,,,2,,,ChargePoint Network,http://www.chargepoint.com/,GPS,43.020405,-73.840820,01/23/2021,143363,2021-01-23 00:19:13,,,,,J1772
ELEC,iPark 386 E 48th Street - Tesla Destination,386 E 48th St,,New York,NY,11248,,212-813-0014  877-798-3752,E,,Public,24 hours daily; see valet for access,,,3,,,Tesla Destination,https://www.tesla.com/destination-charging,200-8,40.751772,-73.964999,11/03/2020,115115,2020-11-18 00:06:10,P,,,03/01/2017,J1772 TESLA
ELEC,TANNERSVILLE,20 Tompkins St,MUNICIPAL LOT,Tannersville,NY,12485,,888-758-4389,E,,Public,24 hours daily,,,2,,,ChargePoint Network,http://www.chargepoint.com/,GPS,42.195133,-74.132420,01/23/2021,152438,2021-01-23 00:19:13,,,,,J1772
ELEC,PRIMA LOFTS LL,1373 Broadway,ALB LOFTS 1.1; -ALB LOFTS 1.2ALB LOFTS 1.3ALB LOFTS 1.4ALB LOFTS 1.5,Menands,NY,12204,,888-758-4389,E,,Public,24 hours daily,,,10,,,ChargePoint Network,http://www.chargepoint.com/,200-9,42.676164,-73.734360,01/23/2021,153305,2021-01-23 00:19:13,,,,,J1772
ELEC,Green Lakes State Park,7900 Green Lakes Rd,,Fayetteville,NY,13066,,866-816-7584,E,,Public,24 hours daily,,,1,,,EV Connect,http://evconnect.com/,GPS,43.058244,-75.971429,04/08/2020,123133,2020-04-08 12:29:55,P,,,04/01/2019,J1772
ELEC,35 SUTTON 1,35 Sutton Pl,35 SUTTON PLSUTTON PL 2; Parking garage,New York,NY,10022,,888-758-4389,E,,Public,24 hours daily,,,4,,,ChargePoint Network,http://www.chargepoint.com/,200-9,40.758286,-73.959484,01/23/2021,147425,2021-01-23 00:19:13,,,,,J1772
ELEC,Standard Parking 200 Cadman Plaza West - Tesla Destination,75 Henry St,,Brooklyn,NY,11221,,800-836-6666  877-798-3752,E,,Public,24 hours daily; see valet for access,,,3,,,Tesla Destination,https://www.tesla.com/destination-charging,200-9,40.698807,-73.991859,11/03/2020,114912,2020-11-18 00:06:10,P,,,11/01/2018,J1772 TESLA
ELEC,Longview Parking Garage,11 Longview Ave,"South of E Post Rd. Located at northeast corner of garage, ground level",White Plains,NY,10601,,914-422-1391  866-816-7584,E,,Public,24 hours daily; pay lot,,,2,,,Non-Networked,,200-9,41.026867,-73.767674,09/03/2020,65275,2020-09-03 19:35:48,SG,,,07/23/2014,J1772
ELEC,Candela Systems Corp,168 Old Sawmill River Rd,,Hawthorne,NY,10532,,866-816-7584,E,,Public,24 hours daily,,,2,,,EV Connect,http://evconnect.com/,GPS,41.097414,-73.807592,04/08/2020,122897,2020-04-08 12:29:55,P,,,04/01/2019,J1772
ELEC,Buffalo Niagara Medical Campus - Ellicott Street Parking,589 Ellicott St,Streetside parking adjacent to pay lot,Buffalo,NY,14203,,716-218-7153,E,,Public,24 hours daily; metered parking,,,2,,,Non-Networked,,GPS,42.896112,-78.868551,06/09/2020,50708,2020-06-09 16:47:26,P,,,10/01/2013,J1772
ELEC,GGMC Parking Stewart House Garage - Tesla Destination,91 East 9th St,,New York,NY,10003,,212-995-1940  877-798-3752,E,,Public,24 hours daily; see valet for access,,,3,,,Tesla Destination,https://www.tesla.com/destination-charging,200-8,40.730990,-73.990963,11/03/2020,115194,2020-11-18 00:06:10,P,,,01/01/2016,J1772 TESLA
ELEC,BETHLEHEM EV,445 NY-443,TOWNHALL PUBLIC; -,Delmar,NY,12054,,888-758-4389,E,,Public,24 hours daily,,,2,,,ChargePoint Network,http://www.chargepoint.com/,GPS,42.620461,-73.839323,01/23/2021,166770,2021-01-23 00:19:13,,,,,J1772
ELEC,JATC LU41,3546 California Rd,JATC LU41,Orchard Park,NY,14127,,888-758-4389,E,,Public,24 hours daily,,,2,,,ChargePoint Network,http://www.chargepoint.com/,GPS,42.787197,-78.787821,01/23/2021,162176,2021-01-23 00:19:13,,,,,J1772
ELEC,Union College,Lennox Rd,,Schenectady,NY,12308,,866-816-7584,E,,Public,24 hours daily; Also accepts Paypal,A D M V,,1,,,EV Connect,http://evconnect.com/,GPS,42.815708,-73.923732,04/08/2020,155029,2020-04-08 12:29:55,P,,,04/03/2019,J1772
ELEC,Hampton Inn - Albany,10 Ulenski Dr,,Albany,NY,12205,,518-438-2822,E,,Public,24 hours daily,,,2,,,Non-Networked,,GPS,42.724676,-73.795448,12/03/2020,72909,2020-12-03 22:33:12,P,,,01/25/2016,J1772
ELEC,Somers Commons Shopping Center,80 Route 6,,Baldwin Place,NY,10505,,877-455-3833,E,,Public - Card key at all times,24 hours daily,,,,1,,eVgo Network,https://www.evgo.com/,GPS,41.344875,-73.756256,01/23/2021,93700,2021-01-23 01:19:54,,,,,CHADEMO J1772COMBO
ELEC,Schuyler County,1 Harbor Dr,,Watkins Glen,NY,14891,,866-816-7584,E,,Public - Credit card at all times,24 hours daily; Also accepts PayPal and Apple Pay,A D M V,,4,,,EV Connect,http://evconnect.com/,GPS,42.383664,-76.871132,12/03/2020,168436,2020-12-03 22:33:12,LG,,,09/01/2020,J1772
ELEC,National Grid Liverpool NY,7437 Henry Clay Blvd,,Liverpool,NY,13088,,855-885-9571,E,,Public,,,,6,,,OpConnect,http://www.opconnect.com/,GPS,43.130229,-76.187377,01/23/2021,121645,2021-01-23 01:37:24,,,,04/01/2019,J1772
ELEC,BRUNSWICK HD,1130 Hoosick Rd,BRUNSWICK HDBRUNSWICK HD2,Troy,NY,12180,,888-758-4389,E,,Public,24 hours daily,,,4,,,ChargePoint Network,http://www.chargepoint.com/,200-9,42.759079,-73.601121,01/23/2021,150341,2021-01-23 00:19:13,,,,,J1772
ELEC,STONY BROOK UNV,1000 Innovation Road,AERTC 1; -AERTC 2; -,Stony Brook,NY,11790,,888-758-4389,E,,Public,24 hours daily,,,4,,,ChargePoint Network,http://www.chargepoint.com/,200-9,40.903976,-73.135780,01/23/2021,162348,2021-01-23 00:19:13,,,,,J1772
ELEC,TOWN OF BOLTON,5 Cross Street,TOWN OF BOLTON2,Bolton,NY,12814,,888-758-4389,E,,Public,24 hours daily,,,2,,,ChargePoint Network,http://www.chargepoint.com/,GPS,43.557552,-73.657861,01/23/2021,165305,2021-01-23 00:19:13,,,,,J1772
ELEC,STATION TOR1,122 N Ridge St,CRAWFORD NORTH; North parking lot on Crawford Rd,Port Chester,NY,10573,,888-758-4389,E,,Public,24 hours daily,,,2,,,ChargePoint Network,http://www.chargepoint.com/,GPS,41.015065,-73.686638,01/23/2021,145318,2021-01-23 00:19:13,,,,,J1772
ELEC,"The Inn at Cooperstown, a Select Registry Property - Tesla Destination",16 Chestnut St,,Cooperstown,NY,13326,,607-547-5756  877-798-3752,E,,Public,24 hours daily; see front desk for access,,,2,,,Tesla Destination,https://www.tesla.com/destination-charging,200-9,42.701630,-74.926982,11/03/2020,114925,2020-11-18 00:06:10,P,,,01/01/2016,J1772 TESLA
ELEC,Nissan of Yorktown Heights,3495 Old Crompond Rd,,Yorktown Heights,NY,10598,,914-737-3500,E,,Public - Call ahead,Dealership business hours,,,2,1,,Non-Networked,,200-8,41.289317,-73.835547,06/09/2020,44218,2020-06-09 16:47:26,P,,,11/30/2011,CHADEMO J1772
ELEC,OSSINING TOWN,Louis Engel Park (Waterfront Park) 161-185 Westerly Rd.,LOUIS ENGEL; In parking lot,Ossining,NY,10562,,888-758-4389,E,,Public,24 hours daily,,,2,,,ChargePoint Network,http://www.chargepoint.com/,GPS,41.156094,-73.869640,01/23/2021,162297,2021-01-23 00:19:13,,,,,J1772
ELEC,PV Parking 40-07 73rd St - Tesla Destination,40-07 73rd St,,Woodside,NY,11377,,718-609-1200  877-798-3752,E,,Public,24 hours daily; pay lot; see valet for access,,,4,,,Tesla Destination,https://www.tesla.com/destination-charging,200-9,40.746539,-73.892004,11/03/2020,115251,2020-11-18 00:06:10,P,,,11/01/2018,TESLA
ELEC,Dunkinâ€™,405 W Main St,,Batavia,NY,14020,,585-483-1454,E,,Public,24 hours daily,,,1,,,Non-Networked,,GPS,43.004421,-78.203921,06/09/2020,157965,2020-06-09 16:47:26,P,,,05/15/2020,J1772
ELEC,Peppermint's Restaurant - Tesla Destination,244 E Main St,,Avon,NY,14414,,585-226-2707  877-798-3752,E,,Public,24 hours daily; for customer use only,,,3,,,Tesla Destination,https://www.tesla.com/destination-charging,200-9,42.910883,-77.735952,11/03/2020,114882,2020-11-18 00:06:10,P,,,09/01/2017,TESLA
ELEC,GLENWOOD MGMT,300 E 56th St,BRISTOL GARAGE,New York,NY,10022,,888-758-4389,E,,Public,24 hours daily,,,2,,,ChargePoint Network,http://www.chargepoint.com/,GPS,40.758153,-73.965302,01/23/2021,162365,2021-01-23 00:19:13,,,,,J1772
ELEC,RRH,1455 East Ridge Road,RIEDMAN CTR GW1; Right side of bldg as you face the frontRIEDMAN CTR NG1RIEDMAN CTR NG2; Right side of bldg as you face the frontRIEDMAN CTR NG3; Right side of bldg as you face the frontRIEDMAN CTR NG5; Right side of bldg as you face the frontRIEDMAN CTR NG6; Right side of bldg as you face the front,Rochester,NY,14621,,888-758-4389,E,,Public,24 hours daily,,,11,,,ChargePoint Network,http://www.chargepoint.com/,200-9,43.197839,-77.577747,01/23/2021,143494,2021-01-23 00:19:13,,,,,J1772
ELEC,MOREHEADHONDA,1000 Auto Park Pl,SHOP 02; Exterior,Newburgh,NY,12550,,888-758-4389,E,,Public,24 hours daily,,,1,,,ChargePoint Network,http://www.chargepoint.com/,GPS,41.502394,-74.066239,01/23/2021,143589,2021-01-23 00:19:13,,,,,J1772
ELEC,Tesla Gigafactory 2 - Tesla Destination,1339 South Park Ave,,Buffalo,NY,14220,,877-798-3752  877-798-3752,E,,Public,24 hours daily; for customer use only; see front desk for access,,,2,,,Tesla Destination,https://www.tesla.com/destination-charging,200-9,42.858887,-78.841502,11/03/2020,169163,2020-11-18 00:06:10,P,,,11/03/2020,TESLA
ELEC,KINGSTON,95 Dock St TR Gallo Waterfront Park,TR GALLO PARK; Paid Parking Lot $.75 per hour 9am-6pm Mon-Sat,Kingston,NY,12401,,888-758-4389,E,,Public,24 hours daily,,,2,,,ChargePoint Network,http://www.chargepoint.com/,GPS,41.917631,-73.983671,01/23/2021,162262,2021-01-23 00:19:13,,,,,J1772
ELEC,COHEN BROTHERS,475 Park Ave S,475 PARK AVE S; -,New York,NY,10016,,888-758-4389,E,,Public,24 hours daily,,,1,,,ChargePoint Network,http://www.chargepoint.com/,GPS,40.745372,-73.982107,01/23/2021,162379,2021-01-23 00:19:13,,,,,J1772
ELEC,2600 6TH AVE,102 Jay St,JOHNSTONE 2600; To the right of main entrance. Between yellow posts.,Troy,NY,12180,,888-758-4389,E,,Public,24 hours daily,,,2,,,ChargePoint Network,http://www.chargepoint.com/,GPS,42.741815,-73.682386,01/23/2021,162316,2021-01-23 00:19:13,,,,,J1772
ELEC,Main Place Ramp,221 Pearl St,,Buffalo,NY,14202,,716-849-5812  866-816-7584,E,,Public - Credit card at all times,24 hours daily; must use EVConnect app for payment,A D Debit M V,,4,,,EV Connect,http://evconnect.com/,GPS,42.883926,-78.876050,06/09/2020,104727,2020-06-09 16:47:26,LG,,,04/01/2018,J1772
ELEC,William Henry Miller Inn - Tesla Destination,303 N Aurora St,,Ithaca,NY,14850,,607-256-4553  877-798-3752,E,,Public,24 hours daily; for customer use only,,,1,,,Tesla Destination,https://www.tesla.com/destination-charging,200-9,42.441724,-76.495362,11/03/2020,114959,2020-11-18 00:06:10,P,,,08/15/2016,TESLA
ELEC,Serafini Nissan-Volvo,3101 Vestal Pkwy E,,Vestal,NY,13850,,607-729-3511,E,,Public - Call ahead,Dealership business hours,,,1,,,Non-Networked,,200-9,42.095812,-76.003703,06/09/2020,44204,2020-06-09 16:47:26,P,,,11/30/2011,J1772
ELEC,ABM Parking Services 285 W 50th Street LLC - Tesla Destination,285 W 50th St,,New York,NY,10019,,212-757-6500  877-798-3752,E,,Public,24 hours daily; see valet for access,,,3,,,Tesla Destination,https://www.tesla.com/destination-charging,200-8,40.762337,-73.985727,11/03/2020,115078,2020-11-18 00:06:10,P,,,01/01/2016,J1772 TESLA
ELEC,CARCHARGING,225 W 49th St,"GMC 225 W 49 #1; To use charging station, please see valet attendant.",New York,NY,10019,,888-758-4389,E,,Public,24 hours daily,,,1,,,ChargePoint Network,http://www.chargepoint.com/,GPS,40.761376,-73.985273,01/23/2021,162520,2021-01-23 00:19:13,,,,,J1772
ELEC,IPark 255 Schermerhorn - Tesla Destination,255 Schermerhorn St,,Brooklyn,NY,11217,,347-763-2930  877-798-3752,E,,Public,24 hours daily; pay lot; see valet for access,,,4,,,Tesla Destination,https://www.tesla.com/destination-charging,200-9,40.687927,-73.982998,11/03/2020,150582,2020-11-18 00:06:10,P,,,09/30/2019,TESLA
ELEC,Honest Weight Co-op,100 Watervliet Ave,,Albany,NY,12206,,518-482-2667,E,,Public,8am-10pm daily,,,2,,,Non-Networked,,200-9,42.678984,-73.782529,03/03/2020,86199,2020-03-03 21:13:47,P,,,07/01/2017,J1772
ELEC,Icon Parking - 111 Eighth Avenue,111 Eighth Avenue,Entrance on 385 W 15th St or 386 W 16th St.,New York,NY,10011,,888-998-2546,E,,Public,MON: 24 hours | TUE: 24 hours | WED: 24 hours | THU: 24 hours | FRI: 24 hours | SAT: 24 hours | SUN: 24 hours,,,1,,,Blink Network,http://www.blinkcharging.com/,GPS,40.741421,-74.003186,01/22/2021,164679,2021-01-22 22:55:21,,,,,J1772
ELEC,Hampton Inn & Suites Yonkers - Westchester - Tesla Destination,555 Tuckahoe Rd,,Yonkers,NY,10710,,914-963-3200  877-798-3752,E,,Public,24 hours daily; for customer use only; see front desk for access,,,2,,,Tesla Destination,https://www.tesla.com/destination-charging,200-9,40.954894,-73.849732,11/03/2020,115252,2020-11-18 00:06:10,P,,,12/15/2016,J1772 TESLA
ELEC,"First Avenue Parking, LLC",630 1st Avenue,Monthly parking only.,New York,NY,10016,,888-998-2546,E,,Public,MON: 24 hours | TUE: 24 hours | WED: 24 hours | THU: 24 hours | FRI: 24 hours | SAT: 24 hours | SUN: 24 hours,,,2,,,Blink Network,http://www.blinkcharging.com/,GPS,40.745096,-73.971921,01/22/2021,96624,2021-01-22 22:55:21,,,,,J1772
ELEC,Icon Parking 150 Charles Street - Tesla Destination,150 Charles St,,New York,NY,10014,,212-414-4140  877-798-3752,E,,Public,24 hours daily; pay lot; see valet for access,,,3,,,Tesla Destination,https://www.tesla.com/destination-charging,200-9,40.733633,-74.009239,11/03/2020,115018,2020-11-18 00:06:10,P,,,11/01/2018,J1772 TESLA
ELEC,Town of DeKalb,4343 US Highway 11,,DeKalb Junction,NY,13630,,866-816-7584,E,,Public,24 hours daily,,,2,,,EV Connect,http://evconnect.com/,GPS,44.505435,-75.273847,04/08/2020,123109,2020-04-08 12:29:55,LG,,,04/01/2019,J1772
ELEC,GGMC Parking - 550 W 25th - Tesla Destination,550  W 25th St,,New York,NY,10001,,212-929-0443  877-798-3752,E,,Public,24 hours daily; see valet for access,,,2,,,Tesla Destination,https://www.tesla.com/destination-charging,200-9,40.749666,-74.005485,11/03/2020,115160,2020-11-18 00:06:10,P,,,01/01/2016,J1772 TESLA
ELEC,Niagara Power Vista,5777 Lewiston Rd,,Lewiston,NY,14092,,,E,,Public,24 hours daily,,,6,,,Non-Networked,,GPS,43.140730,-79.037348,03/03/2020,147095,2020-03-03 21:13:47,SG,,,10/01/2019,J1772
ELEC,APDC ADMIN LOT,106 Smith Blvd,PORT 1.1; Near back entrance of Albany port district commission.PORT 1.2; Near rear entrance of Albany port district commission.PORT 1.3; Near rear entrance of Albany port district commission.,Albany,NY,12202,,888-758-4389,E,,Public,24 hours daily,,,6,,,ChargePoint Network,http://www.chargepoint.com/,200-8,42.626569,-73.757383,01/23/2021,165222,2021-01-23 00:19:13,,,,,J1772
ELEC,"Inn at Lake Joseph, a Select Registry Property - Tesla Destination",162 Saint Josephs Rd,,Forestburgh,NY,12777,,845-791-9506  877-798-3752,E,,Public - Call ahead,24 hours daily,,,1,,,Tesla Destination,https://www.tesla.com/destination-charging,200-9,41.589244,-74.713261,11/03/2020,114941,2020-11-18 00:06:10,P,,,05/01/2016,TESLA
ELEC,Kingston Nissan,140 Route 28,,Kingston,NY,12401,,845-338-3100,E,,Public - Call ahead,Dealership business hours,,,1,1,,Non-Networked,,GPS,41.948965,-74.032033,06/09/2020,44352,2020-06-09 16:47:26,P,,,11/30/2011,CHADEMO J1772
ELEC,GGMC Parking 415 E 79th - Tesla Destination,415 E 79th St,,New York,NY,10075,,212-650-1275  877-798-3752,E,,Public,24 hours daily; see valet for access,,,3,,,Tesla Destination,https://www.tesla.com/destination-charging,200-8,40.772197,-73.951830,11/03/2020,115127,2020-11-18 00:06:10,P,,,03/01/2017,J1772 TESLA
ELEC,Homewood Suites,3368 S Broadway,,Saratoga Springs,NY,12866,,866-816-7584,E,,Public - Call ahead,24 hours daily; for hotel guest use only,,,2,,,EV Connect,http://evconnect.com/,GPS,43.054195,-73.786810,04/08/2020,94859,2020-04-08 12:29:55,P,,,09/19/2017,J1772
ELEC,iPark NYC 455 Central Park West - Tesla Destination,27  West 105th St,,New York,NY,10025,,212-666-7246  877-798-3752,E,,Public,24 hours daily; for customer use only; see valet for access,,,3,,,Tesla Destination,https://www.tesla.com/destination-charging,200-8,40.797875,-73.961228,11/03/2020,150521,2020-11-18 00:06:10,P,,,09/30/2019,J1772 TESLA
ELEC,Cumberland Farms,498 County Road 111,,Manorville,NY,11949,,877-455-3833,E,,Public - Card key at all times,24 hours daily,,,,1,,eVgo Network,https://www.evgo.com/,GPS,40.870427,-72.800084,01/23/2021,93596,2021-01-23 01:19:54,,,,,CHADEMO J1772COMBO
ELEC,HOLTSVILLE,12-40 Corporate Dr,EAST; East Side parking lot of Solar IslandWEST; West side parking lot of Solar Island,Holtsville,NY,11742,,888-758-4389,E,,Public,24 hours daily,,,4,,,ChargePoint Network,http://www.chargepoint.com/,200-8,40.810400,-73.038392,01/23/2021,162475,2021-01-23 00:19:13,,,,,J1772
ELEC,MUNICIPAL EVSE,50-54 Park St,"PARK STREET 1; Level 1, 2nd FloorPARK STREET 2; Level 2, 3rd FloorPARK STREET 3; Level 3, 4th Floor",Glens Falls,NY,12801,,888-758-4389,E,,Public,24 hours daily,,,6,,,ChargePoint Network,http://www.chargepoint.com/,200-9,43.307755,-73.644423,01/23/2021,162345,2021-01-23 00:19:13,,,,,J1772
ELEC,Rapidpark 351 East 83rd - Tesla Destination,351  E 83rd,,New York,NY,10028,,212-265-7854  877-798-3752,E,,Public,24 hours daily; see valet for access,,,3,,,Tesla Destination,https://www.tesla.com/destination-charging,200-8,40.775208,-73.950978,11/03/2020,115110,2020-11-18 00:06:10,P,,,11/01/2018,J1772 TESLA
ELEC,N SYR  LOT,106 Fergerson Ave,N SYRACUSE,Syracuse,NY,13212,,888-758-4389,E,,Public,24 hours daily,,,2,,,ChargePoint Network,http://www.chargepoint.com/,GPS,43.135279,-76.130647,01/23/2021,162142,2021-01-23 00:19:13,,,,,J1772
ELEC,NATIONAL GRID,3115 Niagara Falls Blvd,KOHLS AMHERST; In front of Kohlâ€™s and anytime fitness,Buffalo,NY,14228,,888-758-4389,E,,Public,24 hours daily,,,2,,,ChargePoint Network,http://www.chargepoint.com/,GPS,43.039273,-78.820953,01/23/2021,162208,2021-01-23 00:19:13,,,,,J1772
ELEC,MOHAWK HARBOR01,220 Harborside Blvd,STATION #2; Parking deckSTATION #3; Parking deck,Schenectady,NY,12308,,888-758-4389,E,,Public,24 hours daily,,,4,,,ChargePoint Network,http://www.chargepoint.com/,GPS,42.825307,-73.931165,01/23/2021,170027,2021-01-23 00:19:13,,,,,J1772
ELEC,MUNICIPAL EVSE,230 Dix Ave,DPW,Glens Falls,NY,12801,,888-758-4389,E,,Public,24 hours daily,,,2,,,ChargePoint Network,http://www.chargepoint.com/,GPS,43.317207,-73.622670,01/23/2021,155287,2021-01-23 00:19:13,,,,,J1772
ELEC,Momentive,260 Hudson River Rd,,Waterford,NY,12188,,866-816-7584,E,,Public,24 hours daily,,,1,,,EV Connect,http://evconnect.com/,GPS,42.817808,-73.666527,04/08/2020,123090,2020-04-08 12:29:55,P,,,04/01/2019,J1772
ELEC,Broadway Commons - Target,358 N Broadway Commons,,Hicksville,NY,11801,,888-264-2208,E,,Public,6am-12pm daily,,,2,,,Volta,https://voltacharging.com/,GPS,40.771780,-73.532246,03/03/2020,152207,2020-03-03 21:13:47,P,,,01/20/2020,J1772
ELEC,AutoZone Auto Parts,57 Route 6,,Baldwin Place,NY,10505,,866-816-7584,E,,Public,24 hours daily,,,1,,,EV Connect,http://evconnect.com/,GPS,41.346093,-73.756731,04/08/2020,123121,2020-04-08 12:29:55,P,,,04/01/2019,J1772
ELEC,BMW FREEPORT,291 W Sunrise Hwy,STATION 02; -,Freeport,NY,11520,,888-758-4389,E,,Public,24 hours daily,,,2,,,ChargePoint Network,http://www.chargepoint.com/,GPS,40.655617,-73.596005,01/23/2021,162448,2021-01-23 00:19:13,,,,,J1772
ELEC,iPark 10 West 15th - Tesla Destination,10 W 15th,,New York,NY,10011,,212-675-0335  877-798-3752,E,,Public,24 hours daily; see valet for access,,,3,,,Tesla Destination,https://www.tesla.com/destination-charging,200-8,40.736754,-73.993789,11/03/2020,114986,2020-11-18 00:06:10,P,,,11/01/2018,J1772 TESLA
ELEC,Andaz Wall Street - Tesla Destination,75 Wall St,,New York,NY,10005,,212-590-1234  877-798-3752,E,,Public,24 hours daily; for customer use only; see valet for access,,,1,,,Tesla Destination,https://www.tesla.com/destination-charging,200-9,40.705042,-74.008118,11/03/2020,122490,2020-11-18 00:06:10,P,,,03/01/2019,TESLA
ELEC,Discount Parking 180 Ashland Place - Tesla Destination,180 Ashland Pl,,Brooklyn,NY,11217,,718-643-0430  877-798-3752,E,,Public,24 hours daily; see valet for access,,,2,,,Tesla Destination,https://www.tesla.com/destination-charging,200-8,40.689411,-73.978741,11/03/2020,114892,2020-11-18 00:06:10,P,,,05/01/2016,TESLA
ELEC,1081 3RD Avenue,1081 3rd Avenue,Attendant will assist in charging vehicle.  Parking rates apply. Inquire within.,New York,NY,10065,,888-998-2546,E,,Public,MON: 24 hours | TUE: 24 hours | WED: 24 hours | THU: 24 hours | FRI: 24 hours | SAT: 24 hours | SUN: 24 hours,,,1,,,Blink Network,http://www.blinkcharging.com/,GPS,40.764578,-73.964757,01/22/2021,168095,2021-01-22 22:55:21,,,,,J1772
ELEC,NATIONAL GRID,257 Fuller Rd,SUNY NANOTECH,Albany,NY,12203,,888-758-4389,E,,Public,24 hours daily,,,2,,,ChargePoint Network,http://www.chargepoint.com/,GPS,42.690456,-73.833054,01/23/2021,162241,2021-01-23 00:19:13,,,,,J1772
ELEC,iPark 1510 Lex Garage Corp. - Tesla Destination,116 E 98th St,,New York,NY,10029,,212-289-6257  877-798-3752,E,,Public,24 hours daily; see valet for access,,,3,,,Tesla Destination,https://www.tesla.com/destination-charging,200-9,40.787343,-73.951003,11/03/2020,115003,2020-11-18 00:06:10,P,,,03/01/2017,TESLA
ELEC,Atlantic Center - Tesla Supercharger,625 Atlantic Avenue B12,,Brooklyn,NY,11217,,877-798-3752,E,,Public,24 hours daily; for Tesla use only,,,,12,,Tesla,http://www.teslamotors.com/supercharger,200-9,40.683700,-73.974300,08/10/2020,149300,2020-08-27 20:39:12,P,,,09/30/2019,TESLA
ELEC,Icon Parking 5 E 22nd Street - Tesla Destination,5  E 22nd St,,New York,NY,10010,,212-674-9002  877-798-3752,E,,Public,24 hours daily; see valet for access,,,3,,,Tesla Destination,https://www.tesla.com/destination-charging,200-9,40.740794,-73.988885,11/03/2020,115142,2020-11-18 00:06:10,P,,,05/01/2016,J1772 TESLA
ELEC,ROSENBLUM300,300 Great Oaks Blvd,300 GREAT OAKS,Albany,NY,12203,,888-758-4389,E,,Public,24 hours daily,,,2,,,ChargePoint Network,http://www.chargepoint.com/,GPS,42.680984,-73.846759,01/23/2021,118995,2021-01-23 00:19:13,,,,,J1772
ELEC,Village Hall,20 W Summit St,,Lakewood,NY,14750,,716-763-8557,E,,Public,24 hours daily,,,2,,,Non-Networked,,GPS,42.103591,-79.328576,06/09/2020,157955,2020-06-09 16:47:26,P,,,05/15/2020,J1772
ELEC,JFK Airport Travel Plaza - Tesla Supercharger,150th Ave and 147th St,,Queens,NY,11430,,877-798-3752,E,,Public,24 hours daily; for Tesla use only,,,,4,,Tesla,http://www.teslamotors.com/supercharger,GPS,40.661800,-73.792800,08/10/2020,102341,2020-08-27 20:39:12,P,,,12/15/2013,TESLA
ELEC,Town of Westport New York,22 Champlain Ave,,Westport,NY,12993,,866-816-7584,E,,Public,24 hours daily,,,1,,,EV Connect,http://evconnect.com/,GPS,44.185836,-73.435501,04/08/2020,123083,2020-04-08 12:29:55,LG,,,04/01/2019,J1772
ELEC,TownePlace Suites - Buffalo Airport,4265 Genesee St,,Buffalo,NY,14225,,716-839-1880,E,,Public,24 hours daily; two chargers for guest use only,,,4,,,Non-Networked,,GPS,42.930570,-78.728499,06/09/2020,104733,2020-06-09 16:47:26,P,,,11/01/2018,J1772
ELEC,STATION 1,13 Scribner Hollow Rd,SCRIBNERS; Behind lodge,Hunter,NY,12442,,888-758-4389,E,,Public,24 hours daily,,,2,,,ChargePoint Network,http://www.chargepoint.com/,GPS,42.203996,-74.196529,01/23/2021,162331,2021-01-23 00:19:13,,,,,J1772
ELEC,Icon Parking 237 West Thames - Tesla Destination,237 W Thames,,New York,NY,10280,,212-786-4796  877-798-3752,E,,Public,24 hours daily; see valet for access,,,3,,,Tesla Destination,https://www.tesla.com/destination-charging,200-8,40.708465,-74.016762,11/03/2020,115062,2020-11-18 00:06:10,P,,,11/01/2018,J1772 TESLA
ELEC,GMC Copley Parking - Tesla Destination,2000 Broadway,,New York,NY,10023,,212-787-6990  877-798-3752,E,,Public,24 hours daily; see valet for access,,,3,,,Tesla Destination,https://www.tesla.com/destination-charging,200-9,40.775496,-73.981552,11/03/2020,115044,2020-11-18 00:06:10,P,,,09/01/2017,TESLA
ELEC,Best Western Watertown Fort Drum - Tesla Destination,300 Washington St,,Watertown,NY,13601,,315-782-8000  877-798-3752,E,,Public,24 hours daily; for customer use only; see front desk for access,,,3,,,Tesla Destination,https://www.tesla.com/destination-charging,200-9,43.971836,-75.911773,11/03/2020,122498,2020-11-18 00:06:10,P,,,03/01/2019,J1772 TESLA
ELEC,iPark NYC 400 E 35th NYU - Tesla Destination,400 E 35th St,,New York,NY,10016,,855-472-7569  877-798-3752,E,,Public,24 hours daily; for customer use only; see valet for access,,,3,,,Tesla Destination,https://www.tesla.com/destination-charging,200-8,40.744093,-73.972689,11/03/2020,115120,2020-11-18 00:06:10,P,,,01/01/2016,J1772 TESLA
ELEC,James Mitsubishi - Hamburg,5160 Camp Rd,Located at the rear of the dealership,Hamburg,NY,14075,,716-646-6000,E,,Public,24 hours daily,,,2,,,Non-Networked,,200-9,42.746772,-78.852481,03/03/2020,98836,2020-03-03 21:13:47,P,,,04/01/2018,J1772
ELEC,PANYNJ,East Garage E End Rd LaGuardia Airport,"LGA E GARAGE C1; LGA East garage, center sectionLGA E GARAGE W1; LGA East Garage, West End",New York,NY,11371,,888-758-4389,E,,Public,24 hours daily,,,4,,,ChargePoint Network,http://www.chargepoint.com/,GPS,40.770752,-73.866327,01/23/2021,162407,2021-01-23 00:19:13,,,,,J1772
ELEC,OLYMPIC SPORTS,Bob Run Rd,SPORTS 1SPORTS 10SPORTS 2SPORTS 3SPORTS 4SPORTS 5SPORTS 6SPORTS 7SPORTS 8; -SPORTS 9,Lake Placid,NY,12946,,888-758-4389,E,,Public,24 hours daily,,,20,,,ChargePoint Network,http://www.chargepoint.com/,GPS,44.220365,-73.923881,01/23/2021,170503,2021-01-23 00:19:13,,,,,J1772
ELEC,ADAMS STATION,401 Astor Ct,401 ASTOR CT; Between Bldgs 400 and 500,Delmar,NY,12054,,888-758-4389,E,,Public,24 hours daily,,,2,,,ChargePoint Network,http://www.chargepoint.com/,GPS,42.609180,-73.847380,01/23/2021,165400,2021-01-23 00:19:13,,,,,J1772
ELEC,AL SIGL,1600 South Ave,WOLK,Rochester,NY,14620,,888-758-4389,E,,Public,24 hours daily,,,2,,,ChargePoint Network,http://www.chargepoint.com/,GPS,43.123642,-77.613880,01/23/2021,163584,2021-01-23 00:19:13,,,,,J1772
ELEC,iPark NYC 345 East Garage - Tesla Destination,345 East 80th St,,New York,NY,10075,,855-472-7569  877-798-3752,E,,Public,24 hours daily; see valet for access,,,3,,,Tesla Destination,https://www.tesla.com/destination-charging,200-9,40.773471,-73.952304,11/03/2020,115105,2020-11-18 00:06:10,P,,,01/01/2016,J1772 TESLA
ELEC,ROCHESTER NY,1000 N River St,PORT OF ROCH 1; Island in front of Bill GraysPORT OF ROCH 2; Island in front of Bill Grays,Rochester,NY,14612,,888-758-4389,E,,Public,24 hours daily,,,4,,,ChargePoint Network,http://www.chargepoint.com/,200-9,43.253100,-77.609300,01/23/2021,61213,2021-01-23 00:19:13,,,,,J1772
ELEC,Queens College - Kiely Hall,65-30 Kissena Blvd,,Queens,NY,11367,,866-816-7584,E,,Public,24 hours daily,,,2,,,EV Connect,http://evconnect.com/,GPS,40.735874,-73.815819,04/08/2020,123127,2020-04-08 12:29:55,P,,,04/01/2019,J1772
ELEC,ImPark Atlantic Terrace - Tesla Destination,669 Atlantic Ave,,Brooklyn,NY,11217,,718-857-7770  877-798-3752,E,,Public,24 hours daily; pay lot; see valet for access,,,4,,,Tesla Destination,https://www.tesla.com/destination-charging,200-8,40.683295,-73.973753,11/03/2020,122478,2020-11-18 00:06:10,P,,,03/01/2019,TESLA
ELEC,Angelinas Ristorante - Tesla Destination,399 Ellis St,,Staten Island,NY,10307,,877-798-3752  877-798-3752,E,,Public,24 hours daily; for customer use only; see front desk for access,,,3,,,Tesla Destination,https://www.tesla.com/destination-charging,200-9,40.513370,-74.251370,11/03/2020,168580,2020-11-18 00:06:10,P,,,11/03/2020,TESLA
ELEC,SUNY ONEONTA,24-26 Ravine Pkwy N,SUNY ONEONTA,Oneonta,NY,13820,,888-758-4389,E,,Public,24 hours daily,,,2,,,ChargePoint Network,http://www.chargepoint.com/,GPS,42.469481,-75.065723,01/23/2021,71024,2021-01-23 00:19:13,,,,,J1772
ELEC,Hampton Inn & Suites Lake Placid - Tesla Destination,801 Mirror Lake Dr,,Lake Placid,NY,12946,,518-523-9500  877-798-3752,E,,Public,24 hours daily; for customer use only; see front desk for access,,,2,,,Tesla Destination,https://www.tesla.com/destination-charging,200-9,44.283189,-73.980597,11/03/2020,150678,2020-11-18 00:06:10,P,,,09/30/2019,TESLA
ELEC,Crowne Plaza Suffern-Mahwah - Tesla Destination,3 Executive Blvd,,Suffern,NY,10901,,845-357-4800  877-798-3752,E,,Public,24 hours daily; see front desk for access,,,4,,,Tesla Destination,https://www.tesla.com/destination-charging,200-8,41.118791,-74.113794,11/03/2020,115241,2020-11-18 00:06:10,P,,,05/01/2016,J1772 TESLA
ELEC,imPark 422 E 79th Street - Tesla Destination,422  E 79th St,,New York,NY,10075,,212-737-6283  877-798-3752,E,,Public,24 hours daily; see valet for access,,,3,,,Tesla Destination,https://www.tesla.com/destination-charging,200-8,40.771766,-73.951838,11/03/2020,115132,2020-11-18 00:06:10,P,,,09/01/2017,J1772 TESLA
ELEC,Rockaway Nissan,600 Burnside Ave,,Inwood,NY,11096,,516-239-0100,E,,Public - Call ahead,Dealership business hours,,,1,,,Non-Networked,,200-9,40.622268,-73.742699,06/09/2020,44336,2020-06-09 16:47:26,P,,,11/30/2011,J1772
ELEC,ROCHESTER NY,475 East Ave,EAST END -GW 2; Near Scio StEAST END GW-1; -,Rochester,NY,14604,,888-758-4389,E,,Public,24 hours daily,,,4,,,ChargePoint Network,http://www.chargepoint.com/,200-8,43.154246,-77.592066,01/23/2021,167229,2021-01-23 00:19:13,,,,,J1772
ELEC,Icon Parking 101 W 15th - Tesla Destination,101 W 15th St,,New York,NY,10011,,212-243-4201  877-798-3752,E,,Public,24 hours daily; pay lot,,,4,,,Tesla Destination,https://www.tesla.com/destination-charging,200-8,40.738352,-73.996519,11/03/2020,114992,2020-11-18 00:06:10,P,,,11/01/2018,TESLA
ELEC,Gedney Park,155 Millwood Rd,,Chappaqua,NY,10514,,866-816-7584,E,,Public,24 hours daily,,,1,,,EV Connect,http://evconnect.com/,GPS,41.184415,-73.796180,04/08/2020,123070,2020-04-08 12:29:55,P,,,04/01/2019,J1772
ELEC,Hampton Inn Potsdam - Tesla Destination,169 Market St,,Potsdam,NY,13676,,315-265-0100  877-798-3752,E,,Public,24 hours daily; for customer use only; see front desk for access,,,3,,,Tesla Destination,https://www.tesla.com/destination-charging,200-9,44.682982,-74.987514,11/03/2020,115213,2020-11-18 00:06:10,P,,,11/01/2018,J1772 TESLA
ELEC,Parkright 169 Ludlow Street - Tesla Destination,169 Ludlow St,,New York,NY,10012,,212-247-7303  877-798-3752,E,,Public,24 hours daily; see valet for access,,,3,,,Tesla Destination,https://www.tesla.com/destination-charging,200-9,40.721724,-73.987776,11/03/2020,115029,2020-11-18 00:06:10,P,,,11/01/2018,J1772 TESLA
ELEC,West-Herr Nissan,3580 Southwestern Blvd,,Orchard Park,NY,14127,,716-662-8008,E,,Public - Call ahead,Dealership business hours,,,1,,,Non-Networked,,200-9,42.784867,-78.765580,06/09/2020,44178,2020-06-09 16:47:26,P,,,11/30/2011,J1772
ELEC,Romeo Chevrolet,1665 Ulster Ave,,Lake Katrine,NY,12449,,845-943-4374  845-282-0790,E,,Public,24 hours daily,,,2,1,,Non-Networked,,200-9,41.980335,-73.990256,08/05/2020,85682,2020-08-05 19:05:18,P,,,06/01/2017,J1772 J1772COMBO
ELEC,CHHA2 Garages LLC,400 E 56th St,,New York,NY,10022,,866-816-7584,E,,Public - Credit card at all times,24 hours daily; Also accepts Paypal,A D M V,,6,,,EV Connect,http://evconnect.com/,200-9,40.757099,-73.963122,10/09/2020,166325,2020-10-09 12:41:43,P,,,07/02/2020,J1772
ELEC,RRH,Rochester General Hospital Dr,PORTLAND G1; Left side just beyond entrance,Rochester,NY,14621,,888-758-4389,E,,Public,24 hours daily,,,2,,,ChargePoint Network,http://www.chargepoint.com/,GPS,43.193340,-77.585720,01/23/2021,156615,2021-01-23 00:19:13,,,,,J1772
ELEC,EPLLC,497 Electronics Pkwy,ELECTRONICS 1LOCKHEED 2,Liverpool,NY,13088,,888-758-4389,E,,Public,24 hours daily,,,4,,,ChargePoint Network,http://www.chargepoint.com/,200-9,43.106890,-76.184887,01/23/2021,145764,2021-01-23 00:19:13,,,,,J1772
ELEC,IMPark 92-77 Queens Blvd - Tesla Destination,92-77 Queens Blvd,,Rego Park,NY,11374,,212-937-8660  877-798-3752,E,,Public,24 hours daily; pay lot; see valet for access,,,4,,,Tesla Destination,https://www.tesla.com/destination-charging,200-8,40.732184,-73.866525,11/03/2020,150587,2020-11-18 00:06:10,P,,,09/30/2019,TESLA
ELEC,2600 6TH AVE,2600 6th Ave,CHARGEPOINT 1; Back of BuildingCHARGEPOINT 2; Back of BuildingCHARGEPOINT 3; Back of BuildingCHARGEPOINT 4; Back of BuildingCHARGEPOINT 5; Back of Building,Troy,NY,12180,,888-758-4389,E,,Public,24 hours daily,,,10,,,ChargePoint Network,http://www.chargepoint.com/,200-9,42.741954,-73.682685,01/23/2021,143201,2021-01-23 00:19:13,,,,,J1772
ELEC,Quikpark 43-08 Crescent Street - Tesla Destination,43-08 Crescent St,,New York,NY,11101,,718-433-2433  877-798-3752,E,,Public,24 hours daily; see valet for access,,,3,,,Tesla Destination,https://www.tesla.com/destination-charging,200-8,40.748762,-73.942538,11/03/2020,115137,2020-11-18 00:06:10,P,,,09/01/2017,J1772 TESLA
ELEC,Robert Moses State Park,1 Burma Rd,,Bay Shore,NY,11706,,866-816-7584,E,,Public,24 hours daily,,,1,,,EV Connect,http://evconnect.com/,GPS,40.628685,-73.232953,04/08/2020,123258,2020-04-08 12:29:55,P,,,04/01/2019,J1772
ELEC,Nannen Arboretum,28 Parkside Dr,,Ellicottville,NY,14731,,716-699-5046,E,,Public,24 hours daily,,,2,,,Non-Networked,,GPS,42.283144,-78.669294,06/09/2020,157960,2020-06-09 16:47:26,P,,,05/15/2020,J1772
ELEC,BARD ALMNCT,9 Gardener Way,MONTGOMERY; Montgomery Place Visitors Center,Red Hook,NY,12571,,888-758-4389,E,,Public,24 hours daily,,,2,,,ChargePoint Network,http://www.chargepoint.com/,GPS,42.011357,-73.916662,01/23/2021,162330,2021-01-23 00:19:13,,,,,J1772
ELEC,BURNS MGT,25 Whistler Ct,EXCELSIOR 4; -EXCELSIOR 5; -,Saratoga Springs,NY,12866,,888-758-4389,E,,Public,24 hours daily,,,4,,,ChargePoint Network,http://www.chargepoint.com/,200-8,43.093927,-73.754497,01/23/2021,120972,2021-01-23 00:19:13,,,,,J1772
ELEC,NATIONAL GRID,15 Nott Terrace Heights,MISCI,Schenectady,NY,12308,,888-758-4389,E,,Public,24 hours daily,,,1,,,ChargePoint Network,http://www.chargepoint.com/,GPS,42.812593,-73.933160,01/23/2021,162230,2021-01-23 00:19:13,,,,,J1772
ELEC,The Veneto,250 East 53rd Street,,New York,NY,10022,,888-998-2546,E,,Public,MON: 24 hours | TUE: 24 hours | WED: 24 hours | THU: 24 hours | FRI: 24 hours | SAT: 24 hours | SUN: 24 hours,,,2,,,Blink Network,http://www.blinkcharging.com/,GPS,40.756766,-73.967481,01/22/2021,124140,2021-01-22 22:55:21,,,,,J1772
ELEC,U.S.B.STATION#1,180 Schwenk Dr,ULSTER SAVINGS,Kingston,NY,12401,,888-758-4389,E,,Public,24 hours daily,,,2,,,ChargePoint Network,http://www.chargepoint.com/,GPS,41.937650,-74.025314,01/23/2021,145543,2021-01-23 00:19:13,,,,,J1772
ELEC,Delancey and Essex Municipal Parking Garage,107 Essex St,,New York,NY,10002,,866-816-7584,E,,Public,24 hours daily; Also accepts Paypal,A D M V,,2,,,EV Connect,http://evconnect.com/,GPS,40.719319,-73.988196,04/08/2020,155100,2020-04-08 12:29:55,LG,,,04/16/2018,J1772
ELEC,Quik Park Little West LLC - Tesla Destination,70 Little West St,,New York,NY,10280,,212-349-8316  877-798-3752,E,,Public,24 hours daily; for customer use only; see valet for access,,,3,,,Tesla Destination,https://www.tesla.com/destination-charging,200-9,40.706976,-74.016962,11/03/2020,115179,2020-11-18 00:06:10,P,,,11/01/2018,J1772 TESLA
ELEC,Towne Ford Lincoln,3535 Southwestern Blvd,,Orchard Park,NY,14075,,716-662-6500,E,,Public - Call ahead,Dealership business hours,,,1,,,Non-Networked,,GPS,42.786617,-78.761212,03/03/2020,63643,2020-03-03 21:13:47,P,,,01/01/2014,J1772
ELEC,Packetts Landing,500 Packetts Landing,Rear of Public Parking Lot,Fairport,NY,14452,,585-223-9500,E,,Public,24 hours daily,,,6,,,EV Connect,http://evconnect.com/,GPS,43.100475,-77.439834,06/09/2020,152213,2020-06-09 16:47:26,LG,,,12/27/2019,J1772
ELEC,RPI 1,2144 Burdett Ave,RPI FLEET,Troy,NY,12180,,888-758-4389,E,,Public,24 hours daily,,,1,,,ChargePoint Network,http://www.chargepoint.com/,GPS,42.732209,-73.671332,01/23/2021,162147,2021-01-23 00:19:13,,,,,J1772
ELEC,Nissan of Queens,9325 Rockaway Blvd,,Ozone Park,NY,11417,,718-835-8300,E,,Public - Call ahead,Dealership business hours,,,1,,,Non-Networked,,200-9,40.681170,-73.845621,06/09/2020,49938,2020-06-09 16:47:26,P,,,10/25/2012,J1772
ELEC,Colonie Center - Tesla Supercharger,131 Colonie Center,,Albany,NY,12205,,877-798-3752,E,,Public,24 hours daily; for Tesla use only,,,,6,,Tesla,http://www.teslamotors.com/supercharger,200-8,42.710400,-73.819100,08/10/2020,102325,2020-08-27 20:39:12,P,,,05/01/2014,TESLA
ELEC,Red Roof Inn Malone - Tesla Destination,42 Finney Blvd,,Malone,NY,12953,,518-483-8123  877-798-3752,E,,Public,24 hours daily; for customer use only,,,2,,,Tesla Destination,https://www.tesla.com/destination-charging,200-9,44.847758,-74.300297,11/03/2020,114971,2020-11-18 00:06:10,P,,,11/01/2018,J1772 TESLA
ELEC,TRICITYRENTALS,33 New Scotland Ave,33 NEW SCOTLAND,Albany,NY,12208,,888-758-4389,E,,Public,24 hours daily,,,2,,,ChargePoint Network,http://www.chargepoint.com/,GPS,42.653762,-73.774222,01/23/2021,123417,2021-01-23 00:19:13,,,,,J1772
ELEC,Comstock Avenue Garage Unit 1 & 2,501 Comstock Avenue,,Syracuse,NY,13244,,800-663-5633,E,,Public,MO: Not Specified; TU: Not Specified; WE: Not Specified; TH: Not Specified; FR: Not Specified; SA: Not Specified; SU: Not Specified,,,2,,,SemaCharge Network,https://semaconnect.com/,GPS,43.041032,-76.130233,01/23/2021,147905,2021-01-23 00:11:44,,,,,J1772
ELEC,DEMCO,3512 NY-434,TRUHILTONCHARGE,Vestal,NY,13850,,888-758-4389,E,,Public,24 hours daily,,,2,,,ChargePoint Network,http://www.chargepoint.com/,GPS,42.096362,-75.987614,01/23/2021,169881,2021-01-23 00:19:13,,,,,J1772
ELEC,ADAMS STATION,101 Astor Ct,101 ASTOR CT; Between Bldgs 101 and 108,Delmar,NY,12054,,888-758-4389,E,,Public,24 hours daily,,,2,,,ChargePoint Network,http://www.chargepoint.com/,GPS,42.609016,-73.846760,01/23/2021,165399,2021-01-23 00:19:13,,,,,J1772
ELEC,WARRENCOUNTY,1348 U.S. 9,DPW 3,Lake George,NY,12845,,888-758-4389,E,,Public,24 hours daily,,,2,,,ChargePoint Network,http://www.chargepoint.com/,GPS,43.359019,-73.701171,01/23/2021,150257,2021-01-23 00:19:13,,,,,J1772
ELEC,MP 102 LLC,1214 Fifth Avenue,MP 102 LLC; -,New York,NY,10029,,888-758-4389,E,,Public,24 hours daily,,,2,,,ChargePoint Network,http://www.chargepoint.com/,GPS,40.791267,-73.952039,01/23/2021,162472,2021-01-23 00:19:13,,,,,J1772
ELEC,Nassau Community College,1 Education Dr,,Garden City,NY,11530,,866-816-7584,E,,Public,24 hours daily,,,3,,,EV Connect,http://evconnect.com/,GPS,40.730794,-73.591287,04/08/2020,123145,2020-04-08 12:29:55,P,,,04/01/2019,J1772
ELEC,Icon Parking 990 Ave of the Americas - Tesla Destination,990 Avenue of the Americas,,New York,NY,10018,,212-502-5908  877-798-3752,E,,Public,24 hours daily; see valet for access,,,3,,,Tesla Destination,https://www.tesla.com/destination-charging,200-9,40.751363,-73.986389,11/03/2020,115198,2020-11-18 00:06:10,P,,,05/01/2016,J1772 TESLA
ELEC,Icon Parking 169 W 95th Street - Tesla Destination,169  W 95th St,,New York,NY,10025,,212-749-6218  877-798-3752,E,,Public,24 hours daily; see valet for access,,,3,,,Tesla Destination,https://www.tesla.com/destination-charging,200-9,40.793528,-73.970240,11/03/2020,115030,2020-11-18 00:06:10,P,,,05/01/2016,J1772 TESLA
ELEC,SPOTCOWORK,21 Goodway Drive,HENRIETTA; Located at SPOT cowork,Rochester,NY,14623,,888-758-4389,E,,Public,24 hours daily,,,2,,,ChargePoint Network,http://www.chargepoint.com/,GPS,43.091965,-77.580734,01/23/2021,150809,2021-01-23 00:19:13,,,,,J1772
ELEC,BA #1,7 Airport Park Blvd,7 AIRPORT PARK,Latham,NY,12110,,888-758-4389,E,,Public,24 hours daily,,,2,,,ChargePoint Network,http://www.chargepoint.com/,GPS,42.756546,-73.820110,01/23/2021,143433,2021-01-23 00:19:13,,,,,J1772
ELEC,Custer Observatory - Tesla Destination,1115 Main Bayview Rd,,Southold,NY,11971,,877-798-3752  877-798-3752,E,,Public,24 hours daily; for customer use only; see front desk for access,,,2,,,Tesla Destination,https://www.tesla.com/destination-charging,GPS,41.052046,-72.434680,11/03/2020,152628,2020-11-18 00:06:10,P,,,01/20/2020,TESLA
ELEC,Autosaver Ford,11125 State Route 22,,Comstock,NY,12821,,518-639-5542,E,,Public - Call ahead,Dealership business hours; for customer use only,,,2,,,Non-Networked,,200-9,43.456212,-73.383459,09/03/2020,53894,2020-09-03 19:35:48,P,,,04/01/2013,J1772
ELEC,GreenStar Co-op,770 Cascadilla St,,Ithaca,NY,14850,,866-816-7584,E,,Public - Credit card at all times,24 hours daily; Also accepts Paypal,A D M V,,2,,,EV Connect,http://evconnect.com/,200-9,42.445432,-76.509798,10/09/2020,166347,2020-10-09 12:41:43,P,,,05/26/2020,J1772
ELEC,WOODLAWN GARAGE,37 Woodlawn Ave,"WOODLAWN; 1st Floor of parking deck, access from Woodlawn Ave",Saratoga Springs,NY,12866,,888-758-4389,E,,Public,24 hours daily,,,2,,,ChargePoint Network,http://www.chargepoint.com/,GPS,43.084416,-73.786440,01/23/2021,162164,2021-01-23 00:19:13,,,,,J1772
ELEC,Park N Go - E 121 St - Tesla Destination,210 E 121st St,,New York,NY,10035,,877-798-3752  877-798-3752,E,,Public,24 hours daily; for customer use only; see front desk for access,,,4,,,Tesla Destination,https://www.tesla.com/destination-charging,200-8,40.800795,-73.937382,11/03/2020,169011,2020-11-18 00:06:10,P,,,11/03/2020,TESLA
ELEC,Rapidpark 44 State Street - Tesla Destination,44 State St,,Brooklyn,NY,11201,,718-624-5955  877-798-3752,E,,Public,24 hours daily; see valet for access,,,3,,,Tesla Destination,https://www.tesla.com/destination-charging,200-8,40.691871,-73.998307,11/03/2020,114905,2020-11-18 00:06:10,P,,,09/01/2017,J1772 TESLA
ELEC,NATIONAL GRID,1043 U.S. 9,DAVIDSONS BREW,Queensbury,NY,12804,,888-758-4389,E,,Public,24 hours daily,,,2,,,ChargePoint Network,http://www.chargepoint.com/,GPS,43.343451,-73.685700,01/23/2021,162244,2021-01-23 00:19:13,,,,,J1772
ELEC,I-SQUARE,11 Stranahan Park,NORTH IMAGINE; Stations are in rear parking lotSOUTH IMAGINE; Stations are in rear parking lot,Rochester,NY,14617,,888-758-4389,E,,Public,24 hours daily,,,4,,,ChargePoint Network,http://www.chargepoint.com/,200-9,43.209867,-77.597880,01/23/2021,162370,2021-01-23 00:19:13,,,,,J1772
ELEC,MONTEFIOREMOSES,613 E 233rd St,"WAKEFIELD; Located in the 24 hour garage at Montefiori Wakefield Campus.  Right side of garage entrance, in line of sight with attendant booth.",Bronx,NY,10466,,888-758-4389,E,,Public,24 hours daily,,,2,,,ChargePoint Network,http://www.chargepoint.com/,GPS,40.894881,-73.860525,01/23/2021,162485,2021-01-23 00:19:13,,,,,J1772
ELEC,HUDSON PRESERVE,213 Beryl Way,BLDG 2 #6,Watervliet,NY,12189,,888-758-4389,E,,Public,24 hours daily,,,2,,,ChargePoint Network,http://www.chargepoint.com/,GPS,42.732735,-73.725210,01/23/2021,143165,2021-01-23 00:19:13,,,,,J1772
ELEC,14 HUDSON,14 Hudson,14 HUDSON 1.3,Glens Falls,NY,12801,,888-758-4389,E,,Public,24 hours daily,,,2,,,ChargePoint Network,http://www.chargepoint.com/,GPS,43.307865,-73.645470,01/23/2021,153507,2021-01-23 00:19:13,,,,,J1772
ELEC,VILLAGE WARWICK,16 South St,SOUTH ST LOT,Warwick,NY,10990,,888-758-4389,E,,Public,24 hours daily,,,2,,,ChargePoint Network,http://www.chargepoint.com/,GPS,41.257261,-74.358583,01/23/2021,120968,2021-01-23 00:19:13,,,,,J1772
ELEC,SUNY NEW PALTZ,80 NY-32,ROUTE 32 (3),New Paltz,NY,12561,,888-758-4389,E,,Public,24 hours daily,,,2,,,ChargePoint Network,http://www.chargepoint.com/,GPS,41.738571,-74.079661,01/23/2021,122791,2021-01-23 00:19:13,,,,,J1772
ELEC,Icon Parking 51 W 22nd - Tesla Destination,51 W 22nd St,,New York,NY,10010,,646-230-7263  877-798-3752,E,,Public,24 hours daily; see valet for access,,,3,,,Tesla Destination,https://www.tesla.com/destination-charging,200-9,40.742197,-73.992168,11/03/2020,115147,2020-11-18 00:06:10,P,,,01/01/2016,J1772 TESLA
ELEC,Castellani Art Museum - Niagara University,5795 Lewiston Rd,,Niagara University,NY,14109,,716-286-8200,E,,Public,24 hours daily,,,2,,,Non-Networked,,GPS,43.136934,-79.036462,06/09/2020,147097,2020-06-09 16:47:26,P,,,01/01/2019,J1772
ELEC,Holiday Inn Express Painted Post - Corning Area - Tesla Destination,9775 Victory Hwy,,Painted Post,NY,14870,,607-936-3344  877-798-3752,E,,Public,24 hours daily; for customer use only; see front desk for access,,,3,,,Tesla Destination,https://www.tesla.com/destination-charging,200-8,42.171472,-77.107184,11/03/2020,115208,2020-11-18 00:06:10,P,,,11/01/2018,J1772 TESLA
ELEC,75 Park Place,75 Park Place,,New York,NY,10007,,888-998-2546,E,,Public,MON: 24 hours | TUE: 24 hours | WED: 24 hours | THU: 24 hours | FRI: 24 hours | SAT: 24 hours | SUN: 24 hours,,,1,,,Blink Network,http://www.blinkcharging.com/,GPS,40.714463,-74.010980,01/22/2021,154445,2021-01-22 22:55:21,,,,,J1772
ELEC,CDPHP - Patroon Creek Blvd,500 Patroon Creek Blvd,,Albany,NY,12206,,800-663-5633,E,,Public,MO: Not Specified; TU: Not Specified; WE: Not Specified; TH: Not Specified; FR: Not Specified; SA: Not Specified; SU: Not Specified,,,4,,,SemaCharge Network,https://semaconnect.com/,GPS,42.684834,-73.804965,01/23/2021,148065,2021-01-23 00:11:44,,,,,J1772
ELEC,Calspan Corp Flight Research Center,2041 Niagara Falls Blvd,,Niagara Falls,NY,14034,,866-816-7584,E,,Public,Office business hours; for employee and guest use only,,,2,,,EV Connect,http://evconnect.com/,200-8,43.099710,-78.939097,04/08/2020,94826,2020-04-08 12:29:55,P,,,07/07/2014,J1772
ELEC,NATIONAL GRID,1145 Niagara Falls Blvd,CHILIS AMHERST; Chiliâ€™s Parking lot,Amherst,NY,14226,,888-758-4389,E,,Public,24 hours daily,,,2,,,ChargePoint Network,http://www.chargepoint.com/,GPS,42.984648,-78.821984,01/23/2021,162214,2021-01-23 00:19:13,,,,,J1772
ELEC,WILLIAMSVILLE,5565 Main St,VILLAGE HALL 1; In the back parking lot,Williamsville,NY,14221,,888-758-4389,E,,Public,24 hours daily,,,2,,,ChargePoint Network,http://www.chargepoint.com/,GPS,42.961981,-78.745451,01/23/2021,162301,2021-01-23 00:19:13,,,,,J1772
ELEC,Jamestown Park and Ride,2870 N Main St Extension,,Jamestown,NY,14701,,866-816-7584,E,,Public,24 hours daily,,,2,,,EV Connect,http://evconnect.com/,GPS,42.122334,-79.240661,06/09/2020,123095,2020-06-09 16:47:26,P,,,04/01/2019,J1772
ELEC,RRH,100 Kings Hwy S,RIEDMAN CAMP 5RIEDMAN CAMP 6; Rear of BuildingRIEDMAN CAMP 8; Rear of BuildingRIEDMAN CAMP 9; Rear of BuildingRIEDMAN CAMP10; Rear of BuildingRIEDMAN CAMP2; Rear of BuildingRIEDMAN CAMP3; Rear of BuildingRIEDMAN CAMP4; Rear of BuildingRIEDMAN CAMPUS; Rear of BuildingRIEDMAN CANP1; Rear of BuildingRIEDMAN CANP7; Rear of Building,Rochester,NY,14617,,888-758-4389,E,,Public,24 hours daily,,,19,,,ChargePoint Network,http://www.chargepoint.com/,200-9,43.202137,-77.574919,01/23/2021,121386,2021-01-23 00:19:13,,,,,J1772
ELEC,GARVEY VW,483 Quaker Rd,VE_408313_A,Queensbury,NY,12804,,888-758-4389,E,,Public,24 hours daily,,,2,,,ChargePoint Network,http://www.chargepoint.com/,GPS,43.329369,-73.629750,01/23/2021,162422,2021-01-23 00:19:13,,,,,J1772
ELEC,Adirondack Mountain Club - Tesla Destination,814 Goggins Rd,,Lake George,NY,12845,,518-668-4447  877-798-3752,E,,Public,24 hours daily; for customer use only; see front desk for access,,,2,,,Tesla Destination,https://www.tesla.com/destination-charging,200-8,43.400634,-73.716573,11/03/2020,114964,2020-11-18 00:06:10,P,,,11/01/2018,J1772 TESLA
ELEC,US Postal Service,45 Hudson Ave,,Albany,NY,12207,,866-816-7584,E,,Public,24 hours daily,,,1,,,EV Connect,http://evconnect.com/,GPS,42.648003,-73.752290,04/08/2020,123113,2020-04-08 12:29:55,FG,25.0,U.S. Postal Service,04/01/2019,J1772
ELEC,JEFFERSON COUNT,175 Arsenal St,JEFF COUNTY; -,Watertown,NY,13601,,888-758-4389,E,,Public,24 hours daily,,,2,,,ChargePoint Network,http://www.chargepoint.com/,GPS,43.974990,-75.913506,01/23/2021,145367,2021-01-23 00:19:13,,,,,J1772
ELEC,Broadway Commons - Macyâ€™s,358 N Broadway Commons,,Hicksville,NY,11801,,888-264-2208,E,,Public,6am-12pm daily,,,2,,,Volta,https://voltacharging.com/,GPS,40.771828,-73.531142,03/03/2020,152208,2020-03-03 21:13:47,P,,,01/20/2020,J1772
ELEC,Davidson Nissan,18423 Route 11,,Watertown,NY,13601,,315-782-7700,E,,Public,Dealership business hours,,,1,,,Non-Networked,,200-9,43.932998,-75.936638,06/09/2020,74631,2020-06-09 16:47:26,P,,,03/01/2016,J1772
ELEC,Icon Parking 40 W 26th Street - Tesla Destination,40 W 26th St,,New York,NY,10010,,212-206-8749  877-798-3752,E,,Public - Call ahead,24 hours daily,,,3,,,Tesla Destination,https://www.tesla.com/destination-charging,200-8,40.743961,-73.989912,11/03/2020,115119,2020-11-18 00:06:10,P,,,05/01/2016,J1772 TESLA
ELEC,Standard Parking 1 Metrotech - Tesla Destination,351 Jay St,,Brooklyn,NY,11201,,212-321-7500  877-798-3752,E,,Public,24 hours daily; see valet for access,,,3,,,Tesla Destination,https://www.tesla.com/destination-charging,200-9,40.693216,-73.986716,11/03/2020,114900,2020-11-18 00:06:10,P,,,11/01/2018,J1772 TESLA
ELEC,BA #1,40 British American Blvd,40BRITISH AMER,Latham,NY,12110,,888-758-4389,E,,Public,24 hours daily,,,2,,,ChargePoint Network,http://www.chargepoint.com/,GPS,42.768475,-73.822260,01/23/2021,143441,2021-01-23 00:19:13,,,,,J1772
ELEC,Westchester County Department of Health,134 Main St,,White Plains,NY,10601,,866-816-7584,E,,Public,24 hours daily,,,3,,,EV Connect,http://evconnect.com/,200-8,41.031941,-73.769376,06/09/2020,94865,2020-06-09 16:47:26,LG,,,07/06/2014,J1772
ELEC,WARRENCOUNTY,1344 U.S. 9,DPW 2,Lake George,NY,12845,,888-758-4389,E,,Public,24 hours daily,,,2,,,ChargePoint Network,http://www.chargepoint.com/,GPS,43.359015,-73.701099,01/23/2021,150258,2021-01-23 00:19:13,,,,,J1772
ELEC,Parkit 27 N Moore Street - Tesla Destination,27  N Moore St,,New York,NY,10013,,212-929-9404  877-798-3752,E,,Public,24 hours daily; see valet for access,,,3,,,Tesla Destination,https://www.tesla.com/destination-charging,200-9,40.720215,-74.007465,11/03/2020,115074,2020-11-18 00:06:10,P,,,01/01/2016,J1772 TESLA
ELEC,315 E 40th Street,315 E 40th Street,Attendant will assist in charging vehicle.  Parking rates apply. Inquire within.,New York,NY,10017,,888-998-2546,E,,Public,MON: 24 hours | TUE: 24 hours | WED: 24 hours | THU: 24 hours | FRI: 24 hours | SAT: 24 hours | SUN: 24 hours,,,1,,,Blink Network,http://www.blinkcharging.com/,GPS,40.748359,-73.972213,01/22/2021,164701,2021-01-22 22:55:21,,,,,J1772
ELEC,TOM,175 myrtle blvd,PARKING DECK,Larchmont,NY,10538,,888-758-4389,E,,Public,24 hours daily,,,2,,,ChargePoint Network,http://www.chargepoint.com/,GPS,40.932917,-73.761363,01/23/2021,143877,2021-01-23 00:19:13,,,,,J1772
ELEC,NATIONAL GRID,5801 Rock Cut Rd,COVANTA ENERGY; Near main entrance of Covanta Energy,Jamesville,NY,13078,,888-758-4389,E,,Public,24 hours daily,,,2,,,ChargePoint Network,http://www.chargepoint.com/,GPS,43.005040,-76.116311,01/23/2021,162204,2021-01-23 00:19:13,,,,,J1772
ELEC,Spectrum,401 W 219th St,,New York,NY,10034,,866-816-7584,E,,Public,Office business hours; for employee and guest use only,,,8,,,EV Connect,http://evconnect.com/,200-8,40.871210,-73.911616,04/08/2020,94854,2020-04-08 12:29:55,P,,,06/27/2016,J1772
ELEC,NATIONAL GRID,600 Riverwalk Pkwy,RIVERVIEW SOLAR; Side of the 600 building,Tonawanda,NY,14150,,888-758-4389,E,,Public,24 hours daily,,,2,,,ChargePoint Network,http://www.chargepoint.com/,GPS,43.000068,-78.910950,01/23/2021,162247,2021-01-23 00:19:13,,,,,J1772
ELEC,MUNICIPAL EVSE,Fire rd,HOCKE RINK 2HOCKEY ICE RINK,Glens Falls,NY,12801,,888-758-4389,E,,Public,24 hours daily,,,4,,,ChargePoint Network,http://www.chargepoint.com/,GPS,43.322010,-73.665310,01/23/2021,155263,2021-01-23 00:19:13,,,,,J1772
ELEC,Apple West Parking,303 West 96th Street,This is located in the entrance of the garage,New York,NY,10025,,888-998-2546,E,,Public,MON: 24 hours | TUE: 24 hours | WED: 24 hours | THU: 24 hours | FRI: 24 hours | SAT: 24 hours | SUN: 24 hours,,,4,,,Blink Network,http://www.blinkcharging.com/,GPS,40.795783,-73.973678,01/22/2021,163485,2021-01-22 22:55:21,,,,,J1772
ELEC,ULSTER COUNTY,733 Broadway,"PROBATION DEPT; Station located at rear of the building. Ulster County's fee for public charging is $0.50 per hour, effective 1-1-2020.",Kingston,NY,12401,,888-758-4389,E,,Public,24 hours daily,,,2,,,ChargePoint Network,http://www.chargepoint.com/,GPS,41.931091,-74.010589,01/23/2021,162129,2021-01-23 00:19:13,,,,,J1772
ELEC,TONAWANDA YPR,157 Thorncliff Rd,POOL PLAZA 3; -,Buffalo,NY,14223,,888-758-4389,E,,Public,24 hours daily,,,2,,,ChargePoint Network,http://www.chargepoint.com/,GPS,42.982750,-78.866710,01/23/2021,154519,2021-01-23 00:19:13,,,,,J1772
ELEC,U OF R,265 Crittenden Blvd,SAUNDERS (SRB); Rear of building at loading dock/dumpster area,Rochester,NY,14642,,888-758-4389,E,,Public,24 hours daily,,,2,,,ChargePoint Network,http://www.chargepoint.com/,GPS,43.120697,-77.627760,01/23/2021,162267,2021-01-23 00:19:13,,,,,J1772
ELEC,Hannaford Supermarket,900 Central Ave,,Albany,NY,12206,,877-455-3833,E,,Public - Card key at all times,24 hours daily,,,,1,,eVgo Network,https://www.evgo.com/,GPS,42.680658,-73.790978,01/23/2021,93508,2021-01-23 01:19:54,,,,,CHADEMO J1772COMBO
ELEC,Town of Danby - Clerk's Office,1830 Danby Rd,,Ithaca,NY,14850,,866-816-7584,E,,Public,24 hours daily,,,1,,,EV Connect,http://evconnect.com/,GPS,42.353991,-76.481996,04/08/2020,123074,2020-04-08 12:29:55,LG,,,04/01/2019,J1772
ELEC,TONAWANDA YPR,175 Brompton Rd,GOLF DOME 1; -GOLF DOME 2; -,Tonawanda,NY,14150,,888-758-4389,E,,Public,24 hours daily,,,4,,,ChargePoint Network,http://www.chargepoint.com/,200-8,43.004226,-78.843914,01/23/2021,149727,2021-01-23 00:19:13,,,,,J1772
ELEC,Icon Parking 14-26 William Street - Tesla Destination,14-26 William St,,New York,NY,10004,,212-269-5056  877-798-3752,E,,Public,24 hours daily; see valet for access,,,3,,,Tesla Destination,https://www.tesla.com/destination-charging,200-8,40.704976,-74.009682,11/03/2020,115014,2020-11-18 00:06:10,P,,,05/01/2016,J1772 TESLA
ELEC,Hawthorne Valley - Tesla Destination,330 Country Rte 21C,,Ghent,NY,12075,,518-672-4465  877-798-3752,E,,Public,24 hours daily,,,6,,,Tesla Destination,https://www.tesla.com/destination-charging,200-8,42.270437,-73.593885,11/03/2020,114946,2020-11-18 00:06:10,P,,,07/26/2018,J1772 TESLA
ELEC,Luce Ristorante - Tesla Destination,1053 Oyster Bay Rd,,East Norwich,NY,11732,,516-624-8330  877-798-3752,E,,Public,24 hours daily; for customer use only; see front desk for access,,,3,,,Tesla Destination,https://www.tesla.com/destination-charging,200-9,40.843546,-73.532489,11/03/2020,114938,2020-11-18 00:06:10,P,,,08/15/2016,J1772 TESLA
ELEC,Catamount Ski,78 Catamount Rd,,Hillsdale,NY,12529,,518-325-3200,E,,Public - Call ahead,10am-5:30pm daily,,2,2,,,Non-Networked,,200-8,42.171859,-73.477728,03/03/2020,85949,2020-03-03 21:13:47,P,,,03/01/2020,J1772 NEMA1450 NEMA520
ELEC,West Herr Nissan - Williamsville,8137 Main St,,Williamsville,NY,14221,,877-813-5387,E,,Public - Call ahead,Dealership business hours,,,1,,,Non-Networked,,GPS,42.962750,-78.691132,06/09/2020,44216,2020-06-09 16:47:26,P,,,11/30/2011,J1772
ELEC,Parkit 575 Washington - Tesla Destination,575 Washington St,,New York,NY,10014,,212-929-9404  877-798-3752,E,,Public,24 hours daily; for customer use only; see valet for access,,,6,,,Tesla Destination,https://www.tesla.com/destination-charging,200-9,40.729474,-74.008847,11/03/2020,115164,2020-11-18 00:06:10,P,,,01/01/2016,J1772 TESLA
ELEC,HOLIDAY INN J,308 N Comrie Ave,HOLIDAY INN 1; Station is located in Employee lot at rear of hotel,Johnstown,NY,12095,,888-758-4389,E,,Public,24 hours daily,,,2,,,ChargePoint Network,http://www.chargepoint.com/,GPS,43.022409,-74.360229,01/23/2021,162479,2021-01-23 00:19:13,,,,,J1772
ELEC,Metro North Train Station - North White Plains,50 Haarlem Ave,,White Plains,NY,10603,,866-816-7584,E,,Public,24 hours daily,,,10,,,EV Connect,http://evconnect.com/,GPS,41.053445,-73.772404,04/08/2020,123265,2020-04-08 12:29:55,P,,,04/01/2019,J1772
ELEC,Cliff's Elbow Room,1549 Main Rd,South Jamesport Ave,Jamesport,NY,11947,,631-722-3292,E,,Public,24 hours daily,,,1,,,Non-Networked,,200-9,40.948819,-72.582795,03/03/2020,64706,2020-03-03 21:13:47,P,,,05/01/2012,J1772
ELEC,NY DCFC,1791 Old Country Rd,"RIVERHEAD, NY; Behind Starbucks",Riverhead,NY,11901,,888-758-4389,E,,Public,24 hours daily,,,,2,,ChargePoint Network,http://www.chargepoint.com/,GPS,40.923448,-72.703416,01/23/2021,170120,2021-01-23 00:19:13,,,,,CHADEMO J1772COMBO
ELEC,TOWN OF BOLTON,5 Cross Street,TOWN OF BOLTON1,Bolton Landing,NY,12814,,888-758-4389,E,,Public,24 hours daily,,,2,,,ChargePoint Network,http://www.chargepoint.com/,GPS,43.557602,-73.657839,01/23/2021,165304,2021-01-23 00:19:13,,,,,J1772
ELEC,RapidPark 600 Columbus Ave - Tesla Destination,600 Columbus Ave,,New York,NY,10128,,212-874-7086  877-798-3752,E,,Public,24 hours daily; see valet for access,,,3,,,Tesla Destination,https://www.tesla.com/destination-charging,200-9,40.788716,-73.970934,11/03/2020,115169,2020-11-18 00:06:10,P,,,08/15/2016,J1772 TESLA
ELEC,BEDFORDEV,321 Bedford Rd.,TOWN HALL; Bedford Town Hall - side parking lot,Bedford Hills,NY,10507,,888-758-4389,E,,Public,24 hours daily,,,2,,,ChargePoint Network,http://www.chargepoint.com/,GPS,41.239820,-73.699073,01/23/2021,162336,2021-01-23 00:19:13,,,,,J1772
ELEC,69 COLLIER ST,7 Hawley St,,Binghamton,NY,13901,,888-758-4389,E,,Public,24 hours daily,,,4,,,ChargePoint Network,http://www.chargepoint.com/,200-9,42.097692,-75.914117,01/23/2021,171217,2021-01-23 00:19:13,,,,,J1772
ELEC,VILLAGEHALL,76 E Market Street,VILLAGE CENTER; -Behind FirehouseVILLAGE HALL; -Behind the Firehouse,Rhinebeck,NY,12572,,888-758-4389,E,,Public,24 hours daily,,,4,,,ChargePoint Network,http://www.chargepoint.com/,200-9,41.926636,-73.909771,01/23/2021,162181,2021-01-23 00:19:13,,,,,J1772
ELEC,Hampton Inn New Paltz - Tesla Destination,4 S Putt Corners Rd,,New Paltz,NY,12561,,845-255-4200  877-798-3752,E,,Public,24 hours daily; for customer use only; see front desk for access,,,4,,,Tesla Destination,https://www.tesla.com/destination-charging,200-9,41.740795,-74.067127,11/03/2020,114982,2020-11-18 00:06:10,P,,,11/01/2018,J1772 TESLA
ELEC,TOWN SAND LAKE,8428 Miller Hill Rd,SAND LAKE,Averill Park,NY,12018,,888-758-4389,E,,Public,24 hours daily,,,2,,,ChargePoint Network,http://www.chargepoint.com/,GPS,42.638393,-73.541670,01/23/2021,149114,2021-01-23 00:19:13,,,,,J1772
ELEC,STOP SHOP,194 W Montauk Hwy,HAMPTON BAY 01; ChargePoint BMW/VW Express Corridor Location,Hampton Bays,NY,11946,,888-758-4389,E,,Public,24 hours daily,,,,1,,ChargePoint Network,http://www.chargepoint.com/,200-9,40.875588,-72.539078,01/23/2021,162402,2021-01-23 00:19:13,,,,,J1772COMBO
ELEC,Sunset Beach Hotel - Tesla Destination,35 Shore Rd,,Shelter Island,NY,11964,,631-749-2001  877-798-3752,E,,Public,24 hours daily; for customer use only; see front desk for access,,,3,,,Tesla Destination,https://www.tesla.com/destination-charging,200-9,41.073469,-72.364514,11/03/2020,115237,2020-11-18 00:06:10,P,,,09/01/2016,J1772 TESLA
ELEC,BEAM CHARGING / 1510 LEX GARAGE,1510 Lexington Avenue,Located on 98th St between Lexington Ave & Park Ave. - Attendant will assist in charging vehicle.  Parking rates apply. Inquire within.,Manhattan,NY,10029,,888-998-2546,E,,Public,MON: 24 hours | TUE: 24 hours | WED: 24 hours | THU: 24 hours | FRI: 24 hours | SAT: 24 hours | SUN: 24 hours,,,1,,,Blink Network,http://www.blinkcharging.com/,GPS,40.786732,-73.950411,01/22/2021,169848,2021-01-22 22:55:21,,,,,J1772
ELEC,HONEST WEIGHT,81 Watervliet Ave,HONEST WEIGHT 1,Albany,NY,12206,,888-758-4389,E,,Public,24 hours daily,,,2,,,ChargePoint Network,http://www.chargepoint.com/,GPS,42.678158,-73.781550,01/23/2021,146797,2021-01-23 00:19:13,,,,,J1772
ELEC,iPark NYC 1025 83rd - Tesla Destination,11 E 83rd St,,New York,NY,10028,,855-472-7569  877-798-3752,E,,Public,24 hours daily; see valet for access,,,3,,,Tesla Destination,https://www.tesla.com/destination-charging,200-8,40.779468,-73.961086,11/03/2020,114999,2020-11-18 00:06:10,P,,,03/01/2016,J1772 TESLA
ELEC,Quik Park 808 Garage LLC - Tesla Destination,808 Columbus Ave,,New York,NY,10025,,212-352-0514  877-798-3752,E,,Public,24 hours daily; for customer use only; see valet for access,,,3,,,Tesla Destination,https://www.tesla.com/destination-charging,200-9,40.795214,-73.966003,11/03/2020,115188,2020-11-18 00:06:10,P,,,01/01/2016,J1772 TESLA
ELEC,COHOES,65 Remsen St,STATION 3,Cohoes,NY,12047,,888-758-4389,E,,Public,24 hours daily,,,2,,,ChargePoint Network,http://www.chargepoint.com/,GPS,42.775368,-73.701350,01/23/2021,162359,2021-01-23 00:19:13,,,,,J1772
ELEC,WEST HARRISON,85 Lake St,STATION ONE; Parking lot,Harrison,NY,10604,,888-758-4389,E,,Public,24 hours daily,,,2,,,ChargePoint Network,http://www.chargepoint.com/,GPS,41.043003,-73.747760,01/23/2021,165336,2021-01-23 00:19:13,,,,,J1772
ELEC,BMWHV,2068 South Rd,STATION 01,Poughkeepsie,NY,12601,,888-758-4389,E,,Public,24 hours daily,,,1,,,ChargePoint Network,http://www.chargepoint.com/,GPS,41.630920,-73.914444,01/23/2021,162443,2021-01-23 00:19:13,,,,,J1772
ELEC,Dalewood Shopping Center,371 North Central Avenue,,Hartsdale,NY,10530,,833-632-2778,E,,Public,24 hours daily,,,1,3,,Electrify America,https://www.electrifyamerica.com/,GPS,41.032196,-73.787087,01/23/2021,167890,2021-01-23 01:23:19,,,,,CHADEMO J1772 J1772COMBO
ELEC,River Spring Lodge - Tesla Destination,1961 Church Rd,,Darien Center,NY,14040,,585-708-4212  877-798-3752,E,,Public - Call ahead,24 hours daily; for customer use only,,,1,,,Tesla Destination,https://www.tesla.com/destination-charging,200-9,42.862450,-78.344960,11/03/2020,114932,2020-11-18 00:06:10,P,,,03/01/2017,TESLA
ELEC,S.A.N.Y.,160 School Ln,PARKING 1PARKING FOURPARKING THREEPARKING TWO,Frankfort,NY,13340,,888-758-4389,E,,Public,24 hours daily,,,4,,,ChargePoint Network,http://www.chargepoint.com/,200-9,43.075925,-75.169394,01/23/2021,164389,2021-01-23 00:19:13,,,,,J1772
ELEC,Lake Pleasant Lodge - Tesla Destination,2839 State Rte 30,,Speculator,NY,12164,,518-548-5253  877-798-3752,E,,Public,24 hours daily; for customer use only; see front desk for access,,,2,,,Tesla Destination,https://www.tesla.com/destination-charging,200-8,43.495979,-74.360195,11/03/2020,150725,2020-11-18 00:06:10,P,,,09/30/2019,TESLA
ELEC,CLARKSTOWN,10 Maple Ave,TOC 1 & 2; Enter parking lot from eastbound Congers RdTOC 3 & 4; Enter parking lot from eastbound Congers Rd,New City,NY,10956,,888-758-4389,E,,Public,24 hours daily,,,4,,,ChargePoint Network,http://www.chargepoint.com/,200-9,41.146584,-73.987847,01/23/2021,153177,2021-01-23 00:19:13,,,,,J1772
ELEC,500 PEARL,500 Pearl street,500 PEARL; Inside parking garage on 2nd floor,Buffalo,NY,14202,,888-758-4389,E,,Public,24 hours daily,,,2,,,ChargePoint Network,http://www.chargepoint.com/,GPS,42.893581,-78.873877,01/23/2021,153301,2021-01-23 00:19:13,,,,,J1772
ELEC,Apple Parking 332 W 11th Street - Tesla Destination,332 W 11th St,,New York,NY,10014,,212-741-9079  877-798-3752,E,,Public - Call ahead,24 hours daily,,,3,,,Tesla Destination,https://www.tesla.com/destination-charging,200-9,40.735404,-74.007717,11/03/2020,115100,2020-11-18 00:06:10,P,,,03/01/2017,TESLA
ELEC,Ramp Ford,4869 Nesconset Hwy,,Port Jefferson Station,NY,11776,,631-473-1550,E,,Public - Call ahead,Dealership business hours,,,1,,,Non-Networked,,200-9,40.919660,-73.051332,03/03/2020,64141,2020-03-03 21:13:47,P,,,05/01/2014,J1772
ELEC,Icon Parking 200 E 65th Street - Tesla Destination,200 E 65th St,,New York,NY,10021,,212-319-1485  877-798-3752,E,,Public,24 hours daily; see valet for access,,,3,,,Tesla Destination,https://www.tesla.com/destination-charging,200-9,40.764777,-73.963555,11/03/2020,115040,2020-11-18 00:06:10,P,,,09/01/2017,J1772 TESLA
ELEC,Coliseum Park Apts - Central Parking,345 W 58th Street,Entrance on 910 9th Ave.,New York,NY,10019,,888-998-2546,E,,Public,MON: 24 hours | TUE: 24 hours | WED: 24 hours | THU: 24 hours | FRI: 24 hours | SAT: 24 hours | SUN: 24 hours,,,2,,,Blink Network,http://www.blinkcharging.com/,GPS,40.768432,-73.984033,01/22/2021,124141,2021-01-22 22:55:21,,,,,J1772
ELEC,NATIONAL GRID,N Barry St,KOHLS OLEAN; Kohlâ€™s parking lot Olean NY,Olean,NY,14760,,888-758-4389,E,,Public,24 hours daily,,,2,,,ChargePoint Network,http://www.chargepoint.com/,GPS,42.081885,-78.427994,01/23/2021,162237,2021-01-23 00:19:13,,,,,J1772
ELEC,iPark 34 N 7th Street - Tesla Destination,34  N 7th St,,Brooklyn,NY,11249,,718-782-1494  877-798-3752,E,,Public,24 hours daily; see valet for access,,,3,,,Tesla Destination,https://www.tesla.com/destination-charging,200-9,40.720475,-73.962650,09/30/2019,122473,2020-03-02 20:14:21,P,,,03/01/2019,J1772 TESLA
ELEC,Quik Park West 57 LLC - Tesla Destination,9 W 57th St,,New York,NY,10019,,212-754-4077  877-798-3752,E,,Public,24 hours daily; for customer use only; see valet for access,,,3,,,Tesla Destination,https://www.tesla.com/destination-charging,200-9,40.763888,-73.974990,11/03/2020,115193,2020-11-18 00:06:10,P,,,03/01/2015,J1772 TESLA
ELEC,Parkit 10 Wooster St. - Tesla Destination,6-10 Wooster St,,New York,NY,10013,,212-431-1034  877-798-3752,E,,Public,24 hours daily; for customer use only; see valet for access,,,3,,,Tesla Destination,https://www.tesla.com/destination-charging,200-9,40.721131,-74.003570,11/03/2020,115174,2020-11-18 00:06:10,P,,,02/01/2015,J1772 TESLA
ELEC,Icon Parking 225 W 83 Street - Tesla Destination,225  W 83rd St,,New York,NY,10024,,212-874-9934  877-798-3752,E,,Public,24 hours daily; see valet for access,,,3,,,Tesla Destination,https://www.tesla.com/destination-charging,200-9,40.786371,-73.977357,11/03/2020,115058,2020-11-18 00:06:10,P,,,05/01/2016,J1772 TESLA
ELEC,551W21 SR Capital - Tesla Destination,558 West 21st Street,,New York,NY,10011,,877-798-3752  877-798-3752,E,,Public,24 hours daily; for customer use only; see front desk for access,,,6,,,Tesla Destination,https://www.tesla.com/destination-charging,200-9,40.747278,-74.007618,11/03/2020,168556,2020-11-18 00:06:10,P,,,11/03/2020,TESLA
ELEC,DEFREETSVILLE 1,443 East St,TRAIN STATION,Rensselaer,NY,12144,,888-758-4389,E,,Public,24 hours daily,,,2,,,ChargePoint Network,http://www.chargepoint.com/,GPS,42.640590,-73.740738,01/23/2021,162189,2021-01-23 00:19:13,,,,,J1772
ELEC,NYS ORDA,793 Peaceful Valley Rd,GORE MOUNTAINGORE MOUNTAIN 2GORE MOUNTAIN 3,North Creek,NY,12853,,888-758-4389,E,,Public,24 hours daily,,,6,,,ChargePoint Network,http://www.chargepoint.com/,200-9,43.678499,-73.991539,01/23/2021,123391,2021-01-23 00:19:13,,,,,J1772
ELEC,Troutbeck - Tesla Destination,515 Leedsville Rd,,Amenia,NY,12501,,845-789-1555  877-798-3752,E,,Public,24 hours daily; for customer use only; see front desk for access,,,2,,,Tesla Destination,https://www.tesla.com/destination-charging,200-9,41.855019,-73.515167,11/03/2020,114879,2020-11-18 00:06:10,P,,,11/01/2018,TESLA
ELEC,Price Chopper,3863 Route 31,,Liverpool,NY,13090,,315-622-6008,E,,Public,24 hours daily; 2 hour limit,,,2,,,Non-Networked,,200-9,43.188350,-76.245500,03/03/2020,91865,2020-03-03 21:13:47,P,,,01/01/2018,J1772
ELEC,EAST HAMPTON TH,200 Daniels Hole Rd,EH AIRPORT; -,East Hampton,NY,11937,,888-758-4389,E,,Public,24 hours daily,,,2,,,ChargePoint Network,http://www.chargepoint.com/,GPS,40.961178,-72.247936,01/23/2021,162467,2021-01-23 00:19:13,,,,,J1772
ELEC,Tebbens Steel,800 Burman Blvd,,Calverton,NY,11933,,866-816-7584,E,,Public,24 hours daily; Also accepts Paypal,A D M V,,2,,,EV Connect,http://evconnect.com/,GPS,40.913144,-72.793118,04/08/2020,154922,2020-04-08 12:29:55,P,,,08/07/2019,J1772
ELEC,Icon Parking 175 W 90th Street - Tesla Destination,175 W 90th St,,Manhattan,NY,10024,,212-874-8983  877-798-3752,E,,Public,24 hours daily; pay lot; see valet for access,,,4,,,Tesla Destination,https://www.tesla.com/destination-charging,200-8,40.790289,-73.972756,11/03/2020,150572,2020-11-18 00:06:10,P,,,09/30/2019,TESLA
ELEC,Icon Parking 55 W 14th Street - Tesla Destination,55 W 14th St,,New York,NY,10011,,212-242-9218  877-798-3752,E,,Public,24 hours daily; see valet for access,,,3,,,Tesla Destination,https://www.tesla.com/destination-charging,200-9,40.737266,-73.996110,11/03/2020,115159,2020-11-18 00:06:10,P,,,05/01/2016,J1772 TESLA
ELEC,Price Chopper,1060 Madison Ave,,Albany,NY,12208,,518-438-6241,E,,Public,24 hours daily; maximum stay of 2 hours,,,2,,,Non-Networked,,200-9,42.664671,-73.790463,03/03/2020,68579,2020-03-03 21:13:47,P,,,05/01/2015,J1772
ELEC,Rapidpark 99 Park Ave - Tesla Destination,105 E 39th,,New York,NY,10016,,212-265-7854  877-798-3752,E,,Public,24 hours daily; for customer use only; see valet for access,,,3,,,Tesla Destination,https://www.tesla.com/destination-charging,200-8,40.750254,-73.978627,11/03/2020,114996,2020-11-18 00:06:10,P,,,11/01/2018,J1772 TESLA
ELEC,Buffalo Niagara Medical Campus - Ellicott Street Lot,589 Ellicott St,,Buffalo,NY,14203,,716-218-7153,E,,Public,Lot business hours; pay lot,,,4,,,Non-Networked,,GPS,42.895794,-78.868315,06/09/2020,50707,2020-06-09 16:47:26,P,,,09/01/2010,J1772
ELEC,iPark NYC 75 Wall Street - Tesla Destination,75 Wall St,,New York,NY,10005,,855-472-7569  877-798-3752,E,,Public,24 hours daily; for customer use only; see valet for access,,,3,,,Tesla Destination,https://www.tesla.com/destination-charging,200-9,40.705042,-74.008118,11/03/2020,122491,2020-11-18 00:06:10,P,,,03/01/2019,J1772 TESLA
ELEC,TOWN OF BABYLON,Tanner Park,TANNER PARK 1; East side station TANNER PARK 2; West side station,Amityville,NY,11701,,888-758-4389,E,,Public,24 hours daily,,,2,,,ChargePoint Network,http://www.chargepoint.com/,GPS,40.656884,-73.396359,01/23/2021,162280,2021-01-23 00:19:13,,,,,J1772
ELEC,The Shops at Atlas Park - Tesla Supercharger,8000 Cooper Avenue,,Glendale,NY,11385,,877-798-3752,E,,Public,24 hours daily; for Tesla use only,,,,10,,Tesla,http://www.teslamotors.com/supercharger,200-9,40.708000,-73.867000,08/10/2020,149312,2020-08-27 20:39:12,P,,,09/30/2019,TESLA
ELEC,DeNooyer Chevrolet,127 Wolf Rd,,Albany,NY,12205,,,E,,Public - Call ahead,Dealership business hours; 518-458-7700,,,,1,,Non-Networked,,GPS,42.717867,-73.806317,03/03/2020,117741,2020-03-03 21:13:47,P,,,01/01/2019,J1772COMBO
ELEC,"Montauk, NY - Tesla Supercharger",70 S Euclid Ave,,Montauk,NY,11954,,877-798-3752,E,,Public,24 hours daily; for Tesla use only,,,,8,,Tesla,http://www.teslamotors.com/supercharger,GPS,41.036006,-71.943652,01/14/2021,170431,2021-01-14 18:42:41,P,,,12/14/2020,TESLA
ELEC,Icon Parking Sutton 53 - Tesla Destination,417 E 53rd St,,New York,NY,10022,,212-644-6312  877-798-3752,E,,Public,24 hours daily; pay lot; see valet for access,,,3,,,Tesla Destination,https://www.tesla.com/destination-charging,200-8,40.755371,-73.963368,11/03/2020,115128,2020-11-18 00:06:10,P,,,11/01/2018,J1772 TESLA
ELEC,Champion Parking W 53rd Street - Tesla Destination,159 W 53rd St,,New York,NY,10019,,212-245-1299  877-798-3752,E,,Public,24 hours daily; see valet for access,,,3,,,Tesla Destination,https://www.tesla.com/destination-charging,200-9,40.763000,-73.981278,11/03/2020,115025,2020-11-18 00:06:10,P,,,01/01/2016,J1772 TESLA
ELEC,National Grid - Syracuse Office Center,300 Erie Blvd W,"In customer parking lot, access off of Genesee Street",Syracuse,NY,13202,,315-474-1511,E,,Public,8am-5pm M-F,,,6,,,ChargePoint Network,http://www.chargepoint.com/,200-9,43.051581,-76.157208,11/09/2020,123603,2020-11-09 16:53:32,T,,,03/01/2019,J1772
ELEC,Busti Town Hall,125 Chautauqua Ave,,Lakewood,NY,14750,,716-763-8561,E,,Public,24 hours daily,,,2,,,Non-Networked,,GPS,42.102039,-79.325406,06/09/2020,157956,2020-06-09 16:47:26,P,,,05/15/2020,J1772
ELEC,125 Victory Hwy - Tesla Supercharger,125 Victory Hwy Painted Post,,Painted Post,NY,14870,,877-798-3752,E,,Public,24 hours daily; for Tesla use only,,,,10,,Tesla,http://www.teslamotors.com/supercharger,200-9,42.170800,-77.108100,08/10/2020,102338,2020-08-27 20:39:12,P,,,07/23/2018,TESLA
ELEC,NATIONAL GRID,Goat Island Rd,NIAGARA FALLS 2,Niagara Falls,NY,14303,,888-758-4389,E,,Public,24 hours daily,,,2,,,ChargePoint Network,http://www.chargepoint.com/,GPS,43.081539,-79.070427,01/23/2021,162242,2021-01-23 00:19:13,,,,,J1772
ELEC,IPark 99 3rd Avenue - Tesla Destination,99 3rd Ave,,Brooklyn,NY,11217,,347-457-6504  877-798-3752,E,,Public,24 hours daily; pay lot; see valet for access,,,4,,,Tesla Destination,https://www.tesla.com/destination-charging,200-8,40.683176,-73.981914,11/03/2020,150583,2020-11-18 00:06:10,P,,,09/30/2019,TESLA
ELEC,ROCHESTER NY,28 Fitzhugh St N,SISTER CITIES 1;  Level 1,Rochester,NY,14614,,888-758-4389,E,,Public,24 hours daily,,,2,,,ChargePoint Network,http://www.chargepoint.com/,GPS,43.156136,-77.614096,01/23/2021,145450,2021-01-23 00:19:13,,,,,J1772
ELEC,854ELLICOTT,1040 Michigan Ave,134 HIGH ST 10; -134 HIGH ST 7; -134 HIGH ST 8; -134 HIGH ST 9; -,Buffalo,NY,14203,,888-758-4389,E,,Public,24 hours daily,,,8,,,ChargePoint Network,http://www.chargepoint.com/,200-8,42.901290,-78.862912,01/23/2021,169910,2021-01-23 00:19:13,,,,,J1772
ELEC,GMC - BEEKMAN 1,420 E 51st St,Located between 1st Ave & FDR. - Attendant will assist in charging vehicle.  Parking rates apply. Inquire within,New York,NY,10022,,888-998-2546,E,,Public,MON: 24 hours | TUE: 24 hours | WED: 24 hours | THU: 24 hours | FRI: 24 hours | SAT: 24 hours | SUN: 24 hours,,,1,,,Blink Network,http://www.blinkcharging.com/,GPS,40.754022,-73.965166,01/22/2021,118348,2021-01-22 22:55:21,,,,,J1772
ELEC,Icon 299 Peal Street Seaport Parking - Tesla Destination,238 Pearl St,,New York,NY,10069,,212-227-2215  877-798-3752,E,,Public,24 hours daily; see valet for access,,,3,,,Tesla Destination,https://www.tesla.com/destination-charging,200-8,40.707360,-74.004989,11/03/2020,115063,2020-11-18 00:06:10,P,,,08/15/2016,J1772 TESLA
ELEC,HUDSON PRESERVE,8 Beryl Way,BLDG 11 #9,Watervliet,NY,12189,,888-758-4389,E,,Public,24 hours daily,,,2,,,ChargePoint Network,http://www.chargepoint.com/,GPS,42.731430,-73.724330,01/23/2021,143229,2021-01-23 00:19:13,,,,,J1772
ELEC,AAA Latham - Tesla Destination,595 New Loudon Rd,,Latham,NY,12110,,518-426-1000  877-798-3752,E,,Public,24 hours daily; for customer use only,,,2,,,Tesla Destination,https://www.tesla.com/destination-charging,200-9,42.728097,-73.759578,11/03/2020,114967,2020-11-18 00:06:10,P,,,11/01/2018,J1772 TESLA
ELEC,600 RIVER ROAD,600 River Rd,600 RIVER600 RIVER 92107,North Tonawanda,NY,14120,,888-758-4389,E,,Public,24 hours daily,,,4,,,ChargePoint Network,http://www.chargepoint.com/,200-9,43.035848,-78.886544,01/23/2021,152233,2021-01-23 00:19:13,,,,,J1772
ELEC,SUNY NEW PALTZ,61 Southside Ave,WALLKILL 2,New Paltz,NY,12561,,888-758-4389,E,,Public,24 hours daily,,,2,,,ChargePoint Network,http://www.chargepoint.com/,GPS,41.741501,-74.088157,01/23/2021,122785,2021-01-23 00:19:13,,,,,J1772
ELEC,Bear Mountain State Park,3006 Seven Lakes Pkwy,,Bear Mountain,NY,10911,,866-816-7584,E,,Public,24 hours daily,,,1,,,EV Connect,http://evconnect.com/,200-8,41.309433,-73.990271,05/06/2020,123056,2020-05-06 17:56:57,P,,,04/01/2019,J1772
ELEC,BETHEL,3586 State Rte 55,BETHEL; Behind Town Court,Kauneonga Lake,NY,12749,,888-758-4389,E,,Public,24 hours daily,,,2,,,ChargePoint Network,http://www.chargepoint.com/,GPS,41.685982,-74.830789,01/23/2021,162325,2021-01-23 00:19:13,,,,,J1772
ELEC,CHARGING UR CAR,1546 U.S. 9,STATION 1; To the right of main entranceSTATION 2; -,clifton park,NY,12065,,888-758-4389,E,,Public,24 hours daily,,,4,,,ChargePoint Network,http://www.chargepoint.com/,200-9,42.844604,-73.752077,01/23/2021,147429,2021-01-23 00:19:13,,,,,J1772
ELEC,Pearl Street Parking,221 Pearl St,,Buffalo,NY,14202,,866-816-7584,E,,Public - Credit card at all times,24 hours daily; Also accepts Paypal,A D M V,,4,,,EV Connect,http://evconnect.com/,200-9,42.885188,-78.875488,10/09/2020,166425,2020-10-09 12:41:43,SG,,,03/13/2018,J1772
ELEC,MAIN LIBRARY,99 Clinton St,SCHENECTADY; In lot off of Clinton Street,Schenectady,NY,12305,,888-758-4389,E,,Public,24 hours daily,,,2,,,ChargePoint Network,http://www.chargepoint.com/,GPS,42.815247,-73.937702,01/23/2021,162321,2021-01-23 00:19:13,,,,,J1772
ELEC,RPI 1,110 8th St,SERVICE S1; -,Troy,NY,12180,,888-758-4389,E,,Public,24 hours daily,,,2,,,ChargePoint Network,http://www.chargepoint.com/,200-9,42.729185,-73.679038,01/23/2021,121219,2021-01-23 00:19:13,,,,,J1772
ELEC,HAWTHORNE RIDGE,30 Community Way,STATION 1STATION 2,East Greenbush,NY,12061,,888-758-4389,E,,Public,24 hours daily,,,4,,,ChargePoint Network,http://www.chargepoint.com/,200-9,42.614498,-73.696414,01/23/2021,164156,2021-01-23 00:19:13,,,,,J1772
ELEC,CAR CHARGERS,140 Nottingham Cir,NUMBER 411NUMBER 421NUMBER 434,Jamesville,NY,13078,,888-758-4389,E,,Public,24 hours daily,,,3,,,ChargePoint Network,http://www.chargepoint.com/,200-8,43.012430,-76.083041,01/23/2021,165198,2021-01-23 00:19:13,,,,,J1772
ELEC,iPark NYC 183 E 73rd Street - Tesla Destination,184 E 73rd St,,New York,NY,10021,,212-517-3534  877-798-3752,E,,Public,24 hours daily; see valet for access,,,3,,,Tesla Destination,https://www.tesla.com/destination-charging,200-8,40.770442,-73.960649,11/03/2020,115034,2020-11-18 00:06:10,P,,,05/01/2016,J1772 TESLA
ELEC,Best Western Rochester Marketplace Inn - Tesla Destination,940 Jefferson Rd,,Rochester,NY,14623,,585-427-2700  877-798-3752,E,,Public,24 hours daily; for customer use only; see front desk for access,,,3,,,Tesla Destination,https://www.tesla.com/destination-charging,200-9,43.087708,-77.613092,11/03/2020,115227,2020-11-18 00:06:10,P,,,11/01/2018,J1772 TESLA
ELEC,iPark NYC 250 West Parking - Tesla Destination,250  W 19th St,,New York,NY,10011,,212-627-1704  877-798-3752,E,,Public,24 hours daily; for customer use only; see valet for access,,,3,,,Tesla Destination,https://www.tesla.com/destination-charging,200-8,40.742179,-73.999226,11/03/2020,115068,2020-11-18 00:06:10,P,,,03/01/2015,J1772 TESLA
ELEC,CITYLIGHTS,4-74 48th Ave,QUEENS LANDING; First floor parking garage,Long Island City,NY,11109,,888-758-4389,E,,Public,24 hours daily,,,2,,,ChargePoint Network,http://www.chargepoint.com/,GPS,40.745011,-73.957424,01/23/2021,144109,2021-01-23 00:19:13,,,,,J1772
ELEC,CITY OF GENEVA,47 Castle St,CITY HALL #1; At the rear of the building,Geneva,NY,14456,,888-758-4389,E,,Public,24 hours daily,,,2,,,ChargePoint Network,http://www.chargepoint.com/,GPS,42.867477,-76.982604,01/23/2021,164639,2021-01-23 00:19:13,,,,,J1772
ELEC,Quik Park 311 West Broadway LLC - Tesla Destination,311 W Broadway,,New York,NY,10013,,212-925-2539  877-798-3752,E,,Public,24 hours daily; see valet for access,,,2,,,Tesla Destination,https://www.tesla.com/destination-charging,200-9,40.721638,-74.003781,11/03/2020,115091,2020-11-18 00:06:10,P,,,01/01/2016,TESLA
ELEC,Lane Valente Industries,20 Keyland Ct,,Bohemia,NY,11716,,866-816-7584,E,,Public,24 hours daily,,,3,,,EV Connect,http://evconnect.com/,GPS,40.776286,-73.095956,04/08/2020,123078,2020-04-08 12:29:55,P,,,04/01/2019,J1772
ELEC,Best Western Plus University Inn - Tesla Destination,3051 W State St,,Olean,NY,14760,,716-372-1300  877-798-3752,E,,Public,24 hours daily; for customer use only; see front desk for access,,,3,,,Tesla Destination,https://www.tesla.com/destination-charging,200-9,42.076450,-78.466970,11/03/2020,115203,2020-11-18 00:06:10,P,,,11/01/2018,J1772 TESLA
ELEC,WATERCLUB2582,36 Pine Street,GARAGE 2 CHARGE,Poughkeepsie,NY,12601,,888-758-4389,E,,Public,24 hours daily,,,2,,,ChargePoint Network,http://www.chargepoint.com/,GPS,41.698847,-73.937505,01/23/2021,162288,2021-01-23 00:19:13,,,,,J1772
ELEC,GOSHEN EVCS #1A,128 W Main St,STATION 1,Goshen,NY,10924,,888-758-4389,E,,Public,24 hours daily,,,2,,,ChargePoint Network,http://www.chargepoint.com/,GPS,41.401950,-74.326510,01/23/2021,162374,2021-01-23 00:19:13,,,,,J1772
ELEC,iPark 530 E 80th Street - Tesla Destination,530 E 80th St,,New York,NY,10075,,212-439-1580  877-798-3752,E,,Public,24 hours daily; see valet for access,,,3,,,Tesla Destination,https://www.tesla.com/destination-charging,200-8,40.771136,-73.948252,11/03/2020,115151,2020-11-18 00:06:10,P,,,03/01/2017,J1772 TESLA
ELEC,TCR TOWNE EV,12 California ave,STATION 1; -STATION 2; -STATION 3; -,Albany,NY,12205,,888-758-4389,E,,Public,24 hours daily,,,6,,,ChargePoint Network,http://www.chargepoint.com/,200-9,42.703771,-73.813932,01/23/2021,169945,2021-01-23 00:19:13,,,,,J1772
ELEC,IPT - SMITHTOWN,320 Middle Country Rd,SUNOCO MIDCNTRY,Smithtown,NY,11787,,888-758-4389,E,,Public,24 hours daily,,,2,,,ChargePoint Network,http://www.chargepoint.com/,GPS,40.855212,-73.173585,01/23/2021,145735,2021-01-23 00:19:13,,,,,J1772
ELEC,Marcellus Village Police Department,6 Slocombe Ave,,Marcellus,NY,13108,,866-816-7584,E,,Public,24 hours daily,,,1,,,EV Connect,http://evconnect.com/,200-9,42.982820,-76.341410,04/08/2020,94849,2020-04-08 12:29:55,LG,,,04/12/2017,J1772
ELEC,BottleBuys,350 Glen Head Road,Store hoursMon - Sat 10am-8pm Sun Noon-5pmFREE During business hours$2.00 per hour when closed,Glen Head,NY,11545,,800-663-5633,E,,Public,MO: 12:00am-12:00am; TU: 12:00am-12:00am; WE: 12:00am-12:00am; TH: 12:00am-12:00am; FR: 12:00am-12:00am; SA: 12:00am-12:00am; SU: 12:00am-12:00am,,,2,,,SemaCharge Network,https://semaconnect.com/,GPS,40.837575,-73.614379,01/23/2021,148164,2021-01-23 00:11:44,,,,,J1772
ELEC,Moriches Community Center,313 Frowein Rd,,Center Moriches,NY,11934,,866-816-7584,E,,Public,24 hours daily,,,4,,,EV Connect,http://evconnect.com/,GPS,40.805016,-72.807488,12/03/2020,123099,2020-12-03 22:33:12,LG,,,04/01/2019,J1772
ELEC,Fairfield Inn by Marriott Rochester Airport - Tesla Destination,1200 Brooks Ave,,Rochester,NY,14623,,585-529-5000  877-798-3752,E,,Public,24 hours daily; for customer use only; see front desk for access,,,4,,,Tesla Destination,https://www.tesla.com/destination-charging,200-9,43.127560,-77.665112,11/03/2020,115220,2020-11-18 00:06:10,P,,,11/01/2018,J1772 TESLA
ELEC,Parking Garage,59 Paidge Ave,,Brooklyn,NY,11222,,866-816-7584,E,,Public,Garage business hours,,,10,,,EV Connect,http://evconnect.com/,200-9,40.737171,-73.949257,04/08/2020,94831,2020-04-08 12:29:55,P,,,06/24/2016,J1772
ELEC,NATIONAL GRID,Putnam Way,BONNER HALL.; Station located at Bonner Hall,Buffalo,NY,14228,,888-758-4389,E,,Public,24 hours daily,,,2,,,ChargePoint Network,http://www.chargepoint.com/,GPS,43.001813,-78.788469,01/23/2021,162387,2021-01-23 00:19:13,,,,,J1772
ELEC,3050 Corlear Ave - Nagle Parking Inc. - Tesla Destination,3050 Corlear Ave,,Bronx,NY,10463,,718-708-5077  877-798-3752,E,,Public,24 hours daily; pay lot; see valet for access,,,4,,,Tesla Destination,https://www.tesla.com/destination-charging,200-9,40.879900,-73.907762,11/03/2020,150624,2020-11-18 00:06:10,P,,,09/30/2019,TESLA
ELEC,COLE GROUP,98 Saratoga Ct,COLONIE EAST 3,Latham,NY,12110,,888-758-4389,E,,Public,24 hours daily,,,2,,,ChargePoint Network,http://www.chargepoint.com/,GPS,42.746113,-73.770676,01/23/2021,154059,2021-01-23 00:19:13,,,,,J1772
ELEC,SAVARINO COMPAN,Myrtle St Lot Charger 2 500 Seneca Street,500 SENECA 2; -,Buffalo,NY,14204,,888-758-4389,E,,Public,24 hours daily,,,2,,,ChargePoint Network,http://www.chargepoint.com/,GPS,42.878418,-78.857730,01/23/2021,164150,2021-01-23 00:19:13,,,,,J1772
ELEC,IBEW LU86,2300 E River Rd,IBEW LU86; IBEW Local 86 behind building,Rochester,NY,14623,,888-758-4389,E,,Public,24 hours daily,,,2,,,ChargePoint Network,http://www.chargepoint.com/,GPS,43.096721,-77.676694,01/23/2021,162168,2021-01-23 00:19:13,,,,,J1772
ELEC,Fairfield Inn & Suites by Marriott Rochester West - Tesla Destination,400 Paddy Creek Cir,,Rochester,NY,14623,,585-621-6050  877-798-3752,E,,Public,24 hours daily; for customer use only; see front desk for access,,,3,,,Tesla Destination,https://www.tesla.com/destination-charging,200-8,43.204373,-77.673253,11/03/2020,115222,2020-11-18 00:06:10,P,,,11/01/2018,J1772 TESLA
ELEC,Walkway Over the Hudson,61 Parker Ave,,Poughkeepsie,NY,12601,,866-816-7584,E,,Public,24 hours daily,,,4,,,EV Connect,http://evconnect.com/,GPS,41.711943,-73.926052,10/09/2020,123117,2020-10-09 12:41:43,P,,,04/01/2019,J1772
ELEC,Holiday Inn Express Canandaigua - Finger Lakes - Tesla Destination,330 Eastern Blvd,,Canandaigua,NY,14424,,585-396-3669  877-798-3752,E,,Public,24 hours daily; for customer use only; see front desk for access,,,3,,,Tesla Destination,https://www.tesla.com/destination-charging,200-8,42.878166,-77.255793,11/03/2020,114920,2020-11-18 00:06:10,P,,,11/01/2018,J1772 TESLA
ELEC,HUDSON PRESERVE,1901 Beryl Way,BLDG 19 #12BLDG 22 #2,Watervliet,NY,12189,,888-758-4389,E,,Public,24 hours daily,,,4,,,ChargePoint Network,http://www.chargepoint.com/,200-9,42.732747,-73.727052,01/23/2021,143244,2021-01-23 00:19:13,,,,,J1772
ELEC,Nissan - Garden City,316 N Franklin St,,Hempstead,NY,11550,,,E,,Public - Call ahead,Dealership business hours; contact 516-483-4400 for more information,,,1,1,,Non-Networked,,GPS,40.716930,-73.630152,06/09/2020,44346,2020-06-09 16:47:26,P,,,11/30/2011,CHADEMO J1772
ELEC,BEDFORDEV,65 Greenwich Rd,MEMORIAL PARK 1; Bedford Village Memorial Park (near exit),Bedford,NY,10506,,888-758-4389,E,,Public,24 hours daily,,,2,,,ChargePoint Network,http://www.chargepoint.com/,GPS,41.197058,-73.644729,01/23/2021,162340,2021-01-23 00:19:13,,,,,J1772
ELEC,SPRINGVALLEYAPT,92 High Rock Ave,,Saratoga Springs,NY,12866,,888-758-4389,E,,Public,24 hours daily,,,4,,,ChargePoint Network,http://www.chargepoint.com/,200-8,43.085278,-73.780670,01/23/2021,171309,2021-01-23 00:19:13,,,,,J1772
ELEC,MAIN,1133 NY-414,"DEL LAGO 1ST FL; 1st floor, use right side entrance and go to the far left",Waterloo,NY,13165,,888-758-4389,E,,Public,24 hours daily,,,2,,,ChargePoint Network,http://www.chargepoint.com/,GPS,42.969966,-76.845282,01/23/2021,162381,2021-01-23 00:19:13,,,,,J1772
ELEC,Village of Waterville - West Main Street,115 W Main St,,Waterville,NY,13480,,315-841-4221,E,,Public,24 hours daily,,,2,,,Non-Networked,,200-8,42.930765,-75.380530,03/03/2020,99360,2020-03-03 21:13:47,LG,,,04/18/2018,J1772
ELEC,NORTHTOWN VW,1135 Millersport Hwy,VW_408152_A,Buffalo,NY,14226,,888-758-4389,E,,Public,24 hours daily,,,2,,,ChargePoint Network,http://www.chargepoint.com/,GPS,42.981621,-78.795872,01/23/2021,162426,2021-01-23 00:19:13,,,,,J1772
ELEC,STONY BROOK UNV,Engineering Dr,ENGINEERING; -,Stony Brook,NY,11790,,888-758-4389,E,,Public,24 hours daily,,,2,,,ChargePoint Network,http://www.chargepoint.com/,GPS,40.912355,-73.125968,01/23/2021,169335,2021-01-23 00:19:13,,,,,J1772
ELEC,Glen Avenue Suites,6 Glen Ave,,Cooperstown,NY,13326,,607-547-5054,E,,Public,8am-6pm daily; for guest use only,,,1,,,Non-Networked,,GPS,42.698540,-74.931170,03/03/2020,131661,2020-03-03 21:13:47,P,,,07/15/2019,J1772
ELEC,DELLA HONDA,702 NY-3,SHOP02,Plattsburgh,NY,12901,,888-758-4389,E,,Public,24 hours daily,,,1,,,ChargePoint Network,http://www.chargepoint.com/,GPS,44.695726,-73.515764,01/23/2021,154583,2021-01-23 00:19:13,,,,,J1772
ELEC,Islandia Shopping Center - Tesla Supercharger,1750 Veterans Hwy,,Islandia,NY,11598,,877-798-3752,E,,Public,24 hours daily; for Tesla use only,,,,10,,Tesla,http://www.teslamotors.com/supercharger,GPS,40.804800,-73.180100,08/10/2020,116807,2020-08-27 20:39:12,P,,,12/01/2018,TESLA
ELEC,TOK EVSE,3211 Church St,TOWN OF KINDERH,Valatie,NY,12184,,888-758-4389,E,,Public,24 hours daily,,,2,,,ChargePoint Network,http://www.chargepoint.com/,GPS,42.415531,-73.676855,01/23/2021,162133,2021-01-23 00:19:13,,,,,J1772
ELEC,KISSENA GARAGE,43-70 Kissena Boulevard,,Flushing,NY,11355,,888-998-2546,E,,Public,MON: 24 hours | TUE: 24 hours | WED: 24 hours | THU: 24 hours | FRI: 24 hours | SAT: 24 hours | SUN: 24 hours,,,1,,,Blink Network,http://www.blinkcharging.com/,GPS,40.753624,-73.823573,01/22/2021,164727,2021-01-22 22:55:21,,,,,J1772
ELEC,Gateway Center at Bronx Terminal Market,610 Exterior St,Level 1 across from Home Depot lot near the Parking Customer Service Window,Bronx,NY,10451,,888-998-2546,E,,Public,MON: 24 hours | TUE: 24 hours | WED: 24 hours | THU: 24 hours | FRI: 24 hours | SAT: 24 hours | SUN: 24 hours,,,2,,,Blink Network,http://www.blinkcharging.com/,GPS,40.822142,-73.931128,01/22/2021,164227,2021-01-22 22:55:21,,,,,J1772
ELEC,Dayton T Brown Inc,1175 Church St,,Bohemia,NY,11743,,866-816-7584,E,,Public,24 hours daily; Also accepts Paypal,A D M V,,8,,,EV Connect,http://evconnect.com/,GPS,40.771770,-73.099184,04/08/2020,154892,2020-04-08 12:29:55,P,,,04/25/2019,J1772
ELEC,210 HANCOCK,423 1st St,STATION 1,Ithaca,NY,14850,,888-758-4389,E,,Public,24 hours daily,,,2,,,ChargePoint Network,http://www.chargepoint.com/,GPS,42.448275,-76.503354,01/23/2021,162304,2021-01-23 00:19:13,,,,,J1772
ELEC,Quik Park 81 Fleet Place LLC - Tesla Destination,81 Fleet Pl,,Brooklyn,NY,11201,,212-832-2066  877-798-3752,E,,Public,24 hours daily; see valet for access,,,3,,,Tesla Destination,https://www.tesla.com/destination-charging,200-9,40.693208,-73.981326,11/03/2020,114915,2020-11-18 00:06:10,P,,,01/01/2016,J1772 TESLA
ELEC,QuickChek - Tesla Supercharger,1147 Sunrise Highway,,Copiague,NY,11726,,877-798-3752,E,,Public,24 hours daily; for Tesla use only,,,,8,,Tesla,http://www.teslamotors.com/supercharger,GPS,40.688720,-73.406200,08/10/2020,154208,2020-08-27 20:39:12,P,,,02/28/2020,TESLA
ELEC,HUNTER LOT,141 Prospect Ave,MAMARONECK; On 1st level on south side of garage,Mamaroneck,NY,10543,,888-758-4389,E,,Public,24 hours daily,,,2,,,ChargePoint Network,http://www.chargepoint.com/,GPS,40.949583,-73.735136,01/23/2021,162254,2021-01-23 00:19:13,,,,,J1772
ELEC,Walgreens,589 Prospect Ave,,Brooklyn,NY,11215,,877-455-3833,E,,Public - Card key at all times,24 hours daily,,,,1,,eVgo Network,https://www.evgo.com/,GPS,40.656459,-73.977527,01/23/2021,93308,2021-01-23 01:19:54,,,,,CHADEMO J1772COMBO
ELEC,HARMONY MILLS 1,Mohawk St & Cohoes Mills,FALLSVIEW 1.1FALLSVIEW 1.2FALLSVIEW 1.3WEST 1WEST 1 1.2,Cohoes,NY,12047,,888-758-4389,E,,Public,24 hours daily,,,10,,,ChargePoint Network,http://www.chargepoint.com/,GPS,42.781780,-73.705505,01/23/2021,149627,2021-01-23 00:19:13,,,,,J1772
ELEC,Yonkers Parking Authority,8 Buena Vista Ave,,Yonkers,NY,10701,,866-816-7584,E,,Public,24 hours daily,,,4,,,EV Connect,http://evconnect.com/,200-9,40.934270,-73.902149,04/08/2020,94871,2020-04-08 12:29:55,LG,,,04/18/2016,J1772
ELEC,BURNS MGT,74 Weibel Ave,THE SPRINGS #5; -,Saratoga Springs,NY,12866,,888-758-4389,E,,Public,24 hours daily,,,2,,,ChargePoint Network,http://www.chargepoint.com/,GPS,43.094795,-73.743675,01/23/2021,143573,2021-01-23 00:19:13,,,,,J1772
ELEC,RUSTIC VILLAGE,140-280 W Squire Dr,RUSTICCLUBHOUSE; station is located in the island in the clubhouse lot,Rochester,NY,14623,,888-758-4389,E,,Public,24 hours daily,,,2,,,ChargePoint Network,http://www.chargepoint.com/,GPS,43.101488,-77.622587,01/23/2021,162503,2021-01-23 00:19:13,,,,,J1772
ELEC,PANYNJ,JFK Terminal 5 JFK International Airport,JFK Y GARAGE 4; -,Queens,NY,11430,,888-758-4389,E,,Public,24 hours daily,,,2,,,ChargePoint Network,http://www.chargepoint.com/,GPS,40.645841,-73.779222,01/23/2021,147470,2021-01-23 00:19:13,,,,,J1772
ELEC,GLOVERS PARKING,85 Mill Rd,STATION 1STATION 2,Westhampton Beach,NY,11978,,888-758-4389,E,,Public,24 hours daily,,,4,,,ChargePoint Network,http://www.chargepoint.com/,200-8,40.811928,-72.643211,01/23/2021,162270,2021-01-23 00:19:13,,,,,J1772
ELEC,Nissan 112,730 Route 112,Route 112,Patchogue,NY,11772,,,E,,Public - Call ahead,Dealership business hours; contact 631-289-9100 for more information,,,1,1,,Non-Networked,,GPS,40.792986,-73.008270,06/09/2020,44180,2020-06-09 16:47:26,P,,,11/30/2011,CHADEMO J1772
ELEC,Icon Parking 70 Gold Street - Tesla Destination,80 Gold St,,New York,NY,10038,,212-964-5250  877-798-3752,E,,Public,24 hours daily; pay lot; see valet for access,,,3,,,Tesla Destination,https://www.tesla.com/destination-charging,200-9,40.709609,-74.004401,11/03/2020,115186,2020-11-18 00:06:10,P,,,11/01/2018,J1772 TESLA
ELEC,AMBEMA CORP.,579 NY-3,STATION 1.1; Back of the hotel parking lot.,Plattsburgh,NY,12901,,888-758-4389,E,,Public,24 hours daily,,,2,,,ChargePoint Network,http://www.chargepoint.com/,GPS,44.695385,-73.504720,01/23/2021,164860,2021-01-23 00:19:13,,,,,J1772
ELEC,DENNYâ€™S / RED ROOF INN,100 Marginal Rd.,,Herkimer,NY,13350,,833-632-2778,E,,Public,24 hours daily,,,,4,,Electrify America,https://www.electrifyamerica.com/,GPS,43.018812,-74.991876,01/23/2021,170367,2021-01-23 01:23:19,,,,,CHADEMO J1772COMBO
ELEC,EVPASS,135 North James Street,R FTS-1; 4 units on 2nd level of garageR FTS-2; 4 units on 2nd level of garageR FTS-3; 4 units on 2nd level of garageR FTS-4; Fort Stanwix Parking Garage,Rome,NY,13440,,888-758-4389,E,,Public,24 hours daily,,,4,,,ChargePoint Network,http://www.chargepoint.com/,200-8,43.211739,-75.456778,01/23/2021,162508,2021-01-23 00:19:13,,,,,J1772
ELEC,NATIONAL GRID,135 Western Ave,SUNY 1,Albany,NY,12203,,888-758-4389,E,,Public,24 hours daily,,,2,,,ChargePoint Network,http://www.chargepoint.com/,GPS,42.659167,-73.772672,01/23/2021,162201,2021-01-23 00:19:13,,,,,J1772
ELEC,ADAMS STATION,708 Catlyn Ct,708 CATLYN CT; Bldg 701-708,Delmar,NY,12054,,888-758-4389,E,,Public,24 hours daily,,,2,,,ChargePoint Network,http://www.chargepoint.com/,GPS,42.606503,-73.848000,01/23/2021,165392,2021-01-23 00:19:13,,,,,J1772
ELEC,MUNICIPAL EVSE,28 Elm St,ELM STREET LOT,Glens Falls,NY,12801,,888-758-4389,E,,Public,24 hours daily,,,2,,,ChargePoint Network,http://www.chargepoint.com/,GPS,43.309433,-73.646380,01/23/2021,155243,2021-01-23 00:19:13,,,,,J1772
ELEC,NATIONAL GRID,15-25 4th St,UNCLE SAM 2; Near exitUNCLE SAM; Near main entrance,Troy,NY,12180,,888-758-4389,E,,Public,24 hours daily,,,4,,,ChargePoint Network,http://www.chargepoint.com/,200-9,42.733226,-73.688856,01/23/2021,162222,2021-01-23 00:19:13,,,,,J1772
ELEC,HABBERSTAD BMW,959 E Jericho Turnpike,DC FAST 01HUNTINGTON 01,Huntington Station,NY,11746,,888-758-4389,E,,Public,24 hours daily,,,2,1,,ChargePoint Network,http://www.chargepoint.com/,200-8,40.835792,-73.373734,01/23/2021,162414,2021-01-23 00:19:13,,,,,J1772 J1772COMBO
ELEC,Beacon Metro North Train Station,1 Ferry Plaza,Located off Route 9D,Beacon,NY,12508,,866-816-7584,E,,Public,24 hours daily,,,4,,,EV Connect,http://evconnect.com/,200-8,41.505079,-73.983205,04/08/2020,65284,2020-04-08 12:29:55,SG,,,04/01/2018,J1772
ELEC,ImPark Underhill Garage - Tesla Destination,105 Underhill Ave,,Brooklyn,NY,11238,,877-909-6199  877-798-3752,E,,Public,24 hours daily; pay lot; see front desk for access,,,4,,,Tesla Destination,https://www.tesla.com/destination-charging,200-9,40.677460,-73.965421,11/03/2020,122469,2020-11-18 00:06:10,P,,,03/01/2019,TESLA
ELEC,East 149th Street Municipal Parking Garage,315 E 149th St,,Bronx,NY,10451,,718-292-4523  866-816-7584,E,,Public,24 hours daily,,,3,,,EV Connect,http://evconnect.com/,200-9,40.817326,-73.920914,04/08/2020,65291,2020-04-08 12:29:55,LG,,,06/01/2015,J1772
ELEC,The Spot Restaurant - Tesla Supercharger,1062 Front Street,,Binghamton,NY,13905,,877-798-3752,E,,Public,24 hours daily; for Tesla use only,,,,8,,Tesla,http://www.teslamotors.com/supercharger,200-9,42.145500,-75.902100,08/10/2020,102326,2020-08-27 20:39:12,P,,,10/01/2015,TESLA
ELEC,MARKET 32 EV,15 Park Avenue,MARKET 32 CP; IN FRONT OF PHARMACYMARKET32 EV CP; IN FRONT OF PHARMACY,Clifton Park,NY,12065,,888-758-4389,E,,Public,24 hours daily,,,4,,,ChargePoint Network,http://www.chargepoint.com/,200-8,42.864962,-73.781404,01/23/2021,152283,2021-01-23 00:19:13,,,,,J1772
ELEC,MARKET 32 EV,1 Kendall Way,MALTA EV CHARGE; In front of building,Malta,NY,12020,,888-758-4389,E,,Public,24 hours daily,,,2,,,ChargePoint Network,http://www.chargepoint.com/,GPS,42.973660,-73.794790,01/23/2021,152281,2021-01-23 00:19:13,,,,,J1772
ELEC,Hudson Valley Rail Trail Depot - Tesla Destination,101 New Paltz Rd,,Highland,NY,12528,,845-691-2144  877-798-3752,E,,Public,24 hours daily,,,4,,,Tesla Destination,https://www.tesla.com/destination-charging,200-9,41.733972,-73.974846,11/03/2020,114949,2020-11-18 00:06:10,P,,,11/01/2018,J1772 TESLA
ELEC,CFL-1,9 NY-9H,LIBRARY RT 23B; Back of new building,Claverack-Red Mills,NY,12513,,888-758-4389,E,,Public,24 hours daily,,,2,,,ChargePoint Network,http://www.chargepoint.com/,GPS,42.222970,-73.735540,01/23/2021,146985,2021-01-23 00:19:13,,,,,J1772
ELEC,GGMC Parking 8 E 33rd St Garage - Tesla Destination,325  East 5th Ave,,New York,NY,10016,,212-725-4102  877-798-3752,E,,Public,24 hours daily; see valet for access,,,3,,,Tesla Destination,https://www.tesla.com/destination-charging,200-9,40.747330,-73.984857,11/03/2020,115096,2020-11-18 00:06:10,P,,,01/01/2016,J1772 TESLA
ELEC,Southern Tier Welcome Center,2 Route 81 N,,Kirkwood,NY,13795,,607-775-0156,E,,Public,24 hours daily,,,,2,,Non-Networked,,GPS,42.020139,-75.780637,03/03/2020,104977,2020-03-03 21:13:47,SG,,,10/05/2017,CHADEMO J1772COMBO
ELEC,Baron's Cove - Tesla Destination,31 W Water St,,Sag Harbor,NY,11963,,631-725-2100  877-798-3752,E,,Public,24 hours daily; for customer use only; see front desk for access,,,1,,,Tesla Destination,https://www.tesla.com/destination-charging,200-9,41.000092,-72.300430,11/03/2020,115232,2020-11-18 00:06:10,P,,,08/15/2016,TESLA
ELEC,New York Hilton Midtown - Tesla Destination,1335 Avenue of the Americas,,New York,NY,10019,,212-586-7000  877-798-3752,E,,Public,24 hours daily; for customer use only; see valet for access,,,4,,,Tesla Destination,https://www.tesla.com/destination-charging,200-9,40.762445,-73.979710,11/03/2020,115011,2020-11-18 00:06:10,P,,,11/01/2018,J1772 TESLA
ELEC,NYSE Thruway - NYPA,Milepost 96 S,,Ruby,NY,12475,,866-816-7584,E,,Public,24 hours daily,A D M V,,,2,,EV Connect,http://evconnect.com/,GPS,42.013813,-74.000036,11/09/2020,167632,2020-11-09 16:53:32,SG,,,06/25/2020,CHADEMO J1772COMBO
ELEC,St. Paul's Church Episcopal,121 Lincoln Ave,,Waddington,NY,13694,,866-816-7584,E,,Public,24 hours daily,,,1,,,EV Connect,http://evconnect.com/,GPS,44.863388,-75.202879,04/08/2020,123061,2020-04-08 12:29:55,P,,,04/01/2019,J1772
ELEC,SFG Garage,204 E 80th Street,,New York,NY,10075,,888-998-2546,E,,Public,MON: 24 hours | TUE: 24 hours | WED: 24 hours | THU: 24 hours | FRI: 24 hours | SAT: 24 hours | SUN: 24 hours,,,2,,,Blink Network,http://www.blinkcharging.com/,GPS,40.774436,-73.956354,01/22/2021,164750,2021-01-22 22:55:21,,,,,J1772
ELEC,ERIE COUNTY,12 Calvert Blvd,ELLIOTT CREEK,Tonawanda,NY,14150,,888-758-4389,E,,Public,24 hours daily,,,2,,,ChargePoint Network,http://www.chargepoint.com/,GPS,43.022540,-78.826160,01/23/2021,154777,2021-01-23 00:19:13,,,,,J1772
ELEC,255ORANGE,255 Orange St,255 ORANGE ST,Albany,NY,12210,,888-758-4389,E,,Public,24 hours daily,,,2,,,ChargePoint Network,http://www.chargepoint.com/,GPS,42.658684,-73.758840,01/23/2021,154335,2021-01-23 00:19:13,,,,,J1772
ELEC,Icon Parking 235 W 48th - Tesla Destination,235 W 48th St,,Manhattan,NY,10036,,212-245-9421  877-798-3752,E,,Public,24 hours daily; pay lot; see valet for access,,,4,,,Tesla Destination,https://www.tesla.com/destination-charging,200-9,40.760856,-73.986218,11/03/2020,114972,2020-11-18 00:06:10,P,,,11/01/2018,TESLA
ELEC,ERIE COUNTY,6205 Main St,STATION ONE; -,Buffalo,NY,14221,,888-758-4389,E,,Public,24 hours daily,,,2,,,ChargePoint Network,http://www.chargepoint.com/,GPS,42.960476,-78.720009,01/23/2021,170241,2021-01-23 00:19:13,,,,,J1772
ELEC,Union College - Nott/Seward Lot,Nott St,,Schenectady,NY,12308,,866-816-7584,E,,Public,24 hours daily,,,6,,,EV Connect,http://evconnect.com/,GPS,42.820416,-73.930589,05/06/2020,156044,2020-05-06 17:56:57,P,,,05/01/2020,J1772
ELEC,BETHLEHEM EV,445 DELAWARE AVE (NY-443),FLEET #1; Next to playground FLEET #2; Next to playground,Delmar,NY,12054,,888-758-4389,E,,Public,24 hours daily,,,2,,,ChargePoint Network,http://www.chargepoint.com/,200-9,42.620497,-73.839629,01/23/2021,165630,2021-01-23 00:19:13,,,,,J1772
ELEC,BEVERWYCK,12 Hickory Dr,STATION 4,Slingerlands,NY,12159,,888-758-4389,E,,Public,24 hours daily,,,2,,,ChargePoint Network,http://www.chargepoint.com/,GPS,42.659280,-73.836850,01/23/2021,164421,2021-01-23 00:19:13,,,,,J1772
ELEC,New Roc Garage - Tesla Supercharger,33 LeCount Place and Huguenot Street,,New Rochelle,NY,10801,,877-798-3752,E,,Public,24 hours daily; for Tesla use only,,,,8,,Tesla,http://www.teslamotors.com/supercharger,GPS,40.912500,-73.780500,08/10/2020,102333,2020-08-27 20:39:12,P,,,07/23/2018,TESLA
ELEC,STATION 4TH FL,680 Main St,MOTORGATE 3; Motorgate Garage -Fourth Level,New York,NY,10044,,888-758-4389,E,,Public,24 hours daily,,,2,,,ChargePoint Network,http://www.chargepoint.com/,GPS,40.764464,-73.946924,01/23/2021,168524,2021-01-23 00:19:13,,,,,J1772
ELEC,Staples Plaza - Tesla Supercharger,3379 Crompond Road,,Yorktown Heights,NY,10589,,877-798-3752,E,,Public,24 hours daily; for Tesla use only,,,,12,,Tesla,http://www.teslamotors.com/supercharger,200-8,41.290500,-73.832500,08/10/2020,149366,2020-08-27 20:39:12,P,,,09/30/2019,TESLA
ELEC,Gurney's Montauk Resort & Spa - Tesla Destination,290 Old Montauk Hwy,,Montauk,NY,11954,,631-668-2345  877-798-3752,E,,Public,24 hours daily; see valet for access,,,3,,,Tesla Destination,https://www.tesla.com/destination-charging,200-9,41.015489,-71.992316,11/03/2020,114979,2020-11-18 00:06:10,P,,,12/15/2016,J1772 TESLA
ELEC,Parkit 301 E 64th - Tesla Destination,301 E 64th St,,New York,NY,10065,,212-929-9404  877-798-3752,E,,Public,24 hours daily; see valet for access,,,3,,,Tesla Destination,https://www.tesla.com/destination-charging,200-8,40.763890,-73.961892,11/03/2020,115087,2020-11-18 00:06:10,P,,,01/01/2016,J1772 TESLA
ELEC,BMW MANHATTAN,601-605 W 55th St,CHAPMAN STAT01; -,New York,NY,10019,,888-758-4389,E,,Public,24 hours daily,,,2,,,ChargePoint Network,http://www.chargepoint.com/,GPS,40.769291,-73.992541,01/23/2021,162438,2021-01-23 00:19:13,,,,,J1772
ELEC,UTICA CITY HALL,1 Kennedy Plaza,CITY OF UTICA; Off Broadway lot left of clock tower,Utica,NY,13502,,888-758-4389,E,,Public,24 hours daily,,,2,,,ChargePoint Network,http://www.chargepoint.com/,GPS,43.101554,-75.235544,01/23/2021,162311,2021-01-23 00:19:13,,,,,J1772
ELEC,The Westport,500 W 56th St,,New York,NY,10019,,888-998-2546,E,,Public,MON: 24 hours | TUE: 24 hours | WED: 24 hours | THU: 24 hours | FRI: 24 hours | SAT: 24 hours | SUN: 24 hours,,,2,,,Blink Network,http://www.blinkcharging.com/,GPS,40.768211,-73.989479,01/22/2021,124690,2021-01-22 22:55:21,,,,,J1772
ELEC,MTP Parking 31-00 47th Ave - Tesla Destination,31-00 47th Ave,,Long Island City,NY,11101,,718-729-3615  877-798-3752,E,,Public,24 hours daily; pay lot; see valet for access,,,4,,,Tesla Destination,https://www.tesla.com/destination-charging,200-8,40.742875,-73.935806,11/03/2020,122487,2020-11-18 00:06:10,P,,,03/01/2019,TESLA
ELEC,HABBERSTAD BMW,596 Sunrise Hwy,BAY SHORE 01,Bay Shore,NY,11706,,888-758-4389,E,,Public,24 hours daily,,,2,,,ChargePoint Network,http://www.chargepoint.com/,GPS,40.726926,-73.283143,01/23/2021,162462,2021-01-23 00:19:13,,,,,J1772
ELEC,WCS,Boston Rd,NS1 ASIANS1 BOSTON RD; Bronx zoo Asia Parking lot,Bronx,NY,10460,,888-758-4389,E,,Public,24 hours daily,,,3,,,ChargePoint Network,http://www.chargepoint.com/,GPS,40.846205,-73.876513,01/23/2021,104341,2021-01-23 00:19:13,,,,,J1772
ELEC,Bruno's Bakery and Restaurant - Tesla Destination,676 Forest Ave,,Staten Island,NY,10310,,718-448-0993  877-798-3752,E,,Public,24 hours daily,,,2,,,Tesla Destination,https://www.tesla.com/destination-charging,200-9,40.629424,-74.111586,11/03/2020,150541,2020-11-18 00:06:10,P,,,09/30/2019,TESLA
ELEC,VILLAGE HALL,49 State St,STATION; In tear parking lot of Village Hall,Brockport,NY,14420,,888-758-4389,E,,Public,24 hours daily,,,2,,,ChargePoint Network,http://www.chargepoint.com/,GPS,43.214395,-77.936224,01/23/2021,162355,2021-01-23 00:19:13,,,,,J1772
ELEC,Alfano Roman Group,24 Airport Rd,,Schenectady,NY,12308,,866-816-7584,E,,Public,24 hours daily; Also accepts Paypal,A D M V,,2,,,EV Connect,http://evconnect.com/,GPS,42.852650,-73.939268,04/08/2020,155076,2020-04-08 12:29:55,P,,,04/12/2019,J1772
ELEC,GREECE TOWN HAL,1 Vince Tofany Blvd,GREECE NORTH 1; Middle parking lot of Greece town hall buildingGREECE SOUTH 2; Middle parking lot of Greece town hall building,Rochester,NY,14612,,888-758-4389,E,,Public,24 hours daily,,,4,,,ChargePoint Network,http://www.chargepoint.com/,200-9,43.258481,-77.698107,01/23/2021,164052,2021-01-23 00:19:13,,,,,J1772
ELEC,Cabela's Crossing - Tesla Supercharger,2013 Walden Avenue,,Cheektowaga,NY,14225,,877-798-3752,E,,Public,24 hours daily; for Tesla use only,,,,8,,Tesla,http://www.teslamotors.com/supercharger,GPS,42.907291,-78.762200,08/10/2020,153790,2020-08-27 20:39:12,P,,,02/14/2020,TESLA
ELEC,Village of Burdett,4125 NY-79,,Burdett,NY,14818,,866-816-7584,E,,Public,24 hours daily,,,2,,,EV Connect,http://evconnect.com/,GPS,42.421065,-76.838615,06/09/2020,157946,2020-06-09 16:47:26,P,,,05/15/2020,J1772
ELEC,Icon Parking 54 Murray Street - Tesla Destination,54 Murray St,,New York,NY,10007,,212-962-9011  877-798-3752,E,,Public,24 hours daily; see valet for access,,,3,,,Tesla Destination,https://www.tesla.com/destination-charging,200-9,40.714121,-74.009808,11/03/2020,115154,2020-11-18 00:06:10,P,,,11/01/2018,J1772 TESLA
ELEC,5TH AVE,King St & Federal St,RIVER STREET 1RIVER STREET 2RIVER STREET 3,Troy,NY,12180,,888-758-4389,E,,Public,24 hours daily,,,6,,,ChargePoint Network,http://www.chargepoint.com/,GPS,42.735110,-73.688050,01/23/2021,154052,2021-01-23 00:19:13,,,,,J1772
ELEC,GGMC Parking Seven Eleven (Located at 217 E 44th St) - Tesla Destination,217 E 44th St,,New York,NY,10017,,212-661-0850  877-798-3752,E,,Public,24 hours daily; see valet for access,,,3,,,Tesla Destination,https://www.tesla.com/destination-charging,200-8,40.752004,-73.972808,11/03/2020,115053,2020-11-18 00:06:10,P,,,01/01/2016,J1772 TESLA
ELEC,Mills Norrie State Park,9 Old Post Rd,,Staatsburg,NY,12580,,866-816-7584,E,,Public,24 hours daily,,,1,,,EV Connect,http://evconnect.com/,GPS,41.842603,-73.930954,04/08/2020,123140,2020-04-08 12:29:55,P,,,04/01/2019,J1772
ELEC,ULSTER COUNTY,244 Fair Street,"OFFICE BUILDING; Ulster County's fee for public charging is $0.50 per hour, effective 1-1-2020. Additional parking fees apply during working hours.",Kingston,NY,12401,,888-758-4389,E,,Public,24 hours daily,,,2,,,ChargePoint Network,http://www.chargepoint.com/,GPS,41.932984,-74.017134,01/23/2021,162172,2021-01-23 00:19:13,,,,,J1772
ELEC,CENTROTHERM,427 S Pearl St,CENTRO F1; Right side of lot as you pull inCT4021 LOT,Albany,NY,12202,,888-758-4389,E,,Public,24 hours daily,,,3,,,ChargePoint Network,http://www.chargepoint.com/,200-9,42.637931,-73.759403,01/23/2021,158535,2021-01-23 00:19:13,,,,,J1772
ELEC,The Clinton Exchange - Tesla Destination,4 Clinton Square,,Syracuse,NY,13202,,877-798-3752  877-798-3752,E,,Public,24 hours daily; for customer use only; see front desk for access,,,1,,,Tesla Destination,https://www.tesla.com/destination-charging,200-8,43.050899,-76.153729,11/03/2020,169169,2020-11-18 00:06:10,P,,,11/03/2020,TESLA
ELEC,Village of Kinderhook,3 Hudson St,,Kinderhook,NY,12106,,518-758-9882,E,,Public,24 hours daily,,,2,,,Non-Networked,,200-9,42.395119,-73.696947,03/03/2020,117325,2020-03-03 21:13:47,LG,,,01/23/2019,J1772
ELEC,HUNTER MOUNTAIN,82 Liftside Dr,HUNTER; -,Hunter,NY,12442,,888-758-4389,E,,Public,24 hours daily,,,2,,,ChargePoint Network,http://www.chargepoint.com/,GPS,42.205127,-74.212669,01/23/2021,162317,2021-01-23 00:19:13,,,,,J1772
ELEC,FOODBANK LATHAM,959 Albany Shaker Rd,PARKING 3PARKING FOURPARKING ONEPARKING TWO,Latham,NY,12110,,888-758-4389,E,,Public,24 hours daily,,,8,,,ChargePoint Network,http://www.chargepoint.com/,200-9,42.764434,-73.813416,01/23/2021,164452,2021-01-23 00:19:13,,,,,J1772
ELEC,QuickChek - Tesla Supercharger,640 Washington Ave.,,Kingston,NY,12401,,877-798-3752,E,,Public,24 hours daily; for Tesla use only,,,,8,,Tesla,http://www.teslamotors.com/supercharger,200-9,41.941900,-74.027400,08/10/2020,102331,2020-08-27 20:39:12,P,,,10/01/2016,TESLA
ELEC,NYSE Thruway - NYPA,370 NY-23,,Catskill,NY,12414,,866-816-7584,E,,Public - Credit card at all times,24 hours daily; Also accepts PayPal and Apple Pay,A D M V,,,2,,EV Connect,http://evconnect.com/,GPS,42.246462,-73.885301,12/03/2020,168464,2020-12-03 22:33:12,LG,,,08/17/2020,CHADEMO J1772COMBO
ELEC,Staten Island Mall - Macyâ€™s,2655 Richmond Ave,,Staten Island,NY,10314,,888-264-2208,E,,Public,6am-12am daily,,,2,,,Volta,https://voltacharging.com/,GPS,40.583330,-74.166262,10/09/2020,166727,2020-10-09 12:41:43,P,,,08/31/2020,J1772
ELEC,COLE GROUP,12 Doorstone Dr,COLE GROUP 2,Latham,NY,12110,,888-758-4389,E,,Public,24 hours daily,,,2,,,ChargePoint Network,http://www.chargepoint.com/,GPS,42.745613,-73.772060,01/23/2021,154705,2021-01-23 00:19:13,,,,,J1772
ELEC,Jedediah Hawkins Inn - Tesla Destination,400 S Jamesport Ave,,Riverhead,NY,11901,,631-722-2900  877-798-3752,E,,Public,24 hours daily; for customer use only; see front desk for access,,,1,,,Tesla Destination,https://www.tesla.com/destination-charging,200-9,40.947089,-72.579622,11/03/2020,115218,2020-11-18 00:06:10,P,,,01/01/2016,TESLA
ELEC,LAZ Parking 136-20 38th Ave - Tesla Destination,136-20 38th Ave,,Flushing,NY,11354,,347-723-3375  877-798-3752,E,,Public,24 hours daily; pay lot; see valet for access,,,4,,,Tesla Destination,https://www.tesla.com/destination-charging,200-9,40.760676,-73.829774,11/03/2020,150579,2020-11-18 00:06:10,P,,,09/30/2019,TESLA
ELEC,SULLIVAN CENTER,270-277 Rock Hill Dr,ROCK HILL; To the right of main entrance,Rock Hill,NY,12775,,888-758-4389,E,,Public,24 hours daily,,,2,,,ChargePoint Network,http://www.chargepoint.com/,GPS,41.623169,-74.590722,01/23/2021,162309,2021-01-23 00:19:13,,,,,J1772
ELEC,ERIE COUNTY,4205 Main St,STATION TWO; -,Buffalo,NY,14221,,888-758-4389,E,,Public,24 hours daily,,,2,,,ChargePoint Network,http://www.chargepoint.com/,GPS,42.960529,-78.720001,01/23/2021,170242,2021-01-23 00:19:13,,,,,J1772
ELEC,Champion Parking 90 LLC - Tesla Destination,60 E 90th St,,New York,NY,10028,,212-828-8282  877-798-3752,E,,Public,24 hours daily; see valet for access,,,3,,,Tesla Destination,https://www.tesla.com/destination-charging,GPS,40.783085,-73.956304,11/03/2020,115167,2020-11-18 00:06:10,P,,,03/01/2017,J1772 TESLA
ELEC,SUNY BROOME,907 Front St,SUNY BROOME #1; SUNY Broome Ice RinkSUNY BROOME #2; Ice rinkSUNY BROOME #3; SUNY Broome Ice Center,Binghamton,NY,13905,,888-758-4389,E,,Public,24 hours daily,,,6,,,ChargePoint Network,http://www.chargepoint.com/,200-9,42.141107,-75.903433,01/23/2021,165223,2021-01-23 00:19:13,,,,,J1772
ELEC,HENRIETTA,625 Calkins Rd,LIBRARY 1; Side entrance of library,Rochester,NY,14623,,888-758-4389,E,,Public,24 hours daily,,,2,,,ChargePoint Network,http://www.chargepoint.com/,GPS,43.067992,-77.617545,01/23/2021,145651,2021-01-23 00:19:13,,,,,J1772
ELEC,MP 225 LLC,225 Rector Pl,"NS1-225 RECTOR; First level of garage, east wall near garage cashier office",New York,NY,10280,,888-758-4389,E,,Public,24 hours daily,,,2,,,ChargePoint Network,http://www.chargepoint.com/,GPS,40.709225,-74.016154,01/23/2021,162488,2021-01-23 00:19:13,,,,,J1772
ELEC,Parkit 403 Lafayette St. - Tesla Destination,403 Lafayette St,,New York,NY,10003,,212-254-1263  877-798-3752,E,,Public,24 hours daily; for customer use only; see valet for access,,,3,,,Tesla Destination,https://www.tesla.com/destination-charging,200-9,40.728137,-73.992393,11/03/2020,115124,2020-11-18 00:06:10,P,,,03/01/2015,J1772 TESLA
ELEC,PEPSICO INC,100 E Stevens Ave,STATION 2; -STATION 3; -,Valhalla,NY,10595,,888-758-4389,E,,Public,24 hours daily,,,4,,,ChargePoint Network,http://www.chargepoint.com/,200-8,41.097433,-73.772900,01/23/2021,154053,2021-01-23 00:19:13,,,,,J1772
ELEC,Leo Kaytes Ford,145 Route 94 S,,Warwick,NY,10990,,845-986-1131,E,,Public - Call ahead,Dealership business hours,,,2,,,Non-Networked,,200-9,41.237296,-74.379503,09/03/2020,63618,2020-09-03 19:35:48,P,,,09/01/2014,J1772
ELEC,Gunlocke Co,1 Gunlocke Dr,,Wayland,NY,14572,,866-816-7584,E,,Public,24 hours daily; Also accepts Paypal,A D M V,,4,,,EV Connect,http://evconnect.com/,GPS,42.555384,-77.589129,04/08/2020,155031,2020-04-08 12:29:55,P,,,08/09/2018,J1772
ELEC,The Lodge at Grist Iron Brewing Co.,4880 NY-414,,Burdett,NY,14818,,697-882-2739,E,,Public,24 hours daily,,,1,,,Non-Networked,,GPS,42.469877,-76.864653,06/09/2020,157970,2020-06-09 16:47:26,P,,,05/15/2020,J1772
ELEC,Icon Parking 35-39 East 61st Street - Tesla Destination,35-39  E 61st St,,New York,NY,10021,,212-980-3057  877-798-3752,E,,Public,24 hours daily; pay lot; see valet for access,,,3,,,Tesla Destination,https://www.tesla.com/destination-charging,200-8,40.764876,-73.970102,11/03/2020,115111,2020-11-18 00:06:10,P,,,11/01/2016,J1772 TESLA
ELEC,854ELLICOTT,589 Ellicott St,589 ELLICOTT 1; -589 ELLICOTT 2; -589 ELLICOTT 3; -589 ELLICOTT 5,Buffalo,NY,14203,,888-758-4389,E,,Public,24 hours daily,,,14,,,ChargePoint Network,http://www.chargepoint.com/,200-9,42.895820,-78.867980,01/23/2021,169907,2021-01-23 00:19:13,,,,,J1772
ELEC,COMFORT INN,156 Sacandaga Rd,COMFORT INN,Scotia,NY,12302,,888-758-4389,E,,Public,24 hours daily,,,2,,,ChargePoint Network,http://www.chargepoint.com/,GPS,42.834270,-73.969972,01/23/2021,162255,2021-01-23 00:19:13,,,,,J1772
ELEC,375 Hudson St Icon Parking,375 Hudson Street,Located between King St & Houston St.,New York,NY,10014,,888-998-2546,E,,Public,MON: 24 hours | TUE: 24 hours | WED: 24 hours | THU: 24 hours | FRI: 24 hours | SAT: 24 hours | SUN: 24 hours,,,1,,,Blink Network,http://www.blinkcharging.com/,GPS,40.728704,-74.007650,01/22/2021,170049,2021-01-22 22:55:21,,,,,J1772
ELEC,PANYNJ,JFK Access Road JFK International Airport,JFK Y GARAGE 1; First floor near elevator JFK Y GARAGE 2; Level 1 by elevator JFK Y GARAGE 3; -JFK Y GARAGE 5; Yellow garage first floor near elevator,Queens,NY,11430,,888-758-4389,E,,Public,24 hours daily,,,8,,,ChargePoint Network,http://www.chargepoint.com/,GPS,40.645720,-73.779384,01/23/2021,147469,2021-01-23 00:19:13,,,,,J1772
ELEC,TOWN OF BABYLON,N Jefferson Ave,TOWN HALL 2; Near front entrance,Lindenhurst,NY,11757,,888-758-4389,E,,Public,24 hours daily,,,1,,,ChargePoint Network,http://www.chargepoint.com/,GPS,40.704729,-73.375555,01/23/2021,162277,2021-01-23 00:19:13,,,,,J1772
ELEC,Malone Town - Justice Court,27 Airport Rd,,Malone,NY,12953,,866-816-7584,E,,Public,24 hours daily,,,2,,,EV Connect,http://evconnect.com/,GPS,44.848490,-74.327675,04/08/2020,123091,2020-04-08 12:29:55,LG,,,04/01/2019,J1772
ELEC,SAVARINO COMPAN,"BRL Parking Lot, closest to Building 1 South Street",BRL 3; -,Buffalo,NY,14204,,888-758-4389,E,,Public,24 hours daily,,,2,,,ChargePoint Network,http://www.chargepoint.com/,GPS,42.863736,-78.868086,01/23/2021,164157,2021-01-23 00:19:13,,,,,J1772
ELEC,NATIONAL GRID,79 Weibel Rd,KOHLS SARATOGA,Saratoga Springs,NY,12866,,888-758-4389,E,,Public,24 hours daily,,,2,,,ChargePoint Network,http://www.chargepoint.com/,GPS,43.097209,-73.746601,01/23/2021,162196,2021-01-23 00:19:13,,,,,J1772
ELEC,COE ITC,727-799 E Washington St,SYRACUSE UNIV,Syracuse,NY,13210,,888-758-4389,E,,Public,24 hours daily,,,2,,,ChargePoint Network,http://www.chargepoint.com/,GPS,43.049634,-76.141079,01/23/2021,162275,2021-01-23 00:19:13,,,,,J1772
ELEC,Tarrytown House Estate on the Hudson - Tesla Destination,49 E Sunnyside Ln,,Tarrytown,NY,10591,,914-591-8200  877-798-3752,E,,Public - Call ahead,24 hours daily; for customer use only,,,2,,,Tesla Destination,https://www.tesla.com/destination-charging,200-8,41.048273,-73.857440,11/03/2020,115242,2020-11-18 00:06:10,P,,,12/15/2016,TESLA
ELEC,Smithtown Nissan,535 Middle Country Rd,,St. James,NY,11780,,,E,,Public - Call ahead,Dealership business hours; contact 631-361-9696 for more information,,,1,1,,Non-Networked,,200-9,40.859886,-73.162067,06/09/2020,44190,2020-06-09 16:47:26,P,,,11/30/2011,CHADEMO J1772
ELEC,FAYETTEVILLE,205 Brooklea Dr,FAYETTEVILLE; Village lot on Brooklea Drive,Fayetteville,NY,13066,,888-758-4389,E,,Public,24 hours daily,,,2,,,ChargePoint Network,http://www.chargepoint.com/,GPS,43.031004,-76.012470,01/23/2021,162361,2021-01-23 00:19:13,,,,,J1772
ELEC,Lexington-Grove East Garage,100 Main St,Turn right from Main St. Entrance. EVSE facing Dr. Martin Luther King Jr Blvd,White Plains,NY,10601,,914-422-1392,E,,Public,24 hours daily,,,3,,,Non-Networked,,200-9,41.031464,-73.769946,09/03/2020,65278,2020-09-03 19:35:48,SG,,,07/16/2014,J1772
ELEC,BURNS MGT,1 broom shop rd,SCH COMM BLD 2SCH COMM BLDG 2,Latham,NY,12110,,888-758-4389,E,,Public,24 hours daily,,,4,,,ChargePoint Network,http://www.chargepoint.com/,GPS,42.739933,-73.788345,01/23/2021,149546,2021-01-23 00:19:13,,,,,J1772
ELEC,WARREN TIRE,159 stone quarry rd,WT HALFMOON 1; -,Halfmoon,NY,12065,,888-758-4389,E,,Public,24 hours daily,,,2,,,ChargePoint Network,http://www.chargepoint.com/,GPS,42.831394,-73.738060,01/23/2021,143322,2021-01-23 00:19:13,,,,,J1772
ELEC,LAZ Parking 133-59 Roosevelt Ave - Tesla Destination,133-59 Roosevelt Ave,,Flushing,NY,11354,,718-888-1234  877-798-3752,E,,Public,24 hours daily; pay lot; see valet for access,,,4,,,Tesla Destination,https://www.tesla.com/destination-charging,200-8,40.758745,-73.833154,11/03/2020,150578,2020-11-18 00:06:10,P,,,09/30/2019,TESLA
ELEC,Quik Park Armory Parking Inc. - Tesla Destination,172 Vanderbilt,,Brooklyn,NY,11205,,718-222-9427  877-798-3752,E,,Public,24 hours daily; see valet for access,,,2,,,Tesla Destination,https://www.tesla.com/destination-charging,200-8,40.692372,-73.969893,11/03/2020,114891,2020-11-18 00:06:10,P,,,03/01/2017,TESLA
ELEC,TOWNE BMW,8195 Main St,DUAL CHARGER; Across from Building (SouthWest Corner),Williamsville,NY,14221,,888-758-4389,E,,Public,24 hours daily,,,2,,,ChargePoint Network,http://www.chargepoint.com/,GPS,42.964139,-78.688046,01/23/2021,162452,2021-01-23 00:19:13,,,,,J1772
ELEC,S.A.N.Y.,1001 Park Ave,STATION FOURSTATION ONESTATION THREESTATION TWO,Syracuse,NY,13204,,888-758-4389,E,,Public,24 hours daily,,,4,,,ChargePoint Network,http://www.chargepoint.com/,200-9,43.051750,-76.180247,01/23/2021,165173,2021-01-23 00:19:13,,,,,J1772
ELEC,ELECTRIC DOG,910 Delaware Ave,DELMAR VET 1,Delmar,NY,12054,,888-758-4389,E,,Public,24 hours daily,,,2,,,ChargePoint Network,http://www.chargepoint.com/,GPS,42.607400,-73.872826,01/23/2021,144998,2021-01-23 00:19:13,,,,,J1772
ELEC,EVPASS,217 Montgomery Street,HILL-1; 2 units at Hill Building parking lotHILLS - 2; 2 units at Hill Building parking lot,Syracuse,NY,13202,,888-758-4389,E,,Public,24 hours daily,,,2,,,ChargePoint Network,http://www.chargepoint.com/,200-9,43.048831,-76.148959,01/23/2021,162510,2021-01-23 00:19:13,,,,,J1772
ELEC,iPark - Paradise Garage,62-60 99th Street,Attendant will assist in charging vehicle.  Parking rates apply. Inquire within.,Rego Park,NY,11374,,888-998-2546,E,,Public,MON: 24 hours | TUE: 24 hours | WED: 24 hours | THU: 24 hours | FRI: 24 hours | SAT: 24 hours | SUN: 24 hours,,,1,,,Blink Network,http://www.blinkcharging.com/,GPS,40.733347,-73.858012,01/22/2021,95270,2021-01-22 22:55:21,,,,,J1772
ELEC,Courtyard by Marriott Elmira Horseheads - Tesla Destination,202 Colonial Dr,,Horseheads,NY,14845,,607-795-5900  877-798-3752,E,,Public,24 hours daily; for customer use only; see front desk for access,,,3,,,Tesla Destination,https://www.tesla.com/destination-charging,200-8,42.161972,-76.867318,11/03/2020,114954,2020-11-18 00:06:10,P,,,11/01/2018,J1772 TESLA
ELEC,GGMC Parking Connaught - Tesla Destination,300  E 54th St,,New York,NY,10022,,212-223-4891  877-798-3752,E,,Public,24 hours daily; see valet for access,,,3,,,Tesla Destination,https://www.tesla.com/destination-charging,200-9,40.756956,-73.966399,11/03/2020,115082,2020-11-18 00:06:10,P,,,03/01/2017,J1772 TESLA
ELEC,GARBER ROC,3925 W Henrietta Rd,SHOP 01; Inside side doorSHOP 02,Rochester,NY,14623,,888-758-4389,E,,Public,24 hours daily,,,2,,,ChargePoint Network,http://www.chargepoint.com/,200-9,43.074417,-77.644740,01/23/2021,162138,2021-01-23 00:19:13,,,,,J1772
ELEC,Rapidpark 35 E 75th Street - Tesla Destination,35  E 75th St,,New York,NY,10021,,917-675-6906  877-798-3752,E,,Public,24 hours daily; see valet for access,,,3,,,Tesla Destination,https://www.tesla.com/destination-charging,200-8,40.773815,-73.963696,11/03/2020,115106,2020-11-18 00:06:10,P,,,09/01/2017,J1772 TESLA
ELEC,ERIE COUNTY,Erie College Drive,ECC SOUTH 1; -ECC SOUTH 2; -,Hamburg,NY,14075,,888-758-4389,E,,Public,24 hours daily,,,4,,,ChargePoint Network,http://www.chargepoint.com/,GPS,42.771831,-78.796294,01/23/2021,168262,2021-01-23 00:19:13,,,,,J1772
ELEC,Cooper Vision,180 Thruway Park Dr,,West Henrietta,NY,14586,,866-816-7584,E,,Public,24 hours daily; Also accepts Paypal,A D M V,,2,,,EV Connect,http://evconnect.com/,GPS,43.045175,-77.672334,04/08/2020,154915,2020-04-08 12:29:55,P,,,04/29/2019,J1772
ELEC,Propark 401 W 110th Street - Tesla Destination,401 W 110th St,,New York,NY,10025,,212-864-7164  877-798-3752,E,,Public,24 hours daily; see valet for access,,,3,,,Tesla Destination,https://www.tesla.com/destination-charging,200-9,40.802368,-73.961689,11/03/2020,115123,2020-11-18 00:06:10,P,,,09/01/2017,J1772 TESLA
ELEC,MPG 121 Reade Street - Tesla Destination,121 Reade St,,New York,NY,10013,,212-608-3060  877-798-3752,E,,Public,24 hours daily; pay lot; see valet for access,,,3,,,Tesla Destination,https://www.tesla.com/destination-charging,200-9,40.716208,-74.009488,11/03/2020,115006,2020-11-18 00:06:10,P,,,11/01/2018,J1772 TESLA
ELEC,West Jefferson Street,358 W Jefferson St,,Syracuse,NY,13202,,866-816-7584,E,,Public,24 hours daily,,,1,,,EV Connect,http://evconnect.com/,GPS,43.047384,-76.158146,04/08/2020,123104,2020-04-08 12:29:55,P,,,04/01/2019,J1772
ELEC,Dutchess County Motor Vehicles,22 Market St,,Poughkeepsie,NY,12601,,866-816-7584,E,,Public,24 hours daily,,,1,,,EV Connect,http://evconnect.com/,GPS,41.703439,-73.929551,10/09/2020,123084,2020-10-09 12:41:43,LG,,,04/01/2019,J1772
ELEC,1285 MAIN,1285 Main St,1285 MAIN (1),Buffalo,NY,14209,,888-758-4389,E,,Public,24 hours daily,,,2,,,ChargePoint Network,http://www.chargepoint.com/,GPS,42.908237,-78.866359,01/23/2021,154372,2021-01-23 00:19:13,,,,,J1772
ELEC,SUNFLOWER,75 Mill Hill Rd,MARKET,Woodstock,NY,12498,,888-758-4389,E,,Public,24 hours daily,,,2,,,ChargePoint Network,http://www.chargepoint.com/,GPS,42.039112,-74.113426,01/23/2021,143566,2021-01-23 00:19:13,,,,,J1772
ELEC,CT ROCHESTER,655 Elmwood Ave,CTR GARAGE; The station is located on the 2nd level of the parking garage,Rochester,NY,14620,,888-758-4389,E,,Public,24 hours daily,,,2,,,ChargePoint Network,http://www.chargepoint.com/,GPS,43.124269,-77.621274,01/23/2021,162393,2021-01-23 00:19:13,,,,,J1772
ELEC,The Mill at Water Mill - Tesla Supercharger,760 Montauk Hwy,,Water Mill,NY,11976,,877-798-3752,E,,Public,24 hours daily; for Tesla use only,,,,8,,Tesla,http://www.teslamotors.com/supercharger,GPS,40.912013,-72.353128,12/03/2020,169303,2020-12-03 22:33:12,P,,,11/09/2020,TESLA
ELEC,Blind Brook Treatment Plant,141 Oakland Beach Ave,,Rye,NY,10580,,866-816-7584,E,,Public,24 hours daily,,,1,,,EV Connect,http://evconnect.com/,GPS,40.965352,-73.689731,04/08/2020,123067,2020-04-08 12:29:55,LG,,,04/01/2019,J1772
ELEC,SUNY NEW PALTZ,98 S Manheim Blvd,SUNY NEW PALTZ; -,New Paltz,NY,12561,,888-758-4389,E,,Public,24 hours daily,,,2,,,ChargePoint Network,http://www.chargepoint.com/,GPS,41.738917,-74.080123,01/23/2021,162190,2021-01-23 00:19:13,,,,,J1772
ELEC,SKYVIEW APARTME,5700 Arlington Ave,,North Riverdale,NY,10471,,888-758-4389,E,,Public,24 hours daily,,,4,,,ChargePoint Network,http://www.chargepoint.com/,200-9,40.907370,-73.906558,01/23/2021,171342,2021-01-23 00:19:13,,,,,J1772
ELEC,Icon Parking 205 E 63rd St - Tesla Destination,205  E 63rd St,,Manhattan,NY,10065,,212-750-3535  877-798-3752,E,,Public,24 hours daily; see valet for access,,,2,,,Tesla Destination,https://www.tesla.com/destination-charging,200-8,40.764174,-73.964533,11/03/2020,114974,2020-11-18 00:06:10,P,,,11/01/2016,TESLA
ELEC,SUNation Solar Systems,171 Remington Blvd,,Ronkonkoma,NY,11779,,631-750-9454,E,,Public,9am-5pm M-F,,,3,,,Non-Networked,,200-9,40.790090,-73.130392,09/03/2020,78416,2020-09-03 19:35:48,P,,,07/01/2016,J1772
ELEC,Dimension Fabricators,2000 7th St,,Scotia,NY,12302,,866-816-7584,E,,Public - Credit card at all times,24 hours daily; Also accepts Paypal,A D M V,,4,,,EV Connect,http://evconnect.com/,200-9,42.844741,-73.994662,10/09/2020,166331,2020-10-09 12:41:43,P,,,05/12/2020,J1772
ELEC,iPark NYC 44 Elizabeth Street - Tesla Destination,44 Elizabeth St,,New York,NY,10013,,855-472-7569  877-798-3752,E,,Public,24 hours daily; for customer use only; see valet for access,,,3,,,Tesla Destination,https://www.tesla.com/destination-charging,200-9,40.716947,-73.996472,11/03/2020,115138,2020-11-18 00:06:10,P,,,02/01/2016,J1772 TESLA
ELEC,Monticello Motor Club - Tesla Destination,67 Cantrell Rd,,Monticello,NY,12701,,877-798-3752  877-798-3752,E,,Public,24 hours daily; for customer use only; see front desk for access,,,2,,,Tesla Destination,https://www.tesla.com/destination-charging,200-9,41.617641,-74.702993,11/03/2020,168974,2020-11-18 00:06:10,P,,,11/03/2020,TESLA
ELEC,Porter Town Hall,3265 Creek Rd,,Youngstown,NY,14175,,866-816-7584,E,,Public - Credit card at all times,24 hours daily; also accepts Paypal and EV Connect App,A D M V,,2,,,EV Connect,http://evconnect.com/,GPS,43.257291,-79.008523,06/09/2020,155681,2020-06-09 16:47:26,LG,,,07/19/2019,J1772
ELEC,HUDSON VALLEY,1148 Old Rte 9,VW_408151_A,Wappingers Falls,NY,12590,,888-758-4389,E,,Public,24 hours daily,,,2,,,ChargePoint Network,http://www.chargepoint.com/,GPS,41.566517,-73.906339,01/23/2021,162428,2021-01-23 00:19:13,,,,,J1772
ELEC,Hilton Garden Inn - Downtown Ithaca - Tesla Destination,130 E Seneca St,,Ithaca,NY,14850,,607-277-8900  877-798-3752,E,,Public - Call ahead,24 hours daily; for customer use only,,,2,,,Tesla Destination,https://www.tesla.com/destination-charging,200-9,42.440673,-76.497375,11/03/2020,114958,2020-11-18 00:06:10,P,,,11/01/2018,TESLA
ELEC,Palisades Shopping Center - Tesla Supercharger,1000 Palisades Center Drive,,West Nyack,NY,10994,,877-798-3752,E,,Public,24 hours daily; for Tesla use only,,,,20,,Tesla,http://www.teslamotors.com/supercharger,200-9,41.094700,-73.955400,08/10/2020,149365,2020-08-27 20:39:12,P,,,09/30/2019,TESLA
ELEC,SCCC,121 Speonk Riverhead Rd,EAST CAMPUS 1EAST CAMPUS 2,Riverhead,NY,11901,,888-758-4389,E,,Public,24 hours daily,,,4,,,ChargePoint Network,http://www.chargepoint.com/,200-8,40.865293,-72.696524,01/23/2021,162229,2021-01-23 00:19:13,,,,,J1772
ELEC,West Herr Nissan,6069 S Transit Rd,,Lockport,NY,14094,,716-625-8889,E,,Public - Call ahead,Dealership business hours,,,1,,,Non-Networked,,200-9,43.128557,-78.696197,06/09/2020,44354,2020-06-09 16:47:26,P,,,11/30/2011,J1772
ELEC,ATRIUM EVCHARGE,634 Plank Rd,"PRC-EV1; Back of building, first row of parking spots.PRC-EV2; Back of building, first row of parking spots.PRC-EV3; Back of building, first row of parking spots.PRC-EV4; Back of building, first row of parking spots.",Clifton Park,NY,12065,,888-758-4389,E,,Public,24 hours daily,,,8,,,ChargePoint Network,http://www.chargepoint.com/,200-9,42.866708,-73.777956,01/23/2021,152232,2021-01-23 00:19:13,,,,,J1772
ELEC,MPG: Manhattan parking,475 West 41st St,,New York,NY,10036,,888-998-2546,E,,Public,MON: 24 hours | TUE: 24 hours | WED: 24 hours | THU: 24 hours | FRI: 24 hours | SAT: 24 hours | SUN: 24 hours,,,2,,,Blink Network,http://www.blinkcharging.com/,GPS,40.758967,-73.995189,01/22/2021,169992,2021-01-22 22:55:21,,,,,J1772
ELEC,Fernbach Ramp,200 Pearl St,,Buffalo,NY,14202,,716-849-5812  866-816-7584,E,,Public - Credit card at all times,24 hours daily; must use EVConnect app for payment,A D Debit M V,,4,,,EV Connect,http://evconnect.com/,200-8,42.884991,-78.876036,04/08/2020,104728,2020-04-08 12:29:55,LG,,,04/01/2018,J1772
ELEC,iPark NYC 246 E 45 Street - Tesla Destination,246  E 45th St,,New York,NY,10017,,212-599-8658  877-798-3752,E,,Public,24 hours daily; see valet for access,,,3,,,Tesla Destination,https://www.tesla.com/destination-charging,200-8,40.751676,-73.971144,11/03/2020,115067,2020-11-18 00:06:10,P,,,06/01/2016,J1772 TESLA
ELEC,TRICITYRENTALS,17 New Scotland Av,PARK SOUTH,Albany,NY,12208,,888-758-4389,E,,Public,24 hours daily,,,2,,,ChargePoint Network,http://www.chargepoint.com/,GPS,42.654458,-73.773464,01/23/2021,123416,2021-01-23 00:19:13,,,,,J1772
ELEC,MAIN LOT,112 Main St,"EV 1; -Village Hall, Cross Elm, Cross Oak",Dobbs Ferry,NY,10522,,888-758-4389,E,,Public,24 hours daily,,,2,,,ChargePoint Network,http://www.chargepoint.com/,GPS,41.015691,-73.874532,01/23/2021,162468,2021-01-23 00:19:13,,,,,J1772
ELEC,Champion Parking W 76th Street - Tesla Destination,205 W 76th St,,New York,NY,10023,,212-874-7600  877-798-3752,E,,Public,24 hours daily; see valet for access,,,3,,,Tesla Destination,https://www.tesla.com/destination-charging,200-9,40.781680,-73.979940,11/03/2020,115048,2020-11-18 00:06:10,P,,,01/01/2016,J1772 TESLA
ELEC,ULYSSES TOWN,10 Elm St,ULYSSES; In rear parking lot,Trumansburg,NY,14886,,888-758-4389,E,,Public,24 hours daily,,,2,,,ChargePoint Network,http://www.chargepoint.com/,GPS,42.541251,-76.661435,01/23/2021,162327,2021-01-23 00:19:13,,,,,J1772
ELEC,Bay Ridge Nissan,6501 5th Ave,,Brooklyn,NY,11220,,718-238-8000,E,,Public - Call ahead,Dealership business hours,,,1,,,Non-Networked,,200-9,40.636324,-74.019228,06/09/2020,44327,2020-06-09 16:47:26,P,,,11/30/2011,J1772
ELEC,Imperial Parking,332-342 E 34th St,Attendant will assist in charging vehicle.  Parking rates apply. Inquire within.,New York,NY,10016,,888-998-2546,E,,Public,MON: 24 hours | TUE: 24 hours | WED: 24 hours | THU: 24 hours | FRI: 24 hours | SAT: 24 hours | SUN: 24 hours,,,2,,,Blink Network,http://www.blinkcharging.com/,GPS,40.744011,-73.974116,01/22/2021,169851,2021-01-22 22:55:21,,,,,J1772
ELEC,Champion Parking E 16th Street - Tesla Destination,101  E 16th St,,New York,NY,10003,,212-358-1476  877-798-3752,E,,Public,24 hours daily; see valet for access,,,3,,,Tesla Destination,https://www.tesla.com/destination-charging,200-8,40.736116,-73.989322,11/03/2020,114991,2020-11-18 00:06:10,P,,,09/01/2017,J1772 TESLA
ELEC,Parkright 738 Greenwich Street - Tesla Destination,738 Greenwich St,,New York,NY,10014,,212-247-7303  877-798-3752,E,,Public,24 hours daily; see valet for access,,,3,,,Tesla Destination,https://www.tesla.com/destination-charging,200-9,40.735165,-74.007231,11/03/2020,115182,2020-11-18 00:06:10,P,,,08/15/2016,J1772 TESLA
ELEC,ADAMS STATION,301 Elkin Ct,301 ELKIN CT; Between Bldgs 300 and 400,Delmar,NY,12054,,888-758-4389,E,,Public,24 hours daily,,,2,,,ChargePoint Network,http://www.chargepoint.com/,GPS,42.607437,-73.850940,01/23/2021,165396,2021-01-23 00:19:13,,,,,J1772
ELEC,Best Western Saranac Lake - Tesla Destination,487 Lake Flower Ave,,Saranac Lake,NY,12983,,518-891-1970  877-798-3752,E,,Public,24 hours daily,,,2,,,Tesla Destination,https://www.tesla.com/destination-charging,200-8,44.314712,-74.119133,11/03/2020,150637,2020-11-18 00:06:10,P,,,09/30/2019,TESLA
ELEC,MARKET 32 EV,Jason Morris Way,JASONMORRIS EV2; In the playground parking lot.JASONMORRIS EV3; In the playground parking lot.JASONMORRIS EV4; In the playground parking lot.,Schenectady,NY,12302,,888-758-4389,E,,Public,24 hours daily,,,6,,,ChargePoint Network,http://www.chargepoint.com/,GPS,42.887582,-73.936643,01/23/2021,156059,2021-01-23 00:19:13,,,,,J1772
ELEC,Walmart 2586 Cheektowaga,2500 Walden Ave,,Cheektowaga,NY,14225,,833-632-2778,E,,Public,24 hours daily,,,,4,,Electrify America,https://www.electrifyamerica.com/,GPS,42.909598,-78.744700,01/23/2021,166207,2021-01-23 01:23:19,,,,,CHADEMO J1772COMBO
ELEC,Emerson Resort and Spa - Tesla Destination,5340 Route 28,,Mount Tremper,NY,12457,,877-798-3752  877-798-3752,E,,Public,24 hours daily; for customer use only; see front desk for access,,,8,,,Tesla Destination,https://www.tesla.com/destination-charging,200-9,42.050140,-74.287611,11/03/2020,168755,2020-11-18 00:06:10,P,,,11/03/2020,TESLA
ELEC,MUNICIPAL BLDG,2 Veterans Plaza,TRAIN STATION 1; Train stain parking lot,Croton-on-Hudson,NY,10520,,888-758-4389,E,,Public,24 hours daily,,,2,,,ChargePoint Network,http://www.chargepoint.com/,GPS,41.191670,-73.882470,01/23/2021,143300,2021-01-23 00:19:13,,,,,J1772
ELEC,Northwell,475 Seaview Ave,,Staten Island,NY,10305,,866-816-7584,E,,Public - Credit card at all times,24 hours daily; Also accepts Paypal,A D M V,,6,,,EV Connect,http://evconnect.com/,200-8,40.584259,-74.086919,10/09/2020,166368,2020-10-09 12:41:43,P,,,05/07/2020,J1772
ELEC,Great Pines - Tesla Destination,4920  State Route 28,,Old Forge,NY,13420,,315-369-6777  877-798-3752,E,,Public - Call ahead,24 hours daily; for customer use only,,,4,,,Tesla Destination,https://www.tesla.com/destination-charging,200-9,43.758812,-74.859153,11/03/2020,115201,2020-11-18 00:06:10,P,,,09/01/2017,TESLA
ELEC,John Boyd Thacher State Park,830 Thacher Park Rd,,Voorheesville,NY,12186,,866-816-7584,E,,Public,24 hours daily,,,1,,,EV Connect,http://evconnect.com/,GPS,42.654195,-74.017814,04/08/2020,123136,2020-04-08 12:29:55,P,,,04/01/2019,J1772
ELEC,Quik Park Hudson 180 LLC - Tesla Destination,180 Riverside Blvd,,New York,NY,10069,,212-352-0514  877-798-3752,E,,Public,24 hours daily; for customer use only; see valet for access,,,3,,,Tesla Destination,https://www.tesla.com/destination-charging,200-9,40.778397,-73.987899,11/03/2020,115033,2020-11-18 00:06:10,P,,,01/01/2016,J1772 TESLA
ELEC,Icon Parking 322 23rd Street - Tesla Destination,318-322  E 23rd St,,New York,NY,10010,,212-674-2918  877-798-3752,E,,Public,24 hours daily; pay lot; see valet for access,,,3,,,Tesla Destination,https://www.tesla.com/destination-charging,200-8,40.737362,-73.980167,11/03/2020,115092,2020-11-18 00:06:10,P,,,11/01/2018,J1772 TESLA
ELEC,ABM Parking 750 Lexington Ave LLC - Tesla Destination,118 E 60th St,,New York,NY,10022,,212-754-2678  877-798-3752,E,,Public,24 hours daily; see valet for access,,,3,,,Tesla Destination,https://www.tesla.com/destination-charging,200-9,40.762806,-73.968700,11/03/2020,115004,2020-11-18 00:06:10,P,,,11/01/2018,TESLA
ELEC,I-SQUARE,400 Bakers Park,"MAIN LOT (EAST); Main Lot in Front of StageMAIN LOT (WEST); In Main Lot, Front of Stage",Rochester,NY,14617,,888-758-4389,E,,Public,24 hours daily,,,4,,,ChargePoint Network,http://www.chargepoint.com/,200-9,43.209711,-77.598237,01/23/2021,162434,2021-01-23 00:19:13,,,,,J1772
ELEC,LIA HONDA,4871 NY-78,STATION1,Buffalo,NY,14221,,888-758-4389,E,,Public,24 hours daily,,,2,,,ChargePoint Network,http://www.chargepoint.com/,GPS,42.980606,-78.696452,01/23/2021,162180,2021-01-23 00:19:13,,,,,J1772
ELEC,HOLT1,671-699 W State St,HOLT; Directly in front of Holt Architects,Ithaca,NY,14850,,888-758-4389,E,,Public,24 hours daily,,,2,,,ChargePoint Network,http://www.chargepoint.com/,GPS,42.439069,-76.510104,01/23/2021,162290,2021-01-23 00:19:13,,,,,J1772
ELEC,BREWSTER HONDA,2 Allview Ave,STATION01; Outside Service center garage,Brewster,NY,10509,,888-758-4389,E,,Public,24 hours daily,,,2,,,ChargePoint Network,http://www.chargepoint.com/,200-9,41.395991,-73.605373,01/23/2021,118998,2021-01-23 00:19:13,,,,,J1772
ELEC,Time Warner Center,10 Columbus Circle,,Manhattan,NY,10019,,888-998-2546,E,,Public,MON: 24 hours | TUE: 24 hours | WED: 24 hours | THU: 24 hours | FRI: 24 hours | SAT: 24 hours | SUN: 24 hours,,,1,,,Blink Network,http://www.blinkcharging.com/,GPS,40.768721,-73.983487,01/22/2021,164737,2021-01-22 22:55:21,,,,,J1772
ELEC,Hopson Cottage - Brad College Admissions,60 W Ravine Rd,,Annandale-on-Hudson,NY,12504,,866-816-7584,E,,Public,24 hours daily,,,2,,,EV Connect,http://evconnect.com/,GPS,42.022071,-73.910996,05/06/2020,123122,2020-05-06 17:56:57,P,,,04/01/2019,J1772
ELEC,Hampton Inn - Schenectady,450 State St,,Schenectady,NY,12305,,518-377-4500,E,,Public,24 hours daily,,,2,,,Non-Networked,,GPS,42.812153,-73.940917,01/14/2021,72907,2021-01-14 18:42:41,P,,,01/07/2021,J1772
ELEC,4320 Broadway-PARK-it - Tesla Destination,4320 Broadway,,Manhattan,NY,10033,,212-929-9404  877-798-3752,E,,Public,24 hours daily; pay lot; see valet for access,,,4,,,Tesla Destination,https://www.tesla.com/destination-charging,200-9,40.852225,-73.934213,11/03/2020,150534,2020-11-18 00:06:10,P,,,09/30/2019,TESLA
ELEC,NATIONAL GRID,126 South St,GLENS FALLS,Glens Falls,NY,12801,,888-758-4389,E,,Public,24 hours daily,,,2,,,ChargePoint Network,http://www.chargepoint.com/,GPS,43.305308,-73.649371,01/23/2021,162218,2021-01-23 00:19:13,,,,,J1772
ELEC,MARKET 32 EV,501 COLUMBIA PLAZA,MARKET 32 EG CH; In front of building,Rensselaer,NY,12144,,888-758-4389,E,,Public,24 hours daily,,,2,,,ChargePoint Network,http://www.chargepoint.com/,GPS,42.607573,-73.719919,01/23/2021,152319,2021-01-23 00:19:13,,,,,J1772
ELEC,RRH,1200 Driving Park Ave,NEWARK EAST 1; East Side of Hospital between Candy Apple Ln and Driving Park AveNEWARK EAST 3; East Side of Hospital between Candy Apple Ln and Driving Park AveNEWARK EAST 4; East Side of Hospital between Candy Apple Ln and Driving Park AveNEWARK EAST GW2; East Side of Hospital between Candy Apple Ln and Driving Park AveNEWARK WEST 1; West Side of Hospital on Sunset Drive NEWARK WEST 2; -NEWARK WEST 4; West Side of Hospital on Sunset Drive NEWARK WEST 5; West Side of Hospital on Sunset Drive NEWARK WEST GW3; West Side of Hospital on Sunset Drive,Newark,NY,14513,,888-758-4389,E,,Public,24 hours daily,,,18,,,ChargePoint Network,http://www.chargepoint.com/,200-9,43.060529,-77.101648,01/23/2021,145144,2021-01-23 00:19:13,,,,,J1772
ELEC,DOUBLEDAY EV,2 Doubleday Ct,COOPERSTOWN 1; parking lot between ball field and museumCOOPERSTOWN 2; parking lot between ball field and museum,Cooperstown,NY,13326,,888-758-4389,E,,Public,24 hours daily,,,2,,,ChargePoint Network,http://www.chargepoint.com/,200-9,42.700207,-74.926410,01/23/2021,162158,2021-01-23 00:19:13,,,,,J1772
ELEC,CITYOFGLEN COVE,9 Glen Street,"PULASKI ST GARG; Pulaski Street Parking Garage located behind City Hall, ground floor level, center of lot",Glen Cove,NY,11542,,888-758-4389,E,,Public,24 hours daily,,,2,,,ChargePoint Network,http://www.chargepoint.com/,GPS,40.864321,-73.631262,01/23/2021,162350,2021-01-23 00:19:13,,,,,J1772
ELEC,Marty's True Value,1751 Van Vranken Ave,,Schenectady,NY,12308,,866-816-7584,E,,Public,24 hours daily; Also accepts Paypal,A D M V,,2,,,EV Connect,http://evconnect.com/,GPS,42.825230,-73.923890,04/08/2020,155081,2020-04-08 12:29:55,P,,,04/18/2019,J1772
ELEC,Buffalo State - Cleveland Hall,1300 Elmwood Ave,,Buffalo,NY,14222,,716-878-3041,E,,Public,24 hours daily,,,2,,,Non-Networked,,GPS,42.932067,-78.881370,06/09/2020,104734,2020-06-09 16:47:26,P,,,02/01/2018,J1772
ELEC,Genesee Valley Park - Sports Complex,131 Elmwood Ave,,Rochester,NY,14611,,866-816-7584,E,,Public,24 hours daily,,,2,,,EV Connect,http://evconnect.com/,GPS,43.124109,-77.635749,06/09/2020,123066,2020-06-09 16:47:26,P,,,04/01/2019,J1772
ELEC,NATIONAL GRID,113 West Ave,EMPIRE STATE,Saratoga Springs,NY,12866,,888-758-4389,E,,Public,24 hours daily,,,2,,,ChargePoint Network,http://www.chargepoint.com/,GPS,43.077743,-73.804522,01/23/2021,162223,2021-01-23 00:19:13,,,,,J1772
ELEC,124 Dell Street,124 Dell Street,,Syracuse,NY,13210,,888-998-2546,E,,Public,MON: 24 hours | TUE: 24 hours | WED: 24 hours | THU: 24 hours | FRI: 24 hours | SAT: 24 hours | SUN: 24 hours,,,2,,,Blink Network,http://www.blinkcharging.com/,GPS,43.042078,-76.120702,01/22/2021,167546,2021-01-22 22:55:21,,,,,J1772
ELEC,STOHL,3860 California Rd,STOHL1STOHL2STOHL3; -STOHL4STOHL5STOHL6,Orchard Park,NY,14127,,888-758-4389,E,,Public,24 hours daily,,,6,,,ChargePoint Network,http://www.chargepoint.com/,200-9,42.779595,-78.780856,01/23/2021,163646,2021-01-23 00:19:13,,,,,J1772
ELEC,ERIE COUNTY,9674 Foote Rd,SPRAGUE BROOK; -,Glenwood,NY,14069,,888-758-4389,E,,Public,24 hours daily,,,2,,,ChargePoint Network,http://www.chargepoint.com/,GPS,42.587340,-78.638110,01/23/2021,165307,2021-01-23 00:19:13,,,,,J1772
ELEC,ROSENBLUM300,100 Great Oaks Blvd,100 GREAT OAKS,Albany,NY,12203,,888-758-4389,E,,Public,24 hours daily,,,2,,,ChargePoint Network,http://www.chargepoint.com/,GPS,42.683264,-73.846461,01/23/2021,120975,2021-01-23 00:19:13,,,,,J1772
ELEC,TOG,11177 NY-32,CAR CHARGE 1,Greenville,NY,12083,,888-758-4389,E,,Public,24 hours daily,,,2,,,ChargePoint Network,http://www.chargepoint.com/,GPS,42.415910,-74.022550,01/23/2021,150045,2021-01-23 00:19:13,,,,,J1772
ELEC,WHITEFACE MT,Unnamed Road,WHITEFACE 2; Right Side Bear Den Lot,Wilmington,NY,12997,,888-758-4389,E,,Public,24 hours daily,,,2,,,ChargePoint Network,http://www.chargepoint.com/,GPS,44.359129,-73.858775,01/23/2021,170743,2021-01-23 00:19:13,,,,,J1772
ELEC,Phelps Memorial Hospital Northwell Health,733 N Broadway Garage,,Sleepy Hollow,NY,10591,,866-816-7584,E,,Public,24 hours daily; Also accepts Paypal,A D M V,,4,,,EV Connect,http://evconnect.com/,GPS,41.104998,-73.860423,04/08/2020,154921,2020-04-08 12:29:55,P,,,08/16/2019,J1772
ELEC,STATION 1,20 Old Post Rd,TOWN OF LG; Next to Lake George Town Court entrance,Lake George,NY,12845,,888-758-4389,E,,Public,24 hours daily,,,2,,,ChargePoint Network,http://www.chargepoint.com/,GPS,43.431324,-73.717171,01/23/2021,162366,2021-01-23 00:19:13,,,,,J1772
ELEC,NYE VW OF ROME.,5865 Rome-Taberg Rd,VW_408216_A; -,Rome,NY,13440,,888-758-4389,E,,Public,24 hours daily,,,2,,,ChargePoint Network,http://www.chargepoint.com/,GPS,43.232646,-75.498111,01/23/2021,162425,2021-01-23 00:19:13,,,,,J1772
ELEC,MARKET 32 EV,442 Balltown Rd,BALLTOWN EV1; To the left of main entrance.BALLTOWN EV2; To the left of main entrance.BALLTOWN EV3; To the left of main entrance.,Schenectady,NY,12304,,888-758-4389,E,,Public,24 hours daily,,,6,,,ChargePoint Network,http://www.chargepoint.com/,200-9,42.776160,-73.892840,01/23/2021,156639,2021-01-23 00:19:13,,,,,J1772
ELEC,Icon Parking 330 W 58th Street - Tesla Destination,330  W 58th St,,New York,NY,10019,,212-245-9634  877-798-3752,E,,Public,24 hours daily; see valet for access,,,3,,,Tesla Destination,https://www.tesla.com/destination-charging,200-8,40.767725,-73.983646,11/03/2020,115099,2020-11-18 00:06:10,P,,,01/01/2016,J1772 TESLA
ELEC,Icon Parking - Omni Parking,159 W 68th Street,Entrance on 179 W 68th St or 184 W 69th St between Broadway & Amsterdam Ave.,New York,NY,10023,,888-998-2546,E,,Public,MON: 24 hours | TUE: 24 hours | WED: 24 hours | THU: 24 hours | FRI: 24 hours | SAT: 24 hours | SUN: 24 hours,,,1,,,Blink Network,http://www.blinkcharging.com/,GPS,40.776152,-73.982820,01/22/2021,154593,2021-01-22 22:55:21,,,,,J1772
ELEC,Cedar Lakes Estate - Tesla Destination,1 Team USA Wy,,Port Jervis,NY,12771,,845-533-3328  877-798-3752,E,,Public,24 hours daily; for customer use only; see front desk for access,,,4,,,Tesla Destination,https://www.tesla.com/destination-charging,200-8,41.346021,-74.638058,11/03/2020,115212,2020-11-18 00:06:10,P,,,11/01/2018,J1772 TESLA
ELEC,EASTERN HARLEY,1570 Old Country Rd,DCFAST HOG; West side of building,Riverhead,NY,11901,,888-758-4389,E,,Public,24 hours daily,,,,1,,ChargePoint Network,http://www.chargepoint.com/,GPS,40.925156,-72.699036,01/23/2021,143181,2021-01-23 00:19:13,,,,,J1772COMBO
ELEC,"Country Inn & Suites by Radisson, Lake George - Tesla Destination",1130 U.S. 9,,Queensbury,NY,12804,,518-745-0180  877-798-3752,E,,Public,24 hours daily; for customer use only; see front desk for access,,,4,,,Tesla Destination,https://www.tesla.com/destination-charging,200-9,43.348226,-73.690167,11/03/2020,122495,2020-11-18 00:06:10,P,,,03/01/2019,J1772 TESLA
ELEC,IBEW 325,142 Corporate Dr,STATION 1,Binghamton,NY,13904,,888-758-4389,E,,Public,24 hours daily,,,2,,,ChargePoint Network,http://www.chargepoint.com/,GPS,42.101268,-75.817186,01/23/2021,162151,2021-01-23 00:19:13,,,,,J1772
ELEC,MP 102 LLC,401 Bedford Park Blvd,"MP GARDEN; 2nd level of garage, Bedford Park side",Bronx,NY,10458,,888-758-4389,E,,Public,24 hours daily,,,2,,,ChargePoint Network,http://www.chargepoint.com/,GPS,40.867165,-73.883186,01/23/2021,162519,2021-01-23 00:19:13,,,,,J1772
ELEC,HUDSON PRESERVE,12 Brooke Cir,BLDG 22 #3,Watervliet,NY,12189,,888-758-4389,E,,Public,24 hours daily,,,2,,,ChargePoint Network,http://www.chargepoint.com/,GPS,42.733753,-73.727530,01/23/2021,143196,2021-01-23 00:19:13,,,,,J1772
ELEC,Icon Parking 16 W 16th Street - Tesla Destination,16 W 16th St,,New York,NY,10011,,212-242-9635  877-798-3752,E,,Public,24 hours daily; see valet for access,,,3,,,Tesla Destination,https://www.tesla.com/destination-charging,200-8,40.737595,-73.993837,11/03/2020,115026,2020-11-18 00:06:10,P,,,01/01/2016,J1772 TESLA
ELEC,Four Brothers Drive In,4957 Route 22,,Amenia,NY,12501,,888-998-2546,E,,Public,MON: 24 hours | TUE: 24 hours | WED: 24 hours | THU: 24 hours | FRI: 24 hours | SAT: 24 hours | SUN: 24 hours,,,1,,,Blink Network,http://www.blinkcharging.com/,GPS,41.850398,-73.557933,01/22/2021,96638,2021-01-22 22:55:21,,,,,J1772
ELEC,NATIONAL GRID,1 Flint rd,COMFORT INN; Back of Comfort inn parking lot,Buffalo,NY,14221,,888-758-4389,E,,Public,24 hours daily,,,2,,,ChargePoint Network,http://www.chargepoint.com/,GPS,42.990251,-78.790769,01/23/2021,162246,2021-01-23 00:19:13,,,,,J1772
ELEC,Lucille Ball Memorial Park,42 Dunham Ave,,Celoron,NY,14701,,716-487-4175,E,,Public,24 hours daily,,,2,,,Non-Networked,,GPS,42.110155,-79.282850,06/09/2020,157957,2020-06-09 16:47:26,P,,,05/15/2020,J1772
ELEC,New York and Atlantic Railway Fresh Pond Yard,68-01 Otto Rd,,Glendale,NY,11385,,866-816-7584,E,,Public,24 hours daily,,,2,,,EV Connect,http://evconnect.com/,GPS,40.706231,-73.886487,04/08/2020,123128,2020-04-08 12:29:55,P,,,04/01/2019,J1772
ELEC,Elm Chevrolet,301 E Church St,,Elmira,NY,14901,,607-734-4141,E,,Public - Call ahead,Dealership business hours,,,,1,,Non-Networked,,GPS,42.091802,-76.804195,09/03/2020,117740,2020-09-03 19:35:48,P,,,01/01/2019,J1772COMBO
ELEC,STONY BROOK UNV,Lake Dr,LAKE DRIVE; -,Stony Brook,NY,11790,,888-758-4389,E,,Public,24 hours daily,,,2,,,ChargePoint Network,http://www.chargepoint.com/,GPS,40.911831,-73.121521,01/23/2021,162456,2021-01-23 00:19:13,,,,,J1772
ELEC,DORSCHEL VW,3817 W Henrietta Rd,VW_408149,Rochester,NY,14623,,888-758-4389,E,,Public,24 hours daily,,,2,,,ChargePoint Network,http://www.chargepoint.com/,GPS,43.077718,-77.644172,01/23/2021,162418,2021-01-23 00:19:13,,,,,J1772
ELEC,iPark 34 N 7th Street - Tesla Destination,34 N 7th St,,Brooklyn,NY,11249,,718-782-1494  877-798-3752,E,,Public,24 hours daily; pay lot; see valet for access,,,8,,,Tesla Destination,https://www.tesla.com/destination-charging,200-9,40.720475,-73.962650,11/03/2020,168539,2020-11-18 00:06:10,P,,,11/03/2020,TESLA
ELEC,Stony Brook University,100 Nicolls Rd,,Stony Brook,NY,11794,,866-816-7584,E,,Public,24 hours daily,,,2,,,EV Connect,http://evconnect.com/,200-8,40.913685,-73.116048,04/08/2020,94862,2020-04-08 12:29:55,P,,,07/13/2014,J1772
ELEC,Spin Test Facility,1 Research Cir.,,Niskayuna,NY,12309,,800-663-5633,E,,Public,MO: Closed; TU: Closed; WE: Closed; TH: Closed; FR: Closed; SA: Closed; SU: Closed,,,10,,,SemaCharge Network,https://semaconnect.com/,GPS,42.831453,-73.880977,01/23/2021,148041,2021-01-23 00:11:44,,,,,J1772
ELEC,TOWN OF BABYLON,100 Ocean Pkwy,OVERLOOK 1OVERLOOK 2,Babylon,NY,11702,,888-758-4389,E,,Public,24 hours daily,,,2,,,ChargePoint Network,http://www.chargepoint.com/,GPS,40.633720,-73.333663,01/23/2021,162279,2021-01-23 00:19:13,,,,,J1772
ELEC,NATIONAL GRID,1220 Coffeen street,JEFFERSON 1; C LOTJEFFERSON 2; C LOT,Watertown,NY,13601,,888-758-4389,E,,Public,24 hours daily,,,2,,,ChargePoint Network,http://www.chargepoint.com/,200-8,43.987562,-75.939726,01/23/2021,162251,2021-01-23 00:19:13,,,,,J1772
ELEC,Central Parking,350 E 30th Street,,New York,NY,10016,,888-998-2546,E,,Public,MON: 24 hours | TUE: 24 hours | WED: 24 hours | THU: 24 hours | FRI: 24 hours | SAT: 24 hours | SUN: 24 hours,,,1,,,Blink Network,http://www.blinkcharging.com/,GPS,40.741065,-73.975788,01/22/2021,124143,2021-01-22 22:55:21,,,,,J1772
ELEC,NEW HARTFORD,8635 Clinton St,GW-1 1.1GW-1 1.2GW-1 1.3GW-1 1.4GW-1 1.5; In parking lotGW-1 1.6,New Hartford,NY,13413,,888-758-4389,E,,Public,24 hours daily,,,12,,,ChargePoint Network,http://www.chargepoint.com/,200-9,43.092458,-75.316904,01/23/2021,149668,2021-01-23 00:19:13,,,,,J1772
ELEC,Rochester Institute of Technology - Lot T,1 Lomb Memorial Dr,Located across from the GIS building,Rochester,NY,14623,,585-475-2074,E,,Public,24 hours daily; parking pass required,,,6,,,Non-Networked,,200-9,43.087790,-77.674413,03/03/2020,63988,2020-03-03 21:13:47,P,,,10/01/2013,J1772
ELEC,Rapidpark 575 1st Avenue - Tesla Destination,575 1st Ave,,New York,NY,10016,,212-684-2762  877-798-3752,E,,Public,24 hours daily; see valet for access,,,3,,,Tesla Destination,https://www.tesla.com/destination-charging,200-8,40.742761,-73.974554,11/03/2020,115163,2020-11-18 00:06:10,P,,,09/01/2017,J1772 TESLA
ELEC,Eastview Mall - Tesla Supercharger,7979 Pittsford Victor Rd,,Victor,NY,14564,,877-798-3752,E,,Public,24 hours daily; for Tesla use only,,,,8,,Tesla,http://www.teslamotors.com/supercharger,200-8,43.028700,-77.440100,08/10/2020,102348,2020-08-27 20:39:12,P,,,09/01/2017,TESLA
ELEC,Parkright 257 Gold Street - Tesla Destination,257  Gold St,,Brooklyn,NY,11201,,212-247-7303  877-798-3752,E,,Public,24 hours daily; see valet for access,,,3,,,Tesla Destination,https://www.tesla.com/destination-charging,200-9,40.696871,-73.983002,11/03/2020,114895,2020-11-18 00:06:10,P,,,01/01/2016,J1772 TESLA
ELEC,DEER PARK,152 The Arches Cir,TANGER EV 1; South side of center between Nike and Neiman MarcusTANGER EV 2; South side of center between Nike and Neiman MarcusTANGER EV 3; South side of center between Nike and Neiman MarcusTANGER EV 4; South side of center between Nike and Neiman Marcus TANGER EV 5; South side of center between Nike and Neiman MarcusTANGER EV 6; South side of center between Nike and Neiman Marcus,Deer Park,NY,11729,,888-758-4389,E,,Public,24 hours daily,,,12,,,ChargePoint Network,http://www.chargepoint.com/,200-9,40.764866,-73.304950,01/23/2021,162405,2021-01-23 00:19:13,,,,,J1772
ELEC,Long Island Railroad - Freeport,Freeport Plaza E,Located at the North East corner of East Sunrise Highway and Henry St,Freeport,NY,11520,,866-816-7584  516-377-2300,E,,Public,24 hours daily; commuter permit required 6am-2pm,,,1,,,EV Connect,http://evconnect.com/,GPS,40.656692,-73.580924,04/08/2020,65303,2020-04-08 12:29:55,LG,,,05/15/2016,J1772
ELEC,SSCCA,37 High Rock Ave,,Saratoga Springs,NY,12866,,888-758-4389,E,,Public,24 hours daily,,,4,,,ChargePoint Network,http://www.chargepoint.com/,200-8,43.083885,-73.782571,01/23/2021,171216,2021-01-23 00:19:13,,,,,J1772
ELEC,SAVARINO COMPAN,Myrtle St Lot Charger 4 500 Seneca Street,500 SENECA 4; -,Buffalo,NY,14204,,888-758-4389,E,,Public,24 hours daily,,,2,,,ChargePoint Network,http://www.chargepoint.com/,GPS,42.878530,-78.857700,01/23/2021,164152,2021-01-23 00:19:13,,,,,J1772
ELEC,Buffalo Niagara Medical Campus - MiGo Garage,134 High St,1st level,Buffalo,NY,14226,,716-218-7351,E,,Public,Pay to park for access,,,5,,,Non-Networked,,GPS,42.900444,-78.864070,06/09/2020,50710,2020-06-09 16:47:26,P,,,03/31/2011,J1772
ELEC,GGMC Parking Battery Place - Tesla Destination,50 Battery Pl,,New York,NY,10280,,212-945-3109  877-798-3752,E,,Public,24 hours daily; pay lot; see valet for access,,,3,,,Tesla Destination,https://www.tesla.com/destination-charging,200-9,40.706643,-74.018095,11/03/2020,115143,2020-11-18 00:06:10,P,,,11/01/2018,J1772 TESLA
ELEC,PICOTTE,12 Corporate Woods Blvd,12 CORPORATE 1; Near main entrance of 12 corporate woods12 CORPORATE 2; Near Main entrance of 12 corporate woods 12 CORPORATE 3; Near main entrance of 12 corporate woods12 CORPORATE 412 CORPORATE 5,Albany,NY,12211,,888-758-4389,E,,Public,24 hours daily,,,10,,,ChargePoint Network,http://www.chargepoint.com/,200-9,42.684115,-73.765599,01/23/2021,166798,2021-01-23 00:19:13,,,,,J1772
ELEC,Kings County Parking - Tesla Destination,581 Clarkson Ave,,Brooklyn,NY,11203,,718-245-5337  877-798-3752,E,,Public,24 hours daily; see front desk for access,,,2,,,Tesla Destination,https://www.tesla.com/destination-charging,200-9,40.656148,-73.940355,11/03/2020,114907,2020-11-18 00:06:10,P,,,09/01/2017,TESLA
ELEC,Hamilton Parking Garage,365 Hamilton Ave,Near entrance from EJ Conroy Dr,White Plains,NY,10601,,914-422-1310,E,,Public,24 hours daily; pay lot,,,3,,,Non-Networked,,200-9,41.034121,-73.766241,09/03/2020,65274,2020-09-03 19:35:48,SG,,,07/23/2014,J1772
ELEC,ROCHESTER NY,194 Court St,"COURT ST 1; Level 1 Adjacent to entrance on right sideCOURT ST 2; Level 2, South West Corner, near stairs",Rochester,NY,14604,,888-758-4389,E,,Public,24 hours daily,,,4,,,ChargePoint Network,http://www.chargepoint.com/,200-9,43.154238,-77.607055,01/23/2021,61065,2021-01-23 00:19:13,,,,,J1772
ELEC,SPOT cowork Rochester - Tesla Destination,21 Goodway Dr,,Rochester,NY,14623,,877-798-3752  877-798-3752,E,,Public,24 hours daily; for customer use only; see front desk for access,,,4,,,Tesla Destination,https://www.tesla.com/destination-charging,GPS,43.091974,-77.580604,11/03/2020,154441,2020-11-18 00:06:10,P,,,03/06/2020,TESLA
ELEC,PICOTTE,22 Corporate Woods Blvd,22 CORPORATE 1; First floor of parking garage next to 22 corporate woods 22 CORPORATE 2; First floor of parking garage near 22 corporate woods 22 CORPORATE 3; First floor of parking garage next to 22 corporate woods22 CORPORATE 4; First floor of parking garage next to 22 corporate woods22 CORPORATE 5; First floor of parking garage next to 22 corporate woods,Albany,NY,12211,,888-758-4389,E,,Public,24 hours daily,,,10,,,ChargePoint Network,http://www.chargepoint.com/,200-9,42.682652,-73.769368,01/23/2021,165498,2021-01-23 00:19:13,,,,,J1772
ELEC,CITY OF ITHACA,118 Dryden Rd,DRYDEN; 2nd floor,Ithaca,NY,14850,,888-758-4389,E,,Public,24 hours daily,,,2,,,ChargePoint Network,http://www.chargepoint.com/,GPS,42.442142,-76.486112,01/23/2021,162296,2021-01-23 00:19:13,,,,,J1772
ELEC,Hilton Garden Inn Watertown - Tesla Destination,1290 Arsenal St,,Watertown,NY,13601,,315-788-1234  877-798-3752,E,,Public,24 hours daily; for customer use only,,,2,,,Tesla Destination,https://www.tesla.com/destination-charging,200-8,43.976367,-75.946435,11/03/2020,115246,2020-11-18 00:06:10,P,,,08/15/2016,J1772 TESLA
ELEC,Asa Ransom House - Tesla Destination,10529 Main St,,Clarence,NY,14031,,716-759-2315  877-798-3752,E,,Public,24 hours daily; for customer use only; see front desk for access,,,1,,,Tesla Destination,https://www.tesla.com/destination-charging,200-9,42.980201,-78.595784,11/03/2020,114924,2020-11-18 00:06:10,P,,,01/01/2016,TESLA
ELEC,Brooklyn Renaissance Plaza - Muss Properties,335 Adams St,,Brooklyn,NY,11201,,866-816-7584,E,,Public,24 hours daily,,,3,,,EV Connect,http://evconnect.com/,200-9,40.693507,-73.988425,04/08/2020,121863,2020-04-08 12:29:55,P,,,04/01/2019,J1772
ELEC,BURNS MGT,151 Jefferson St,WHITMORE #1,Saratoga Springs,NY,12866,,888-758-4389,E,,Public,24 hours daily,,,2,,,ChargePoint Network,http://www.chargepoint.com/,GPS,43.066259,-73.780757,01/23/2021,143586,2021-01-23 00:19:13,,,,,J1772
ELEC,ELECTRIC CAT,2037 Nys Hwy 17b,CATSKILL DISTIL; Rear of building,Bethel,NY,12720,,888-758-4389,E,,Public,24 hours daily,,,2,,,ChargePoint Network,http://www.chargepoint.com/,GPS,41.684274,-74.877327,01/23/2021,162332,2021-01-23 00:19:13,,,,,J1772
ELEC,SYLVAN BEACH,1 Sunset Park,,Sylvan Beach,NY,13157,,888-758-4389,E,,Public,24 hours daily,,,2,,,ChargePoint Network,http://www.chargepoint.com/,GPS,43.196123,-75.730890,01/23/2021,171231,2021-01-23 00:19:13,,,,,J1772
ELEC,HAWKINS P2 ST 1,47 Beekman Street,SUNYPLATTSBURGH; -,Plattsburgh,NY,12901,,888-758-4389,E,,Public,24 hours daily,,,2,,,ChargePoint Network,http://www.chargepoint.com/,GPS,44.697682,-73.467520,01/23/2021,167180,2021-01-23 00:19:13,,,,,J1772
ELEC,Legend Nissan,268 Jericho Turnpike,,Syosset,NY,11791,,516-496-8181,E,,Public,Dealership business hours,,,1,,,Non-Networked,,200-9,40.809865,-73.507761,06/09/2020,44203,2020-06-09 16:47:26,P,,,11/30/2011,J1772
ELEC,7-Eleven,5820 Francis Lewis Blvd,,Oakland Gardens,NY,11364,,877-455-3833,E,,Public,24 hours daily,,,,1,,eVgo Network,https://www.evgo.com/,GPS,40.744854,-73.777104,01/23/2021,146586,2021-01-23 01:19:54,,,,,CHADEMO J1772COMBO
ELEC,KINGSTON,2 Broadway,VISITORS CENTER; Free Parking,Kingston,NY,12401,,888-758-4389,E,,Public,24 hours daily,,,2,,,ChargePoint Network,http://www.chargepoint.com/,GPS,41.918516,-73.982758,01/23/2021,162261,2021-01-23 00:19:13,,,,,J1772
ELEC,TIME WARNER,1021 Highbridge Rd,TIME WARNER; station is located along the west side of the building off Highbridge road,Schenectady,NY,12303,,888-758-4389,E,,Public,24 hours daily,,,2,,,ChargePoint Network,http://www.chargepoint.com/,GPS,42.769329,-73.928738,01/23/2021,162473,2021-01-23 00:19:13,,,,,J1772
ELEC,Parkright 39 E 29th Street - Tesla Destination,29 East 29th St,,New York,NY,10016,,212-247-7303  877-798-3752,E,,Public,24 hours daily; see valet for access,,,3,,,Tesla Destination,https://www.tesla.com/destination-charging,200-8,40.744551,-73.984535,11/03/2020,115079,2020-11-18 00:06:10,P,,,01/01/2016,J1772 TESLA
ELEC,Office Building,40 Newbridge Rd,,Hicksville,NY,11801,,866-816-7584,E,,Public,Office business hours; for employee and guest use only,,,3,,,EV Connect,http://evconnect.com/,200-8,40.768280,-73.528019,04/08/2020,94842,2020-04-08 12:29:55,P,,,10/31/2014,J1772
ELEC,Gallin Beeler Design Studio,23 Washington Ave,,Pleasantville,NY,10570,,866-816-7584,E,,Public,24 hours daily,,,3,,,EV Connect,http://evconnect.com/,GPS,41.135753,-73.791497,04/08/2020,123192,2020-04-08 12:29:55,P,,,04/01/2019,J1772
ELEC,DoubleTree by Hilton Binghamton - Tesla Destination,225 Water St,,Binghamton,NY,13901,,607-722-7575  877-798-3752,E,,Public,24 hours daily; for customer use only; see front desk for access,,,1,,,Tesla Destination,https://www.tesla.com/destination-charging,200-9,42.101763,-75.914203,11/03/2020,114883,2020-11-18 00:06:10,P,,,01/01/2016,TESLA
ELEC,Peconic Lane Community Center,1170 Peconic Ln,,Peconic,NY,11958,,631-765-8251,E,,Public - Credit card at all times,24 hours daily,A D M V,,1,,,Non-Networked,,GPS,41.043700,-72.456800,03/03/2020,80873,2020-03-03 21:13:47,LG,,,11/15/2017,J1772
ELEC,Marbletown Community Center,3562 Main St,Located in the parking lot,Stone Ridge,NY,12484,,845-687-0800,E,,Public,24 hours daily,,,2,,,Non-Networked,,GPS,41.852574,-74.139946,10/09/2020,86200,2020-10-09 12:41:43,LG,,,07/01/2017,J1772
ELEC,Sylvan Pinnacle Garage - Tesla Destination,112-01 Queens Blvd,,Forest Hills,NY,11375,,718-520-1403  877-798-3752,E,,Public,24 hours daily; pay lot; see valet for access,,,4,,,Tesla Destination,https://www.tesla.com/destination-charging,200-9,40.726421,-73.851406,11/03/2020,114940,2020-11-18 00:06:10,P,,,11/01/2018,TESLA
ELEC,Icon Parking 150 E 58th Street - Tesla Destination,150 E 58th St,,New York,NY,10155,,212-755-8678  877-798-3752,E,,Public,24 hours daily; see valet for access,,,3,,,Tesla Destination,https://www.tesla.com/destination-charging,200-9,40.761610,-73.967750,11/03/2020,115019,2020-11-18 00:06:10,P,,,05/01/2016,J1772 TESLA
ELEC,Sylvan Parking - Pinnacle Garage,112-01 Queens Boulevard,Charger is located 1 floor below street level,Forest Hills,NY,11375,,888-998-2546,E,,Public,MON: 24 hours | TUE: 24 hours | WED: 24 hours | THU: 24 hours | FRI: 24 hours | SAT: 24 hours | SUN: 24 hours,,,1,,,Blink Network,http://www.blinkcharging.com/,GPS,40.718455,-73.836510,01/22/2021,164711,2021-01-22 22:55:21,,,,,J1772
ELEC,ScottTech,336 Court St,,Binghamton,NY,13904,,315-214-6065,E,,Public,24 hours daily,,,1,,,Non-Networked,,200-9,42.103472,-75.892293,09/03/2020,67753,2020-09-03 19:35:48,P,,,04/01/2015,J1772
ELEC,Parkright 670 W 43rd Street - Tesla Destination,670 W 43rd St,,New York,NY,10036,,212-247-7303  877-798-3752,E,,Public,24 hours daily; see valet for access,,,3,,,Tesla Destination,https://www.tesla.com/destination-charging,200-8,40.762316,-74.000256,11/03/2020,115178,2020-11-18 00:06:10,P,,,01/01/2016,J1772 TESLA
ELEC,Oerlikon Metco,1101 Prospect Ave,,Westbury,NY,11590,,866-816-7584,E,,Public,24 hours daily; Also accepts Paypal,A D M V,,2,,,EV Connect,http://evconnect.com/,GPS,40.764764,-73.554076,04/08/2020,155101,2020-04-08 12:29:55,P,,,04/29/2019,J1772
ELEC,NATIONAL GRID,1305 Buckley Rd,NEW HAMPTON INN; Near main front entrance,Syracuse,NY,13212,,888-758-4389,E,,Public,24 hours daily,,,2,,,ChargePoint Network,http://www.chargepoint.com/,GPS,43.094833,-76.172042,01/23/2021,162209,2021-01-23 00:19:13,,,,,J1772
ELEC,INNATHOUGHTONCR,9722 Co Rd 35,HOUGHTON CREEK; Located at the parking lot for Inn at Houghton Creek lodge,Houghton,NY,14744,,888-758-4389,E,,Public,24 hours daily,,,2,,,ChargePoint Network,http://www.chargepoint.com/,GPS,42.423464,-78.158123,01/23/2021,123393,2021-01-23 00:19:13,,,,,J1772
ELEC,VASSAR COLLEGE,Unnamed Road,SOUTH LOT 2,Arlington,NY,12603,,888-758-4389,E,,Public,24 hours daily,,,2,,,ChargePoint Network,http://www.chargepoint.com/,GPS,41.681771,-73.894668,01/23/2021,155288,2021-01-23 00:19:13,,,,,J1772
ELEC,BEAM CHARGING,122 W 3rd St,MINETTA GARAGE; See valet attendant for instructions on how to use the charging station.,New York,NY,10012,,888-758-4389,E,,Public,24 hours daily,,,2,,,ChargePoint Network,http://www.chargepoint.com/,GPS,40.730485,-74.000728,01/23/2021,162496,2021-01-23 00:19:13,,,,,J1772
ELEC,TANNERSVILLE,1 Park Ln,TOWN HALL,Tannersville,NY,12485,,888-758-4389,E,,Public,24 hours daily,,,2,,,ChargePoint Network,http://www.chargepoint.com/,GPS,42.196110,-74.131660,01/23/2021,152437,2021-01-23 00:19:13,,,,,J1772
ELEC,WHEATLAND-CHILI,940 N Rd,"HIGH SCH #1; Front of gym, entrance 25HIGH SCH 2; Front of gym, entrance 25",Scottsville,NY,14546,,888-758-4389,E,,Public,24 hours daily,,,2,,,ChargePoint Network,http://www.chargepoint.com/,200-9,43.025602,-77.762202,01/23/2021,149178,2021-01-23 00:19:13,,,,,J1772
ELEC,MUNICIPAL EVSE,635 Upper Glen St,YMCA GLENN ST,Queensbury,NY,12804,,888-758-4389,E,,Public,24 hours daily,,,2,,,ChargePoint Network,http://www.chargepoint.com/,GPS,43.323772,-73.662550,01/23/2021,155246,2021-01-23 00:19:13,,,,,J1772
ELEC,GGMC Parking 10 W 66th St Garage - Tesla Destination,10 W 66th St,,New York,NY,10023,,212-874-1100  877-798-3752,E,,Public,24 hours daily; see valet for access,,,2,,,Tesla Destination,https://www.tesla.com/destination-charging,200-8,40.772308,-73.978966,11/03/2020,114987,2020-11-18 00:06:10,P,,,01/01/2016,TESLA
ELEC,Brookfield Place - Tesla Supercharger,250 Vesey Street,,New York,NY,10080,,877-798-3752,E,,Public,24 hours daily; for Tesla use only,,,,4,,Tesla,http://www.teslamotors.com/supercharger,GPS,40.714200,-74.016300,08/10/2020,153434,2020-08-27 20:39:12,P,,,01/31/2020,TESLA
ELEC,LEARYS 1,3256 Monroe Ave,"LEARY'S 1; In front of Leary's Cleaners, Next to McDonald's",Rochester,NY,14618,,888-758-4389,E,,Public,24 hours daily,,,1,,,ChargePoint Network,http://www.chargepoint.com/,GPS,43.104502,-77.539475,01/23/2021,162383,2021-01-23 00:19:13,,,,,J1772
ELEC,BURNS MGT,102 Bleeker Rd,HV 1; -HV 2; -HV 3; -,Guilderland,NY,12084,,888-758-4389,E,,Public,24 hours daily,,,6,,,ChargePoint Network,http://www.chargepoint.com/,200-8,42.691644,-73.888216,01/23/2021,120826,2021-01-23 00:19:13,,,,,J1772
ELEC,Staples Plaza,3379 Crompond Rd,,Yorktown Heights,NY,10598,,877-455-3833,E,,Public - Card key at all times,24 hours daily,,,,1,,eVgo Network,https://www.evgo.com/,GPS,41.289986,-73.830730,01/23/2021,93697,2021-01-23 01:19:54,,,,,CHADEMO J1772COMBO
ELEC,Century Parking Corp - Tesla Destination,2600 Netherland Ave,,Bronx,NY,10463,,718-543-6002  877-798-3752,E,,Public,24 hours daily; pay lot; see valet for access,,,4,,,Tesla Destination,https://www.tesla.com/destination-charging,200-9,40.878611,-73.914792,11/03/2020,114888,2020-11-18 00:06:10,P,,,11/01/2018,TESLA
ELEC,PANYNJ,LGA West Garage LaGuardia Airport,LGA WEST 1; Terminal B parking garageLGA WEST 2; -LGA WEST 5; -,Flushing,NY,11371,,888-758-4389,E,,Public,24 hours daily,,,3,,,ChargePoint Network,http://www.chargepoint.com/,GPS,40.773116,-73.874977,01/23/2021,162285,2021-01-23 00:19:13,,,,,J1772
ELEC,Avon Village Office,102 Genesee St,,Avon,NY,14414,,866-816-7584,E,,Public,24 hours daily,,,2,,,EV Connect,http://evconnect.com/,GPS,42.910580,-77.746443,06/09/2020,123132,2020-06-09 16:47:26,LG,,,04/01/2019,J1772
ELEC,O. C. BMW,101 Maher Ln,STATION 01,Harriman,NY,10926,,888-758-4389,E,,Public,24 hours daily,,,2,,,ChargePoint Network,http://www.chargepoint.com/,GPS,41.314906,-74.139157,01/23/2021,162442,2021-01-23 00:19:13,,,,,J1772
ELEC,CSJ BRENTWOOD,1725 Brentwood Rd,BRENTWOOD RD; -STATION 2,Brentwood,NY,11717,,888-758-4389,E,,Public,24 hours daily,,,4,,,ChargePoint Network,http://www.chargepoint.com/,200-9,40.774401,-73.246076,01/23/2021,122961,2021-01-23 00:19:13,,,,,J1772
ELEC,GGMC The Cove - Tesla Destination,99 Battery Pl,,New York,NY,10280,,212-945-3109  877-798-3752,E,,Public,24 hours daily; for customer use only; see valet for access,,,3,,,Tesla Destination,https://www.tesla.com/destination-charging,200-9,40.707624,-74.016593,11/03/2020,115197,2020-11-18 00:06:10,P,,,09/01/2017,J1772 TESLA
ELEC,Aviation Mall - Tesla Supercharger,578 Aviation Road,,Queensbury,NY,12804,,877-798-3752,E,,Public,24 hours daily; for Tesla use only,,,,8,,Tesla,http://www.teslamotors.com/supercharger,200-8,43.328400,-73.680000,08/10/2020,102342,2020-08-27 20:39:12,P,,,07/15/2016,TESLA
ELEC,Schuyler County,323 Owego St,,Montour Falls,NY,14865,,866-816-7584,E,,Public - Credit card at all times,24 hours daily; Also accepts PayPal and Apple Pay,A D M V,,4,,,EV Connect,http://evconnect.com/,GPS,42.340492,-76.840909,12/03/2020,168435,2020-12-03 22:33:12,LG,,,09/01/2020,J1772
ELEC,VASSAR COLLEGE,112130 Raymond Ave,SOUTH LOT 1,Arlington,NY,12603,,888-758-4389,E,,Public,24 hours daily,,,2,,,ChargePoint Network,http://www.chargepoint.com/,GPS,41.681836,-73.894667,01/23/2021,155289,2021-01-23 00:19:13,,,,,J1772
ELEC,Quik Park Broadway Garage LLC - Tesla Destination,225-251  W 56th St,,New York,NY,10019,,212-974-6147  877-798-3752,E,,Public,24 hours daily; for customer use only; see valet for access,,,3,,,Tesla Destination,https://www.tesla.com/destination-charging,200-8,40.765735,-73.982101,11/03/2020,115059,2020-11-18 00:06:10,P,,,11/01/2018,J1772 TESLA
ELEC,NATIONAL GRID,104 Lake Dr,ONONDAGA LAKE; In front of Onondaga County Parks Main Office,Liverpool,NY,13088,,888-758-4389,E,,Public,24 hours daily,,,2,,,ChargePoint Network,http://www.chargepoint.com/,GPS,43.100500,-76.206648,01/23/2021,162213,2021-01-23 00:19:13,,,,,J1772
ELEC,NATIONAL GRID,941 Washington St,SMART HOME,Buffalo,NY,14203,,888-758-4389,E,,Public,24 hours daily,,,2,,,ChargePoint Network,http://www.chargepoint.com/,GPS,42.899468,-78.868659,01/23/2021,162211,2021-01-23 00:19:13,,,,,J1772
ELEC,EVolve NY - Schroon Lake - Sunoco,1567 U.S. 9,,Schroon Lake,NY,12870,,914-287-4200,E,,Public,24 hours daily,,,1,,,Non-Networked,,GPS,43.869511,-73.752705,01/14/2021,170565,2021-01-14 18:42:41,P,,,12/21/2020,J1772
ELEC,MPG 201 E 56th - Tesla Destination,201 E 56th,,New York,NY,10022,,212-490-3460  877-798-3752,E,,Public,24 hours daily; see valet for access,,,3,,,Tesla Destination,https://www.tesla.com/destination-charging,200-8,40.759764,-73.967956,11/03/2020,115045,2020-11-18 00:06:10,P,,,11/01/2018,J1772 TESLA
ELEC,Destination Nissan,770 Central Ave,,Albany,NY,12206,,518-438-8461,E,,Public - Call ahead,Dealership business hours,,,1,,,Non-Networked,,200-9,42.676971,-73.787334,06/09/2020,44317,2020-06-09 16:47:26,P,,,11/30/2011,J1772
ELEC,Queens Center Mall,90-15 Queens Blvd.,,Elmhurst,NY,11373,,833-632-2778,E,,Public,24 hours daily,,,1,3,,Electrify America,https://www.electrifyamerica.com/,GPS,40.734870,-73.870375,01/23/2021,147204,2021-01-23 01:23:19,,,,,CHADEMO J1772 J1772COMBO
ELEC,Serendipity Labs Inc. - Tesla Destination,80 Theodore Fremd Ave,,Rye,NY,10580,,914-908-6770  877-798-3752,E,,Public - Call ahead,24 hours daily,,,1,,,Tesla Destination,https://www.tesla.com/destination-charging,200-9,40.983031,-73.687987,11/03/2020,115231,2020-11-18 00:06:10,P,,,02/01/2015,TESLA
ELEC,Icon Parking 515 E 72nd Street - Tesla Destination,515  E 72nd St,,New York,NY,10021,,212-249-8196  877-798-3752,E,,Public,24 hours daily; pay lot; see valet for access,,,3,,,Tesla Destination,https://www.tesla.com/destination-charging,200-9,40.766857,-73.952647,11/03/2020,150660,2020-11-18 00:06:10,P,,,09/30/2019,J1772 TESLA
ELEC,QUEENS COLLEGE,153-23 61st Rd,NS1-STATION2; Queens College Parking Lot 15N (north),Queens,NY,11367,,888-758-4389,E,,Public,24 hours daily,,,2,,,ChargePoint Network,http://www.chargepoint.com/,GPS,40.738866,-73.817146,01/23/2021,162390,2021-01-23 00:19:13,,,,,J1772
ELEC,MTP Parking 755 Kent Ave - Tesla Destination,755 Kent Ave,,Brooklyn,NY,11249,,718-855-7407  877-798-3752,E,,Public,24 hours daily; pay lot; see valet for access,,,4,,,Tesla Destination,https://www.tesla.com/destination-charging,200-8,40.698959,-73.960100,11/03/2020,122479,2020-11-18 00:06:10,P,,,03/01/2019,TESLA
ELEC,Fair Haven Public Works,14523 Cayuga St,,Fair Haven,NY,13156,,866-816-7584,E,,Public,24 hours daily,,,2,,,EV Connect,http://evconnect.com/,200-9,43.319653,-76.698558,04/08/2020,94838,2020-04-08 12:29:55,LG,,,09/29/2017,J1772
ELEC,960 BUSTI,960 Busti Ave,960 BUSTI 1; On exterior wall towards back of building,Buffalo,NY,14213,,888-758-4389,E,,Public,24 hours daily,,,2,,,ChargePoint Network,http://www.chargepoint.com/,GPS,42.908953,-78.900652,01/23/2021,150340,2021-01-23 00:19:13,,,,,J1772
ELEC,Alps Provisions - Tesla Destination,43-11 23rd Ave.,,Astoria,NY,11105,,877-798-3752  877-798-3752,E,,Public,24 hours daily; for customer use only; see front desk for access,,,3,,,Tesla Destination,https://www.tesla.com/destination-charging,200-9,40.769436,-73.905312,11/03/2020,168571,2020-11-18 00:06:10,P,,,11/03/2020,TESLA
ELEC,BA PLAZA,1 Northwestern Blvd,,Albany,NY,12211,,888-758-4389,E,,Public,24 hours daily,,,4,,,ChargePoint Network,http://www.chargepoint.com/,GPS,42.745924,-73.821006,01/23/2021,171197,2021-01-23 00:19:13,,,,,J1772
ELEC,CenterPark 4172 Broadway - Tesla Destination,4172 Broadway Ave,,Washington Heights,NY,10033,,212-543-2700  877-798-3752,E,,Public,24 hours daily; pay lot; see valet for access,,,4,,,Tesla Destination,https://www.tesla.com/destination-charging,200-8,40.847482,-73.937862,11/03/2020,150571,2020-11-18 00:06:10,P,,,09/30/2019,TESLA
ELEC,Residence Inn - Marriott Poughkeepsie,2525 South St,,Poughkeepsie,NY,12601,,866-816-7584,E,,Public - Call ahead,24 hours daily; for hotel guest use only,,,2,,,EV Connect,http://evconnect.com/,GPS,41.660699,-73.932808,10/09/2020,94855,2020-10-09 12:41:43,P,,,12/23/2013,J1772
ELEC,The Inn At Houghton Creek,9722 Genesee St,,Houghton,NY,14744,,585-567-8400,E,,Public,24 hours daily; guest use only,,,2,,,Non-Networked,,GPS,42.423533,-78.158051,06/09/2020,157964,2020-06-09 16:47:26,P,,,05/15/2020,TESLA
ELEC,City of Plattsburgh - City Hall,41 City Hall Pl,,Plattsburgh,NY,12901,,518-563-7702,E,,Public,24 hours daily,,,2,,,ChargePoint Network,http://www.chargepoint.com/,200-9,44.699260,-73.452022,09/03/2020,143788,2020-09-03 19:35:48,LG,,,08/08/2019,J1772
ELEC,Sutton Place North Garage - Tesla Destination,420 E 54th St,,New York,NY,10022,,212-752-7504  877-798-3752,E,,Public,24 hours daily; pay lot; see valet for access,,,2,,,Tesla Destination,https://www.tesla.com/destination-charging,200-9,40.755679,-73.963528,11/03/2020,115131,2020-11-18 00:06:10,P,,,11/01/2018,TESLA
ELEC,SCHENECTADY,17 Broadway,LIBERTY-YATES; In center of paid lot near utility pole,Schenectady,NY,12305,,888-758-4389,E,,Public,24 hours daily,,,2,,,ChargePoint Network,http://www.chargepoint.com/,GPS,42.815406,-73.940711,01/23/2021,162421,2021-01-23 00:19:13,,,,,J1772
ELEC,Village of Scarsdale,14 Freightway,,Scarsdale,NY,10583,,855-900-7584,E,,Public,24 hours daily,,,2,,,Greenlots,http://greenlots.com/,200-9,40.988106,-73.809122,01/23/2021,118059,2021-01-23 01:21:30,,,,,J1772
ELEC,BARD ALMNCT,Robbins Rd,FISHER CENTER; In third lot â€œCâ€,Tivoli,NY,12583,,888-758-4389,E,,Public,24 hours daily,,,2,,,ChargePoint Network,http://www.chargepoint.com/,GPS,42.031453,-73.904186,01/23/2021,162283,2021-01-23 00:19:13,,,,,J1772
ELEC,The Caledonia,450 W 17th Street,Chargers located on Level 1,New York,NY,10011,,888-998-2546,E,,Public,MON: 24 hours | TUE: 24 hours | WED: 24 hours | THU: 24 hours | FRI: 24 hours | SAT: 24 hours | SUN: 24 hours,,,2,,,Blink Network,http://www.blinkcharging.com/,GPS,40.743832,-74.006578,01/22/2021,164687,2021-01-22 22:55:21,,,,,J1772
ELEC,Hilton Garden Inn Elmira/Corning - Tesla Destination,35  Arnot Rd,,Horseheads,NY,14845,,607-795-1111  877-798-3752,E,,Public,24 hours daily; for customer use only; see front desk for access,,,2,,,Tesla Destination,https://www.tesla.com/destination-charging,200-8,42.162052,-76.873535,11/03/2020,114955,2020-11-18 00:06:10,P,,,09/01/2017,TESLA
ELEC,iPark - 59 Allen Street Garage,59 Allen Street,Attendant will assist in charging vehicle.  Parking rates apply. Inquire within.,New York,NY,10002,,888-998-2546,E,,Public,MON: 24 hours | TUE: 24 hours | WED: 24 hours | THU: 24 hours | FRI: 24 hours | SAT: 24 hours | SUN: 24 hours,,,2,,,Blink Network,http://www.blinkcharging.com/,GPS,40.717195,-73.991658,01/22/2021,95271,2021-01-22 22:55:21,,,,,J1772
ELEC,"HAVERSTRAW, NY",48 New Main St,NS1-STATION#1; -,Haverstraw,NY,10927,,888-758-4389,E,,Public,24 hours daily,,,2,,,ChargePoint Network,http://www.chargepoint.com/,GPS,41.196680,-73.966573,01/23/2021,163459,2021-01-23 00:19:13,,,,,J1772
ELEC,Bear Metal Works,39 Scoville Ave,,Buffalo,NY,14206,,866-816-7584,E,,Public,24 hours daily; Also accepts Paypal,A D M V,,4,,,EV Connect,http://evconnect.com/,GPS,42.873786,-78.827735,04/08/2020,155026,2020-04-08 12:29:55,P,,,08/08/2019,J1772
ELEC,TIOGA HOTEL,NY-17,CASINO 1CASINO 2,Nichols,NY,13812,,888-758-4389,E,,Public,24 hours daily,,,4,,,ChargePoint Network,http://www.chargepoint.com/,GPS,42.024208,-76.410780,01/23/2021,162353,2021-01-23 00:19:13,,,,,J1772
ELEC,854ELLICOTT,134 High St,134 HIGH ST 1; -134 HIGH ST 2; -134 HIGH ST 3134 HIGH ST 4134 HIGH ST 5,Buffalo,NY,14203,,888-758-4389,E,,Public,24 hours daily,,,10,,,ChargePoint Network,http://www.chargepoint.com/,200-9,42.900774,-78.863674,01/23/2021,169909,2021-01-23 00:19:13,,,,,J1772
ELEC,COMPETITION BMW,599 Jericho Turnpike,"BMW- PUBLIC; East side of main parking lot, near parts department parking.",Smithtown,NY,11787,,888-758-4389,E,,Public,24 hours daily,,,2,,,ChargePoint Network,http://www.chargepoint.com/,GPS,40.860511,-73.158271,01/23/2021,162461,2021-01-23 00:19:13,,,,,J1772
ELEC,MPG The Shops at Skyview - Tesla Destination,40-24 College Point Blvd,,Flushing,NY,11354,,212-490-3460  877-798-3752,E,,Public,24 hours daily; pay lot,,,3,,,Tesla Destination,https://www.tesla.com/destination-charging,200-9,40.756893,-73.834158,11/03/2020,114939,2020-11-18 00:06:10,P,,,11/01/2018,TESLA
ELEC,FOX HONDA,320 Grant Avenue Rd,SHOP 01; Near service entrance,Auburn,NY,13021,,888-758-4389,E,,Public,24 hours daily,,,1,,,ChargePoint Network,http://www.chargepoint.com/,GPS,42.957863,-76.541092,01/23/2021,122964,2021-01-23 00:19:13,,,,,J1772
ELEC,Rapidpark 906 Union Street - Tesla Destination,906 Union St,,Brooklyn,NY,11215,,718-622-4867  877-798-3752,E,,Public,24 hours daily; see valet for access,,,3,,,Tesla Destination,https://www.tesla.com/destination-charging,200-9,40.672726,-73.971664,11/03/2020,114916,2020-11-18 00:06:10,P,,,09/01/2017,J1772 TESLA
ELEC,HUDSON PRESERVE,913 Beryl Way,BLDG 6 #8,Watervliet,NY,12189,,888-758-4389,E,,Public,24 hours daily,,,2,,,ChargePoint Network,http://www.chargepoint.com/,GPS,42.731922,-73.724144,01/23/2021,143224,2021-01-23 00:19:13,,,,,J1772
ELEC,Eventi Hotel - LAZ,851 Avenue of the Americas,,New York,NY,10001,,888-998-2546,E,,Public,MON: 24 hours | TUE: 24 hours | WED: 24 hours | THU: 24 hours | FRI: 24 hours | SAT: 24 hours | SUN: 24 hours,,,1,,,Blink Network,http://www.blinkcharging.com/,GPS,40.758681,-73.981350,01/22/2021,124149,2021-01-22 22:55:21,,,,,J1772
ELEC,HARMONY MILLS 1,50 N Mohawk St,WEST 2 2.4WEST 2 2.5,Cohoes,NY,12047,,888-758-4389,E,,Public,24 hours daily,,,4,,,ChargePoint Network,http://www.chargepoint.com/,200-8,42.778925,-73.702993,01/23/2021,149626,2021-01-23 00:19:13,,,,,J1772
ELEC,Town of Cortlandt,1 Heady St,"Right off Oregon Rd, north of Bear Mountain State Parkway",Cortlandt,NY,10567,,914-734-1002  866-816-7584,E,,Public,24 hours daily,,,2,,,EV Connect,http://evconnect.com/,200-9,41.310139,-73.905002,04/08/2020,65270,2020-04-08 12:29:55,SG,,,11/01/2014,J1772
ELEC,520806-Rockefeller Center,55 W 48th St,,New York City,NY,10036,,855-900-7584,E,,Public,24 hours daily,,,8,,,Greenlots,http://greenlots.com/,200-8,40.758305,-73.980311,01/23/2021,123040,2021-01-23 01:21:30,,,,,J1772
ELEC,Sunshine Square,700 Patchogue Yaphank Rd,,Medford,NY,11763,,877-455-3833,E,,Public - Card key at all times,24 hours daily,,,1,1,,eVgo Network,https://www.evgo.com/,GPS,40.807079,-72.954544,01/23/2021,93249,2021-01-23 01:19:54,,,,,CHADEMO J1772 J1772COMBO
ELEC,ROCHESTER NY,39 Trinidad St,"PUBLC MARKET; Public Market Parking Lot off Trinidad St, across the street from the Public Market",Rochester,NY,14605,,888-758-4389,E,,Public,24 hours daily,,,2,,,ChargePoint Network,http://www.chargepoint.com/,GPS,43.166030,-77.591324,01/23/2021,62307,2021-01-23 00:19:13,,,,,J1772
ELEC,EV Charge Solutions - Headquarters,7464 W Henrietta Rd,,Rush,NY,14543,,585-533-4051,E,,Public,24 hours daily,,,4,,,Non-Networked,,200-9,42.996895,-77.667425,03/03/2020,154200,2020-03-03 21:13:47,P,,,05/01/2018,J1772
ELEC,STATION 1 @ VIL,70 E Main St,VICTOR; In lot next to church,Victor,NY,14564,,888-758-4389,E,,Public,24 hours daily,,,2,,,ChargePoint Network,http://www.chargepoint.com/,GPS,42.981755,-77.408360,01/23/2021,162320,2021-01-23 00:19:13,,,,,J1772
ELEC,JATC IBEW LU910,25001 Water St,WATER ST 1,Watertown,NY,13601,,888-758-4389,E,,Public,24 hours daily,,,2,,,ChargePoint Network,http://www.chargepoint.com/,200-9,43.981728,-75.870905,01/23/2021,162163,2021-01-23 00:19:13,,,,,J1772
ELEC,SHINEMAN SOUTH,309 Washington Blvd SUNY Oswego PERMIT REQUIRED - Parking Lot C-8,SHINEMAN 01GW; PERMIT REQUIRED (oswego.edu_parking 315.312.3227) Located on SUNY Oswego Campus in front of the Shineman Center; Lot C-8 (off Washington Blvd)SHINEMAN 02; PERMIT REQUIRED (oswego.edu_parking 315.312.3227) Located on the SUNY Oswego campus in front of the Shineman center; Parking Lot C-8 off Washington BoulevardSHINEMAN 03; PERMIT REQUIRED (oswego.edu_parking 315.312.3227) Located on the SUNY Oswego campus in front of the Shineman center; Parking Lot C-8 off Washington Boulevard,Oswego,NY,13126,,888-758-4389,E,,Public,24 hours daily,,,6,,,ChargePoint Network,http://www.chargepoint.com/,200-8,43.453772,-76.536902,01/23/2021,162401,2021-01-23 00:19:13,,,,,J1772
ELEC,INDUSTRY CITY,533 2nd Ave,LOT B EAST; Parking Lot CLOT B WEST; Parking lot B,Brooklyn,NY,11232,,888-758-4389,E,,Public,24 hours daily,,,4,,,ChargePoint Network,http://www.chargepoint.com/,200-9,40.659333,-74.006419,01/23/2021,122592,2021-01-23 00:19:13,,,,,J1772
ELEC,VILLAGE STATION,15-21 James St,VILLAGE OF LG; Intersection of James and Ottawa,Lake George,NY,12845,,888-758-4389,E,,Public,24 hours daily,,,2,,,ChargePoint Network,http://www.chargepoint.com/,GPS,43.424217,-73.715238,01/23/2021,162369,2021-01-23 00:19:13,,,,,J1772
ELEC,ICE RINK,311 Washington Ave Ext,TENNIS COURTS; South end of tennis courts,Saugerties,NY,12477,,888-758-4389,E,,Public,24 hours daily,,,2,,,ChargePoint Network,http://www.chargepoint.com/,GPS,42.086179,-73.951671,01/23/2021,162146,2021-01-23 00:19:13,,,,,J1772
ELEC,GGMC Parking 66 Rockwell Pl Garage - Tesla Destination,66 Rockwell Pl,,Brooklyn,NY,11217,,718-797-2408  877-798-3752,E,,Public,24 hours daily; see valet for access,,,3,,,Tesla Destination,https://www.tesla.com/destination-charging,200-8,40.688060,-73.979449,11/03/2020,114911,2020-11-18 00:06:10,P,,,01/01/2016,J1772 TESLA
ELEC,Seagrams BLDG,375 Park Avenue,,New York,NY,10022,,888-998-2546,E,,Public,MON: 24 hours | TUE: 24 hours | WED: 24 hours | THU: 24 hours | FRI: 24 hours | SAT: 24 hours | SUN: 24 hours,,,1,,,Blink Network,http://www.blinkcharging.com/,GPS,40.758526,-73.971786,01/22/2021,168066,2021-01-22 22:55:21,,,,,J1772
ELEC,SUNY Empire State College,2 Union Ave,,Saratoga Springs,NY,12866,,866-816-7584,E,,Public,24 hours daily,,,2,,,EV Connect,http://evconnect.com/,GPS,43.077341,-73.782443,04/08/2020,123077,2020-04-08 12:29:55,P,,,04/01/2019,J1772
ELEC,SYLVAN BEACH,11 Spencer Ave,,Sylvan Beach,NY,13157,,888-758-4389,E,,Public,24 hours daily,,,2,,,ChargePoint Network,http://www.chargepoint.com/,GPS,43.195776,-75.731229,01/23/2021,171230,2021-01-23 00:19:13,,,,,J1772
ELEC,"Sam's Club 6428 (Medford, NY)",2950 Horseblock Rd,,Medford,NY,11933,,833-632-2778,E,,Public,24 hours daily,,,,4,,Electrify America,https://www.electrifyamerica.com/,GPS,40.826203,-72.990418,01/23/2021,170300,2021-01-23 01:23:19,,,,,CHADEMO J1772COMBO
ELEC,WOODLAWN GARAGE,17-21 Division St,SARATOGA; Top floor,Saratoga Springs,NY,12866,,888-758-4389,E,,Public,24 hours daily,,,2,,,ChargePoint Network,http://www.chargepoint.com/,GPS,43.081886,-73.786524,01/23/2021,162300,2021-01-23 00:19:13,,,,,J1772
ELEC,Saint George Courthouse,54 Central Ave,,Staten Island,NY,10301,,718-524-1190  866-816-7584,E,,Public,24 hours daily,,,5,,,EV Connect,http://evconnect.com/,200-9,40.639470,-74.076912,04/08/2020,65296,2020-04-08 12:29:55,LG,,,08/08/2016,J1772
ELEC,Sylvan Parking 136-33 37th Ave - Tesla Destination,136-33 37th Ave,,Flushing,NY,11354,,718-762-2729  877-798-3752,E,,Public,24 hours daily; pay lot; see valet for access,,,3,,,Tesla Destination,https://www.tesla.com/destination-charging,200-9,40.762206,-73.830022,11/03/2020,150586,2020-11-18 00:06:10,P,,,09/30/2019,TESLA
ELEC,STONY BROOK UNV,Gymnasium Rd,ARENA 1; -ARENA 2; -,Stony Brook,NY,11790,,888-758-4389,E,,Public,24 hours daily,,,4,,,ChargePoint Network,http://www.chargepoint.com/,GPS,40.917249,-73.127280,01/23/2021,162455,2021-01-23 00:19:13,,,,,J1772
ELEC,Storm King Tavern and Golf Club - Tesla Destination,18 Ridge Rd,,Cornwall,NY,12518,,845-534-3899  877-798-3752,E,,Public,24 hours daily,,,2,,,Tesla Destination,https://www.tesla.com/destination-charging,200-9,41.429428,-74.028204,11/03/2020,114928,2020-11-18 00:06:10,P,,,09/01/2017,TESLA
ELEC,TONAWANDA YPR,147 Thorncliff Rd,POOL PLAZA 1; -,Buffalo,NY,14223,,888-758-4389,E,,Public,24 hours daily,,,2,,,ChargePoint Network,http://www.chargepoint.com/,GPS,42.982760,-78.866850,01/23/2021,154517,2021-01-23 00:19:13,,,,,J1772
ELEC,Cosimo's on Union - Tesla Supercharger,1217 NY-300,,Newburgh,NY,12550,,877-798-3752,E,,Public,24 hours daily; for Tesla use only,,,,6,,Tesla,http://www.teslamotors.com/supercharger,200-9,41.499600,-74.071300,08/10/2020,122261,2020-08-27 20:39:12,P,,,03/01/2019,TESLA
ELEC,Centereach Park,284 Hawkins Rd,,Centereach,NY,11720,,866-816-7584,E,,Public,24 hours daily,,,4,,,EV Connect,http://evconnect.com/,GPS,40.881709,-73.076176,12/03/2020,123094,2020-12-03 22:33:12,P,,,04/01/2019,J1772
ELEC,Burger King Attica NY,130 Prospect St,,Attica,NY,14011,,888-998-2546,E,,Public,MON: 24 hours | TUE: 24 hours | WED: 24 hours | THU: 24 hours | FRI: 24 hours | SAT: 24 hours | SUN: 24 hours,,,2,,,Blink Network,http://www.blinkcharging.com/,GPS,42.871300,-78.276100,01/22/2021,164375,2021-01-22 22:55:21,,,,,J1772
ELEC,Towne Centre at Somers,325 Route 100,,Somers,NY,10589,,877-455-3833,E,,Public - Card key at all times,24 hours daily,,,,1,,eVgo Network,https://www.evgo.com/,GPS,41.325390,-73.686843,01/23/2021,93699,2021-01-23 01:19:54,,,,,CHADEMO J1772COMBO
ELEC,Jones Beach State Park,275 Bay Pkwy,,Wantaugh,NY,11793,,866-816-7584,E,,Public,24 hours daily,,,1,,,EV Connect,http://evconnect.com/,GPS,40.596790,-73.496049,04/08/2020,123092,2020-04-08 12:29:55,P,,,04/01/2019,J1772
ELEC,NATIONAL GRID,Bissel Hall,BISSEL HALL; Next to the police building,Buffalo,NY,14228,,888-758-4389,E,,Public,24 hours daily,,,2,,,ChargePoint Network,http://www.chargepoint.com/,GPS,42.998555,-78.781323,01/23/2021,162250,2021-01-23 00:19:13,,,,,J1772
ELEC,AAA Albany - Tesla Destination,618 Delaware Ave,,Albany,NY,12209,,518-426-1000  877-798-3752,E,,Public,24 hours daily; for customer use only; see front desk for access,,,4,,,Tesla Destination,https://www.tesla.com/destination-charging,200-9,42.636441,-73.791489,11/03/2020,114878,2020-11-18 00:06:10,P,,,11/01/2018,J1772 TESLA
ELEC,Icon Parking 111 8th Ave Parking - Tesla Destination,385  W 15th St,,New York,NY,10011,,212-929-8164  877-798-3752,E,,Public,24 hours daily; see valet for access,,,4,,,Tesla Destination,https://www.tesla.com/destination-charging,200-8,40.741669,-74.004397,11/03/2020,115114,2020-11-18 00:06:10,P,,,03/01/2017,TESLA
ELEC,Winwood Inn - Windham Mountain Resort - Tesla Destination,5220 State Rte 23,,Windham,NY,12496,,518-734-3000  877-798-3752,E,,Public - Call ahead,24 hours daily; available with reservation only,,,2,,,Tesla Destination,https://www.tesla.com/destination-charging,200-9,42.310435,-74.241272,11/03/2020,115250,2020-11-18 00:06:10,P,,,03/01/2017,TESLA
ELEC,iPark 455 Central Park West - Tesla Destination,27  W 105th St,,New York,NY,10025,,212-666-7246  877-798-3752,E,,Public,24 hours daily; see valet for access,,,3,,,Tesla Destination,https://www.tesla.com/destination-charging,200-8,40.797875,-73.961228,11/03/2020,115075,2020-11-18 00:06:10,P,,,08/15/2016,J1772 TESLA
ELEC,ADAMS STATION,701 Elkin Ct,701 ELKIN CT; Bldg 701,Delmar,NY,12054,,888-758-4389,E,,Public,24 hours daily,,,2,,,ChargePoint Network,http://www.chargepoint.com/,GPS,42.607304,-73.850000,01/23/2021,165395,2021-01-23 00:19:13,,,,,J1772
ELEC,Residence Inn,6420 Yorktown Cir,,Syracuse,NY,13057,,866-816-7584,E,,Public - Call ahead,24 hours daily; for hotel guest use only,,,2,,,EV Connect,http://evconnect.com/,200-9,43.090770,-76.088086,04/08/2020,94863,2020-04-08 12:29:55,P,,,11/28/2013,J1772
ELEC,NATIONAL GRID,40 Leigh St,ST LAWRENCE; Between tennis courts and athletic field,Canton,NY,13617,,888-758-4389,E,,Public,24 hours daily,,,2,,,ChargePoint Network,http://www.chargepoint.com/,GPS,44.586170,-75.163936,01/23/2021,162205,2021-01-23 00:19:13,,,,,J1772
ELEC,Stone Ridge Physical Therapy,3555 Main St,,Stone Ridge,NY,12484,,845-687-8806,E,,Public,24 hours daily,,,3,,,Non-Networked,,GPS,41.852508,-74.138776,10/09/2020,167131,2020-10-09 12:41:43,P,,,09/21/2020,TESLA
ELEC,Kings County Parking,581 Clarkson Ave,,Brooklyn,NY,11203,,855-900-7584,E,,Public,24 hours daily,,,2,,,Greenlots,http://greenlots.com/,200-9,40.656635,-73.940857,01/23/2021,99290,2021-01-23 01:21:30,,,,,J1772
ELEC,Shults Nissan,311 Fluvanna Ave,,Jamestown,NY,14701,,716-484-2780,E,,Public - Call ahead,Dealership business hours,,,1,,,Non-Networked,,200-9,42.115661,-79.253776,06/09/2020,49932,2020-06-09 16:47:26,P,,,10/25/2012,J1772
ELEC,Reinstein Woods Nature Preserve,93 Honorine Dr,"Between Union & Transit Rds, off of Como Park Boulevard",Depew,NY,14043,,716-683-5959,E,,Public - Call ahead,Sunrise to sunset daily,,,2,,,Non-Networked,,GPS,42.891613,-78.717862,06/09/2020,82545,2020-06-09 16:47:26,SG,,,04/21/2017,J1772
ELEC,Koeppel Nissan,74-15 Northern Blvd,,Jackson Heights,NY,11372,,877-505-6334,E,,Public - Call ahead,Dealership business hours,,,2,1,,Non-Networked,,200-9,40.755072,-73.892094,06/09/2020,85969,2020-06-09 16:47:26,P,,,03/01/2017,CHADEMO J1772 J1772COMBO
ELEC,Delancey & Essex Municipal Parking Garage,107 Essex St,,Manhattan,NY,10002,,866-816-7584,E,,Public,24 hours daily,,,5,,,EV Connect,http://evconnect.com/,200-8,40.719051,-73.988181,04/08/2020,94848,2020-04-08 12:29:55,LG,,,03/20/2015,J1772
ELEC,Lake Riley Lodge,100 Norris Dr,,Rochester,NY,14610,,866-816-7584,E,,Public,24 hours daily,,,1,,,EV Connect,http://evconnect.com/,GPS,43.141410,-77.574932,04/08/2020,123261,2020-04-08 12:29:55,P,,,04/01/2019,J1772
ELEC,The Rose Motel - Tesla Destination,3840 State Hwy 145,,Durham,NY,12422,,518-239-8496  877-798-3752,E,,Public,24 hours daily; for customer use only; see front desk for access,,,2,,,Tesla Destination,https://www.tesla.com/destination-charging,200-8,42.399652,-74.172565,11/03/2020,122480,2020-11-18 00:06:10,P,,,03/01/2019,TESLA
ELEC,Riverhead Town Center - Tesla Supercharger,1761 Old Country Rd,,Riverhead,NY,11901,,877-798-3752,E,,Public,24 hours daily; for Tesla use only,,,,8,,Tesla,http://www.teslamotors.com/supercharger,GPS,40.923460,-72.703557,01/14/2021,170430,2021-01-14 18:42:41,P,,,12/14/2020,TESLA
ELEC,ADELPHI UNIV,1 South Ave,STATION 01STATION 02STATION 03STATION 04STATION 05; In Motamed parking garageSTATION 06; In Motamed parking garage,Garden City,NY,11530,,888-758-4389,E,,Public,24 hours daily,,,12,,,ChargePoint Network,http://www.chargepoint.com/,200-8,40.723006,-73.664140,01/23/2021,60739,2021-01-23 00:19:13,,,,,J1772
ELEC,BURNS MGT,19 Seward St,SGA 3; -SGA 4; -SGA 5; -,Saratoga Springs,NY,12866,,888-758-4389,E,,Public,24 hours daily,,,6,,,ChargePoint Network,http://www.chargepoint.com/,200-9,43.087178,-73.795553,01/23/2021,162128,2021-01-23 00:19:13,,,,,J1772
ELEC,Central Parking - 115 E 87th St,115 East 87th Street,,New York,NY,10128,,888-998-2546,E,,Public,MON: 24 hours | TUE: 24 hours | WED: 24 hours | THU: 24 hours | FRI: 24 hours | SAT: 24 hours | SUN: 24 hours,,,2,,,Blink Network,http://www.blinkcharging.com/,GPS,40.780678,-73.956269,01/22/2021,155449,2021-01-22 22:55:21,,,,,J1772
ELEC,E 47th Street - Tesla Supercharger,212 East 47th Street,,New York,NY,10017,,877-798-3752,E,,Public,24 hours daily; for Tesla use only,,,,4,,Tesla,http://www.teslamotors.com/supercharger,200-9,40.753400,-73.971700,08/10/2020,102336,2020-08-27 20:39:12,P,,,07/23/2018,TESLA
ELEC,U OF R,730 Library Rd,GOERGEN CENTER; At service entrance on Library Rd.,Rochester,NY,14627,,888-758-4389,E,,Public,24 hours daily,,,2,,,ChargePoint Network,http://www.chargepoint.com/,GPS,43.129952,-77.629052,01/23/2021,162266,2021-01-23 00:19:13,,,,,J1772
ELEC,LASH VW,376 Tarrytown Rd,VW_408340_A,White Plains,NY,10607,,888-758-4389,E,,Public,24 hours daily,,,2,,,ChargePoint Network,http://www.chargepoint.com/,GPS,41.043001,-73.796297,01/23/2021,162437,2021-01-23 00:19:13,,,,,J1772
ELEC,Icon Parking OMNI - Tesla Destination,143-159 W 68th St,,New York,NY,10023,,212-874-9664  877-798-3752,E,,Public,24 hours daily; see valet for access,,,3,,,Tesla Destination,https://www.tesla.com/destination-charging,200-8,40.775545,-73.981800,11/03/2020,115015,2020-11-18 00:06:10,P,,,11/01/2018,J1772 TESLA
ELEC,Hannaford Supermarket,5 Maple Rd,,Voorheesville,NY,12186,,877-455-3833,E,,Public - Card key at all times,24 hours daily,,,,1,,eVgo Network,https://www.evgo.com/,GPS,42.649353,-73.923215,01/23/2021,93509,2021-01-23 01:19:54,,,,,CHADEMO J1772COMBO
ELEC,Village of Cherry Valley,2 Genesee St,Located near Village Park entrance,Cherry Valley,NY,13320,,607-264-3791,E,,Public,24 hours daily,,,2,,,Non-Networked,,200-9,42.797294,-74.758022,03/03/2020,104135,2020-03-03 21:13:47,P,,,10/04/2018,J1772
ELEC,Nissan of Westbury,939 Old Country Rd,,Westbury,NY,11590,,516-338-5600,E,,Public - Call ahead,Dealership business hours,,,1,1,,Non-Networked,,200-8,40.753954,-73.561974,06/09/2020,44212,2020-06-09 16:47:26,P,,,11/30/2011,CHADEMO J1772
ELEC,TownePlace Suites by Marriott Syracuse Liverpool - Tesla Destination,8505 Carling Rd,,Liverpool,NY,13090,,315-715-3636  877-798-3752,E,,Public,24 hours daily; for customer use only; see front desk for access,,,3,,,Tesla Destination,https://www.tesla.com/destination-charging,200-8,43.183881,-76.238636,11/03/2020,122486,2020-11-18 00:06:10,P,,,03/01/2019,J1772 TESLA
ELEC,The Garrison and Highlands Country Club - Tesla Destination,1 Snakehill Rd,,Garrison,NY,10524,,845-424-3604  877-798-3752,E,,Public,24 hours daily,,,2,,,Tesla Destination,https://www.tesla.com/destination-charging,200-8,41.381167,-73.912428,11/03/2020,114945,2020-11-18 00:06:10,P,,,08/15/2016,TESLA
ELEC,Tom Wahlâ€™s Inc,283 E Main St,,Avon,NY,14414,,866-816-7584,E,,Public,24 hours daily,,,4,,,EV Connect,http://evconnect.com/,GPS,42.909660,-77.732626,06/09/2020,157945,2020-06-09 16:47:26,P,,,05/15/2020,J1772
ELEC,VANDERBILTFG,125 Froehlich Farm Blvd,125VFG; From the Entrance Directly Ahead on Left Side of the Building,Woodbury,NY,11797,,888-758-4389,E,,Public,24 hours daily,,,2,,,ChargePoint Network,http://www.chargepoint.com/,GPS,40.802210,-73.477734,01/23/2021,162478,2021-01-23 00:19:13,,,,,J1772
ELEC,BEDFORDEV,11 Railroad Ave,METRO NORTH RR1; Bedford Hills Metro North Train Station,Bedford Hills,NY,10507,,888-758-4389,E,,Public,24 hours daily,,,2,,,ChargePoint Network,http://www.chargepoint.com/,GPS,41.237361,-73.700105,01/23/2021,162335,2021-01-23 00:19:13,,,,,J1772
ELEC,REIKART HOUSE,5000-5010 Main St,JAZZBOLINE 1; -,Buffalo,NY,14226,,888-758-4389,E,,Public,24 hours daily,,,2,,,ChargePoint Network,http://www.chargepoint.com/,GPS,42.960140,-78.769770,01/23/2021,150825,2021-01-23 00:19:13,,,,,J1772
ELEC,Jordan Village Clerk,7 Mechanic St,,Jordan,NY,13080,,866-816-7584,E,,Public,24 hours daily,,,1,,,EV Connect,http://evconnect.com/,GPS,43.065654,-76.472259,04/08/2020,123129,2020-04-08 12:29:55,LG,,,04/01/2019,J1772
ELEC,MPG 10 E 102nd Street - Tesla Destination,10 E 102nd St,,New York,NY,10029,,212-249-1947  877-798-3752,E,,Public,24 hours daily; for customer use only; see valet for access,,,3,,,Tesla Destination,https://www.tesla.com/destination-charging,200-9,40.791232,-73.952370,11/03/2020,114983,2020-11-18 00:06:10,P,,,09/01/2017,J1772 TESLA
ELEC,JATC LU25,370 Vanderbilt Motor Pkwy,JATC LU25; -,Hauppauge,NY,11788,,888-758-4389,E,,Public,24 hours daily,,,2,,,ChargePoint Network,http://www.chargepoint.com/,GPS,40.808219,-73.241735,01/23/2021,162178,2021-01-23 00:19:13,,,,,J1772
ELEC,BURNS MGT,19-21 Wells St,SHERWOOD 1; -,Saratoga Springs,NY,12866,,888-758-4389,E,,Public,24 hours daily,,,2,,,ChargePoint Network,http://www.chargepoint.com/,GPS,43.087137,-73.792150,01/23/2021,120967,2021-01-23 00:19:13,,,,,J1772
ELEC,ULSTER COUNTY,214 Libertyville Rd,"POOL; Ulster County's fee for public charging is $0.50 per hour, effective 1-1-2020.",New Paltz,NY,12561,,888-758-4389,E,,Public,24 hours daily,,,2,,,ChargePoint Network,http://www.chargepoint.com/,GPS,41.723953,-74.117600,01/23/2021,147504,2021-01-23 00:19:13,,,,,J1772
ELEC,DRYDEN,93 E Main St,STATION 1; Rear parking area,Dryden,NY,13053,,888-758-4389,E,,Public,24 hours daily,,,2,,,ChargePoint Network,http://www.chargepoint.com/,GPS,42.491640,-76.286830,01/23/2021,164859,2021-01-23 00:19:13,,,,,J1772
ELEC,imPark 611 E 83rd Street - Tesla Destination,611 E 83rd St,,New York,NY,10028,,212-249-5124  877-798-3752,E,,Public,24 hours daily; see valet for access,,,3,,,Tesla Destination,https://www.tesla.com/destination-charging,200-8,40.772931,-73.945552,11/03/2020,115175,2020-11-18 00:06:10,P,,,03/01/2017,J1772 TESLA
ELEC,HONEST WEIGHT,100 Watervliet av,HONEST WEIGHT 2,Albany,NY,12206,,888-758-4389,E,,Public,24 hours daily,,,2,,,ChargePoint Network,http://www.chargepoint.com/,GPS,42.678190,-73.781630,01/23/2021,146796,2021-01-23 00:19:13,,,,,J1772
ELEC,Country Inn & Suites - Rochester East,2851 Monroe Ave,,Rochester,NY,14618,,866-816-7584,E,,Public,24 hours daily; Also accepts Paypal,A D M V,,2,,,EV Connect,http://evconnect.com/,GPS,43.111149,-77.548642,04/08/2020,155079,2020-04-08 12:29:55,P,,,08/01/2019,J1772
ELEC,BEAM CHARGING,1081 3rd Ave,1081 3RD AVENUE; See Valet for instructions on using charging station.,New York,NY,10065,,888-758-4389,E,,Public,24 hours daily,,,2,,,ChargePoint Network,http://www.chargepoint.com/,GPS,40.764341,-73.964080,01/23/2021,162501,2021-01-23 00:19:13,,,,,J1772
ELEC,Park Kwik LLC 50 Washington St. - Tesla Destination,45 Main St,,Brooklyn,NY,11201,,718-222-0500  877-798-3752,E,,Public,24 hours daily; for customer use only; see valet for access,,,3,,,Tesla Destination,https://www.tesla.com/destination-charging,200-9,40.702769,-73.990584,11/03/2020,114906,2020-11-18 00:06:10,P,,,09/01/2017,J1772 TESLA
ELEC,286WAE,286 Washington Ave Ext,286 WAS AVE EXT,Albany,NY,12203,,888-758-4389,E,,Public,24 hours daily,,,2,,,ChargePoint Network,http://www.chargepoint.com/,GPS,42.705350,-73.860690,01/23/2021,152461,2021-01-23 00:19:13,,,,,J1772
ELEC,Village of Mt. Morris - Veterans Park,185 Main St,,Mt. Morris,NY,14510,,866-816-7584,E,,Public - Credit card at all times,24 hours daily; Also accepts PayPal and Apple Pay,A D M V,,4,,,EV Connect,http://evconnect.com/,GPS,42.718547,-77.869580,12/03/2020,168430,2020-12-03 22:33:12,LG,,,09/03/2020,J1772
ELEC,SUNY NEW PALTZ,Campus Transportation Hub,ROUTE 32 (2)ROUTE 32 LOT,New Paltz,NY,12561,,888-758-4389,E,,Public,24 hours daily,,,4,,,ChargePoint Network,http://www.chargepoint.com/,GPS,41.738961,-74.080128,01/23/2021,122792,2021-01-23 00:19:13,,,,,J1772
ELEC,HUDSON PRESERVE,12 Beryl Way,BLDG 7 #7,Watervliet,NY,12189,,888-758-4389,E,,Public,24 hours daily,,,2,,,ChargePoint Network,http://www.chargepoint.com/,GPS,42.732693,-73.723590,01/23/2021,143172,2021-01-23 00:19:13,,,,,J1772
ELEC,Roger Smith Hotel - Tesla Destination,501 Lexington Ave,,New York,NY,10017,,212-755-1400  877-798-3752,E,,Public,24 hours daily; for customer use only; see valet for access,,,1,,,Tesla Destination,https://www.tesla.com/destination-charging,200-9,40.754735,-73.973361,11/03/2020,115146,2020-11-18 00:06:10,P,,,11/01/2018,TESLA
ELEC,HIGHBRIDGE,128 Vineyard Ave,HIGHBRIDGE 1,Highland,NY,12528,,888-758-4389,E,,Public,24 hours daily,,,2,,,ChargePoint Network,http://www.chargepoint.com/,GPS,41.716319,-73.967742,01/23/2021,162243,2021-01-23 00:19:13,,,,,J1772
ELEC,Enterprise Parking 200 E 69th St - Tesla Destination,200 E 69th St,,New York,NY,10065,,212)-564-3199  877-798-3752,E,,Public,24 hours daily; see valet for access,,,2,,,Tesla Destination,https://www.tesla.com/destination-charging,200-9,40.767289,-73.961762,11/03/2020,115041,2020-11-18 00:06:10,P,,,11/01/2016,TESLA
ELEC,Elm Ave,1 Research Circle,,Niskayuna,NY,12309,,800-663-5633,E,,Public,MO: Not Specified; TU: Not Specified; WE: Not Specified; TH: Not Specified; FR: Not Specified; SA: Not Specified; SU: Not Specified,,,10,,,SemaCharge Network,https://semaconnect.com/,GPS,42.825583,-73.879337,01/23/2021,148044,2021-01-23 00:11:44,,,,,J1772
ELEC,Pindar Vineyards - Tesla Destination,37645 NY-25,,Peconic,NY,11958,,631-734-6200  877-798-3752,E,,Public,24 hours daily; for customer use only,,,1,,,Tesla Destination,https://www.tesla.com/destination-charging,200-9,41.034704,-72.469690,11/03/2020,115209,2020-11-18 00:06:10,P,,,11/01/2018,TESLA
ELEC,Gideon Putnam Resort and Spa - Tesla Destination,24  Gideon Putnam Rd,,Saratoga Springs,NY,12866,,518-584-3000  877-798-3752,E,,Public,24 hours daily; available with reservation only; see front desk for access,,,3,,,Tesla Destination,https://www.tesla.com/destination-charging,200-9,43.057104,-73.798310,11/03/2020,115235,2020-11-18 00:06:10,P,,,01/01/2016,J1772 TESLA
ELEC,Manhattan Parking 110 LLC - Tesla Destination,543 W 110th St,,New York,NY,10025,,212-222-7813  877-798-3752,E,,Public,24 hours daily; see valet for access,,,3,,,Tesla Destination,https://www.tesla.com/destination-charging,200-9,40.804167,-73.965894,11/03/2020,150722,2020-11-18 00:06:10,P,,,09/30/2019,J1772 TESLA
ELEC,Village of Springville - Municipal Parking Lot,29 Pearl St,,Springville,NY,14141,,716-592-4936,E,,Public,24 hours daily,,,2,,,Non-Networked,,GPS,42.507662,-78.666638,06/09/2020,157962,2020-06-09 16:47:26,P,,,05/15/2020,J1772
ELEC,PARKING GARAGE,15 Bank St,STATION 1; 1st floor section A3STATION 2; 1st fl section A3,White Plains,NY,10606,,888-758-4389,E,,Public,24 hours daily,,,4,,,ChargePoint Network,http://www.chargepoint.com/,200-9,41.031322,-73.774501,01/23/2021,162386,2021-01-23 00:19:13,,,,,J1772
ELEC,Treiber Nissan,320 N Comrie Ave,,Johnstown,NY,12095,,518-736-1300,E,,Public - Call ahead,Dealership business hours,,,1,,,Non-Networked,,200-9,43.025044,-74.358103,06/09/2020,44344,2020-06-09 16:47:26,P,,,11/30/2011,J1772
ELEC,IMPark 353 4th Ave - Tesla Destination,353 4th Ave,,Brooklyn,NY,11215,,212-937-8660  877-798-3752,E,,Public,24 hours daily; pay lot; see valet for access,,,4,,,Tesla Destination,https://www.tesla.com/destination-charging,200-8,40.672845,-73.986284,11/03/2020,122475,2020-11-18 00:06:10,P,,,03/01/2019,TESLA
ELEC,Brooklyn Navy Yard,63 Flushing Ave,,Brooklyn,NY,11205,,866-816-7584,E,,Public,24 hours daily,,,8,,,EV Connect,http://evconnect.com/,200-8,40.698235,-73.975114,04/08/2020,94832,2020-04-08 12:29:55,LG,,,07/20/2016,J1772
ELEC,Selux Corp,5 Lumen Ln,,Highland,NY,12528,,866-816-7584,E,,Public,24 hours daily,,,7,,,EV Connect,http://evconnect.com/,GPS,41.739522,-73.960362,04/08/2020,123116,2020-04-08 12:29:55,P,,,04/01/2019,J1772
ELEC,SAVARINO COMPAN,Myrtle St Lot Charger 3 500 Seneca Street,500 SENECA 3; -,Buffalo,NY,14204,,888-758-4389,E,,Public,24 hours daily,,,2,,,ChargePoint Network,http://www.chargepoint.com/,GPS,42.878456,-78.857720,01/23/2021,164149,2021-01-23 00:19:13,,,,,J1772
ELEC,SUNY NEW PALTZ,Service building,SOUTH LOOP 1; -STATION 2; -STATION 3; -,New Paltz,NY,12561,,888-758-4389,E,,Public,24 hours daily,,,6,,,ChargePoint Network,http://www.chargepoint.com/,GPS,41.736732,-74.084307,01/23/2021,123392,2021-01-23 00:19:13,,,,,J1772
ELEC,Best Western University Inn - Tesla Destination,90 E Main St,,Canton,NY,13617,,315-386-8522  877-798-3752,E,,Public,24 hours daily; for customer use only; see front desk for access,,,3,,,Tesla Destination,https://www.tesla.com/destination-charging,200-9,44.596265,-75.149319,11/03/2020,114921,2020-11-18 00:06:10,P,,,01/01/2016,J1772 TESLA
ELEC,BURNS MGT,1 broom shop lane,SCH COMM BLD 3SCH COMM BLDG 3SCH COMM BLDG 5,Latham,NY,12110,,888-758-4389,E,,Public,24 hours daily,,,6,,,ChargePoint Network,http://www.chargepoint.com/,GPS,42.741806,-73.787998,01/23/2021,149545,2021-01-23 00:19:13,,,,,J1772
ELEC,Shaheens Adirondack Inn - Tesla Destination,314 Park St,,Tupper Lake,NY,12986,,877-798-3752  877-798-3752,E,,Public,24 hours daily; for customer use only; see front desk for access,,,2,,,Tesla Destination,https://www.tesla.com/destination-charging,200-9,44.224690,-74.448721,11/03/2020,169099,2020-11-18 00:06:10,P,,,11/03/2020,TESLA
ELEC,GGMC Belltel Car Park - Tesla Destination,356  Bridge St,,Brooklyn,NY,11201,,718-643-1385  877-798-3752,E,,Public,24 hours daily; for customer use only; see valet for access,,,3,,,Tesla Destination,https://www.tesla.com/destination-charging,200-8,40.692645,-73.985451,11/03/2020,114901,2020-11-18 00:06:10,P,,,09/01/2017,J1772 TESLA
ELEC,City Parking E 61st Street - Tesla Destination,425 E 61st St,,New York,NY,10065,,212-219-3413  877-798-3752,E,,Public,24 hours daily; see valet for access,,,3,,,Tesla Destination,https://www.tesla.com/destination-charging,200-9,40.760522,-73.959278,11/03/2020,115135,2020-11-18 00:06:10,P,,,09/01/2017,J1772 TESLA
ELEC,Veteran's Municipal Parking Lot,111 Main St,,Nyack,NY,10960,,866-816-7584,E,,Public,24 hours daily,,,1,,,EV Connect,http://evconnect.com/,GPS,41.090931,-73.919850,04/08/2020,123060,2020-04-08 12:29:55,P,,,04/01/2019,J1772
ELEC,AAA Troy - Tesla Destination,514 Congress Wy,,Troy,NY,12180,,518-426-1000  877-798-3752,E,,Public,24 hours daily; for customer use only,,,2,,,Tesla Destination,https://www.tesla.com/destination-charging,200-9,42.721994,-73.678944,11/03/2020,115243,2020-11-18 00:06:10,P,,,11/01/2018,J1772 TESLA
ELEC,59 Allen Street - Tesla Supercharger,59 Allen Street,,New York,NY,10002,,877-798-3752,E,,Public,24 hours daily; for Tesla use only,,,,4,,Tesla,http://www.teslamotors.com/supercharger,GPS,40.717200,-73.991900,08/10/2020,116808,2020-08-27 20:39:12,P,,,12/01/2018,TESLA
ELEC,5TH AVE,King St &amp; Federal St,RIVER STREET 4; -,Troy,NY,12180,,888-758-4389,E,,Public,24 hours daily,,,2,,,ChargePoint Network,http://www.chargepoint.com/,GPS,42.735077,-73.687950,01/23/2021,154336,2021-01-23 00:19:13,,,,,J1772
ELEC,VANKLEECKS TIRE,1987 Ulster Ave,VANLKEECKS TIRE,Lake Katrine,NY,12449,,888-758-4389,E,,Public,24 hours daily,,,2,,,ChargePoint Network,http://www.chargepoint.com/,GPS,41.991154,-73.986860,01/23/2021,143464,2021-01-23 00:19:13,,,,,J1772
ELEC,Best Western Plus The Hammondsport Hotel,8440 NY-54,,Hammondsport,NY,14840,,607-224-4120,E,,Public,24 hours daily; guest use only; see front desk for access,,,1,,,Non-Networked,,GPS,42.398830,-77.227276,06/09/2020,157969,2020-06-09 16:47:26,P,,,05/15/2020,J1772
ELEC,Icon Parking 360 E 65th - Tesla Destination,360 E 65th St,,Manhattan,NY,10065,,212-772-7728  877-798-3752,E,,Public,24 hours daily; pay lot; see valet for access,,,4,,,Tesla Destination,https://www.tesla.com/destination-charging,200-8,40.763564,-73.960236,11/03/2020,114973,2020-11-18 00:06:10,P,,,11/01/2018,TESLA
ELEC,QUEENSBURY TOWN,105 Main St,"EXIT 18 KIOSK 1; Close to highway, located at media drive park and ride.EXIT 18 KIOSK 2; Close to I87, locates at media drive park and ride",Queensbury,NY,12804,,888-758-4389,E,,Public,24 hours daily,,,4,,,ChargePoint Network,http://www.chargepoint.com/,200-9,43.298436,-73.676853,01/23/2021,165629,2021-01-23 00:19:13,,,,,J1772
ELEC,The St. Regis,Two East 55th Street,,New York,NY,10022,,800-663-5633,E,,Public,MO: Not Specified; TU: Not Specified; WE: Not Specified; TH: Not Specified; FR: Not Specified; SA: Not Specified; SU: Not Specified,,,1,,,SemaCharge Network,https://semaconnect.com/,GPS,40.761398,-73.974613,01/23/2021,170181,2021-01-23 00:11:44,,,,,J1772
ELEC,North 12 Parking (at the William Vale) - Tesla Supercharger,113 N. 12th Street,,Brooklyn,NY,11249,,877-798-3752,E,,Public,24 hours daily; for Tesla use only,,,,4,,Tesla,http://www.teslamotors.com/supercharger,200-8,40.721900,-73.956700,08/10/2020,102327,2020-08-27 20:39:12,P,,,07/23/2018,TESLA
ELEC,One Blue Slip-Greenpoint - Tesla Destination,1 Blue Slip,,Brooklyn,NY,11222,,718-713-8733  877-798-3752,E,,Public,24 hours daily; pay lot; see valet for access,,,5,,,Tesla Destination,https://www.tesla.com/destination-charging,GPS,40.736224,-73.959356,11/03/2020,150540,2020-11-18 00:06:10,P,,,09/30/2019,J1772 TESLA
ELEC,Mohawk Valley Welcome Center,I90 Westbound Milepost 187,,Fultonville,NY,12072,,855-900-7584,E,,Public,24 hours daily,,,,2,,Greenlots,http://greenlots.com/,GPS,42.916201,-74.446642,01/23/2021,165567,2021-01-23 01:21:30,,,,,CHADEMO J1772COMBO
ELEC,Price Chopper,10 Glenwood Ave,,Binghamton,NY,13905,,607-770-7151,E,,Public,24 hours daily,,,2,,,Non-Networked,,200-9,42.107612,-75.935778,04/08/2020,154765,2020-04-08 12:29:55,P,,,09/01/2015,J1772
ELEC,Hamilton College,198 College Hill Rd,,Clinton,NY,13323,,866-816-7584,E,,Public,24 hours daily; Also accepts Paypal,A D M V,,18,,,EV Connect,http://evconnect.com/,GPS,43.049748,-75.406056,04/08/2020,154893,2020-04-08 12:29:55,P,,,04/10/2019,J1772
ELEC,Icon Parking 301 E 57 Street - Tesla Destination,301 E 57th St,,New York,NY,10022,,212-755-6223  877-798-3752,E,,Public,24 hours daily; see valet for access,,,3,,,Tesla Destination,https://www.tesla.com/destination-charging,200-8,40.759484,-73.965206,11/03/2020,115086,2020-11-18 00:06:10,P,,,05/01/2016,J1772 TESLA
